category,tag,domain,source,environment,scenario
Attack/Transient,thumping,Mechanical,well pump,farm,a deep mechanical well pump thumping on a farm
Attack/Transient,thumping,Mechanical,millstone,mill,two massive millstones grinding together in a mill
Attack/Transient,thumping,Mechanical,compactor,facility,a trash compactor crushing a load of debris
Attack/Transient,thumping,Mechanical,blower,mill,a large foundry blower forcing air into a furnace
Attack/Transient,thumping,Mechanical,piledriver,harbor,a mechanical piledriver striking a concrete pillar
Attack/Transient,thumping,Mechanical,wrecking ball,site,a wrecking ball swinging and hitting a soft structure
Attack/Transient,thumping,Mechanical,escalator,mall,the internal machinery of an escalator thumping in a mall
Attack/Transient,thumping,Mechanical,hammer,site,a rubber mallet striking a wooden stake on a site
Attack/Transient,thumping,Mechanical,furnace,basement,the low rhythmic roar of a coal furnace in a basement
Attack/Transient,thumping,Environmental,thunder,distance,distant thunder rolling behind a heavy cloud cover
Attack/Transient,thumping,Environmental,waterfall,gorge,a massive waterfall hitting a deep plunge pool
Attack/Transient,thumping,Environmental,boulder,canyon,a massive boulder rolling across a sandy canyon floor
Attack/Transient,thumping,Environmental,mud,bog,thick mud bubbling and popping in a volcanic bog
Attack/Transient,thumping,Environmental,landslide,valley,a distant landslide of heavy earth in a valley
Attack/Transient,thumping,Environmental,glacier,bay,the deep internal groaning of a moving glacier
Attack/Transient,thumping,Environmental,earthquake,vault,the low rumble of a shifting tectonic plate
Attack/Transient,thumping,Environmental,volcano,peak,the low rhythmic grumbling of an active volcano
Attack/Transient,thumping,Environmental,ocean swell,underwater,an ocean swell passing overhead while underwater
Attack/Transient,thumping,Environmental,sandstorm,plain,the heavy abrasive roar of a sandstorm on a plain
Attack/Transient,thumping,Environmental,avalanche,slope,the muffled roar of a distant snow avalanche
Attack/Transient,thumping,Environmental,geyser,park,the deep subterranean gurgling of a geyser
Attack/Transient,thumping,Environmental,iceberg,sea,a large iceberg calving into the ocean with a thud
Attack/Transient,thumping,Environmental,river,plain,the heavy churning of a swollen river during a flood
Attack/Transient,thumping,Environmental,lava,tube,a slow-moving flow of lava churning in a tube
Attack/Transient,thumping,Environmental,tide,cave,the heavy surge of the tide rushing into a sea cave
Attack/Transient,thumping,Environmental,wind,canyon,a low wind howling through the base of a canyon
Attack/Transient,thumping,Environmental,waves,beach,heavy waves hitting a soft sandy beach at night
Attack/Transient,thumping,Organic,heartbeat,room,a human heartbeat heard through a thick pillow
Attack/Transient,thumping,Organic,footsteps,hall,bare feet walking on a thick wool carpet in a hall
Attack/Transient,thumping,Organic,elephant,savanna,an elephant making a low infrasonic rumble
Attack/Transient,thumping,Organic,lion,park,a lion’s deep chest-heavy growl in a safari park
Attack/Transient,thumping,Organic,gorilla,rainforest,a gorilla thumping its chest in a rainforest
Attack/Transient,thumping,Organic,alligator,swamp,an alligator’s low-frequency bellow in a swamp
Attack/Transient,thumping,Organic,bison,prairie,a bison’s heavy hooves thudding on the prairie
Attack/Transient,thumping,Organic,bear,den,a large bear snoring deeply inside a hollow log
Attack/Transient,thumping,Organic,walrus,beach,a walrus emitting a low guttural grunt on a beach
Attack/Transient,thumping,Organic,horse,stable,a horse’s low rhythmic breathing in a stable
Attack/Transient,thumping,Organic,hippo,river,a hippo yawning and grunting underwater in a river
Attack/Transient,thumping,Organic,rhino,scrub,a rhino huffing deeply while charging in scrubland
Attack/Transient,thumping,Organic,ostrich,plain,an ostrich booming its neck sac on a plain
Attack/Transient,thumping,Organic,camel,oasis,a camel making a deep gurgling sound at an oasis
Attack/Transient,thumping,Organic,toad,marsh,a bullfrog’s deep rhythmic croak in a marshland
Attack/Transient,thumping,Organic,crowd,stadium,the low indistinct murmur of a large crowd
Attack/Transient,thumping,Organic,muscle,clinic,the sound of a muscle being massaged through a towel
Attack/Transient,thumping,Organic,stomach,bedroom,a stomach growling with a deep tone in a bedroom
Attack/Transient,thumping,Domestic,rug,room,a heavy rug being beaten with a wooden stick
Attack/Transient,thumping,Domestic,cushion,lounge,a person sitting down on a large velvet cushion
Attack/Transient,thumping,Domestic,blanket,bedroom,a heavy wool blanket being shaken out over a bed
Attack/Transient,thumping,Domestic,towel,bathroom,a wet towel being dropped onto a tiled floor
Attack/Transient,thumping,Domestic,washing machine,laundry,the heavy tumbling cycle of a washing machine
Attack/Transient,thumping,Domestic,fireplace,den,the low heavy crackle of a large log in a fireplace
Attack/Transient,thumping,Domestic,sofa,lounge,a person sitting down on a large stuffed sofa
Attack/Transient,thumping,Domestic,door,cellar,a heavy wooden cellar door being closed
Attack/Transient,thumping,Domestic,chest,attic,a large wooden chest being dragged across a floor
Attack/Transient,thumping,Domestic,mattress,bedroom,a heavy mattress being flipped onto a bed frame
Attack/Transient,thumping,Domestic,curtains,theater,heavy velvet curtains being drawn across a stage
Attack/Transient,thumping,Domestic,toolbox,garage,a heavy metal toolbox being set down on a floor
Attack/Transient,thumping,Domestic,barrel,cellar,a wooden wine barrel being rolled across a floor
Attack/Transient,thumping,Domestic,shutter,store,a heavy metal security shutter being lowered
Attack/Transient,thumping,Domestic,trunk,car,a car trunk being slammed shut in a driveway
Attack/Transient,thumping,Domestic,pillow,bedroom,a heavy feather pillow being hit against a mattress
Attack/Transient,thumping,Domestic,oven,bakery,the low roar of a large commercial gas oven
Attack/Transient,thumping,Domestic,bath,bathroom,the low sound of a large bathtub filling
Attack/Transient,thumping,Electronic,subwoofer,concert,a subwoofer emitting a sustained low sine tone
Attack/Transient,thumping,Electronic,transformer,station,the massive hum of a power transformer
Attack/Transient,thumping,Electronic,server,center,the collective low drone of cooling fans
Attack/Transient,thumping,Electronic,electric motor,room,a large electric motor humming under load
Attack/Transient,thumping,Electronic,magnetic coil,lab,a magnetic coil humming with a deep tone
Attack/Transient,thumping,Electronic,welder,shipyard,the heavy buzzing of an industrial arc welder
Attack/Transient,thumping,Electronic,generator,shelter,a diesel-powered electric generator humming
Attack/Transient,thumping,Electronic,television,den,the low static hum of an old crt television
Attack/Transient,thumping,Electronic,ground loop,studio,a 60hz hum from a ground loop in a studio
Attack/Transient,thumping,Electronic,amplifier,garage,a bass amplifier humming with the volume up
Attack/Transient,thumping,Electronic,oscillator,lab,a low-frequency oscillator producing a drone
Attack/Transient,thumping,Electronic,hair dryer,bathroom,a hair dryer running on its lowest setting
Attack/Transient,thumping,Electronic,power line,road,the low buzzing of high-voltage power lines
Attack/Transient,thumping,Electronic,computer,office,the muffled whirring of a desktop computer fan
Attack/Transient,thumping,Electronic,vacuum cleaner,hall,the low-pitched roar of a vacuum cleaner
Attack/Transient,thumping,Electronic,induction,factory,an induction heater buzzing in a factory
Attack/Transient,thumping,Electronic,tesla coil,museum,a large tesla coil emitting a deep discharge
Attack/Transient,thumping,Electronic,compressor,workshop,the heavy thrumming of an air compressor
Attack/Transient,smacking,Musical,slap bass,studio,a bass guitar string hitting the fretboard in a studio
Attack/Transient,smacking,Musical,drumhead,rehearsal,a hand striking a wet drumhead in a rehearsal room
Attack/Transient,smacking,Musical,leather,pit,a leather beater striking a large bass drum in a pit
Attack/Transient,smacking,Musical,mouth,stage,a person making a popping sound with their lips on a stage
Attack/Transient,smacking,Musical,string,hall,a harp string being plucked and released with a wet finger
Attack/Transient,smacking,Musical,hand,booth,a hand slapping a wet bongo drum in a recording booth
Attack/Transient,smacking,Musical,beater,theatre,a felt-covered beater hitting a gong in a theatre
Attack/Transient,smacking,Musical,skin,park,a hand striking a djembe with a wet palm in a park
Attack/Transient,smacking,Musical,slapstick,stage,a wooden slapstick being triggered for a comedic effect
Attack/Transient,smacking,Musical,reed,studio,a saxophone reed vibrating against a wet mouthpiece
Attack/Transient,smacking,Musical,tambourine,club,a tambourine being struck with a damp palm in a club
Attack/Transient,smacking,Musical,piano,parlor,a piano hammer hitting a damp string in a parlor
Attack/Transient,smacking,Musical,cello,chapel,a cello string being snapped against the wood in a chapel
Attack/Transient,smacking,Musical,banjo,cabin,a banjo string being plucked with a wet thumb in a cabin
Attack/Transient,smacking,Musical,ukulele,beach,a ukulele being strummed with a wet finger on a beach
Attack/Transient,smacking,Musical,marimba,gallery,a marimba bar being struck with a wet mallet
Attack/Transient,smacking,Musical,xylophone,school,a xylophone bar being struck with a soft rubber mallet
Attack/Transient,smacking,Musical,drum,tent,a drum being struck with a wet stick during a rainstorm
Attack/Transient,smacking,Mechanical,belt,garage,a wet drive belt slapping against a metal pulley
Attack/Transient,smacking,Mechanical,wiper,car,a rubber windshield wiper slapping against a wet glass
Attack/Transient,smacking,Mechanical,valve,plant,a rubber valve seal snapping shut in a liquid plant
Attack/Transient,smacking,Mechanical,piston,shop,a greased piston hitting its stop in a workshop
Attack/Transient,smacking,Mechanical,hose,site,a pressurized rubber hose slapping a concrete floor
Attack/Transient,smacking,Mechanical,conveyor,factory,a wet rubber conveyor belt moving over a roller
Attack/Transient,smacking,Mechanical,press,mill,a wet hydraulic press plate hitting a metal sheet
Attack/Transient,smacking,Mechanical,shutter,house,a wet wooden shutter hitting the side of a house
Attack/Transient,smacking,Mechanical,paddle,well,a wooden paddle hitting water in a well
Attack/Transient,smacking,Mechanical,fan,office,a wet plastic fan blade hitting a metal guard
Attack/Transient,smacking,Mechanical,tire,road,a wet tire hitting a flat patch of pavement on a road
Attack/Transient,smacking,Mechanical,boot,mud,a rubber boot being pulled out of thick mud
Attack/Transient,smacking,Mechanical,stamp,office,a wet rubber stamp being pressed onto a sheet of paper
Attack/Transient,smacking,Mechanical,clapper,theater,a film clapper board being snapped shut in a studio
Attack/Transient,smacking,Mechanical,door,hall,a wet door seal sticking and then pulling away
Attack/Transient,smacking,Mechanical,lid,kitchen,a wet plastic lid being slapped onto a container
Attack/Transient,smacking,Mechanical,brush,garage,a wet brush being slapped against a metal car body
Attack/Transient,smacking,Mechanical,pulley,barn,a wet rope slapping against a wooden pulley
Attack/Transient,smacking,Environmental,waves,rock,waves slapping against a flat rock on a shoreline
Attack/Transient,smacking,Environmental,rain,leaf,large raindrops hitting a broad wet leaf in a jungle
Attack/Transient,smacking,Environmental,mud,bog,a heavy object falling into a thick mud bog
Attack/Transient,smacking,Environmental,water,pool,a flat stone hitting the surface of a still pond
Attack/Transient,smacking,Environmental,ice,river,a flat piece of ice hitting a wet riverbank
Attack/Transient,smacking,Environmental,hail,puddle,hailstones hitting a shallow puddle during a storm
Attack/Transient,smacking,Environmental,sea,pier,sea spray hitting a flat wooden pier during a gale
Attack/Transient,smacking,Environmental,thatch,village,heavy rain slapping against a wet thatched roof
Attack/Transient,smacking,Environmental,sand,beach,a wave receding over wet sand on a beach
Attack/Transient,smacking,Environmental,geyser,park,a burst of wet steam hitting a rock in a park
Attack/Transient,smacking,Environmental,bamboo,jungle,wet bamboo stalks slapping together in a storm
Attack/Transient,smacking,Environmental,leaves,forest,wet leaves slapping together in a strong wind
Attack/Transient,smacking,Environmental,reeds,marsh,wet marsh reeds hitting the side of a boat
Attack/Transient,smacking,Environmental,driftwood,shore,wet driftwood clacking together in the surf
Attack/Transient,smacking,Environmental,shale,peak,wet shale fragments hitting a flat rock ledge
Attack/Transient,smacking,Environmental,moss,canyon,a wet clump of moss falling and hitting a rock
Attack/Transient,smacking,Environmental,roots,woods,a wet tree root being pulled from the mud
Attack/Transient,smacking,Environmental,mist,fjord,mist droplets hitting a flat metal buoy in a fjord
Attack/Transient,smacking,Organic,lips,room,a person smacking their lips after eating in a room
Attack/Transient,smacking,Organic,hand clap,hall,a person clapping their wet hands in a hall
Attack/Transient,smacking,Organic,tail,water,a fish slapping its tail against a wet stone ledge
Attack/Transient,smacking,Organic,wings,pond,a duck’s wet wings slapping the water as it takes off
Attack/Transient,smacking,Organic,tongue,mouth,the sound of a tongue clicking against a wet palate
Attack/Transient,smacking,Organic,skin,gym,a wet hand slapping a person’s back in a locker room
Attack/Transient,smacking,Organic,paws,floor,wet dog paws treading on a tile floor in a hallway
Attack/Transient,smacking,Organic,chewing,dining,a person chewing wet food in a quiet dining room
Attack/Transient,smacking,Organic,footsteps,bathroom,bare wet feet walking on a ceramic tile floor
Attack/Transient,smacking,Organic,swallow,kitchen,the sound of a person swallowing a large gulp of water
Attack/Transient,smacking,Organic,claws,beach,a crab’s wet claws hitting a flat rock on a beach
Attack/Transient,smacking,Organic,beak,river,a bird’s wet beak snapping shut on a fish in a river
Attack/Transient,smacking,Organic,scales,swamp,a snake’s wet scales sliding over a flat log
Attack/Transient,smacking,Organic,frog,marsh,a frog jumping and landing on a wet lily pad
Attack/Transient,smacking,Organic,hippo,river,a hippo’s wet skin slapping against the water surface
Attack/Transient,smacking,Organic,elephant,savanna,an elephant’s wet trunk slapping its side
Attack/Transient,smacking,Organic,muscle,clinic,a wet hand slapping a person’s muscle in a clinic
Attack/Transient,smacking,Organic,lizard,wall,a wet lizard jumping and hitting a glass window
Attack/Transient,smacking,Domestic,towel,bathroom,a wet towel being slapped against a tiled wall
Attack/Transient,smacking,Domestic,dough,kitchen,a large ball of dough being slapped onto a counter
Attack/Transient,smacking,Domestic,sponge,sink,a wet sponge being slapped against a stainless steel sink
Attack/Transient,smacking,Domestic,mop,kitchen,a wet mop being slapped onto a linoleum floor
Attack/Transient,smacking,Domestic,fly swatter,porch,a fly swatter hitting a flat wooden surface on a porch
Attack/Transient,smacking,Domestic,boot,entry,a wet rubber boot being set down hard on a floor
Attack/Transient,smacking,Domestic,lid,pantry,a wet plastic lid being slapped onto a glass jar
Attack/Transient,smacking,Domestic,glove,garage,a wet rubber glove being slapped against a hand
Attack/Transient,smacking,Domestic,soap,bathroom,a wet bar of soap being dropped onto a tile floor
Attack/Transient,smacking,Domestic,curtain,shower,a wet plastic shower curtain slapping against the tub
Attack/Transient,smacking,Domestic,bag,kitchen,a wet plastic grocery bag being slapped onto a table
Attack/Transient,smacking,Domestic,bottle,cellar,a wet glass bottle hitting a stone floor in a cellar
Attack/Transient,smacking,Domestic,plate,dining,a wet ceramic plate being set down on a table
Attack/Transient,smacking,Domestic,cloth,laundry,a wet washcloth being slapped against a metal sink
Attack/Transient,smacking,Domestic,brush,bedroom,a wet hairbrush being set down on a glass vanity
Attack/Transient,smacking,Domestic,slippers,hall,wet slippers slapping against a hardwood floor
Attack/Transient,smacking,Domestic,tray,parlor,a wet serving tray being set down on a coffee table
Attack/Transient,smacking,Domestic,can,pantry,a wet tin can being slapped onto a metal shelf
Attack/Transient,smacking,Electronic,pulse,studio,a high-amplitude electronic pulse with a wet filter
Attack/Transient,smacking,Electronic,speaker,lab,a speaker diaphragm hitting its guard with a wet sound
Attack/Transient,smacking,Electronic,synthesizer,booth,a synthesizer playing a square wave with a wet envelope
Attack/Transient,smacking,Electronic,arc,garage,a wet electric arc jumping between two terminals
Attack/Transient,smacking,Electronic,buzzer,entry,a piezoelectric buzzer sounding through a wet door
Attack/Transient,smacking,Electronic,short,attic,a short circuit sparking in a wet junction box
Attack/Transient,smacking,Electronic,modem,office,a wet burst of data noise from a digital modem
Attack/Transient,smacking,Electronic,static,radio,a wet pop of static from an untuned radio receiver
Attack/Transient,smacking,Electronic,relay,closet,a wet mechanical relay clicking in a closet
Attack/Transient,smacking,Electronic,taser,gym,a wet electrical discharge from a taser in a gym
Attack/Transient,smacking,Electronic,flash,studio,a wet photographic flash tube firing in a studio
Attack/Transient,smacking,Electronic,capacitor,bench,a wet capacitor discharging with a snap in a lab
Attack/Transient,smacking,Electronic,breaker,hall,a wet circuit breaker flipping shut in a hallway
Attack/Transient,smacking,Electronic,hard drive,server,a wet hard drive head clicking as it parks
Attack/Transient,smacking,Electronic,solenoid,factory,a wet solenoid valve snapping open on a line
Attack/Transient,smacking,Electronic,monitor,office,a wet hum from a cathode ray tube television
Attack/Transient,smacking,Electronic,hum,cabin,a wet ground loop hum resonating in a cabin
Attack/Transient,smacking,Electronic,buzz,diner,a wet neon sign flickering with a buzzing snap
Attack/Transient,percussive,Musical,woodblock,orchestra,a hollow woodblock being struck with a hard wooden mallet
Attack/Transient,percussive,Musical,xylophone,hall,a rosewood xylophone being played with hard mallets
Attack/Transient,percussive,Musical,cowbell,stadium,a metal cowbell being struck with a drumstick
Attack/Transient,percussive,Musical,marimba,gallery,a marimba being played with rhythmic mallet strokes
Attack/Transient,percussive,Musical,castanets,stage,a pair of wooden castanets clicking rhythmically
Attack/Transient,percussive,Musical,claves,plaza,two hardwood claves being struck together in a plaza
Attack/Transient,percussive,Musical,triangle,cathedral,a steel triangle being struck in a rhythmic pattern
Attack/Transient,percussive,Musical,tambourine,club,a tambourine being shaken and struck in a rhythmic line
Attack/Transient,percussive,Musical,snare drum,studio,a snare drum playing a rhythmic roll in a studio
Attack/Transient,percussive,Musical,hi-hat,parade,a pair of hi-hat cymbals clashing rhythmically
Attack/Transient,percussive,Musical,glockenspiel,attic,a glockenspiel playing a rhythmic melody in an attic
Attack/Transient,percussive,Musical,handbells,church,a set of handbells being rung in a rhythmic sequence
Attack/Transient,percussive,Musical,koto,garden,a koto being played with rhythmic fingerpicking
Attack/Transient,percussive,Musical,steel drum,beach,a steel drum playing a rhythmic calypso beat
Attack/Transient,percussive,Musical,log drum,jungle,a hollow log drum being struck in a rhythmic pattern
Attack/Transient,percussive,Musical,frame drum,desert,a frame drum being struck with rhythmic palm hits
Attack/Transient,percussive,Musical,tabla,temple,a set of tabla drums being played with rhythmic fingerwork
Attack/Transient,percussive,Musical,kalimba,bedroom,a kalimba being played with rhythmic thumb plucks
Attack/Transient,percussive,Mechanical,typewriter,office,the rhythmic clicking of a typewriter in a quiet office
Attack/Transient,percussive,Mechanical,clock,library,a mechanical clock ticking rhythmically on a desk
Attack/Transient,percussive,Mechanical,engine,garage,the rhythmic thrum of an internal combustion engine
Attack/Transient,percussive,Mechanical,metronome,parlor,a mechanical metronome ticking at a set tempo
Attack/Transient,percussive,Mechanical,printing press,cellar,the rhythmic clatter of a printing press in a cellar
Attack/Transient,percussive,Mechanical,piston,factory,the rhythmic stroke of a piston in a factory machine
Attack/Transient,percussive,Mechanical,loom,studio,the rhythmic sound of a floor loom being operated
Attack/Transient,percussive,Mechanical,conveyor,warehouse,the rhythmic sound of a conveyor belt on rollers
Attack/Transient,percussive,Mechanical,well pump,farm,the rhythmic thumping of a manual well pump
Attack/Transient,percussive,Mechanical,fan,office,the rhythmic whirring of a desk fan in a quiet office
Attack/Transient,percussive,Mechanical,sewing machine,attic,the rhythmic stitching of a sewing machine
Attack/Transient,percussive,Mechanical,ratchet,garage,the rhythmic clicking of a metal ratchet in a garage
Attack/Transient,percussive,Mechanical,hammer,site,the rhythmic striking of a hammer on a steel nail
Attack/Transient,percussive,Mechanical,telegraph,station,the rhythmic tapping of a telegraph key in a station
Attack/Transient,percussive,Mechanical,projector,booth,the rhythmic clicking of a film projector shutter
Attack/Transient,percussive,Mechanical,slot machine,casino,the rhythmic clicking of a slot machine reel
Attack/Transient,percussive,Mechanical,spinning wheel,cottage,the rhythmic whirring of a spinning wheel
Attack/Transient,percussive,Mechanical,clapper,studio,the rhythmic snapping of a film clapper board
Attack/Transient,percussive,Environmental,woodpecker,forest,a woodpecker tapping rhythmically on a hollow tree
Attack/Transient,percussive,Environmental,hail,roof,the rhythmic sound of hail hitting a corrugated roof
Attack/Transient,percussive,Environmental,rain,tent,the rhythmic sound of rain hitting a nylon tent
Attack/Transient,percussive,Environmental,drip,cave,the rhythmic sound of water dripping into a cave pool
Attack/Transient,percussive,Environmental,waves,beach,the rhythmic sound of waves lapping on a sandy beach
Attack/Transient,percussive,Environmental,wind,fence,the rhythmic whistling of wind through a wire fence
Attack/Transient,percussive,Environmental,geyser,park,the rhythmic gurgling of a geyser before eruption
Attack/Transient,percussive,Environmental,bamboo,jungle,the rhythmic knocking of bamboo stalks in a breeze
Attack/Transient,percussive,Environmental,leaves,woods,the rhythmic rustling of dry leaves in a forest
Attack/Transient,percussive,Environmental,thunder,valley,the rhythmic rolling of distant thunder in a valley
Attack/Transient,percussive,Environmental,river,plain,the rhythmic churning of a river over stones
Attack/Transient,percussive,Environmental,avalanche,slope,the rhythmic sound of sliding snow on a mountain
Attack/Transient,percussive,Environmental,glacier,bay,the rhythmic groaning of a glacier in a bay
Attack/Transient,percussive,Environmental,sandstorm,desert,the rhythmic abrasive roar of a sandstorm
Attack/Transient,percussive,Environmental,lava,tube,the rhythmic popping of lava bubbles in a tube
Attack/Transient,percussive,Environmental,tide,cave,the rhythmic surge of the tide into a sea cave
Attack/Transient,percussive,Environmental,fire,campsite,the rhythmic crackling of a log in a campfire
Attack/Transient,percussive,Environmental,mist,fjord,the rhythmic sound of mist droplets hitting a buoy
Attack/Transient,percussive,Organic,hoofbeats,road,the rhythmic sound of horse hooves on a paved road
Attack/Transient,percussive,Organic,heartbeat,room,the rhythmic sound of a human heartbeat in a room
Attack/Transient,percussive,Organic,cricket,field,the rhythmic chirping of a cricket in a summer field
Attack/Transient,percussive,Organic,cicada,orchard,the rhythmic buzzing of a cicada in an orchard
Attack/Transient,percussive,Organic,footsteps,hall,the rhythmic sound of leather boots in a hallway
Attack/Transient,percussive,Organic,tongue,nook,the rhythmic clicking of a tongue against a palate
Attack/Transient,percussive,Organic,knuckles,door,the rhythmic rapping of knuckles on a wooden door
Attack/Transient,percussive,Organic,wings,barn,the rhythmic flapping of bird wings in a barn
Attack/Transient,percussive,Organic,chewing,dining,the rhythmic sound of a person chewing crisp food
Attack/Transient,percussive,Organic,clapping,hall,the rhythmic sound of a person clapping their hands
Attack/Transient,percussive,Organic,beak,forest,the rhythmic tapping of a bird’s beak on a branch
Attack/Transient,percussive,Organic,scales,desert,the rhythmic rattling of a snake’s tail in the desert
Attack/Transient,percussive,Organic,frog,marsh,the rhythmic croaking of a bullfrog in a marshland
Attack/Transient,percussive,Organic,hippo,river,the rhythmic grunting of a hippo in a river
Attack/Transient,percussive,Organic,elephant,savanna,the rhythmic rumbling of an elephant on the savanna
Attack/Transient,percussive,Organic,lion,park,the rhythmic growling of a lion in a safari park
