category,tag,domain,source,environment,scenario
Attack/Transient,percussive,Electronic,sequencer,studio,a sequencer running in a studio
Attack/Transient,percussive,Electronic,relay,room,relays clicking in a room
Attack/Transient,percussive,Electronic,clock signal,lab,a clock signal in a lab
Attack/Transient,percussive,Electronic,glitch,studio,digital glitches in a studio
Attack/Transient,percussive,Electronic,spark,garage,sparks in a garage
Attack/Transient,percussive,Electronic,drive,office,a drive clicking in an office
Attack/Transient,percussive,Electronic,capacitor,shop,capacitors popping in a shop
Attack/Transient,percussive,Electronic,lcd,study,tapping an lcd in a study
Attack/Transient,percussive,Electronic,calculator,room,calculator buttons in a room
Attack/Transient,percussive,Electronic,strobe,club,a strobe in a club
Attack/Transient,percussive,Electronic,tester,bench,a tester in a bench
Attack/Transient,percussive,Electronic,taser,facility,a taser in a facility
Attack/Transient,percussive,Electronic,switch,room,a switch in a room
