category,tag,domain,source,environment,scenario
Attack/Transient,percussive,Organic,muscle,clinic,the rhythmic sound of a muscle being massaged
Attack/Transient,percussive,Organic,lizard,wall,the rhythmic clicking of a lizard’s feet on a wall
Attack/Transient,percussive,Domestic,chopping,kitchen,the rhythmic sound of a knife chopping vegetables
Attack/Transient,percussive,Domestic,hammering,garage,the rhythmic sound of a hammer hitting a nail
Attack/Transient,percussive,Domestic,typing,office,the rhythmic sound of typing on a computer keyboard
Attack/Transient,percussive,Domestic,shuffling,library,the rhythmic sound of pages being turned in a book
Attack/Transient,percussive,Domestic,sweeping,porch,the rhythmic sound of a broom sweeping a porch
Attack/Transient,percussive,Domestic,rocking,nursery,the rhythmic creaking of a rocking chair in a nursery
Attack/Transient,percussive,Domestic,stirring,kitchen,the rhythmic sound of a spoon stirring a ceramic bowl
Attack/Transient,percussive,Domestic,tapping,desk,the rhythmic sound of fingers tapping on a wooden desk
Attack/Transient,percussive,Domestic,shaking,laundry,the rhythmic sound of a laundry machine tumbling
Attack/Transient,percussive,Domestic,scrubbing,bathroom,the rhythmic sound of a brush scrubbing a tile floor
Attack/Transient,percussive,Domestic,dripping,sink,the rhythmic sound of water dripping into a sink
Attack/Transient,percussive,Domestic,ticking,study,the rhythmic sound of a small desk clock ticking
Attack/Transient,percussive,Domestic,clicking,bedroom,the rhythmic sound of a pen being clicked in a study
Attack/Transient,percussive,Domestic,closing,hall,the rhythmic sound of a door being opened and closed
Attack/Transient,percussive,Domestic,bagging,grocery,the rhythmic sound of groceries being placed in a bag
Attack/Transient,percussive,Domestic,pouring,dining,the rhythmic sound of water being poured into a glass
Attack/Transient,percussive,Domestic,clinking,kitchen,the rhythmic sound of silverware being sorted
Attack/Transient,percussive,Domestic,knocking,door,the rhythmic sound of a person knocking on a door
Attack/Transient,percussive,Electronic,sequencer,studio,a digital sequencer playing a rhythmic pulse in a studio
Attack/Transient,percussive,Electronic,buzzer,classroom,a piezoelectric buzzer sounding in a rhythmic pattern
Attack/Transient,percussive,Electronic,relay,closet,a mechanical relay switching in a rhythmic sequence
Attack/Transient,percussive,Electronic,spark,lab,a rhythmic series of sparks jumping between electrodes
Attack/Transient,percussive,Electronic,synthesizer,booth,a synthesizer playing a rhythmic square wave pulse
Attack/Transient,percussive,Electronic,modem,office,the rhythmic screeching of a dial-up modem
Attack/Transient,percussive,Electronic,clock,bedroom,the rhythmic beeping of a digital alarm clock
Attack/Transient,percussive,Electronic,hard drive,server,the rhythmic clicking of a hard drive head
Attack/Transient,percussive,Electronic,solenoid,factory,the rhythmic clicking of a solenoid on a machine
Attack/Transient,percussive,Electronic,monitor,office,the rhythmic buzzing of a cathode ray tube television
Attack/Transient,percussive,Electronic,hum,cabin,the rhythmic resonance of a ground loop in a cabin
Attack/Transient,percussive,Electronic,buzz,diner,the rhythmic flickering of a neon sign in a diner
Attack/Transient,percussive,Electronic,short,attic,the rhythmic snapping of a short circuit in a junction box
Attack/Transient,percussive,Electronic,taser,gym,the rhythmic discharge of a taser in a training room
Attack/Transient,percussive,Electronic,flash,studio,the rhythmic charging of a photographic flash tube
Attack/Transient,percussive,Electronic,capacitor,bench,the rhythmic discharge of capacitors in a lab
Attack/Transient,percussive,Electronic,breaker,hall,the rhythmic flipping of a circuit breaker in a hallway
Attack/Transient,percussive,Electronic,static,radio,the rhythmic popping of static from an untuned radio
