category,tag,domain,source,environment,scenario
Brightness/Spectral,brilliant,Mechanical,typewriter,office,a mechanical typewriter being used at a frantic pace
Brightness/Spectral,brilliant,Mechanical,projector,theater,the high-pitched flicker of a vintage film projector
Brightness/Spectral,brilliant,Mechanical,clutch,race track,a racing car clutch engaging with a sharp metallic clink
Brightness/Spectral,brilliant,Mechanical,spring,factory,a high-tension coil spring snapping back into place
Brightness/Spectral,brilliant,Mechanical,blade,kitchen,a steel blade being honed on a ceramic rod
Brightness/Spectral,brilliant,Mechanical,pulley,gymnasium,a metal pulley system whirring under a light load
Brightness/Spectral,brilliant,Environmental,lightning,open field,a nearby lightning strike cracking through the air
Brightness/Spectral,brilliant,Environmental,ice,arctic,a massive sheet of thin ice shattering on a frozen sea
Brightness/Spectral,brilliant,Environmental,waterfall,mountain stream,the spray of a waterfall hitting a tin plate
Brightness/Spectral,brilliant,Environmental,hail,car roof,large hailstones striking a car's sunroof
Brightness/Spectral,brilliant,Environmental,wind,high peaks,wind whistling through a narrow rock crevice
Brightness/Spectral,brilliant,Environmental,fire,forest,the intense crackle of dry bamboo exploding in a fire
Brightness/Spectral,brilliant,Environmental,stream,glacier,a glacial stream rushing over crystalline rocks
Brightness/Spectral,brilliant,Environmental,geyser,geothermal park,a geyser jetting high-pressure steam into the air
Brightness/Spectral,brilliant,Environmental,thaw,spring forest,icicles shattering on a stone ledge during a thaw
Brightness/Spectral,brilliant,Environmental,sand,desert,wind-blown sand sandblasting a glass pane
Brightness/Spectral,brilliant,Environmental,cave,stalactite room,the sharp splash of a water drop in a crystal cavern
Brightness/Spectral,brilliant,Environmental,sleet,winter storm,sleet hitting a window pane in a gale
Brightness/Spectral,brilliant,Environmental,reef,underwater,the snapping of pistol shrimp on a coral reef
Brightness/Spectral,brilliant,Environmental,shore,rocky beach,pebbles being dragged rapidly by a receding wave
Brightness/Spectral,brilliant,Environmental,volcano,ash field,obsidian fragments clinking as they settle
Brightness/Spectral,brilliant,Environmental,meadow,summer noon,thousands of cicadas buzzing in unison
Brightness/Spectral,brilliant,Environmental,avalanche,mountain top,the sharp crack of a cornice breaking
Brightness/Spectral,brilliant,Environmental,tundra,winter,frozen grass snapping in a sub-zero wind
Brightness/Spectral,brilliant,Organic,insect,rainforest,a swarm of cicadas screaming in a jungle canopy
Brightness/Spectral,brilliant,Organic,bird,cliffs,the piercing shriek of a hawk echoing off a cliff
Brightness/Spectral,brilliant,Organic,dolphin,ocean,a dolphin emitting a series of high-pitched clicks
Brightness/Spectral,brilliant,Organic,rattlesnake,scrubland,the rapid-fire rattle of a snake in the brush
Brightness/Spectral,brilliant,Organic,bat,cave,a colony of bats chirping in a stone cavern
Brightness/Spectral,brilliant,Organic,shriek,meadow,the high-pitched alarm call of a marmot
Brightness/Spectral,brilliant,Organic,teeth,cold room,the sharp chattering of teeth in a freezing cellar
Brightness/Spectral,brilliant,Organic,scales,desert,the dry rustle of a viper sliding over parched earth
Brightness/Spectral,brilliant,Organic,whistle,forest,the clear whistle of a mountain marmot
Brightness/Spectral,brilliant,Organic,wings,garden,the high-frequency hum of a sphinx moth’s wings
Brightness/Spectral,brilliant,Organic,bark,dog park,the sharp yip of a small terrier
Brightness/Spectral,brilliant,Organic,twigs,winter woods,frozen pine twigs snapping in a gust
Brightness/Spectral,brilliant,Organic,bones,ossuary,dry bird bones falling onto a stone floor
Brightness/Spectral,brilliant,Organic,claws,metal roof,a squirrel's claws scrabbling on a tin roof
Brightness/Spectral,brilliant,Organic,voice,theater,a soprano hitting a high-pitched operatic note
Brightness/Spectral,brilliant,Organic,beak,tree trunk,a nuthatch tapping rapidly on a dry branch
Brightness/Spectral,brilliant,Organic,shells,tide pool,barnacles snapping shut as the tide recedes
Brightness/Spectral,brilliant,Organic,shiver,bedroom,the rapid vibration of a person shivering
Brightness/Spectral,brilliant,Domestic,glass,kitchen,a crystal wine glass shattering on a tile floor
Brightness/Spectral,brilliant,Domestic,chandelier,ballroom,crystal droplets clinking together in a draft
Brightness/Spectral,brilliant,Domestic,silver,dining room,a silver tray being struck with a metal spoon
Brightness/Spectral,brilliant,Domestic,porcelain,shop,a stack of porcelain plates falling and breaking
Brightness/Spectral,brilliant,Domestic,jewelry,bedroom,a diamond ring being dropped into a glass bowl
Brightness/Spectral,brilliant,Domestic,beads,playroom,a thousand glass beads spilling onto a hardwood floor
Brightness/Spectral,brilliant,Domestic,foil,kitchen,a sheet of tin foil being ripped quickly
Brightness/Spectral,brilliant,Domestic,keys,hallway,a large bunch of brass keys hitting a stone floor
Brightness/Spectral,brilliant,Domestic,coins,bank,a bag of silver coins being emptied onto a metal counter
Brightness/Spectral,brilliant,Domestic,lightbulb,garage,a lightbulb exploding into many small pieces
Brightness/Spectral,brilliant,Domestic,mirror,bathroom,a hand mirror shattering on a marble vanity
Brightness/Spectral,brilliant,Domestic,spray,bathroom,a high-pressure aerosol spray nozzle being engaged
Brightness/Spectral,brilliant,Domestic,whistle,kitchen,a tea kettle whistling at maximum pressure
Brightness/Spectral,brilliant,Domestic,zipper,closet,a long metal zipper being zipped up very fast
Brightness/Spectral,brilliant,Domestic,ceramic,patio,a ceramic pot shattering into shards on stone
Brightness/Spectral,brilliant,Domestic,utensil,kitchen,a stainless steel spatula scraping a hot griddle
Brightness/Spectral,brilliant,Domestic,clapper,doorway,a brass door knocker striking a metal plate
Brightness/Spectral,brilliant,Domestic,jar,pantry,a glass jar of marbles being shaken
Brightness/Spectral,brilliant,Electronic,arc,laboratory,a high-voltage plasma arc sizzling in a vacuum
Brightness/Spectral,brilliant,Electronic,flash,studio,a professional camera flash charging and firing
Brightness/Spectral,brilliant,Electronic,spark,workshop,a Tesla coil emitting a series of bright sparks
Brightness/Spectral,brilliant,Electronic,buzzer,factory,a high-frequency electronic alarm sounding
Brightness/Spectral,brilliant,Electronic,glitch,studio,a short burst of digital clipping in a recording
Brightness/Spectral,brilliant,Electronic,oscillator,lab,a square wave generator at 15kHz
Brightness/Spectral,brilliant,Electronic,laser,research facility,a high-power laser pulsing against a metal target
Brightness/Spectral,brilliant,Electronic,feedback,stage,a sharp squeal of guitar feedback through a tweeter
Brightness/Spectral,brilliant,Electronic,capacitance,clean room,the discharge of a high-energy capacitor bank
Brightness/Spectral,brilliant,Electronic,modem,office,the screeching tones of an old fax machine
Brightness/Spectral,brilliant,Electronic,radio,wilderness,the high-pitched whistle of a shortwave radio tuner
Brightness/Spectral,brilliant,Electronic,beeper,hospital,a rapid high-pitched medical alert beeper
Brightness/Spectral,brilliant,Electronic,monitor,control room,the high-pitched whine of a flyback transformer
Brightness/Spectral,brilliant,Electronic,switch,substation,the sharp crack of a high-voltage circuit breaker
Brightness/Spectral,brilliant,Electronic,synthesizer,studio,a resonant high-pass filter sweep on a synth
Brightness/Spectral,brilliant,Electronic,scanner,library,the high-pitched whir of a flatbed scanner
Brightness/Spectral,brilliant,Electronic,relay,telecom hub,the rapid-fire clicking of electronic relays
Brightness/Spectral,brilliant,Electronic,chip,server room,the high-pitched hum of a malfunctioning microchip
Brightness/Spectral,dull,Musical,drum,rehearsal room,a floor tom being struck with a heavy felt mallet
Brightness/Spectral,dull,Musical,woodblock,orchestra hall,a woodblock wrapped in thick cloth being struck
Brightness/Spectral,dull,Musical,guitar,bedroom,a palm-muted strum on old nylon guitar strings
Brightness/Spectral,dull,Musical,piano,saloon,a piano played with the damper pedal fully depressed
Brightness/Spectral,dull,Musical,cello,basement,a cello string being plucked while muted with a finger
Brightness/Spectral,dull,Musical,tambourine,recording booth,a tambourine with the jingles taped shut being shaken
Brightness/Spectral,dull,Musical,marimba,conservatory,a marimba played with extremely soft yarn mallets
Brightness/Spectral,dull,Musical,cymbals,studio,a ride cymbal being struck while covered in a towel
Brightness/Spectral,dull,Musical,violin,attic,a violin being bowed with a heavy metal practice mute
Brightness/Spectral,dull,Musical,snare drum,garage,a snare drum with the wires turned off and a cloth on top
Brightness/Spectral,dull,Musical,harp,closet,a harp string being plucked near the soundboard with a thumb
Brightness/Spectral,dull,Musical,banjo,porch,a banjo played with a thick rag stuffed behind the bridge
Brightness/Spectral,dull,Musical,gong,meditation hall,a large gong being struck with a massive rubber beater
Brightness/Spectral,dull,Musical,flute,museum,a wooden flute being played softly in a carpeted room
Brightness/Spectral,dull,Musical,clarinet,den,a clarinet note played with a very soft reed
Brightness/Spectral,dull,Musical,xylophone,classroom,a xylophone struck with rubber mallets on the lowest bars
Brightness/Spectral,dull,Musical,organ,parlor,a small reed organ with the swell box closed
Brightness/Spectral,dull,Musical,handpan,bedroom,a handpan being played with the soft pads of the fingers
Brightness/Spectral,dull,Mechanical,lever,factory,a heavy rusted iron lever being pulled slowly
Brightness/Spectral,dull,Mechanical,belt,engine room,a thick rubber fan belt slipping on a pulley
Brightness/Spectral,dull,Mechanical,hammer,workshop,a lead-filled dead blow hammer striking a wooden beam
Brightness/Spectral,dull,Mechanical,piston,steam engine,a grease-covered piston sliding in a heavy cylinder
Brightness/Spectral,dull,Mechanical,gears,mill,massive stone gears grinding together under water
Brightness/Spectral,dull,Mechanical,press,industrial plant,a heavy hydraulic press stamping a thick rubber mat
Brightness/Spectral,dull,Mechanical,conveyor,quarry,a heavy conveyor belt moving wet gravel
Brightness/Spectral,dull,Mechanical,lathe,machine shop,a lathe turning a heavy lead cylinder
Brightness/Spectral,dull,Mechanical,pump,basement,a submerged sump pump thumping through a concrete floor
Brightness/Spectral,dull,Mechanical,wrench,garage,a heavy pipe wrench falling onto a thick rubber mat
Brightness/Spectral,dull,Mechanical,shredder,office,a paper shredder struggling with a thick stack of cardboard
Brightness/Spectral,dull,Mechanical,fan,warehouse,a large ceiling fan spinning slowly in a humid room
Brightness/Spectral,dull,Mechanical,door,bunker,a heavy lead-lined door closing against a rubber seal
Brightness/Spectral,dull,Mechanical,pulley,barn,a thick hemp rope creaking through a wooden pulley
Brightness/Spectral,dull,Mechanical,winch,dock,a rusted winch drum turning slowly under high tension
Brightness/Spectral,dull,Mechanical,typewriter,archive,a typewriter being used through a thick felt cover
Brightness/Spectral,dull,Mechanical,clutch,tractor,a heavy tractor clutch engaging in deep mud
Brightness/Spectral,dull,Mechanical,drill,construction,a large auger drilling into soft clay soil
Brightness/Spectral,dull,Environmental,mud,marsh,a large bubble of marsh gas popping in thick mud
Brightness/Spectral,dull,Environmental,snow,forest,a heavy clump of wet snow falling onto a mossy log
Brightness/Spectral,dull,Environmental,sand,dune,a person sliding down a steep sand dune
Brightness/Spectral,dull,Environmental,earth,garden,a heavy shovel being pushed into wet potting soil
Brightness/Spectral,dull,Environmental,water,swamp,a heavy stone being dropped into a murky swamp
Brightness/Spectral,dull,Environmental,leaves,woodland,wet autumn leaves being compressed under a heavy boot
Brightness/Spectral,dull,Environmental,wind,tundra,a low wind moaning through a hollow rotted log
Brightness/Spectral,dull,Environmental,thatch,village,heavy rain hitting a thick thatched roof
Brightness/Spectral,dull,Environmental,ice,river,a thick layer of river ice groaning under pressure
Brightness/Spectral,dull,Environmental,cave,cavern,a distant thud of a falling rock in a silt-filled cave
Brightness/Spectral,dull,Environmental,ash,volcanic plain,walking through a deep layer of volcanic ash
Brightness/Spectral,dull,Environmental,peat,moor,a foot stepping into a waterlogged peat bog
Brightness/Spectral,dull,Environmental,fog,harbor,a distant foghorn sounding through a thick mist
Brightness/Spectral,dull,Environmental,underwater,lake,a large wooden log bumping against a dock underwater
Brightness/Spectral,dull,Environmental,moss,cloud forest,a hand pressing into a thick layer of wet moss
Brightness/Spectral,dull,Environmental,clay,riverbank,a heavy clay bank collapsing into a slow river
Brightness/Spectral,dull,Environmental,dust,desert,a dust devil swirling over a soft silt flat
Brightness/Spectral,dull,Environmental,bark,forest,a piece of sodden bark falling onto the forest floor
Brightness/Spectral,dull,Organic,thump,gym,a heavy medicine ball hitting a padded mat
Brightness/Spectral,dull,Organic,footstep,meadow,a cow walking through deep
Brightness/Spectral,dull,Organic,impact,forest,a heavy branch hitting the soft forest floor
Brightness/Spectral,dull,Organic,squash,garden,a ripe melon dropping onto soft earth
Brightness/Spectral,dull,Organic,heartbeat,medical clinic,the muffled sound of a heart through a thick chest wall
Brightness/Spectral,dull,Organic,clap,theater,someone clapping with cupped hands in a large hall
Brightness/Spectral,dull,Organic,vocal,den,a person humming with their mouth closed and nose pinched
Brightness/Spectral,dull,Organic,breath,bedroom,a heavy sigh into a feather pillow
Brightness/Spectral,dull,Organic,skin,bathroom,a wet hand slapping a damp thigh
Brightness/Spectral,dull,Organic,hair,barber shop,a thick lock of hair being cut with blunt scissors
Brightness/Spectral,dull,Organic,tongue,kitchen,the sound of someone smacking their lips after eating honey
Brightness/Spectral,dull,Organic,muscle,massage room,a heavy muscle being kneaded during a massage
Brightness/Spectral,dull,Organic,belly,poolside,a belly flop into a pool of water
Brightness/Spectral,dull,Organic,fur,stable,brushing a horse’s thick winter coat
Brightness/Spectral,dull,Organic,throat,bedroom,a muffled cough into a thick wool blanket
Brightness/Spectral,dull,Organic,flesh,kitchen,kneading a large mound of heavy bread dough
Brightness/Spectral,dull,Organic,stomp,field,a boot stomping on a patch of wet sod
Brightness/Spectral,dull,Organic,wing,barn,a large bat hitting a wooden beam in flight
Brightness/Spectral,dull,Domestic,rug,living room,a heavy rug being unrolled onto a carpeted floor
Brightness/Spectral,dull,Domestic,pillow,bedroom,a large feather pillow being fluffed
Brightness/Spectral,dull,Domestic,book,library,a heavy thick encyclopedia being dropped onto a sofa
Brightness/Spectral,dull,Domestic,curtain,theater,heavy velvet drapes falling onto a stage floor
Brightness/Spectral,dull,Domestic,cardboard,garage,a large cardboard box being dragged across concrete
Brightness/Spectral,dull,Domestic,mattress,bedroom,a person jumping onto a memory foam mattress
Brightness/Spectral,dull,Domestic,cork,cellar,a cork being pushed into a wine bottle
Brightness/Spectral,dull,Domestic,sponge,kitchen,a wet sponge being squeezed out in a sink
Brightness/Spectral,dull,Domestic,door,hallway,a padded soundproof door swinging shut
Brightness/Spectral,dull,Domestic,towel,bathroom,a heavy wet towel dropping onto a tile floor
Brightness/Spectral,dull,Domestic,suitcase,attic,a soft-sided suitcase being tossed into a corner
Brightness/Spectral,dull,Domestic,dough,kitchen,a heavy ball of pizza dough being slapped onto a wooden board
Brightness/Spectral,dull,Domestic,sofa,living room,someone punching a plush sofa cushion
Brightness/Spectral,dull,Domestic,bread,bakery,a loaf of dense rye bread being dropped on a table
Brightness/Spectral,dull,Domestic,blanket,bedroom,a heavy wool blanket being shaken out
Brightness/Spectral,dull,Domestic,cabinet,kitchen,a kitchen drawer closing against a rubber bumper
Brightness/Spectral,dull,Domestic,soap,bathroom,a bar of soap falling into a full bathtub
Brightness/Spectral,dull,Domestic,cloth,dining room,a heavy tablecloth being spread over a wooden table
Brightness/Spectral,dull,Electronic,hum,basement,the low-frequency thrum of an old transformer buried in a wall
Brightness/Spectral,dull,Electronic,speaker,car,a subwoofer playing through a trunk filled with blankets
Brightness/Spectral,dull,Electronic,battery,workshop,a dying battery causing a motor to groan and stall
Brightness/Spectral,dull,Electronic,static,radio,the muffled static of a radio tuned between stations under water
Brightness/Spectral,dull,Electronic,pulse,lab,a low-frequency square wave passed through a thick wool filter
Brightness/Spectral,dull,Electronic,drone,studio,a synthesizer playing a sine wave at 60Hz
Brightness/Spectral,dull,Electronic,click,office,a keyboard key being pressed through a silicone cover
Brightness/Spectral,dull,Electronic,fan,attic,a dust-clogged computer fan struggling to spin
Brightness/Spectral,dull,Electronic,relay,basement,an electrical relay clicking inside a thick plastic housing
Brightness/Spectral,dull,Electronic,intercom,apartment,a muffled voice coming through a low-quality intercom
Brightness/Spectral,dull,Electronic,alarm,bedroom,a digital alarm clock beeping from under a pile of clothes
Brightness/Spectral,dull,Electronic,transformer,street,the distant low-frequency buzz of a power line in the rain
Brightness/Spectral,dull,Electronic,monitor,office,the degaussing hum of a CRT monitor covered by a cloth
Brightness/Spectral,dull,Electronic,phone,purse,a vibrating cell phone at the bottom of a heavy handbag
Brightness/Spectral,dull,Electronic,engine,garage,the muffled starter motor of a car heard through a wall
Brightness/Spectral,dull,Electronic,solenoid,factory,a solenoid firing inside a heavy oil-filled chamber
Brightness/Spectral,dull,Electronic,wire,construction,the dull snap of a thick insulated copper cable
Brightness/Spectral,dull,Electronic,box,utility room,the low vibration of a circuit breaker panel heard from another room
