category,tag,domain,source,environment,scenario
Density/Complexity,saturated,Mechanical,siren,square,a mechanical air-raid siren wailing at its highest volume
Density/Complexity,saturated,Mechanical,saw,woodshop,a circular saw cutting through a thick oak beam at full speed
Density/Complexity,saturated,Mechanical,hydraulic press,shop,a press crushing a metal can with air trapped inside
Density/Complexity,saturated,Mechanical,fan,server room,a high-speed cooling fan running at maximum speed in a cabinet
Density/Complexity,saturated,Mechanical,vacuum,closet,a powerful vacuum cleaner running with its intake fully blocked
Density/Complexity,saturated,Mechanical,grinder,garage,an angle grinder cutting into a steel pipe at high speed
Density/Complexity,saturated,Mechanical,drill,workshop,a high-speed drill bit screeching against a hardened metal plate
Density/Complexity,saturated,Mechanical,engine,boat,a speedboat engine running at wide-open throttle on the water
Density/Complexity,saturated,Mechanical,blower,mill,a high-pressure leaf blower running at maximum power
Density/Complexity,saturated,Mechanical,conveyor,mine,a heavy conveyor belt struggling under an oversized load of rock
Density/Complexity,saturated,Mechanical,pump,basement,a high-pressure water pump running at its limit
Density/Complexity,saturated,Mechanical,lathe,factory,a metal lathe taking a heavy cut at high speed
Density/Complexity,saturated,Mechanical,stapler,warehouse,a pneumatic staple gun firing in rapid-fire succession
Density/Complexity,saturated,Mechanical,mixer,kitchen,an electric food mixer running at high speed on a heavy dough
Density/Complexity,saturated,Environmental,hurricane,coast,category five hurricane winds screaming through a forest
Density/Complexity,saturated,Environmental,waterfall,cliff,the base of a massive waterfall where the air is full of mist
Density/Complexity,saturated,Environmental,thunder,canyon,a continuous peal of thunder echoing in a narrow rock gorge
Density/Complexity,saturated,Environmental,fire,woods,the roar of a crowning forest fire at its peak intensity
Density/Complexity,saturated,Environmental,sandstorm,desert,a violent sandstorm sandblasting a metal shipping container
Density/Complexity,saturated,Environmental,waves,shore,massive storm waves crashing against a sea wall in a gale
Density/Complexity,saturated,Environmental,geyser,valley,a large geyser erupting with a continuous jet of steam
Density/Complexity,saturated,Environmental,rain,roof,a torrential tropical downpour hitting a metal roof
Density/Complexity,saturated,Environmental,glacier,arctic,a massive glacier calving into the sea with a deafening roar
Density/Complexity,saturated,Environmental,avalanche,slope,a massive snow avalanche rushing down a steep alpine slope
Density/Complexity,saturated,Environmental,river,gorge,a flooded river rushing through a narrow rocky canyon
Density/Complexity,saturated,Environmental,volcano,peak,the continuous roar of a volcanic eruption from the crater
Density/Complexity,saturated,Environmental,mud,bog,a large geothermal mud pit boiling violently at the surface
Density/Complexity,saturated,Environmental,hail,car,a violent hailstorm hitting a car parked in the open
Density/Complexity,saturated,Environmental,wind,tunnel,high-speed wind rushing through a narrow concrete tunnel
Density/Complexity,saturated,Environmental,lava,tube,lava churning and popping at high volume in a tunnel
Density/Complexity,saturated,Environmental,tide,bay,a massive bore tide rushing into a narrow river mouth
Density/Complexity,saturated,Environmental,ice,river,a massive ice jam breaking up in a swollen river
Density/Complexity,saturated,Organic,cicadas,orchard,thousands of cicadas buzzing at high noon in a summer orchard
Density/Complexity,saturated,Organic,lions,zoo,a pride of lions roaring together at close range
Density/Complexity,saturated,Organic,bees,hive,a massive swarm of bees inside a hollow tree trunk
Density/Complexity,saturated,Organic,crowd,stadium,a hundred thousand people cheering at a goal in a stadium
Density/Complexity,saturated,Organic,birds,cliffs,a massive seabird colony screaming on a rocky cliffside
Density/Complexity,saturated,Organic,shrimp,reef,millions of snapping shrimp clicking together in a coral reef
Density/Complexity,saturated,Organic,frogs,marsh,a dense chorus of thousands of frogs in a swamp at night
Density/Complexity,saturated,Organic,elephant,savanna,an elephant trumpeting at maximum volume at close range
Density/Complexity,saturated,Organic,human,hall,a person screaming at the top of their lungs in a stone hall
Density/Complexity,saturated,Organic,howler monkey,jungle,a troop of howler monkeys screaming in the canopy
Density/Complexity,saturated,Organic,dog,kennel,a dozen large dogs barking together in a small kennel
Density/Complexity,saturated,Organic,crickets,field,a field full of crickets chirping at maximum density
Density/Complexity,saturated,Organic,pigeons,square,a thousand pigeons taking off at once from a stone square
Density/Complexity,saturated,Organic,walrus,arctic,a beach full of walruses grunting and bellowing together
Density/Complexity,saturated,Organic,heartbeat,room,a racing human heartbeat heard through a stethoscope
Density/Complexity,saturated,Organic,cough,closet,a person in a fit of coughing in a small enclosed space
Density/Complexity,saturated,Organic,wings,attic,a swarm of bats flying together in a small attic space
Density/Complexity,saturated,Organic,chewing,studio,a person crunching on a mouthful of dry cereal
Density/Complexity,saturated,Domestic,kettle,kitchen,a whistling tea kettle at maximum steam pressure
Density/Complexity,saturated,Domestic,vacuum,room,a high-powered vacuum cleaner running on a thick rug
Density/Complexity,saturated,Domestic,hair dryer,bathroom,a hair dryer running at its highest setting in a small room
Density/Complexity,saturated,Domestic,blender,kitchen,an electric blender crushing ice at maximum speed
Density/Complexity,saturated,Domestic,shower,stall,a high-pressure shower head running in a small stall
Density/Complexity,saturated,Domestic,pressure cooker,nook,a pressure cooker releasing a constant stream of steam
Density/Complexity,saturated,Domestic,furnace,basement,a large forced-air furnace running at full capacity
Density/Complexity,saturated,Domestic,garbage disposal,sink,a disposal unit grinding a load of bones in a sink
Density/Complexity,saturated,Domestic,washing machine,laundry,a machine spinning a heavy load at its highest speed
Density/Complexity,saturated,Domestic,fire,fireplace,a large log fire roaring with a constant draft
Density/Complexity,saturated,Domestic,fan,bedroom,a high-velocity floor fan running on high next to a bed
Density/Complexity,saturated,Domestic,door,entry,a heavy door being slammed with maximum force
Density/Complexity,saturated,Domestic,curtains,theater,the sound of heavy curtains being drawn rapidly
Density/Complexity,saturated,Domestic,shutter,store,a metal security shutter being raised at high speed
Density/Complexity,saturated,Domestic,pot,kitchen,a large pot of water boiling violently on a stove
Density/Complexity,saturated,Domestic,radio,parlor,a radio playing loud white noise at maximum volume
Density/Complexity,saturated,Domestic,iron,laundry,a steam iron releasing a continuous blast of steam
Density/Complexity,saturated,Domestic,box,attic,a cardboard box being torn open with a single long motion
Density/Complexity,saturated,Electronic,arc,lab,a continuous high-voltage arc discharge in a laboratory
Density/Complexity,saturated,Electronic,radio,den,a radio receiver tuned between stations at full volume
Density/Complexity,saturated,Electronic,taser,gym,the continuous rapid-fire crackle of a taser discharge
Density/Complexity,saturated,Electronic,neon,diner,a large neon sign buzzing with high-voltage intensity
Density/Complexity,saturated,Electronic,buzzer,factory,a loud industrial electronic buzzer sounding continuously
Density/Complexity,saturated,Electronic,synthesizer,studio,a synthesizer playing a resonant filter sweep at high volume
Density/Complexity,saturated,Electronic,modem,office,the continuous screeching of a high-speed data transfer
Density/Complexity,saturated,Electronic,static,radio,the constant roar of atmospheric static on a shortwave radio
Density/Complexity,saturated,Electronic,transformer,station,the intense hum of a power station transformer at load
Density/Complexity,saturated,Electronic,feedback,stage,electronic feedback screaming through a large speaker stack
Density/Complexity,saturated,Electronic,hard drive,server,the high-pitched whine of multiple server drives spinning up
Density/Complexity,saturated,Electronic,alarm,bank,a high-intensity electronic siren sounding in a vault
Density/Complexity,saturated,Electronic,generator,shelter,a large diesel generator running at maximum capacity
Density/Complexity,saturated,Electronic,welder,shop,the intense constant hiss of a plasma cutter in a shop
Density/Complexity,saturated,Electronic,coil,museum,the constant growl of a tesla coil in a museum
Density/Complexity,saturated,Electronic,monitor,room,the intense high-pitched whine of an old monitor
Density/Complexity,saturated,Electronic,fan,closet,a high-speed server fan running at its physical limit
Density/Complexity,saturated,Electronic,short,panel,a continuous sparking from a high-voltage short circuit
Density/Complexity,cluttered,Musical,percussion,nursery,a large bin of small percussion toys being dumped on the floor
Density/Complexity,cluttered,Musical,wind chimes,patio,multiple tangled sets of metal wind chimes in a storm
Density/Complexity,cluttered,Musical,tambourine,stage,a tambourine with loose jingles being shaken haphazardly
Density/Complexity,cluttered,Musical,piano,attic,a piano with broken internal strings being played randomly
Density/Complexity,cluttered,Musical,bells,church,a set of small handbells being rung by an uncoordinated group
Density/Complexity,cluttered,Musical,marimba,studio,multiple mallets hitting random bars on a marimba
Density/Complexity,cluttered,Musical,kazoo,parlor,a dozen people playing kazoos out of sync in a room
Density/Complexity,cluttered,Musical,glockenspiel,school,a glockenspiel being struck by many children at once
Density/Complexity,cluttered,Musical,shakers,festival,hundreds of small plastic shakers in a large crowd
Density/Complexity,cluttered,Musical,guitar,garage,a guitar with loose hardware being strummed aggressively
Density/Complexity,cluttered,Musical,snare,field,a snare drum with loose rattling snares being struck
Density/Complexity,cluttered,Musical,harp,closet,a small harp falling over and its strings hitting a shelf
Density/Complexity,cluttered,Musical,accordion,plaza,an accordion with leaking bellows and clicking keys
Density/Complexity,cluttered,Musical,harmonica,tunnel,multiple harmonicas being blown randomly in a tunnel
Density/Complexity,cluttered,Musical,cymbals,bin,a pile of finger cymbals being rattled in a metal container
Density/Complexity,cluttered,Musical,violin,storage,a violin case full of loose bows and rosin being shaken
Density/Complexity,cluttered,Musical,drum kit,shed,a drum kit with many loose accessories being played
Density/Complexity,cluttered,Musical,recorder,nook,several plastic recorders playing different notes at once
Density/Complexity,cluttered,Mechanical,toolbox,garage,a metal toolbox full of loose wrenches being shaken
Density/Complexity,cluttered,Mechanical,typewriter,office,multiple typewriters being used at different speeds in a room
Density/Complexity,cluttered,Mechanical,clockwork,shop,a table full of various clocks ticking out of sync
Density/Complexity,cluttered,Mechanical,gears,factory,a complex machine with many small loose gears rattling
Density/Complexity,cluttered,Mechanical,bolts,bin,a bin of various metal bolts on a vibrating factory belt
Density/Complexity,cluttered,Mechanical,bicycle,shed,a bicycle with a loose chain and rattling fenders being ridden
Density/Complexity,cluttered,Mechanical,keys,hallway,a large ring of various metal keys jingling in a pocket
Density/Complexity,cluttered,Mechanical,printing press,cellar,a press with loose mechanical parts clattering
Density/Complexity,cluttered,Mechanical,projector,booth,a film projector with a loose shutter and rattling reels
Density/Complexity,cluttered,Mechanical,stapler,desk,a box of loose staples being shaken in an office
Density/Complexity,cluttered,Mechanical,toys,nursery,a pile of various mechanical wind-up toys scurrying
Density/Complexity,cluttered,Mechanical,can opener,kitchen,a manual can opener slipping and clicking on a lid
Density/Complexity,cluttered,Mechanical,drill,workshop,a drill bit rattling in a loose chuck while running
Density/Complexity,cluttered,Mechanical,fan,office,a desk fan with a loose metal guard rattling
Density/Complexity,cluttered,Mechanical,piston,garage,an engine with a loose tappet clicking and thumping
Density/Complexity,cluttered,Mechanical,ratchet,shop,a ratchet with a broken internal mechanism clicking randomly
Density/Complexity,cluttered,Mechanical,slots,casino,multiple slot machines with various mechanical sounds
Density/Complexity,cluttered,Mechanical,lathe,mill,a lathe with loose metal shavings hitting the floor
Density/Complexity,cluttered,Environmental,scree,canyon,a slide of various sized rocks down a steep canyon slope
Density/Complexity,cluttered,Environmental,hail,junkyard,hailstones hitting various metal and plastic debris
Density/Complexity,cluttered,Environmental,leaves,forest,wind blowing a mix of dry leaves and twigs across a path
Density/Complexity,cluttered,Environmental,pebbles,shore,a wave receding over a mix of pebbles and shells
Density/Complexity,cluttered,Environmental,rain,woods,rain hitting a mix of leaves
Density/Complexity,cluttered,Environmental,ice,river,various sized pieces of ice clashing in a river
Density/Complexity,cluttered,Environmental,driftwood,beach,a pile of driftwood being shifted by a rising tide
Density/Complexity,cluttered,Environmental,shale,peak,a scatter of shale fragments falling down a cliff
Density/Complexity,cluttered,Environmental,thistles,field,a gust of wind moving through a patch of dry thistles
Density/Complexity,cluttered,Environmental,twigs,grove,a pile of dry sticks and branches being stepped on
Density/Complexity,cluttered,Environmental,mud,marsh,bubbles of various sizes popping in a thick marsh bog
Density/Complexity,cluttered,Environmental,sand,dune,sand and small gravel blowing against a metal sign
Density/Complexity,cluttered,Environmental,fire,campsite,a fire crackling with a mix of different wood types
Density/Complexity,cluttered,Environmental,geyser,park,a geothermal vent sputtering with a mix of steam and water
Density/Complexity,cluttered,Environmental,roots,forest,a mix of dry roots and earth being pulled up
Density/Complexity,cluttered,Environmental,mist,fjord,condensation dripping onto a mix of metal and wood
Density/Complexity,cluttered,Environmental,bamboo,jungle,a grove of various sized bamboo stalks knocking
Density/Complexity,cluttered,Environmental,reeds,swamp,a patch of dry reeds clattering in a chaotic wind
Density/Complexity,cluttered,Organic,scurrying,attic,multiple small rodents running through a pile of debris
Density/Complexity,cluttered,Organic,birds,garden,a group of different birds chirping and fluttering at once
Density/Complexity,cluttered,Organic,insects,meadow,a field full of various insects buzzing and clicking
Density/Complexity,cluttered,Organic,footsteps,square,a busy plaza with many people walking in different shoes
Density/Complexity,cluttered,Organic,wings,barn,a flock of bats taking off from a cluttered rafters
Density/Complexity,cluttered,Organic,chewing,dining,a group of people eating a mix of crunchy foods
Density/Complexity,cluttered,Organic,bones,museum,a bag of various small animal bones being emptied
Density/Complexity,cluttered,Organic,claws,tree,multiple squirrels chasing each other up a tree trunk
Density/Complexity,cluttered,Organic,voice,market,a busy market with many people talking at once
Density/Complexity,cluttered,Organic,scales,desert,multiple snakes moving through a patch of dry brush
Density/Complexity,cluttered,Organic,beaks,reef,a group of fish pecking at a rocky coral reef
Density/Complexity,cluttered,Organic,teeth,room,a group of people with chattering teeth in a cold room
Density/Complexity,cluttered,Organic,fingernails,desk,multiple people tapping fingers on a table at once
Density/Complexity,cluttered,Organic,paws,hallway,a group of dogs running across a hardwood floor
Density/Complexity,cluttered,Organic,toads,pond,a chorus of various toads and frogs in a marsh
Density/Complexity,cluttered,Organic,shrimp,reef,a dense patch of reef with many snapping shrimp
Density/Complexity,cluttered,Organic,wasps,attic,a nest of wasps buzzing and hitting a glass window
Density/Complexity,cluttered,Organic,crab,shore,a group of crabs scuttling over a bed of shells
Density/Complexity,cluttered,Domestic,junk drawer,kitchen,a kitchen drawer full of various utensils being shaken
Density/Complexity,cluttered,Domestic,bottles,bin,a bin full of various glass and plastic bottles being shifted
Density/Complexity,cluttered,Domestic,silverware,tray,a tray of various silverware being dumped onto a table
Density/Complexity,cluttered,Domestic,toys,nursery,a box of plastic building blocks being spilled
Density/Complexity,cluttered,Domestic,keys,entry,a bowl full of various key rings being rummaged through
Density/Complexity,cluttered,Domestic,pantry,shelf,a shelf of various tin cans being shifted around
Density/Complexity,cluttered,Domestic,closet,bedroom,a person rummaging through a pile of shoes and hangers
Density/Complexity,cluttered,Domestic,change,jar,a jar full of various coins being shaken
Density/Complexity,cluttered,Domestic,tools,workshop,a pegboard full of loose tools rattling in a wind
Density/Complexity,cluttered,Domestic,dishes,sink,a sink full of various plates and cups being washed
Density/Complexity,cluttered,Domestic,office,desk,a person rummaging through a drawer of pens and clips
Density/Complexity,cluttered,Domestic,trash,alley,a bag full of various household waste being dropped
Density/Complexity,cluttered,Domestic,laundry,room,a basket of clothes with various buttons and zippers tumbling
Density/Complexity,cluttered,Domestic,sewing,box,a tin full of needles
Density/Complexity,cluttered,Domestic,books,library,a stack of books falling and hitting the floor
Density/Complexity,cluttered,Domestic,curtain,door,a beaded curtain made of various materials clattering
Density/Complexity,cluttered,Domestic,cabinet,pantry,a cabinet of various glass jars being organized
Density/Complexity,cluttered,Domestic,attic,room,a person moving through a pile of old boxes and furniture
Density/Complexity,cluttered,Electronic,components,bin,a bin of various loose electronic parts being shaken
Density/Complexity,cluttered,Electronic,radio,den,a radio dial being turned rapidly through many stations
Density/Complexity,cluttered,Electronic,wiring,panel,a bunch of loose wires sparking in a junction box
Density/Complexity,cluttered,Electronic,server,closet,a rack of various old computers all running at once
Density/Complexity,cluttered,Electronic,relays,cabinet,a panel of multiple mechanical relays clicking out of sync
Density/Complexity,cluttered,Electronic,modems,office,a room full of old dial-up modems all connecting
Density/Complexity,cluttered,Electronic,monitors,lab,a bank of old crt monitors all flickering and buzzing
Density/Complexity,cluttered,Electronic,alarms,store,multiple electronic security tags beeping at once
Density/Complexity,cluttered,Electronic,static,radio,shortwave radio static with various intermittent signals
Density/Complexity,cluttered,Electronic,synthesizer,studio,a synthesizer playing a chaotic random arpeggio
Density/Complexity,cluttered,Electronic,hard drives,center,a cluster of hard drives with various seek patterns
Density/Complexity,cluttered,Electronic,switches,panel,a person flipping multiple toggle switches rapidly
Density/Complexity,cluttered,Electronic,buzzers,entry,a bank of apartment doorbells being pressed randomly
Density/Complexity,cluttered,Electronic,clocks,bedroom,a room full of various digital clocks beeping
Density/Complexity,cluttered,Electronic,fans,closet,a collection of various sized cooling fans rattling
Density/Complexity,cluttered,Electronic,taser,training,multiple tasers discharging at different rates
Density/Complexity,cluttered,Electronic,short,attic,a series of intermittent sparks in a messy wiring loom
Density/Complexity,cluttered,Electronic,led,shop,a sign with many small flickering and buzzing lights
