category,tag,domain,source,environment,scenario
Density/Complexity,sparse,Musical,triangle,cathedral,a single strike of a steel triangle in a massive stone hall
Density/Complexity,sparse,Musical,piano,empty house,a solitary high-register piano key hit once every ten seconds
Density/Complexity,sparse,Musical,timpani,desert,a lone muffled strike on a large copper drum under the open sky
Density/Complexity,sparse,Musical,flute,canyon,a single breathy note from a wooden flute echoing off distant walls
Density/Complexity,sparse,Musical,cymbals,library,two small finger cymbals clinking together once in a quiet room
Density/Complexity,sparse,Musical,cello,attic,a single plucked string on a cello with a long silence following
Density/Complexity,sparse,Musical,bell,meadow,a solitary handbell ringing once across an open field
Density/Complexity,sparse,Musical,woodblock,forest,a single wooden mallet strike on a hollow block in the woods
Density/Complexity,sparse,Musical,harp,conservatory,one high nylon string being plucked and left to decay
Density/Complexity,sparse,Musical,tambourine,busy street,a single light shake of a tambourine near a silent crowd
Density/Complexity,sparse,Musical,trumpet,underpass,a lone staccato blast from a brass trumpet under a bridge
Density/Complexity,sparse,Musical,marimba,gallery,a solitary rosewood bar being hit by a soft yarn mallet
Density/Complexity,sparse,Musical,glockenspiel,playground,a single metal tine ringing out in the cold air
Density/Complexity,sparse,Musical,guitar,beach,a thumb plucking the lowest string of an acoustic guitar once
Density/Complexity,sparse,Musical,gong,temple,a soft impact on a bronze gong that slowly fades to silence
Density/Complexity,sparse,Musical,banjo,front porch,a finger snapping a single banjo string in the afternoon heat
Density/Complexity,sparse,Musical,harmonica,canyon,a brief sharp inhale through a single reed of a harmonica
Density/Complexity,sparse,Musical,organ,chapel,the sound of a single air valve closing after a lone pipe note
Density/Complexity,sparse,Mechanical,gear,clock tower,the solitary click of a massive iron gear tooth engaging
Density/Complexity,sparse,Mechanical,typewriter,office,a single metal hammer hitting the platen of a manual typewriter
Density/Complexity,sparse,Mechanical,relay,server room,the lone click of a solitary electrical relay switching once
Density/Complexity,sparse,Mechanical,valve,boiler room,a single drop of water falling from a high-pressure steam valve
Density/Complexity,sparse,Mechanical,clock,nursery,the rhythmic but isolated ticking of a small mechanical watch
Density/Complexity,sparse,Mechanical,drill,garage,a single brief rotation of a hand-cranked drill in a wooden stud
Density/Complexity,sparse,Mechanical,press,factory,the slow heavy impact of a manual cider press closing once
Density/Complexity,sparse,Mechanical,lathe,workshop,a single metal shaving falling off a stationary lathe bed
Density/Complexity,sparse,Mechanical,stapler,warehouse,a single heavy-duty staple being driven into a wooden crate
Density/Complexity,sparse,Mechanical,switch,control room,the lone snap of a large industrial toggle switch
Density/Complexity,sparse,Mechanical,lock,prison cell,a single steel bolt sliding home in a heavy door frame
Density/Complexity,sparse,Mechanical,piston,engine room,one slow stroke of a manual air pump in a quiet basement
Density/Complexity,sparse,Mechanical,hammer,construction site,a solitary hammer strike on a single steel nail
Density/Complexity,sparse,Mechanical,winch,harbor,one click of a ratchet pawl on a dormant boat winch
Density/Complexity,sparse,Mechanical,fan,attic,a single rotation of a heavy metal fan blade before stopping
Density/Complexity,sparse,Mechanical,camera,darkroom,the isolated fire of a vintage camera shutter in the dark
Density/Complexity,sparse,Mechanical,shredder,office,the sound of a single sheet of paper passing through a shredder
Density/Complexity,sparse,Mechanical,staple gun,theatre,a single staple being fired into a wooden stage flat
Density/Complexity,sparse,Environmental,rain,greenhouse,a single large drop of rain hitting a glass roof every few seconds
Density/Complexity,sparse,Environmental,thunder,plains,a distant and isolated roll of thunder across a dry prairie
Density/Complexity,sparse,Environmental,ice,arctic,the lone sharp crack of a frozen lake surface in the middle of the night
Density/Complexity,sparse,Environmental,geyser,volcanic field,a single bubble of steam bursting at the surface of a mud pot
Density/Complexity,sparse,Environmental,rock,quarry,a solitary stone tumbling down a steep gravel slope
Density/Complexity,sparse,Environmental,leaves,autumn forest,a single dry oak leaf falling and hitting a forest floor
Density/Complexity,sparse,Environmental,wind,desert,a brief and isolated whistle of wind through a narrow rock gap
Density/Complexity,sparse,Environmental,water,cave,the sound of one water droplet hitting a deep limestone pool
Density/Complexity,sparse,Environmental,twigs,orchard,the snapping of a single dry branch under the weight of snow
Density/Complexity,sparse,Environmental,hail,carport,a solitary hailstone bouncing once off a corrugated metal roof
Density/Complexity,sparse,Environmental,fire,campsite,a single pop from a piece of dry cedar in a dying fire
Density/Complexity,sparse,Environmental,pebbles,shoreline,the clink of two small stones colliding in a gentle wave
Density/Complexity,sparse,Environmental,thaw,eaves,a single icicle shattering on the frozen ground below
Density/Complexity,sparse,Environmental,reeds,marsh,the lone rustle of a single cattail stem in a light breeze
Density/Complexity,sparse,Environmental,sand,dune,a small trickle of sand sliding down a sun-baked slope
Density/Complexity,sparse,Environmental,storm,coast,the isolated slam of a single wooden shutter against a wall
Density/Complexity,sparse,Environmental,stalactites,cavern,a lone mineral deposit falling into a dry cave floor
Density/Complexity,sparse,Environmental,mud,swamp,a single slow air bubble escaping from thick peat
Density/Complexity,sparse,Organic,heartbeat,medical room,the slow and isolated pulse of a resting human heart
Density/Complexity,sparse,Organic,footstep,hallway,a single heavy boot landing on a wooden floorboard in the dark
Density/Complexity,sparse,Organic,vocal,woods,the solitary caw of a lone crow in a winter forest
Density/Complexity,sparse,Organic,wings,attic,a single flap of a large bird’s wing against a rafters
Density/Complexity,sparse,Organic,bone,lab,the sound of two dry bones being tapped together once
Density/Complexity,sparse,Organic,jaw,jungle,a single sharp snap of a predator's jaw in the brush
Density/Complexity,sparse,Organic,claws,tile floor,a single click of a dog's nail on a ceramic surface
Density/Complexity,sparse,Organic,beak,forest,a woodpecker striking a hollow tree trunk just once
Density/Complexity,sparse,Organic,throat,orchard,a lone hoot from an owl in a distant tree
Density/Complexity,sparse,Organic,joint,gym,the sound of a single knuckle cracking in a quiet room
Density/Complexity,sparse,Organic,shell,beach,a single crab claw snapping shut on a piece of driftwood
Density/Complexity,sparse,Organic,scales,desert,the brief rustle of a snake moving over a dry leaf
Density/Complexity,sparse,Organic,pods,meadow,a single dry seed pod bursting open in the sun
Density/Complexity,sparse,Organic,bark,woodland,the isolated snap of a frozen twig under a light foot
Density/Complexity,sparse,Organic,exoskeleton,terrace,a single beetle shell hitting a glass table top
Density/Complexity,sparse,Organic,fingernails,desk,a solitary tap of a fingernail on a plastic surface
Density/Complexity,sparse,Organic,tongue,classroom,a single loud tutting sound from a student
Density/Complexity,sparse,Organic,hair,salon,the snip of a pair of scissors cutting one lock of hair
Density/Complexity,sparse,Domestic,coin,hallway,a single brass coin spinning and settling on a tile floor
Density/Complexity,sparse,Domestic,door,mansion,the solitary creak of a heavy wooden door opening slowly
Density/Complexity,sparse,Domestic,cup,kitchen,a single ceramic mug being placed on a stone countertop
Density/Complexity,sparse,Domestic,keys,mudroom,a lone key hitting the bottom of a metal tray
Density/Complexity,sparse,Domestic,box,attic,the sound of a single cardboard flap being folded over
Density/Complexity,sparse,Domestic,zipper,closet,a brief and isolated pull of a metal zipper
Density/Complexity,sparse,Domestic,lightbulb,garage,the single metallic ping of a cooling lightbulb filament
Density/Complexity,sparse,Domestic,can,recycling bin,a single soda can being crushed by a flat hand
Density/Complexity,sparse,Domestic,jewelry,bedroom,a lone silver ring dropping into a glass dish
Density/Complexity,sparse,Domestic,scissors,office,a single cut of sharp scissors through heavy paper
Density/Complexity,sparse,Domestic,curtains,theater,the sound of one metal curtain ring sliding on a rod
Density/Complexity,sparse,Domestic,kettle,pantry,a single drop of water hitting the bottom of an empty kettle
Density/Complexity,sparse,Domestic,drawer,bedroom,the isolated thud of a single dresser drawer closing
Density/Complexity,sparse,Domestic,shoes,porch,the sound of a single slipper shuffling across a rug
Density/Complexity,sparse,Domestic,pan,kitchen,a single drop of oil popping in a hot iron skillet
Density/Complexity,sparse,Domestic,whisk,bakery,a metal whisk hitting the side of a bowl just once
Density/Complexity,sparse,Domestic,pins,sewing room,a solitary metal pin falling on a hardwood floor
Density/Complexity,sparse,Domestic,shaker,restaurant,a single shake of a glass salt cellar
Density/Complexity,sparse,Electronic,spark,laboratory,a solitary electrical arc jumping between two electrodes
Density/Complexity,sparse,Electronic,beeper,hospital,a single sharp chirp from a digital pager
Density/Complexity,sparse,Electronic,switch,control room,the lone click of a micro-switch on a circuit board
Density/Complexity,sparse,Electronic,capacitor,workshop,a single pop of a tiny ceramic capacitor failing
Density/Complexity,sparse,Electronic,buzzer,kitchen,a single brief beep from a digital timer
Density/Complexity,sparse,Electronic,hard drive,office,the isolated click of a mechanical drive head moving
Density/Complexity,sparse,Electronic,tester,garage,a single tone from a continuity probe hitting a wire
Density/Complexity,sparse,Electronic,flash,studio,the lone high-pitched whine of a camera flash charging
Density/Complexity,sparse,Electronic,interference,radio station,a single pulse of digital noise on an audio line
Density/Complexity,sparse,Electronic,oscillator,lab,a single short sine wave pulse through a speaker
Density/Complexity,sparse,Electronic,relay,basement,the solitary snap of a furnace relay engaging once
Density/Complexity,sparse,Electronic,taser,field,a single electrical snap from a stun gun unit
Density/Complexity,sparse,Electronic,modem,office,a single handshake tone from an old dial-up device
Density/Complexity,sparse,Electronic,motor,garage,the briefest spin of a small electric motor
Density/Complexity,sparse,Electronic,welder,shipyard,a single spark from a spot welder making contact
Density/Complexity,sparse,Electronic,scanner,store,one isolated beep from a barcode scanner
Density/Complexity,sparse,Electronic,toy,playroom,a single electronic blip from a plastic toy
Density/Complexity,sparse,Electronic,cable,theatre,a single pop as a live audio jack is plugged in
Density/Complexity,thick,Musical,orchestra,concert hall,a full symphony orchestra playing a massive sustained chord
Density/Complexity,thick,Musical,organ,cathedral,every pipe of a massive organ sounding in unison
Density/Complexity,thick,Musical,cellos,conservatory,twenty cellos playing a low harmonic drone together
Density/Complexity,thick,Musical,piano,ballroom,a grand piano with the sustain pedal down and every key struck
Density/Complexity,thick,Musical,timpani,stadium,ten timpani drums being rolled simultaneously with soft mallets
Density/Complexity,thick,Musical,gongs,temple,a wall of bronze gongs vibrating after a collective strike
Density/Complexity,thick,Musical,choir,abbey,a hundred voices singing a dense polyphonic harmony
Density/Complexity,thick,Musical,synth,studio,a bank of twelve analog oscillators playing a clustered chord
Density/Complexity,thick,Musical,brass,arena,a large brass section playing a loud and low fanfare
Density/Complexity,thick,Musical,harps,hall,multiple harps playing overlapping glissandos in a large space
Density/Complexity,thick,Musical,taiko,village square,a dozen massive taiko drums being beaten in a fast rhythm
Density/Complexity,thick,Musical,marimbas,recital hall,four marimbas playing dense four-mallet chords in unison
Density/Complexity,thick,Musical,bagpipes,field,a massed pipe and drum band playing a loud march
Density/Complexity,thick,Musical,didgeridoos,cave,three didgeridoos blowing a continuous resonant drone
Density/Complexity,thick,Musical,guitars,warehouse,a wall of electric guitars playing a sustained power chord
Density/Complexity,thick,Musical,bells,clock tower,all the bells in a carillon ringing simultaneously
Density/Complexity,thick,Musical,drums,studio,a dense drum roll across four different floor toms
Density/Complexity,thick,Musical,accordions,street,five accordions playing a complex thick chord together
Density/Complexity,thick,Mechanical,factory,industrial park,a hundred sewing machines running at full speed in a hall
Density/Complexity,thick,Mechanical,engine room,shipyard,the massive layered roar of four diesel ship engines
Density/Complexity,thick,Mechanical,press,foundry,a row of hydraulic presses stamping metal in sequence
Density/Complexity,thick,Mechanical,fans,tunnel,a battery of massive ventilation fans spinning in a concrete shaft
Density/Complexity,thick,Mechanical,turbine,dam,the deep resonant hum of a massive water turbine at full capacity
Density/Complexity,thick,Mechanical,conveyor,warehouse,a vast network of moving belts and rollers in a hub
Density/Complexity,thick,Mechanical,gears,mill,the complex grinding of many large stone and wood gears
Density/Complexity,thick,Mechanical,trucks,highway,the combined roar of a dozen semi-trucks accelerating
Density/Complexity,thick,Mechanical,shredder,recycling center,a heavy industrial shredder tearing through a car frame
Density/Complexity,thick,Mechanical,drilling rig,oil field,the massive layered vibration of a rotary drill string
Density/Complexity,thick,Mechanical,printing press,shop,a large newspaper press running at maximum speed
Density/Complexity,thick,Mechanical,pumping station,valley,multiple large centrifugal pumps moving water
Density/Complexity,thick,Mechanical,compactor,landfill,the heavy grinding of a massive trash compactor
Density/Complexity,thick,Mechanical,ventilation,skyscraper,the collective hum of an entire floor's air handling units
Density/Complexity,thick,Mechanical,spinning,textile mill,thousands of spindles whirring together in a large room
Density/Complexity,thick,Mechanical,furnace,foundry,the massive roar of air entering a blast furnace
Density/Complexity,thick,Mechanical,winch,dock,multiple heavy steel cables reeling in under extreme load
Density/Complexity,thick,Mechanical,elevator,skyscraper,the combined rumble of a dozen elevators in a bank
Density/Complexity,thick,Environmental,waterfall,gorge,the massive and continuous impact of a wide waterfall
Density/Complexity,thick,Environmental,thunder,plains,a continuous and overlapping series of thunder rolls
Density/Complexity,thick,Environmental,waves,cliffs,the layered roar of a heavy storm surge hitting rocks
Density/Complexity,thick,Environmental,wind,forest,the deep moan of a gale rushing through a dense pine woods
Density/Complexity,thick,Environmental,rain,greenhouse,a torrential downpour hitting a large glass roof
Density/Complexity,thick,Environmental,avalanche,mountain,the massive layered roar of a large snow slide
Density/Complexity,thick,Environmental,volcano,island,the continuous subterranean rumble of a lava flow
Density/Complexity,thick,Environmental,hail,carport,a dense hailstorm pounding on a corrugated metal roof
Density/Complexity,thick,Environmental,mud,swamp,the constant bubbling of a large area of thick mud pots
Density/Complexity,thick,Environmental,river,floodplain,the heavy surging of a river at peak flood stage
Density/Complexity,thick,Environmental,storm,coast,the vibration of a heavy gale against a wooden sea wall
Density/Complexity,thick,Environmental,glacier,arctic,the internal grinding of a massive ice sheet moving
Density/Complexity,thick,Environmental,sand,desert,the deep singing drone of a massive shifting dune
Density/Complexity,thick,Environmental,hollow,canyon,the deep resonance of wind passing over a cave mouth
Density/Complexity,thick,Environmental,earthquake,valley,the low-frequency tremor of a large tectonic shift
Density/Complexity,thick,Environmental,leaves,garden,the massive rustling of a thousand trees in a windstorm
Density/Complexity,thick,Environmental,boulders,riverbed,large boulders grinding together in a deep current
Density/Complexity,thick,Environmental,geyser,thermal field,the steady roaring hiss of a large steam vent
Density/Complexity,thick,Organic,bees,meadow,a swarm of thousands of bees flying in a dense cloud
Density/Complexity,thick,Organic,stampede,savanna,the thunderous sound of thousands of wildebeest running
Density/Complexity,thick,Organic,vocal,cathedral,the combined chanting of a hundred monks in unison
Density/Complexity,thick,Organic,wings,cave,the sound of thousands of bats flying through a tunnel
Density/Complexity,thick,Organic,cicadas,jungle,the continuous and dense drone of a million insects
Density/Complexity,thick,Organic,footsteps,stadium,the collective movement of a crowd in a concrete hall
Density/Complexity,thick,Organic,heartbeat,medical room,the combined pulse of a litter of puppies in a box
Density/Complexity,thick,Organic,growl,zoo,the collective low warning of a pack of large wolves
Density/Complexity,thick,Organic,mastication,barn,a hundred cows chewing on dry hay simultaneously
Density/Complexity,thick,Organic,throat,woods,the continuous morning chorus of a dense bird population
Density/Complexity,thick,Organic,hooves,pasture,a large herd of horses galloping across soft turf
Density/Complexity,thick,Organic,wings,attic,a swarm of locusts hitting the side of a wooden building
Density/Complexity,thick,Organic,breathing,den,the deep resonant breathing of a hibernating bear colony
Density/Complexity,thick,Organic,whale,ocean,the overlapping songs of a pod of humpback whales
Density/Complexity,thick,Organic,skin,sauna,the collective sound of many people clapping in a hall
Density/Complexity,thick,Organic,trunk,zoo,three elephants blowing air through their trunks together
Density/Complexity,thick,Organic,scales,swamp,the sound of many alligators sliding into the water at once
Density/Complexity,thick,Organic,purr,living room,the deep collective vibration of many cats purring
Density/Complexity,thick,Domestic,washing machines,laundry mat,ten industrial washing machines on a spin cycle
Density/Complexity,thick,Domestic,dishwasher,kitchen,the layered sloshing of water in a large commercial washer
Density/Complexity,thick,Domestic,refrigerator,pantry,the combined hum of multiple large cooling units
Density/Complexity,thick,Domestic,vacuum,hallway,the roar of three vacuum cleaners running in a hall
Density/Complexity,thick,Domestic,doors,office,the sound of many office doors opening and closing in a hall
Density/Complexity,thick,Domestic,shakers,restaurant,the collective sound of a busy dining room at peak hour
Density/Complexity,thick,Domestic,curtains,theater,the massive sliding of heavy velvet drapes across a stage
Density/Complexity,thick,Domestic,water,bathroom,multiple showers running in a tiled locker room
Density/Complexity,thick,Domestic,boiler,basement,the deep roar of a large central heating furnace
Density/Complexity,thick,Domestic,furniture,upstairs,the dragging of many heavy tables across a wooden floor
Density/Complexity,thick,Domestic,books,library,a large shelf of heavy books falling over at once
Density/Complexity,thick,Domestic,vent,office,the massive buffet of air in a large industrial vent
Density/Complexity,thick,Domestic,fireplace,cabin,the roar of a large bonfire in a stone hearth
Density/Complexity,thick,Domestic,box,warehouse,the sound of a hundred cardboard boxes being stacked
Density/Complexity,thick,Domestic,shoes,mudroom,the collective shuffling of a crowd in a small space
Density/Complexity,thick,Domestic,drawer,bedroom,a bank of heavy dresser drawers being closed together
Density/Complexity,thick,Domestic,whisk,bakery,a dozen wire whisks hitting metal bowls in a kitchen
Density/Complexity,thick,Domestic,clasp,hallway,the collective snapping of many briefcase latches
Density/Complexity,thick,Electronic,transformer,substation,the massive 60hz hum of a dozen power transformers
Density/Complexity,thick,Electronic,server room,data center,the combined drone of ten thousand cooling fans
Density/Complexity,thick,Electronic,subwoofer,cinema,the low-frequency rumble of a massive sound system
Density/Complexity,thick,Electronic,hum,factory,the collective electrical noise of a large assembly line
Density/Complexity,thick,Electronic,interference,lab,a massive wall of electromagnetic white noise
Density/Complexity,thick,Electronic,generator,campsite,the combined drone of five portable gas generators
Density/Complexity,thick,Electronic,arc,power line,the deep buzzing of a high-voltage corona discharge
Density/Complexity,thick,Electronic,static,basement,full-spectrum pink noise through a large speaker bank
Density/Complexity,thick,Electronic,solenoid,warehouse,the collective clunk of a bank of industrial relays
Density/Complexity,thick,Electronic,feedback,studio,a layered wall of guitar amplifier feedback
Density/Complexity,thick,Electronic,oscillator,lab,ten sine wave generators playing a clustered frequency
Density/Complexity,thick,Electronic,modem,office,the combined handshake noise of multiple dial-up lines
Density/Complexity,thick,Electronic,motor,garage,the combined whir of multiple electric winches
Density/Complexity,thick,Electronic,welder,foundry,the massive crackle of multiple arc welders in use
Density/Complexity,thick,Electronic,conduit,utility tunnel,the vibration of a thousand cables in a metal pipe
Density/Complexity,thick,Electronic,compressor,workshop,the combined thrum of three large air compressors
Density/Complexity,thick,Electronic,filter,studio,a dense synthesizer patch with multiple oscillators
Density/Complexity,thick,Electronic,toy,playroom,a hundred electronic toys all making noise together
Density/Complexity,saturated,Musical,guitar,concert,an electric guitar playing through a high-gain amplifier at max volume
Density/Complexity,saturated,Musical,cymbals,studio,a continuous and intense wash of a large crash cymbal
Density/Complexity,saturated,Musical,organ,cathedral,a massive pipe organ sounding with every stop pulled to the limit
Density/Complexity,saturated,Musical,choir,hall,a hundred singers projecting at maximum volume in a small space
Density/Complexity,saturated,Musical,trumpet,stadium,a brass section playing a sustained fortissimo note
Density/Complexity,saturated,Musical,synth,studio,a square wave synthesizer with maximum resonance and distortion
Density/Complexity,saturated,Musical,drums,arena,a drummer playing a continuous heavy roll on every drum
Density/Complexity,saturated,Musical,timpani,concert hall,a timpani roll reaching a massive peak of vibration
Density/Complexity,saturated,Musical,violin,recital hall,a violin being played with extreme bow pressure on a low string
Density/Complexity,saturated,Musical,gong,temple,a large gong being hit continuously until it reaches maximum wash
Density/Complexity,saturated,Musical,piano,ballroom,a grand piano being played with heavy chords and sustain pedal
Density/Complexity,saturated,Musical,bass,jazz club,an electric bass playing through a distorted sub-woofer
Density/Complexity,saturated,Musical,flute,meadow,a flute player overblowing to create a distorted harmonic tone
Density/Complexity,saturated,Musical,harps,hall,a harp being played with intense and rapid plucking
Density/Complexity,saturated,Musical,bagpipes,field,the intense and continuous drone of multiple bagpipes
Density/Complexity,saturated,Musical,didgeridoo,cave,a didgeridoo player using circular breathing for a constant drone
Density/Complexity,saturated,Musical,marimba,conservatory,a rapid roll on the lowest bars of a marimba
Density/Complexity,saturated,Musical,harmonium,temple,a harmonium with fully pumped bellows playing a dense chord
Density/Complexity,saturated,Mechanical,engine,shipyard,a massive diesel engine running at maximum rpm
Density/Complexity,saturated,Mechanical,steam,boiler room,a high-pressure steam valve stuck in the open position
Density/Complexity,saturated,Mechanical,turbine,dam,a massive water turbine vibrating at peak capacity
Density/Complexity,saturated,Mechanical,fans,tunnel,a row of industrial fans running at overspeed in a shaft
Density/Complexity,saturated,Mechanical,drill,garage,a high-speed masonry drill struggling through thick stone
Density/Complexity,saturated,Mechanical,saw,woodshop,a circular saw cutting through a dense piece of ironwood
Density/Complexity,saturated,Mechanical,press,factory,a hydraulic press reaching its maximum pressure limit
Density/Complexity,saturated,Mechanical,shredder,recycling center,an industrial shredder jammed with metal scrap
Density/Complexity,saturated,Mechanical,pump,wastewater plant,a centrifugal pump cavitating under extreme load
Density/Complexity,saturated,Mechanical,conveyor,warehouse,a conveyor belt overloaded with heavy stone
