category,tag,domain,source,environment,scenario
Density/Complexity,sparse,Musical,triangle,cathedral,a single strike of a steel triangle in a high-vaulted cathedral
Density/Complexity,sparse,Musical,harp,empty ballroom,a solitary nylon harp string plucked and left to decay in an empty ballroom
Density/Complexity,sparse,Musical,kick drum,warehouse,a single bass drum hit occurring every ten seconds in a concrete warehouse
Density/Complexity,sparse,Musical,woodblock,stone hallway,a lone wooden block struck once in a long stone hallway
Density/Complexity,sparse,Musical,tubular bell,misty valley,a single chime of a distant tubular bell echoing across a misty valley
Density/Complexity,sparse,Musical,piano,theatre,a solitary high piano key pressed softly in a darkened theatre
Density/Complexity,sparse,Musical,violin,library,a single pizzicato violin note in a quiet library
Density/Complexity,sparse,Musical,gong,canyon,a heavy bronze gong struck once and fading in a wide canyon
Density/Complexity,sparse,Musical,flute,mountain peak,a lone short staccato note played on a wooden flute on a mountain peak
Density/Complexity,sparse,Musical,tambourine,desert,a single shake of a tambourine in a vast open desert
Density/Complexity,sparse,Musical,celesta,snowy field,one isolated chime of a celesta in a quiet snowy field
Density/Complexity,sparse,Musical,pauken,quarry,a single timpani stroke echoing in a deep rock quarry
Density/Complexity,sparse,Musical,banjo,prairie,one sharp pluck of a banjo string on a silent prairie
Density/Complexity,sparse,Musical,recorder,cave,a single breathy whistle from a recorder in a limestone cave
Density/Complexity,sparse,Musical,cymbal,cliffs,a lone finger cymbal clink on a windy cliffside
Density/Complexity,sparse,Musical,marimba,orchard,a single rosewood marimba bar struck with a soft mallet in an orchard
Density/Complexity,sparse,Musical,sitar,courtyard,one melodic pluck of a sitar string in a tiled courtyard
Density/Complexity,sparse,Musical,snare,meadow,a single light tap on a snare drum head in a grassy meadow
Density/Complexity,sparse,Mechanical,grandfather clock,study,the slow solitary tick of a grandfather clock in a carpeted study
Density/Complexity,sparse,Mechanical,foghorn,coastline,a distant foghorn sounding once every minute along a rocky coastline
Density/Complexity,sparse,Mechanical,typewriter,attic,one solitary key strike on a vintage typewriter in a dusty attic
Density/Complexity,sparse,Mechanical,printing press,cellar,the single heavy thud of a manual press lever in a stone cellar
Density/Complexity,sparse,Mechanical,well pump,farmland,one rhythmic clank of a metal pump handle on a quiet farm
Density/Complexity,sparse,Mechanical,bicycle bell,park,a single ring of a bicycle bell in a large empty park
Density/Complexity,sparse,Mechanical,staple gun,workshop,a solitary staple being driven into a wooden board
Density/Complexity,sparse,Mechanical,elevator,hotel,the single chime of an elevator arriving on a deserted floor
Density/Complexity,sparse,Mechanical,camera,botanical garden,one mechanical shutter click in a quiet botanical garden
Density/Complexity,sparse,Mechanical,relay,server room,a lone mechanical relay clicking once in a cooled server room
Density/Complexity,sparse,Mechanical,metronome,music room,a single tick of a metronome in an otherwise silent room
Density/Complexity,sparse,Mechanical,lathe,factory,the brief metal-on-metal contact of a lathe starting and stopping
Density/Complexity,sparse,Mechanical,door latch,vault,the isolated click of a heavy vault bolt sliding into place
Density/Complexity,sparse,Mechanical,telegraph,station,a single short tap of a telegraph key in a rural station
Density/Complexity,sparse,Mechanical,wind-up toy,nursery,one solitary click of a winding key on a tin toy
Density/Complexity,sparse,Mechanical,sprinkler,lawn,a single rhythmic burst from a water sprinkler on a suburban lawn
Density/Complexity,sparse,Mechanical,ratchet,garage,one individual click of a metal ratchet wrench
Density/Complexity,sparse,Mechanical,film projector,booth,the single snap of a film leader being threaded onto a reel
Density/Complexity,sparse,Environmental,water drop,cave,a single drop of water falling into a deep still pool in a cave
Density/Complexity,sparse,Environmental,twig,forest,one dry twig snapping under a foot in a quiet autumn forest
Density/Complexity,sparse,Environmental,thunder,desert,a solitary distant roll of thunder over a dry desert plain
Density/Complexity,sparse,Environmental,pebble,canyon,a single pebble falling and hitting a rock floor in a canyon
Density/Complexity,sparse,Environmental,ice,lake,one sharp crack of ice on a frozen lake in the dead of night
Density/Complexity,sparse,Environmental,leaf,garden,a single dry leaf skittering across a stone patio
Density/Complexity,sparse,Environmental,hail,greenhouse,one large hailstone striking a glass pane in a greenhouse
Density/Complexity,sparse,Environmental,geyser,valley,a single short hiss of steam from a geothermal vent
Density/Complexity,sparse,Environmental,rain,tent,one solitary raindrop hitting a taut nylon tent surface
Density/Complexity,sparse,Environmental,shale,ridge,a single flake of shale sliding down a rocky ridge
Density/Complexity,sparse,Environmental,pinecone,grove,one pinecone falling and hitting the forest floor
Density/Complexity,sparse,Environmental,bubble,bog,a single gas bubble rising and popping in a still marsh
Density/Complexity,sparse,Environmental,driftwood,beach,one heavy log of driftwood bumping a rock on a beach
Density/Complexity,sparse,Environmental,thistle,field,the snap of a single brittle thistle in a winter field
Density/Complexity,sparse,Environmental,salt,flat,one crunch of a boot on a dry salt crust
Density/Complexity,sparse,Environmental,mist,fjord,a single drip of condensation falling from a metal buoy
Density/Complexity,sparse,Environmental,bamboo,jungle,one hollow knock of two bamboo stalks in a light breeze
Density/Complexity,sparse,Environmental,fire,campsite,a single pop of sap from a dying campfire ember
Density/Complexity,sparse,Organic,bird,woods,a single bird chirp echoing through a silent morning wood
Density/Complexity,sparse,Organic,footstep,hallway,one solitary footstep on a creaky wooden floorboards
Density/Complexity,sparse,Organic,heartbeat,room,a single muffled thump of a heart heard through a stethoscope
Density/Complexity,sparse,Organic,throat,theatre,one person clearing their throat in a large empty theatre
Density/Complexity,sparse,Organic,beak,orchard,a single tap of a woodpecker on a hollow tree trunk
Density/Complexity,sparse,Organic,joint,library,the sound of one knuckle cracking in a quiet library
Density/Complexity,sparse,Organic,cough,closet,a single dry cough in a small carpeted closet
Density/Complexity,sparse,Organic,wing,barn,one flap of a large bird's wings in a quiet barn
Density/Complexity,sparse,Organic,claw,park,a single click of a squirrel's claw on a metal fence
Density/Complexity,sparse,Organic,teeth,bedroom,one individual click of teeth in a quiet room
Density/Complexity,sparse,Organic,breath,attic,a single sharp intake of breath in a cold attic
Density/Complexity,sparse,Organic,bone,museum,one dry bone shifting on a stone table
Density/Complexity,sparse,Organic,mouth,nook,a single lip smack in a quiet corner
Density/Complexity,sparse,Organic,hand,hall,one individual hand clap in a large tiled hall
Density/Complexity,sparse,Organic,tongue,room,a single tongue click against the roof of the mouth
Density/Complexity,sparse,Organic,scales,desert,one dry rustle of a snake moving over a single rock
Density/Complexity,sparse,Organic,bark,kennel,a solitary dog bark from a distant building
Density/Complexity,sparse,Organic,insect,meadow,one individual cricket chirp in a vast field
Density/Complexity,sparse,Domestic,spoon,kitchen,a single metal spoon clinking against a ceramic bowl
Density/Complexity,sparse,Domestic,door,hallway,one heavy wooden door closing in a long hallway
Density/Complexity,sparse,Domestic,key,entryway,a single key being dropped onto a glass table
Density/Complexity,sparse,Domestic,light switch,bedroom,one plastic switch flipping in a quiet bedroom
Density/Complexity,sparse,Domestic,glass,dining room,a single clink of a wine glass being set on a marble table
Density/Complexity,sparse,Domestic,book,library,one heavy book being closed on a wooden desk
Density/Complexity,sparse,Domestic,faucet,bathroom,a single drip of water hitting a porcelain sink
Density/Complexity,sparse,Domestic,floorboard,attic,one isolated creak of a floorboard in an attic
Density/Complexity,sparse,Domestic,cabinet,kitchen,one wooden cupboard door latching shut
Density/Complexity,sparse,Domestic,can,pantry,a single tin can being placed on a metal shelf
Density/Complexity,sparse,Domestic,scissors,sewing room,one individual snip of metal scissors through paper
Density/Complexity,sparse,Domestic,zipper,closet,a single short tug of a metal zipper
Density/Complexity,sparse,Domestic,coin,desk,one coin being dropped onto a wooden surface
Density/Complexity,sparse,Domestic,shutter,house,a single wooden window shutter latching shut
Density/Complexity,sparse,Domestic,staple,office,one staple being pressed into a stack of paper
Density/Complexity,sparse,Domestic,thimble,nook,the sound of a thimble tapping once against a needle
Density/Complexity,sparse,Domestic,pillow,bedroom,one soft thud of a pillow hitting a bed
Density/Complexity,sparse,Domestic,bottle,cellar,a single glass bottle clinking against a stone wall
Density/Complexity,sparse,Sparse,Electronic,beep,laboratory
Density/Complexity,sparse,Electronic,relay,closet,one electrical relay switching in a quiet telecommunications closet
Density/Complexity,sparse,Electronic,spark,garage,a single static discharge spark jumping to a metal handle
Density/Complexity,sparse,Electronic,buzzer,entryway,one short pulse of a piezoelectric buzzer
Density/Complexity,sparse,Electronic,capacitor,bench,a single capacitor discharging with a sharp snap
Density/Complexity,sparse,Electronic,taser,training room,one individual electrical crackle from a taser
Density/Complexity,sparse,Electronic,switch,basement,the single click of a toggle switch on a metal panel
Density/Complexity,sparse,Electronic,flash,studio,one xenon flash tube firing with a quick pop
Density/Complexity,sparse,Electronic,breaker,hall,a single circuit breaker flipping in a wall box
Density/Complexity,sparse,Electronic,hard drive,office,one individual seek click of a hard drive head
Density/Complexity,sparse,Electronic,alarm,bank,a single short chirp of an electronic security system
Density/Complexity,sparse,Electronic,modem,den,one isolated data pulse from an old modem
Density/Complexity,sparse,Electronic,synthesizer,booth,a single short staccato note from a digital oscillator
Density/Complexity,sparse,Electronic,led,room,the faint individual click of a power button being pressed
Density/Complexity,sparse,Electronic,radio,attic,one short burst of static from a radio dial
Density/Complexity,sparse,Electronic,clock,bedroom,the single pulse of a digital alarm clock beeping
Density/Complexity,sparse,Electronic,solenoid,factory,one individual solenoid valve opening
Density/Complexity,sparse,Electronic,monitor,office,the single high-pitched degaussing pop of a crt screen
Density/Complexity,thick,Musical,pipe organ,cathedral,a massive pipe organ playing a low-register chord with all stops pulled
Density/Complexity,thick,Musical,cello ensemble,theatre,twelve cellos playing a harmonized low melody in unison
Density/Complexity,thick,Musical,taiko drums,temple,multiple large taiko drums being struck simultaneously in a stone temple
Density/Complexity,thick,Musical,orchestra,concert hall,the entire string section of an orchestra playing a dense tremolo
Density/Complexity,thick,Musical,gongs,shrine,three massive bronze gongs ringing together after a heavy strike
Density/Complexity,thick,Musical,piano,ballroom,the low strings of a grand piano vibrating after a fortissimo cluster chord
Density/Complexity,thick,Musical,choir,abbey,a hundred male voices singing a low-frequency chant in an abbey
Density/Complexity,thick,Musical,tuba,tunnel,four tubas playing a sustained minor chord in a tiled tunnel
Density/Complexity,thick,Musical,synthesizer,studio,an analog synthesizer with three oscillators detuned and playing a low pad
Density/Complexity,thick,Musical,marimba,hall,multiple marimbas played with soft mallets in a complex low harmony
Density/Complexity,thick,Musical,didgeridoo,cave,a didgeridoo being played with heavy circular breathing in a cave
Density/Complexity,thick,Musical,bassoon,pit,a section of bassoons playing a sustained low-register passage
Density/Complexity,thick,Musical,horn,valley,a choir of alpine horns echoing with dense harmonics in a valley
Density/Complexity,thick,Musical,harp,manor,the lowest strings of multiple harps being swept in a slow glissando
Density/Complexity,thick,Musical,bagpipes,highlands,a dozen bagpipes playing a drone-heavy pibroch in the highlands
Density/Complexity,thick,Musical,handpans,meditation room,five handpans being struck with the palms in a layered rhythm
Density/Complexity,thick,Musical,double bass,jazz club,a quartet of double basses playing a bowed melodic line
Density/Complexity,thick,Musical,accordion,plaza,a large button accordion playing a dense multi-note chord
Density/Complexity,thick,Mechanical,steam engine,station,a massive steam locomotive idling with heavy rhythmic chuffing
Density/Complexity,thick,Mechanical,ship engine,engine room,the layered thrumming of a massive two-stroke marine engine
Density/Complexity,thick,Mechanical,printing press,cellar,a large newspaper press running at full speed in a stone cellar
Density/Complexity,thick,Mechanical,turbine,dam,the heavy multi-layered hum of a massive water turbine at a dam
Density/Complexity,thick,Mechanical,factory,mill,the collective drone of hundreds of textile looms in a mill
Density/Complexity,thick,Mechanical,conveyor,warehouse,a heavy-duty conveyor system with hundreds of rollers in motion
Density/Complexity,thick,Mechanical,ventilation,garage,a giant industrial ventilation system moving massive volumes of air
Density/Complexity,thick,Mechanical,press,plant,the multi-layered mechanical groan of a heavy hydraulic press cycle
Density/Complexity,thick,Mechanical,cement mixer,site,a fleet of cement mixers rotating heavy loads at a construction site
Density/Complexity,thick,Mechanical,crane,dockyard,the low heavy roar of a diesel crane engine under maximum load
Density/Complexity,thick,Mechanical,well pump,farm,a large industrial well pump system thumping rhythmically
Density/Complexity,thick,Mechanical,millstone,watermill,two massive stones grinding a heavy load of grain in a watermill
Density/Complexity,thick,Mechanical,furnace,basement,the deep layered roar of a large coal furnace in a basement
Density/Complexity,thick,Mechanical,compactor,facility,a trash compactor crushing a full load of debris
Density/Complexity,thick,Mechanical,blower,mill,a large foundry blower forcing air into a blast furnace
Density/Complexity,thick,Mechanical,wrecking ball,site,the heavy sound of a massive iron ball swinging through the air
Density/Complexity,thick,Mechanical,piledriver,harbor,a mechanical piledriver system striking with heavy force
Density/Complexity,thick,Mechanical,escalator,mall,the internal grinding of a heavy escalator bank in a mall
Density/Complexity,thick,Environmental,thunderstorm,valley,a continuous rolling thunderstorm with multiple overlapping peals
Density/Complexity,thick,Environmental,waterfall,gorge,the heavy multi-layered roar of a massive waterfall hitting a pool
Density/Complexity,thick,Environmental,landslide,mountain,the low heavy sound of a massive earth and rock slide in a valley
Density/Complexity,thick,Environmental,ocean swell,underwater,the deep multi-layered rumble of heavy waves passing overhead
Density/Complexity,thick,Environmental,mud,volcanic field,thick mud bubbling and plopping in a massive geothermal pool
Density/Complexity,thick,Environmental,wind,forest,a strong wind howling through a dense forest of various tree types
Density/Complexity,thick,Environmental,glacier,arctic,the deep internal groaning and cracking of a massive moving glacier
Density/Complexity,thick,Environmental,earthquake,vault,the low heavy rumble of a shifting tectonic plate underground
Density/Complexity,thick,Environmental,volcano,peak,the low rhythmic grumbling of an active volcano crater
Density/Complexity,thick,Environmental,sandstorm,desert,the heavy abrasive roar of a sandstorm hitting a canyon wall
Density/Complexity,thick,Environmental,avalanche,slope,the muffled heavy roar of a massive snow avalanche in motion
Density/Complexity,thick,Environmental,forest fire,woods,the deep sustained crackle and roar of a large wildfire
Density/Complexity,thick,Environmental,geyser,park,the deep multi-layered gurgling of a large geyser before eruption
Density/Complexity,thick,Environmental,iceberg,sea,a massive iceberg calving with multiple layers of thuds and splashes
Density/Complexity,thick,Environmental,river,plain,the heavy churning of a swollen river during a flood event
Density/Complexity,thick,Environmental,lava,tube,the slow heavy churning of a large flow of lava in a tube
Density/Complexity,thick,Environmental,tide,cave,the heavy surge of a massive tide rushing into a sea cave
Density/Complexity,thick,Environmental,storm,coast,heavy surf pounding against a rocky coastline during a gale
Density/Complexity,thick,Organic,blue whale,ocean,a blue whale emitting a low-frequency groan in the deep ocean
Density/Complexity,thick,Organic,elephant,savanna,a herd of elephants making a collective low infrasonic rumble
Density/Complexity,thick,Organic,lion,safari park,a pride of lions roaring together in a safari park
Density/Complexity,thick,Organic,gorilla,rainforest,a group of gorillas thumping their chests in a rainforest
Density/Complexity,thick,Organic,alligator,swamp,an alligator's low-frequency bellow vibrating the water in a marsh
Density/Complexity,thick,Organic,bison,prairie,a herd of bison thundering across the dry prairie earth
Density/Complexity,thick,Organic,bear,den,a large bear snoring deeply inside a hollow log den
Density/Complexity,thick,Organic,walrus,beach,a colony of walruses emitting collective guttural grunts
Density/Complexity,thick,Organic,horse,stable,the heavy rhythmic breathing of a horse in a wooden stable
Density/Complexity,thick,Organic,hippo,river,a hippo yawning and grunting underwater in a river
Density/Complexity,thick,Organic,rhino,scrubland,a rhino huffing deeply while charging through thick scrub
Density/Complexity,thick,Organic,ostrich,plain,an ostrich booming its neck sac on a dusty plain
Density/Complexity,thick,Organic,camel,oasis,a camel making a deep gurgling sound at a desert oasis
Density/Complexity,thick,Organic,toad,marshland,a chorus of bullfrogs croaking in a rhythmic low register
Density/Complexity,thick,Organic,crowd,stadium,the low heavy murmur of a massive crowd in a stadium
Density/Complexity,thick,Organic,footsteps,stage,heavy footsteps walking across a large hollow wooden stage
Density/Complexity,thick,Organic,heartbeat,room,the muffled thumping of a human heartbeat heard through a thick wall
Density/Complexity,thick,Organic,bees,garden,a large swarm of honeybees buzzing around a cluster of hives
Density/Complexity,thick,Domestic,wardrobe,bedroom,a massive oak wardrobe door being closed firmly in a bedroom
Density/Complexity,thick,Domestic,cast iron pot,kitchen,a heavy cast iron pot being set down on a wooden table
Density/Complexity,thick,Domestic,rug,living room,a heavy wool rug being dropped onto a floor in a living room
Density/Complexity,thick,Domestic,refrigerator,kitchen,the low heavy hum of a refrigerator compressor in a kitchen
Density/Complexity,thick,Domestic,washing machine,laundry,the heavy tumbling cycle of a washing machine in a laundry room
Density/Complexity,thick,Domestic,fireplace,den,the low heavy crackle of a large log burning in a fireplace
Density/Complexity,thick,Domestic,sofa,lounge,a person sitting down heavily on a large stuffed sofa
Density/Complexity,thick,Domestic,door,cellar,a heavy wooden cellar door swinging slowly on its hinges
Density/Complexity,thick,Domestic,chest,attic,a large wooden chest being dragged across an attic floor
Density/Complexity,thick,Domestic,mattress,bedroom,a heavy mattress being flipped onto a bed frame
Density/Complexity,thick,Domestic,curtains,theater,heavy velvet curtains being drawn across a stage
Density/Complexity,thick,Domestic,toolbox,garage,a heavy metal toolbox being set down on a concrete floor
Density/Complexity,thick,Domestic,barrel,cellar,a wooden wine barrel being rolled across a stone floor
Density/Complexity,thick,Domestic,shutter,storefront,a heavy metal security shutter being lowered
Density/Complexity,thick,Domestic,trunk,car,a car trunk being slammed shut in a quiet driveway
Density/Complexity,thick,Domestic,pillow,bedroom,a heavy feather pillow being hit against a mattress
Density/Complexity,thick,Domestic,oven,bakery,the low roar of a large commercial gas oven in a bakery
Density/Complexity,thick,Domestic,bath,bathroom,the low sound of a large bathtub filling with water
Density/Complexity,thick,Electronic,transformer,station,the massive hum of a power transformer in a station
Density/Complexity,thick,Electronic,subwoofer,concert,a subwoofer emitting a sustained low sine tone at a concert
Density/Complexity,thick,Electronic,server,center,the collective low drone of cooling fans in a data center
Density/Complexity,thick,Electronic,electric motor,room,a large electric motor humming under load
Density/Complexity,thick,Electronic,magnetic coil,lab,a magnetic coil humming with a deep tone in a lab
Density/Complexity,thick,Electronic,welder,shipyard,the heavy buzzing of an industrial arc welder in a shipyard
Density/Complexity,thick,Electronic,generator,shelter,a diesel-powered electric generator humming in a shelter
Density/Complexity,thick,Electronic,television,den,the low static hum of an old cathode ray tube television
Density/Complexity,thick,Electronic,ground loop,studio,a 60hz hum from a ground loop in a recording studio
Density/Complexity,thick,Electronic,amplifier,garage,a bass amplifier humming with the volume turned up
Density/Complexity,thick,Electronic,oscillator,lab,a low-frequency oscillator producing a steady drone in a lab
Density/Complexity,thick,Electronic,hair dryer,bathroom,a hair dryer running on its lowest setting in a bathroom
Density/Complexity,thick,Electronic,power line,road,the low buzzing of high-voltage power lines over a road
Density/Complexity,thick,Electronic,computer,office,the muffled whirring of a desktop computer fan
Density/Complexity,thick,Electronic,vacuum cleaner,hall,the low-pitched roar of a vacuum cleaner in a hall
Density/Complexity,thick,Electronic,induction,factory,an induction heater buzzing while heating a metal rod
Density/Complexity,thick,Electronic,tesla coil,museum,a large tesla coil emitting a deep growling discharge
Density/Complexity,thick,Electronic,compressor,workshop,the heavy thrumming of an air compressor
Density/Complexity,saturated,Musical,pipe organ,cathedral,a pipe organ playing a full fortissimo chord with all registers open
Density/Complexity,saturated,Musical,orchestra,hall,a full symphony orchestra playing a sudden loud tutti chord
Density/Complexity,saturated,Musical,electric guitar,studio,an electric guitar held against an amplifier speaker at maximum volume
Density/Complexity,saturated,Musical,cymbals,rehearsal,a pair of large orchestral cymbals crashed together with force
Density/Complexity,saturated,Musical,drum kit,room,a drummer playing a continuous high-speed roll on every drum simultaneously
Density/Complexity,saturated,Musical,choir,church,a hundred-voice choir singing a sustained high-volume harmony
Density/Complexity,saturated,Musical,synthesizer,booth,a synthesizer playing a square-wave lead with resonance pushed to the limit
Density/Complexity,saturated,Musical,bagpipes,hallway,a dozen bagpipes playing together in a small stone hallway
Density/Complexity,saturated,Musical,taiko,temple,five taiko drums being struck rapidly in a small enclosed space
Density/Complexity,saturated,Musical,glockenspiel,closet,a glockenspiel being struck rapidly with hard mallets in a small room
Density/Complexity,saturated,Musical,trumpet,alleyway,a brass trumpet section playing a loud fanfare in a narrow brick alley
Density/Complexity,saturated,Musical,gong,vault,a large gong struck with maximum force in a reinforced steel vault
Density/Complexity,saturated,Musical,accordion,bus,an accordion being played with full bellows pressure in a small bus
Density/Complexity,saturated,Musical,piano,studio,a piano played with the sustain pedal down and many notes struck at once
Density/Complexity,saturated,Musical,recorder,shower,a recorder playing a high shrill note in a small tiled shower
Density/Complexity,saturated,Musical,tambourine,car,a tambourine being shaken vigorously inside a parked car
Density/Complexity,saturated,Musical,harmonica,tunnel,a harmonica playing a loud sustained chord in a small tunnel
Density/Complexity,saturated,Musical,chimes,nook,a large set of metal wind chimes clashing in a violent gale
Density/Complexity,saturated,Mechanical,steam whistle,station,a steam locomotive whistle blowing at peak pressure
Density/Complexity,saturated,Mechanical,jet engine,hanger,a jet turbine running at maximum rpm during a ground test
Density/Complexity,saturated,Mechanical,pneumatic drill,tunnel,a heavy jackhammer drilling into solid rock in a small tunnel
Density/Complexity,saturated,Mechanical,factory,plant,the roar of a steel mill floor with all machinery at full capacity
