category,tag,domain,source,environment,scenario
Density/Complexity,saturated,Mechanical,gears,mill,massive gears grinding together with no lubrication
Density/Complexity,saturated,Mechanical,truck,highway,a semi-truck using its engine brake on a steep grade
Density/Complexity,saturated,Mechanical,furnace,foundry,a blast furnace at peak temperature with forced air
Density/Complexity,saturated,Mechanical,spinning,textile mill,thousands of spindles whirring at their mechanical limit
Density/Complexity,saturated,Mechanical,winch,harbor,a metal cable straining and creaking at the breaking point
Density/Complexity,saturated,Mechanical,compactor,landfill,a trash compactor reaching the end of its stroke
Density/Complexity,saturated,Mechanical,ventilation,skyscraper,the intense roar of a central air intake
Density/Complexity,saturated,Mechanical,piston,engine room,the rapid and constant thumping of a high-speed piston
Density/Complexity,saturated,Environmental,waterfall,gorge,the deafening roar of a massive waterfall in peak flood
Density/Complexity,saturated,Environmental,thunder,plains,a continuous and intense electrical storm overhead
Density/Complexity,saturated,Environmental,wind,canyon,a hurricane-force wind rushing through a narrow gorge
Density/Complexity,saturated,Environmental,volcano,island,the constant roar of an active volcanic vent
Density/Complexity,saturated,Environmental,waves,cliffs,a massive storm surge hitting a sea wall repeatedly
Density/Complexity,saturated,Environmental,fire,forest,the intense roar of a large forest crown fire
Density/Complexity,saturated,Environmental,rain,greenhouse,a torrential cloudburst pounding on a glass roof
Density/Complexity,saturated,Environmental,avalanche,mountain,the massive and continuous roar of a large snow slide
Density/Complexity,saturated,Environmental,mud,swamp,the constant and intense boiling of a mud volcano
Density/Complexity,saturated,Environmental,hail,carport,a severe hailstorm pounding on a metal roof
Density/Complexity,saturated,Environmental,river,valley,the intense surging of a white-water rapid
Density/Complexity,saturated,Environmental,earthquake,valley,the continuous and deep tremor of a major quake
Density/Complexity,saturated,Environmental,sand,desert,a massive sandstorm hitting a metal structure
Density/Complexity,saturated,Environmental,glacier,arctic,the constant grinding of two massive ice sheets
Density/Complexity,saturated,Environmental,geyser,thermal field,the sustained roaring hiss of a large steam jet
Density/Complexity,saturated,Environmental,storm,coast,the intense buffet of wind against a heavy canvas sail
Density/Complexity,saturated,Environmental,hollow,woodland,the constant resonance of a gale through a hollow tree
Density/Complexity,saturated,Environmental,boulders,riverbed,the constant grinding of stones in a fast river
Density/Complexity,saturated,Organic,cicadas,jungle,the deafening and continuous drone of a million cicadas
Density/Complexity,saturated,Organic,bees,meadow,a swarm of bees surrounding a microphone
Density/Complexity,saturated,Organic,growl,zoo,the intense and sustained roar of a large lion
Density/Complexity,saturated,Organic,vocal,stadium,the constant roar of a crowd of ten thousand people
Density/Complexity,saturated,Organic,wings,cave,the constant fluttering of a massive bat colony
Density/Complexity,saturated,Organic,stampede,savanna,the continuous thunder of a massive animal herd
Density/Complexity,saturated,Organic,throat,woods,the intense and constant morning chorus in a rainforest
Density/Complexity,saturated,Organic,whale,ocean,the continuous and intense singing of a nearby whale
Density/Complexity,saturated,Organic,breathing,den,the heavy and constant snoring of a large animal
Density/Complexity,saturated,Organic,mastication,barn,a dozen horses chewing on dry hay at once
Density/Complexity,saturated,Organic,heartbeat,medical room,the rapid and intense pulse of a person after a race
Density/Complexity,saturated,Organic,purr,living room,the intense and constant vibration of a large cat
Density/Complexity,saturated,Organic,wings,attic,the constant buzzing of a fly trapped in a window
Density/Complexity,saturated,Organic,scales,swamp,the constant rustling of snakes in a dry thicket
Density/Complexity,saturated,Organic,skin,gym,the constant sound of feet scuffing on a wrestling mat
Density/Complexity,saturated,Organic,trunk,zoo,an elephant trumpet at maximum intensity
Density/Complexity,saturated,Organic,hooves,pasture,the constant thunder of a galloping horse herd
Density/Complexity,saturated,Organic,jaw,jungle,the constant snapping of insects in the grass
Density/Complexity,saturated,Domestic,vacuum,closet,a vacuum cleaner running in a small tiled room
Density/Complexity,saturated,Domestic,shower,bathroom,a high-pressure shower hitting a metal bathtub
Density/Complexity,saturated,Domestic,blender,kitchen,a blender running at maximum speed with ice
Density/Complexity,saturated,Domestic,fan,bedroom,a high-speed box fan running right next to the ear
Density/Complexity,saturated,Domestic,refrigerator,pantry,a failing compressor buzzing intensely
Density/Complexity,saturated,Domestic,washer,laundry room,a washing machine on an unbalanced spin cycle
Density/Complexity,saturated,Domestic,kettle,kitchen,the intense and constant whistle of a tea kettle
Density/Complexity,saturated,Domestic,heater,basement,the constant roar of a forced-air furnace
Density/Complexity,saturated,Domestic,door,hallway,a buzzer on an apartment door sounding continuously
Density/Complexity,saturated,Domestic,water,pantry,a burst pipe spraying water against a wall
Density/Complexity,saturated,Domestic,fireplace,cabin,a chimney fire roaring intensely in a hearth
Density/Complexity,saturated,Domestic,radio,living room,a radio tuned to full-volume white noise
Density/Complexity,saturated,Domestic,hairdryer,bathroom,a hairdryer running on the high setting
Density/Complexity,saturated,Domestic,iron,laundry,a steam iron releasing a constant jet of steam
Density/Complexity,saturated,Domestic,pipes,basement,the constant vibration of water hammer in a pipe
Density/Complexity,saturated,Domestic,clock,nursery,a mechanical alarm clock ringing at its peak
Density/Complexity,saturated,Domestic,can,recycling bin,a vacuum cleaner sucking up a plastic bag
Density/Complexity,saturated,Domestic,shoes,mudroom,the constant sound of a treadmill running
Density/Complexity,saturated,Electronic,static,radio station,full-volume white noise from a digital receiver
Density/Complexity,saturated,Electronic,hum,substation,the intense 60hz buzz of a large transformer
Density/Complexity,saturated,Electronic,interference,studio,a high-gain feedback loop in an audio mixer
Density/Complexity,saturated,Electronic,subwoofer,cinema,a constant sub-bass tone at the threshold of hearing
Density/Complexity,saturated,Electronic,arc,laboratory,a continuous electrical arc between two points
Density/Complexity,saturated,Electronic,buzzer,factory,an industrial alarm sounding at its peak intensity
Density/Complexity,saturated,Electronic,generator,campsite,a gas generator running under a heavy load
Density/Complexity,saturated,Electronic,fan,server room,a high-speed server fan spinning at its limit
Density/Complexity,saturated,Electronic,noise,lab,saturated pink noise through a distorted amplifier
Density/Complexity,saturated,Electronic,feedback,rehearsal space,a guitar amplifier at max volume feeding back
Density/Complexity,saturated,Electronic,oscillator,studio,a square wave synthesizer at maximum output
Density/Complexity,saturated,Electronic,transformer,street,the intense buzz of a failing neon sign
Density/Complexity,saturated,Electronic,taser,field,the constant rapid-fire snap of a stun gun
Density/Complexity,saturated,Electronic,monitor,office,the intense coil whine from a failing screen
Density/Complexity,saturated,Electronic,welder,foundry,the constant crackle of a heavy-duty arc welder
Density/Complexity,saturated,Electronic,motor,garage,an electric motor stalled and buzzing
Density/Complexity,saturated,Electronic,modem,office,the continuous noise of a data transfer on a line
Density/Complexity,saturated,Electronic,spark,workshop,a constant stream of sparks from a grinder
Density/Complexity,cluttered,Musical,percussion,studio,a large bag of various percussion items being dumped
Density/Complexity,cluttered,Musical,piano,playroom,a child hitting every key on a piano at once
Density/Complexity,cluttered,Musical,drums,garage,a drummer dropping a bundle of sticks on a drum kit
Density/Complexity,cluttered,Musical,bells,basement,a box of small handbells being shaken vigorously
Density/Complexity,cluttered,Musical,guitar,attic,a guitar being knocked over onto a pile of sheet music
Density/Complexity,cluttered,Musical,tambourines,stage,multiple tambourines being dropped on a wooden floor
Density/Complexity,cluttered,Musical,xylophone,classroom,several children playing a xylophone randomly
Density/Complexity,cluttered,Musical,shakers,conservatory,a drawer full of maracas being opened quickly
Density/Complexity,cluttered,Musical,harpsichord,gallery,the internal mechanism of a harpsichord rattling
Density/Complexity,cluttered,Musical,violins,orchestra pit,twenty violins tuning up simultaneously
Density/Complexity,cluttered,Musical,brass,rehearsal hall,a brass section emptying water from their valves
Density/Complexity,cluttered,Musical,organ,chapel,the mechanical clatter of the stops being pulled
Density/Complexity,cluttered,Musical,metronomes,lab,ten mechanical metronomes ticking at different speeds
Density/Complexity,cluttered,Musical,music boxes,nursery,three different music boxes playing at once
Density/Complexity,cluttered,Musical,castanets,dance studio,a bag of castanets being spilled on a floor
Density/Complexity,cluttered,Musical,cymbals,shipyard,a stack of cymbals sliding and clattering together
Density/Complexity,cluttered,Musical,harmonica,porch,a harmonica being shaken to remove moisture
Density/Complexity,cluttered,Musical,recorder,playground,a group of children blowing recorders haphazardly
Density/Complexity,cluttered,Mechanical,bolts,garage,a bucket of loose metal bolts being shaken
Density/Complexity,cluttered,Mechanical,typewriter,museum,ten manual typewriters being used in a small room
Density/Complexity,cluttered,Mechanical,tools,workshop,a heavy toolbox being spilled onto a concrete floor
Density/Complexity,cluttered,Mechanical,gears,clock tower,a collection of small clock parts rattling in a tray
Density/Complexity,cluttered,Mechanical,conveyor,recycling center,various items tumbling down a metal chute
Density/Complexity,cluttered,Mechanical,shredder,office,a shredder tearing through a pile of envelopes
Density/Complexity,cluttered,Mechanical,lathe,machine shop,metal scraps hitting the floor around a lathe
Density/Complexity,cluttered,Mechanical,printing press,shop,various mechanical arms moving out of sync
Density/Complexity,cluttered,Mechanical,winch,harbor,a loose chain rattling against a metal winch drum
Density/Complexity,cluttered,Mechanical,piston,factory,a row of pistons misfiring and clattering
Density/Complexity,cluttered,Mechanical,valve,boiler room,a bank of steam valves hissing and clicking randomly
Density/Complexity,cluttered,Mechanical,lock,vault,the internal tumblers of a complex lock spinning
Density/Complexity,cluttered,Mechanical,fan,attic,a fan blade hitting various loose debris in a vent
Density/Complexity,cluttered,Mechanical,camera,darkroom,a bag of camera lenses clinking together
Density/Complexity,cluttered,Mechanical,drill,garage,a drill bit vibrating against a tray of screws
Density/Complexity,cluttered,Mechanical,stapler,warehouse,a jam in a heavy-duty industrial stapler
Density/Complexity,cluttered,Mechanical,sewing machine,factory,a sewing machine hitting a metal zipper
Density/Complexity,cluttered,Mechanical,pump,basement,a sump pump sucking up small gravel and water
Density/Complexity,cluttered,Environmental,rockslide,quarry,various sized stones tumbling down a scree slope
Density/Complexity,cluttered,Environmental,twigs,forest,a gust of wind blowing through a pile of dry sticks
Density/Complexity,cluttered,Environmental,ice,river,various chunks of ice colliding in a fast current
Density/Complexity,cluttered,Environmental,leaves,garden,a leaf blower moving a pile of dry debris
Density/Complexity,cluttered,Environmental,hail,carport,hail hitting a pile of garden tools on a porch
Density/Complexity,cluttered,Environmental,water,fountain,water splashing over an irregular pile of rocks
Density/Complexity,cluttered,Environmental,rain,greenhouse,rain hitting a collection of plastic pots
Density/Complexity,cluttered,Environmental,pebbles,shoreline,the retreating tide dragging various sized stones
Density/Complexity,cluttered,Environmental,fire,campsite,a pile of damp leaves and twigs smoldering and popping
Density/Complexity,cluttered,Environmental,sand,desert,sand hitting a collection of glass bottles
Density/Complexity,cluttered,Environmental,storm,coast,debris hitting the side of a wooden beach house
Density/Complexity,cluttered,Environmental,reeds,marsh,a bundle of cattails being stepped on and crushed
Density/Complexity,cluttered,Environmental,thaw,cavern,various icicles falling and breaking on a floor
Density/Complexity,cluttered,Environmental,mud,swamp,various sized bubbles bursting in a thick bog
Density/Complexity,cluttered,Environmental,hollow,woodland,animals scurrying inside a hollow rotted log
Density/Complexity,cluttered,Environmental,boulders,riverbed,stones of all sizes grinding together in a flood
Density/Complexity,cluttered,Environmental,pods,meadow,a bag of dry seed pods being shaken
Density/Complexity,cluttered,Environmental,geyser,thermal field,steam escaping from multiple small cracks
Density/Complexity,cluttered,Organic,bones,archeological site,a bag of small animal bones being sorted
Density/Complexity,cluttered,Organic,insects,field,various different insects buzzing and clicking at once
Density/Complexity,cluttered,Organic,vocal,stadium,a crowd of people talking in different languages
Density/Complexity,cluttered,Organic,footsteps,hallway,a group of people running in different directions
Density/Complexity,cluttered,Organic,claws,den,a litter of puppies scurrying on a wooden floor
Density/Complexity,cluttered,Organic,wings,garden,a swarm of different birds taking flight at once
Density/Complexity,cluttered,Organic,shells,beach,a handful of crushed shells being poured on a rock
Density/Complexity,cluttered,Organic,teeth,bedroom,a person eating a bowl of crunchy granola
Density/Complexity,cluttered,Organic,mastication,barn,multiple animals eating from a common trough
Density/Complexity,cluttered,Organic,bark,forest,the sound of walking over a pile of dry birch bark
Density/Complexity,cluttered,Organic,neck,savanna,a herd of zebras milling around a watering hole
Density/Complexity,cluttered,Organic,paws,desert,a coyote running through a patch of dry scrub
Density/Complexity,cluttered,Organic,throat,woods,a group of monkeys chattering in the canopy
Density/Complexity,cluttered,Organic,joint,gym,a person cracking multiple joints in their hands
Density/Complexity,cluttered,Organic,scales,swamp,snakes moving through a pile of dry reeds
Density/Complexity,cluttered,Organic,exoskeleton,terrace,a bowl of beetles scuttling together
Density/Complexity,cluttered,Organic,fingernails,desk,multiple people tapping on a conference table
Density/Complexity,cluttered,Organic,tongue,classroom,a group of students all whispering at once
Density/Complexity,cluttered,Domestic,silverware,kitchen,a drawer of forks and spoons being shaken
Density/Complexity,cluttered,Domestic,junk drawer,hallway,a drawer full of loose items being rummaged through
Density/Complexity,cluttered,Domestic,toys,playroom,a box of plastic building blocks being dumped
Density/Complexity,cluttered,Domestic,coins,laundry,a handful of loose change falling into a metal tray
Density/Complexity,cluttered,Domestic,keys,mudroom,a large ring of many keys being dropped
Density/Complexity,cluttered,Domestic,box,attic,a box of holiday ornaments being moved and clinking
Density/Complexity,cluttered,Domestic,pantry,grocery store,various cans and jars being moved on a shelf
Density/Complexity,cluttered,Domestic,trash,driveway,a recycling bin full of glass bottles being emptied
Density/Complexity,cluttered,Domestic,closet,bedroom,a pile of wire coat hangers being moved
Density/Complexity,cluttered,Domestic,shoes,porch,a pile of various shoes being sorted through
Density/Complexity,cluttered,Domestic,stationery,office,a desk drawer full of clips and pens being opened
Density/Complexity,cluttered,Domestic,cabinet,kitchen,a cupboard full of plastic containers being organized
Density/Complexity,cluttered,Domestic,laundry,bedroom,a pile of clothes with various zippers and buttons
Density/Complexity,cluttered,Domestic,pan,kitchen,a rack of metal pots and pans clattering together
Density/Complexity,cluttered,Domestic,whisk,bakery,a drawer of kitchen utensils being searched
Density/Complexity,cluttered,Domestic,sewing kit,craft room,a box of buttons and pins being shaken
Density/Complexity,cluttered,Domestic,bathroom,a vanity full of glass bottles being rearranged,
Density/Complexity,cluttered,Domestic,curtains,theater,the sound of many beads on a curtain clinking
Density/Complexity,cluttered,Electronic,circuit,laboratory,a pile of loose electronic parts being sifted
Density/Complexity,cluttered,Electronic,interference,studio,multiple radio stations bleeding into each other
Density/Complexity,cluttered,Electronic,beeper,hospital,several different medical monitors beeping out of sync
Density/Complexity,cluttered,Electronic,switch,control room,a person flipping multiple switches on a panel
Density/Complexity,cluttered,Electronic,hard drive,office,the sound of multiple drives spinning up at once
Density/Complexity,cluttered,Electronic,spark,workshop,a grinder producing a shower of irregular sparks
Density/Complexity,cluttered,Electronic,relay,server room,a bank of relays clicking in a random pattern
Density/Complexity,cluttered,Electronic,buzzer,factory,various small buzzers sounding in an assembly line
Density/Complexity,cluttered,Electronic,tester,garage,a person probing multiple pins on a connector
Density/Complexity,cluttered,Electronic,modem,office,the chaotic noise of multiple fax machines
Density/Complexity,cluttered,Electronic,transformer,street,the irregular buzzing of a failing street lamp
Density/Complexity,cluttered,Electronic,taser,field,the irregular snapping of a shorting electrical wire
Density/Complexity,cluttered,Electronic,oscillator,studio,multiple oscillators drifting in frequency
Density/Complexity,cluttered,Electronic,motor,garage,several small toy motors running at different speeds
Density/Complexity,cluttered,Electronic,welder,foundry,the irregular crackle of a welding torch in use
Density/Complexity,cluttered,Electronic,scanner,store,a cashier scanning many items very quickly
Density/Complexity,cluttered,Electronic,toy,playroom,various electronic toys with low batteries
Density/Complexity,cluttered,Electronic,cable,theatre,a person sorting through a large bin of audio cables
