category,tag,domain,source,environment,scenario
Emotional/Subjective,robotic,Electronic,fan,rack,the rhythmic high-pitched whir of a cooling fan
Emotional/Subjective,robotic,Electronic,transformer,station,the rhythmic low hum of a power unit
Emotional/Subjective,robotic,Electronic,buzzer,kitchen,the rhythmic sharp beep of a digital timer
Emotional/Subjective,robotic,Electronic,watch,bedroom,the rhythmic digital beep of an alarm
Emotional/Subjective,robotic,Electronic,taser,training,the rhythmic snapping of an electrical arc
Emotional/Subjective,robotic,Electronic,led,basement,the rhythmic buzzing of a failing led bulb
Emotional/Subjective,robotic,Electronic,scanner,library,the rhythmic mechanical whir of a carriage
Emotional/Subjective,robotic,Electronic,toy,playroom,the rhythmic electronic chirp of a plastic toy
Emotional/Subjective,robotic,Electronic,feedback,studio,the rhythmic howl of a speaker loop
Emotional/Subjective,robotic,Electronic,treadmill,gym,the rhythmic drone of a motor belt
Emotional/Subjective,robotic,Electronic,shaver,bathroom,the rhythmic mechanical whir of a razor
Emotional/Subjective,retro,Musical,transistor organ,living room,the thin nasal tones of a vintage portable organ
Emotional/Subjective,retro,Musical,mellotron,recording studio,the wavering flute tones of a tape-based keyboard
Emotional/Subjective,retro,Musical,analog synth,basement,a warm detuned sawtooth wave from a 1970s synth
Emotional/Subjective,retro,Musical,upright piano,saloon,a metallic honky-tonk sound from a worn piano
Emotional/Subjective,retro,Musical,harpsichord,ballroom,the brittle mechanical plucking of wire strings
Emotional/Subjective,retro,Musical,harmonica,porch,a scratchy blues note played on an old harmonica
Emotional/Subjective,retro,Musical,tambourine,parade,the dull jingle of tarnished metal zils
Emotional/Subjective,retro,Musical,drum machine,club,the punchy low-bit sound of an early digital drum box
Emotional/Subjective,retro,Musical,electric guitar,garage,the fuzzy distorted roar of a vintage amplifier
Emotional/Subjective,retro,Musical,music box,nursery,a slow mechanical plucking of a rusted comb
Emotional/Subjective,retro,Musical,tin whistle,meadow,a high-pitched peep from a weathered whistle
Emotional/Subjective,retro,Musical,glockenspiel,theatre,the ringing of chipped metal plates
Emotional/Subjective,retro,Musical,banjo,barn,the sharp twang of gut strings on a wooden banjo
Emotional/Subjective,retro,Musical,accordion,pier,the wheezing air-filled chords of an old bellows
Emotional/Subjective,retro,Musical,cello,cellar,the scratchy bowing of a vintage cello string
Emotional/Subjective,retro,Musical,recorder,school,the breathy tone of a cracked wooden recorder
Emotional/Subjective,retro,Musical,snare drum,booth,a muffled hit on a drum with an old hide head
Emotional/Subjective,retro,Musical,organ pedals,church,the mechanical thud of a heavy wooden pedal
Emotional/Subjective,retro,Mechanical,typewriter,office,the sharp metallic snap of a manual typewriter key
Emotional/Subjective,retro,Mechanical,film projector,cinema,the rhythmic whir and click of a 16mm projector
Emotional/Subjective,retro,Mechanical,pocket watch,library,the rapid rhythmic ticking of a wind-up watch
Emotional/Subjective,retro,Mechanical,spinning wheel,cottage,the high-pitched whir of a wooden wheel
Emotional/Subjective,retro,Mechanical,sewing machine,attic,the rhythmic thrum of a treadle-powered machine
Emotional/Subjective,retro,Mechanical,gramophone,room,the scratchy rotation of a hand-cranked platter
Emotional/Subjective,retro,Mechanical,camera,studio,the mechanical click and whir of a manual shutter
Emotional/Subjective,retro,Mechanical,gears,tower clock,the heavy slow grinding of iron gears
Emotional/Subjective,retro,Mechanical,lathe,workshop,the high-pitched shave of a belt-driven lathe
Emotional/Subjective,retro,Mechanical,ticker tape,bank,the rapid rhythmic clicking of a telegraph receiver
Emotional/Subjective,retro,Mechanical,fan,bedroom,the rhythmic rattling of a metal-bladed floor fan
Emotional/Subjective,retro,Mechanical,stapler,office,the sharp metallic snap of an iron stapler
Emotional/Subjective,retro,Mechanical,lock,vault,the heavy clicking of tumblers in a brass lock
Emotional/Subjective,retro,Mechanical,manual drill,garage,the rhythmic whir of a hand-cranked drill
Emotional/Subjective,retro,Mechanical,scale,grocery,the clanking of metal weights on a brass tray
Emotional/Subjective,retro,Mechanical,cash register,diner,the mechanical ring and slide of a metal drawer
Emotional/Subjective,retro,Mechanical,elevator,hotel,the clunk and whir of a gated manual elevator
Emotional/Subjective,retro,Mechanical,metronome,room,the crisp rhythmic click of a wooden metronome
Emotional/Subjective,retro,Environmental,wind,window,the high-pitched whistle through a loose wooden seal
Emotional/Subjective,retro,Environmental,rain,tent,the rhythmic thumping of rain on heavy canvas
Emotional/Subjective,retro,Environmental,fire,lodge,the crackling of seasoned oak in a stone hearth
Emotional/Subjective,retro,Environmental,ocean,beach,the muffled wash of waves through a seashell
Emotional/Subjective,retro,Environmental,sand,desert,the dry rustling of sand in a vintage hourglass
Emotional/Subjective,retro,Environmental,ice,pond,the sharp crack of a thin layer of frozen water
Emotional/Subjective,retro,Environmental,leaves,garden,the brittle crunch of dry leaves under a leather boot
Emotional/Subjective,retro,Environmental,geyser,basin,the muffled gurgling of a steam vent
Emotional/Subjective,retro,Environmental,waterfall,gorge,the continuous roar of water in a deep ravine
Emotional/Subjective,retro,Environmental,cicada,orchard,the shimmering drone of insects in the heat
Emotional/Subjective,retro,Environmental,rocks,river,two stones clicking together in the current
Emotional/Subjective,retro,Environmental,twigs,woods,the sharp snap of a dry branch underfoot
Emotional/Subjective,retro,Environmental,hail,roof,the rhythmic tapping of hail on a tin shed
Emotional/Subjective,retro,Environmental,shale,cliff,the skittering of stones down a rock face
Emotional/Subjective,retro,Environmental,bamboo,jungle,hollow stalks knocking together in the wind
Emotional/Subjective,retro,Environmental,mist,mountain,the faint sound of wind through heavy fog
Emotional/Subjective,retro,Organic,heartbeat,room,the muffled thumping of a heart through a thick coat
Emotional/Subjective,retro,Organic,voice,hall,the thin scratchy tone of a voice on a wax cylinder
Emotional/Subjective,retro,Organic,footsteps,stairs,the creaking of leather boots on wooden steps
Emotional/Subjective,retro,Organic,breathing,bedroom,the rhythmic sound of heavy sleep breathing
Emotional/Subjective,retro,Organic,clapping,hall,the muffled sound of a crowd in a large theatre
Emotional/Subjective,retro,Organic,purr,room,the low-frequency vibration of a large cat
Emotional/Subjective,retro,Organic,growl,den,the guttural huffing of a grizzly bear
Emotional/Subjective,retro,Organic,howl,woods,the sustained howling of a wolf pack at night
Emotional/Subjective,retro,Organic,wings,barn,the heavy fluttering of an owl's wings
Emotional/Subjective,retro,Organic,stomach,library,the deep gurgling of a digestive system
Emotional/Subjective,retro,Organic,chewing,kitchen,the crunch of a person eating a dry cracker
Emotional/Subjective,retro,Organic,claws,floor,the clicking of dog claws on hardwood
Emotional/Subjective,retro,Organic,teeth,room,the rhythmic chattering of teeth in the cold
Emotional/Subjective,retro,Organic,scales,desert,the rustling of a snake moving over dry leaves
Emotional/Subjective,retro,Organic,alligator,swamp,the low-pitched bellowing of an alligator
Emotional/Subjective,retro,Organic,paws,loft,the rhythmic scuttling of a small animal
Emotional/Subjective,retro,Organic,throat,church,the dry intermittent coughing of a person
Emotional/Subjective,retro,Domestic,telephone,hallway,the loud metallic ringing of a rotary phone
Emotional/Subjective,retro,Domestic,television,room,the high-pitched hum of a 1950s tube set
Emotional/Subjective,retro,Domestic,radio,attic,the scratchy white noise of a shortwave receiver
Emotional/Subjective,retro,Domestic,kettle,kitchen,the high-pitched whistle of a stove-top kettle
Emotional/Subjective,retro,Domestic,refrigerator,pantry,the heavy rhythmic thrum of an old compressor
Emotional/Subjective,retro,Domestic,fan,bedroom,the steady rhythmic whoosh of a metal floor fan
Emotional/Subjective,retro,Domestic,vacuum,room,the loud roaring of a vintage canister cleaner
Emotional/Subjective,retro,Domestic,toaster,kitchen,the mechanical pop of a spring-loaded toaster
Emotional/Subjective,retro,Domestic,doorbell,foyer,the metallic ding-dong of a physical bell
Emotional/Subjective,retro,Domestic,floorboard,house,the deep groan of a thick floorboard
Emotional/Subjective,retro,Domestic,iron,laundry,the hiss and clink of a heavy steam iron
Emotional/Subjective,retro,Domestic,fireplace,lodge,the roaring of a wood fire in a stone hearth
Emotional/Subjective,retro,Domestic,record player,room,the scratchy rotation of a needle on vinyl
Emotional/Subjective,retro,Domestic,silverware,kitchen,the clinking of heavy silver forks in a tray
Emotional/Subjective,retro,Domestic,door,mansion,the heavy boom of an oak door closing
Emotional/Subjective,retro,Domestic,trunk,attic,the creaking of a wooden lid being opened
Emotional/Subjective,retro,Electronic,vacuum tube,studio,the warm low hum of a vintage amplifier
Emotional/Subjective,retro,Electronic,static,radio,the scratchy crackling of an am radio band
Emotional/Subjective,retro,Electronic,capacitor,lab,the high-pitched whine of a charging circuit
Emotional/Subjective,retro,Electronic,neon sign,diner,the high-pitched buzzing of a flickering tube
Emotional/Subjective,retro,Electronic,modem,office,the handshake tones of a dial-up connection
Emotional/Subjective,retro,Electronic,relay,closet,the sharp crystalline click of a vintage relay
Emotional/Subjective,retro,Electronic,buzzer,kitchen,the harsh metallic rasp of an old timer
Emotional/Subjective,retro,Electronic,tape hiss,study,the background noise of a playing cassette
Emotional/Subjective,retro,Electronic,flash,studio,the high-frequency whine of a bulb charging
Emotional/Subjective,retro,Electronic,transformer,station,the heavy low hum of a power unit
Emotional/Subjective,retro,Electronic,interference,attic,the rhythmic pulsing of a radio signal
Emotional/Subjective,retro,Electronic,beeper,hospital,the high-pitched pulse of an old pager
Emotional/Subjective,retro,Electronic,tv static,room,the continuous hiss of an old television
Emotional/Subjective,retro,Electronic,toy,playroom,the electronic chirp of a vintage plastic toy
Emotional/Subjective,lo-fi,Musical,transistor radio,bedroom,the thin scratchy audio from a handheld radio
Emotional/Subjective,lo-fi,Musical,cassette tape,attic,the wavering pitch of a recording on a worn tape
Emotional/Subjective,lo-fi,Musical,toy keyboard,nursery,the brittle low-bit sound of a plastic piano
Emotional/Subjective,lo-fi,Musical,mellotron,studio,the fluttery flute tones of a tape-based keyboard
Emotional/Subjective,lo-fi,Musical,harmonica,porch,a scratchy distorted note on a weathered harmonica
Emotional/Subjective,lo-fi,Musical,detuned synth,garage,a warbling sawtooth wave with heavy noise
Emotional/Subjective,lo-fi,Musical,upright piano,saloon,a metallic dissonant sound from an old piano
Emotional/Subjective,lo-fi,Musical,gramophone,room,the thin scratchy music from a hand-cranked platter
Emotional/Subjective,lo-fi,Musical,drum machine,club,the punchy muffled sound of an early sampler
Emotional/Subjective,lo-fi,Musical,electric guitar,basement,the fuzzy distorted hum of a small amp
Emotional/Subjective,lo-fi,Musical,music box,closet,the slow irregular plucking of a rusted comb
Emotional/Subjective,lo-fi,Musical,violin,alley,the scratchy bowing of a cheap student violin
Emotional/Subjective,lo-fi,Musical,recorder,school,the breathy muffled tone of a plastic recorder
Emotional/Subjective,lo-fi,Musical,tambourine,parade,the dull jingle of rusty metal zils
Emotional/Subjective,lo-fi,Musical,banjo,barn,the sharp thin twang of worn wire strings
Emotional/Subjective,lo-fi,Musical,bell,cathedral,a muffled distant chime in the rain
Emotional/Subjective,lo-fi,Musical,kazoo,nursery,the distorted buzzing of a person humming
Emotional/Subjective,lo-fi,Mechanical,typewriter,office,the muffled rhythmic clatter of a manual typewriter
Emotional/Subjective,lo-fi,Mechanical,cassette player,car,the mechanical whir and tape hiss of a deck
Emotional/Subjective,lo-fi,Mechanical,film projector,cinema,the rhythmic whir and click of an 8mm projector
Emotional/Subjective,lo-fi,Mechanical,pocket watch,library,the faint rhythmic ticking of a worn watch
Emotional/Subjective,lo-fi,Mechanical,sewing machine,attic,the rhythmic thrum of a treadle machine
Emotional/Subjective,lo-fi,Mechanical,gears,tower clock,the heavy slow grinding of rusted gears
Emotional/Subjective,lo-fi,Mechanical,ticker tape,bank,the rapid rhythmic clicking of a telegraph
Emotional/Subjective,lo-fi,Mechanical,fan,bedroom,the rhythmic rattling of a metal floor fan
Emotional/Subjective,lo-fi,Mechanical,stapler,office,the sharp metallic snap of an old stapler
Emotional/Subjective,lo-fi,Mechanical,scale,grocery,the clanking of metal weights on a tray
Emotional/Subjective,lo-fi,Mechanical,cash register,diner,the mechanical ring and slide of a drawer
Emotional/Subjective,lo-fi,Mechanical,elevator,hotel,the clunk and whir of a manual lift
Emotional/Subjective,lo-fi,Environmental,wind,window,the high-pitched whistle through a loose seal
Emotional/Subjective,lo-fi,Environmental,fire,lodge,the crackling of oak in a stone hearth
Emotional/Subjective,lo-fi,Environmental,sand,desert,the dry rustling of sand in a vintage glass
Emotional/Subjective,lo-fi,Environmental,leaves,garden,the brittle crunch of leaves under a boot
Emotional/Subjective,lo-fi,Environmental,waterfall,gorge,the continuous roar of water in a ravine
Emotional/Subjective,lo-fi,Environmental,rocks,river,two stones clicking together in a stream
Emotional/Subjective,lo-fi,Environmental,bamboo,jungle,hollow stalks knocking together in wind
Emotional/Subjective,lo-fi,Organic,heartbeat,room,the muffled thumping of a heart through a coat
Emotional/Subjective,lo-fi,Organic,clapping,hall,the muffled sound of a crowd in a theatre
Emotional/Subjective,lo-fi,Domestic,telephone,hallway,the scratchy ringing of a rotary phone
Emotional/Subjective,lo-fi,Domestic,television,room,the high-pitched hum of an old tube set
Emotional/Subjective,lo-fi,Domestic,silverware,kitchen,the clinking of silver forks in a tray
Emotional/Subjective,lo-fi,Electronic,relay,closet,the sharp rhythmic click of a vintage relay
Emotional/Subjective,lo-fi,Electronic,toy,playroom,the electronic chirp of a vintage toy
Emotional/Subjective,hi-fi,Musical,grand piano,concert hall,the precise mechanical thud of a piano hammer
Emotional/Subjective,hi-fi,Musical,violin,studio,the detailed friction of horsehair on a violin string
Emotional/Subjective,hi-fi,Musical,silver flute,chamber,the clear intake of breath and the click of a key
Emotional/Subjective,hi-fi,Musical,cello,conservatory,the resonant vibration of a cello's wooden body
Emotional/Subjective,hi-fi,Musical,acoustic guitar,booth,the detailed scrape of a finger on a wound string
Emotional/Subjective,hi-fi,Musical,triangle,hall,the crystalline ringing of a steel triangle strike
Emotional/Subjective,hi-fi,Musical,snare drum,studio,the detailed rattle of snare wires on a drum head
Emotional/Subjective,hi-fi,Musical,harpsichord,ballroom,the sharp precise plucking of wire strings
Emotional/Subjective,hi-fi,Musical,harp,conservatory,the soft detailed pluck of a gut string
Emotional/Subjective,hi-fi,Musical,piccolo,theatre,the clear high-pitched trill of a silver flute
Emotional/Subjective,hi-fi,Musical,glockenspiel,hall,the pure ringing of a metal plate strike
Emotional/Subjective,hi-fi,Musical,banjo,booth,the sharp metallic snap of a fingerpick on a string
Emotional/Subjective,hi-fi,Musical,tambourine,room,the subtle detailed jingle of metal zils
Emotional/Subjective,hi-fi,Musical,kalimba,studio,the clear percussive snap of a thumb on a metal tine
Emotional/Subjective,hi-fi,Musical,trumpet,hallway,the sharp metallic click of a valve being depressed
Emotional/Subjective,hi-fi,Musical,guiro,plaza,the detailed rhythmic scraping of a wooden stick
Emotional/Subjective,hi-fi,Musical,bassoon,monastery,the deep detailed vibration of a double reed
Emotional/Subjective,hi-fi,Musical,zither,attic,the shimmering metallic ring of a plucked wire string
Emotional/Subjective,hi-fi,Mechanical,wristwatch,study,the fine rapid ticking of a mechanical watch
Emotional/Subjective,hi-fi,Mechanical,pen,library,the detailed rhythmic scratching of a fountain pen
Emotional/Subjective,hi-fi,Mechanical,key,foyer,the metallic clicking and sliding of a brass key
Emotional/Subjective,hi-fi,Mechanical,camera,studio,the intricate mechanical click of a manual shutter
Emotional/Subjective,hi-fi,Mechanical,gears,watchmaker,the delicate detailed whirring of tiny brass gears
Emotional/Subjective,hi-fi,Mechanical,lighter,balcony,the sharp strike of a flint wheel on metal
Emotional/Subjective,hi-fi,Mechanical,scissors,nook,the detailed snip of metal blades through silk
Emotional/Subjective,hi-fi,Mechanical,stapler,desk,the sharp metallic snap of a desktop stapler
Emotional/Subjective,hi-fi,Mechanical,lathe,workshop,the high-pitched shave of a tool on a rod
Emotional/Subjective,hi-fi,Mechanical,mouse,office,the tactile detailed click of a computer button
Emotional/Subjective,hi-fi,Mechanical,drill,garage,the high-pitched whir of a handheld electric drill
Emotional/Subjective,hi-fi,Mechanical,ratchet,auto shop,the rapid metallic clicking of a small wrench
Emotional/Subjective,hi-fi,Mechanical,escapement,watchmaker,the sharp precise ticking of a fine watch
Emotional/Subjective,hi-fi,Mechanical,pulleys,gym,the soft detailed whir of a nylon rope over a wheel
Emotional/Subjective,hi-fi,Mechanical,switch,room,the tactile snap of a plastic toggle light switch
Emotional/Subjective,hi-fi,Mechanical,can opener,kitchen,the sharp rhythmic cutting of a metal opener
Emotional/Subjective,hi-fi,Mechanical,keypad,vault,the high-pitched detailed click of a button
Emotional/Subjective,hi-fi,Mechanical,microscope,lab,the precise click of a lens turret rotating
Emotional/Subjective,hi-fi,Environmental,water drop,sink,the clear splashing of a water droplet hitting a palm
Emotional/Subjective,hi-fi,Environmental,leaf,garden,the detailed brittle crunch of a single maple leaf
Emotional/Subjective,hi-fi,Environmental,twig,woods,the sharp detailed snap of a frozen cedar twig
Emotional/Subjective,hi-fi,Environmental,ice,pond,the crystalline detailed crackle of a thin ice sheet
Emotional/Subjective,hi-fi,Environmental,rain,greenhouse,the detailed rhythmic tapping of raindrops on glass
Emotional/Subjective,hi-fi,Environmental,wind,window,the high-pitched whistle through a narrow gap
Emotional/Subjective,hi-fi,Environmental,geyser,vent,the steady detailed huffing of steam from a fissure
Emotional/Subjective,hi-fi,Environmental,pebbles,shore,the detailed clicking of two smooth quartz stones
Emotional/Subjective,hi-fi,Environmental,fire,campsite,the sharp detailed snapping of dry pine needles
Emotional/Subjective,hi-fi,Environmental,shells,beach,the delicate detailed clinking of seashells in a bag
Emotional/Subjective,hi-fi,Environmental,frost,morning,the crystalline crackling of frost on a blade of grass
Emotional/Subjective,hi-fi,Environmental,grass,prairie,the sharp detailed rustle of dry wheat stalks
Emotional/Subjective,hi-fi,Environmental,shale,cliff,the detailed clattering of small stones on rock
Emotional/Subjective,hi-fi,Environmental,thorns,scrub,the detailed clicking of dry thorns rubbing
Emotional/Subjective,hi-fi,Environmental,bark,forest,the brittle detailed snapping of a piece of bark
Emotional/Subjective,hi-fi,Environmental,quartz,quarry,the sharp detailed ping of a chisel on a vein
Emotional/Subjective,hi-fi,Environmental,mud,swamp,the thick detailed wet squelch of a footstep
Emotional/Subjective,hi-fi,Environmental,icicle,eaves,the sharp detailed snap of an icicle breaking
Emotional/Subjective,hi-fi,Organic,whisper,room,the detailed breathy sibilance of a person whispering
Emotional/Subjective,hi-fi,Organic,scratching,bedroom,the detailed sound of fingernails on dry skin
Emotional/Subjective,hi-fi,Organic,heartbeat,office,the detailed rhythmic thumping through a stethoscope
Emotional/Subjective,hi-fi,Organic,chewing,kitchen,the detailed crunch of a person biting an apple
Emotional/Subjective,hi-fi,Organic,breathing,nursery,the soft detailed rhythmic sound of sleep
Emotional/Subjective,hi-fi,Organic,claws,floor,the sharp detailed clicking of a dog's claws on tile
Emotional/Subjective,hi-fi,Organic,fingernails,desk,the rapid detailed tapping of nails on glass
Emotional/Subjective,hi-fi,Organic,teeth,bathroom,the sharp detailed clicking of a toothbrush on teeth
Emotional/Subjective,hi-fi,Organic,tongue,library,"the sharp detailed ""tsk"" sound made with the tongue"
Emotional/Subjective,hi-fi,Organic,hair,salon,the sharp detailed snip of scissors through hair
Emotional/Subjective,hi-fi,Organic,wings,garden,the high-pitched detailed buzzing of a dragonfly
Emotional/Subjective,hi-fi,Organic,beak,forest,the sharp detailed tap of a beak on a branch
Emotional/Subjective,hi-fi,Organic,skin,gym,the detailed wet-sounding slap of a hand on a torso
Emotional/Subjective,hi-fi,Organic,mouth,room,the detailed wet sound of lips being smacked
Emotional/Subjective,hi-fi,Organic,throat,church,a single detailed short dry cough from a person
Emotional/Subjective,hi-fi,Organic,bone,kitchen,the sharp detailed snapping of a small bone
Emotional/Subjective,hi-fi,Organic,scales,desert,the detailed rustling of a lizard's scales on a leaf
Emotional/Subjective,hi-fi,Organic,fur,den,the detailed sound of a large dog shaking its fur
Emotional/Subjective,hi-fi,Domestic,matches,kitchen,the sharp detailed strike of a match on a strip
Emotional/Subjective,hi-fi,Domestic,scissors,room,the detailed grainy snip of scissors through silk
Emotional/Subjective,hi-fi,Domestic,zipper,closet,the rapid detailed clicking of a metal zipper
Emotional/Subjective,hi-fi,Domestic,silverware,hall,the sharp detailed clink of a fork on a plate
Emotional/Subjective,hi-fi,Domestic,keys,foyer,the metallic detailed jangling of a ring of keys
Emotional/Subjective,hi-fi,Domestic,ice,glass,the sharp detailed crack of water hitting ice cubes
Emotional/Subjective,hi-fi,Domestic,foil,kitchen,the sharp detailed crinkling of a sheet of foil
Emotional/Subjective,hi-fi,Domestic,pill bottle,bathroom,the sharp detailed rattle of pills in a container
Emotional/Subjective,hi-fi,Domestic,comb,bedroom,the detailed snapping of plastic teeth through a knot
Emotional/Subjective,hi-fi,Domestic,spoons,bakery,the detailed clinking of metal spoons on a ring
Emotional/Subjective,hi-fi,Domestic,shutter,study,the sharp detailed click of a camera lens cap
Emotional/Subjective,hi-fi,Domestic,thimble,nook,a metal thimble hitting a glass tabletop
Emotional/Subjective,hi-fi,Domestic,coins,laundry,the detailed jangling of pennies in a metal drum
Emotional/Subjective,hi-fi,Domestic,mirror,bathroom,the detailed ring of a glass mirror being wiped
Emotional/Subjective,hi-fi,Domestic,razor,sink,the high-pitched detailed scrape of a razor on ceramic
Emotional/Subjective,hi-fi,Domestic,tongs,kitchen,the rapid detailed clicking of stainless steel tongs
Emotional/Subjective,hi-fi,Domestic,needle,nook,a detailed sewing needle dropping onto a tiled floor
Emotional/Subjective,hi-fi,Domestic,can tab,patio,the sharp detailed crack of a soda can opening
Emotional/Subjective,hi-fi,Electronic,spark,lab,a detailed high-voltage spark jumping between electrodes
Emotional/Subjective,hi-fi,Electronic,beeper,hospital,the high-pitched detailed pulse of a pager alert
Emotional/Subjective,hi-fi,Electronic,relay,server room,the sharp detailed crystalline click of a relay
Emotional/Subjective,hi-fi,Electronic,keyboard,gaming,the detailed tactile click of a blue-switch keyboard
Emotional/Subjective,hi-fi,Electronic,buzzer,kitchen,the sharp detailed short beep of a digital timer
Emotional/Subjective,hi-fi,Electronic,modem,office,the detailed high-pitched handshake tones of a modem
Emotional/Subjective,hi-fi,Electronic,watch,bedroom,the high-pitched detailed beep of a digital watch
Emotional/Subjective,hi-fi,Electronic,taser,training,the rapid detailed snapping of an electrical arc
Emotional/Subjective,hi-fi,Electronic,hard drive,study,the sharp detailed mechanical click of a head
Emotional/Subjective,hi-fi,Electronic,camera flash,studio,the sharp detailed electrical pop of a strobe
Emotional/Subjective,hi-fi,Electronic,piezo,kitchen,a sharp detailed click of a piezo igniter
Emotional/Subjective,hi-fi,Electronic,static,radio,the piercing detailed hiss of high-frequency noise
Emotional/Subjective,hi-fi,Electronic,soldering,bench,the sharp detailed sizzle of flux on a hot iron
Emotional/Subjective,hi-fi,Electronic,plasma,museum,the high-pitched detailed crackle of a plasma lamp
Emotional/Subjective,hi-fi,Electronic,calculator,room,the detailed sharp click of a plastic button
Emotional/Subjective,hi-fi,Electronic,scanner,library,the high-pitched detailed whir of a scanner carriage
Emotional/Subjective,hi-fi,Electronic,toy,playroom,the high-pitched detailed electronic chirp of a toy
Emotional/Subjective,hi-fi,Electronic,telegraph,museum,the sharp detailed metallic click of a sender
