category,tag,domain,source,environment,scenario
Emotional/Subjective,haunting,Musical,waterphone,abandoned asylum,a metal rod bowing the vertical tines of a waterphone
Emotional/Subjective,haunting,Musical,detuned upright piano,dilapidated ballroom,a single dissonant high note on a dusty upright piano
Emotional/Subjective,haunting,Musical,glass harmonica,misty lake,the ethereal ringing of wet fingers on spinning glass bowls
Emotional/Subjective,haunting,Musical,bowed cymbal,stone crypt,a cello bow drawing a long screech from a suspended cymbal
Emotional/Subjective,haunting,Musical,pipe organ,empty cathedral,a low-frequency pedal note vibrating the air in a stone hall
Emotional/Subjective,haunting,Musical,silver flute,foggy moor,a long breathy note with a slow wavering vibrato
Emotional/Subjective,haunting,Musical,tibetan bowl,mountain peak,the fading resonance of a brass singing bowl struck softly
Emotional/Subjective,haunting,Musical,violin,narrow alleyway,a slow minor-key glissando on a high violin string
Emotional/Subjective,haunting,Musical,harmonium,monastery,the wheezing air intake of an old foot-pumped organ
Emotional/Subjective,haunting,Musical,cello,underground cistern,a deep sustained note on a cello with heavy vibrato
Emotional/Subjective,haunting,Musical,handbell,cemetery,a single muffled chime of a small silver handbell
Emotional/Subjective,haunting,Musical,zither,attic,the shimmering ring of a zither string plucked in a corner
Emotional/Subjective,haunting,Musical,didgeridoo,cave,the low vibrating drone of a eucalyptus didgeridoo in a hollow
Emotional/Subjective,haunting,Musical,theremin,theatre,the sliding pitch of an electronic theremin in an empty room
Emotional/Subjective,haunting,Musical,harp,conservatory,a slow descending arpeggio on gut strings with long decay
Emotional/Subjective,haunting,Musical,woodblock,forest,a single hollow strike on a teak block echoing through trees
Emotional/Subjective,haunting,Musical,chimes,rooftop,metal pipes clinking together in a slow shifting breeze
Emotional/Subjective,haunting,Musical,recorder,nursery,a faint high-pitched peep from a wooden recorder
Emotional/Subjective,haunting,Mechanical,iron gate,graveyard,a rusted iron gate groaning slowly on its hinges
Emotional/Subjective,haunting,Mechanical,elevator cable,skyscraper,the low-frequency hum of a tensioned steel cable in a shaft
Emotional/Subjective,haunting,Mechanical,wind turbine,farmland,the rhythmic low whoosh of massive blades in the fog
Emotional/Subjective,haunting,Mechanical,clockwork,antique shop,the slow heavy ticking of a grandfather clock in a silent room
Emotional/Subjective,haunting,Mechanical,pulley,shipyard,a rusted metal pulley squealing as a rope pulls through
Emotional/Subjective,haunting,Mechanical,ventilator,factory,the rhythmic rattling of a loose metal fan in an air duct
Emotional/Subjective,haunting,Mechanical,music box,bedroom,a slow mechanical plucking of a music box comb winding down
Emotional/Subjective,haunting,Mechanical,steam whistle,harbor,a distant long blast of a steam whistle through the mist
Emotional/Subjective,haunting,Mechanical,gears,tower clock,the slow heavy grinding of brass gears in a belfry
Emotional/Subjective,haunting,Mechanical,typewriter,library,the echoing snap of a typewriter key in a hollow hall
Emotional/Subjective,haunting,Mechanical,shutter,abandoned town,the metallic rattling of a loose corrugated shutter in the wind
Emotional/Subjective,haunting,Mechanical,lathe,workshop,the high-pitched screech of a tool cutting into a hollow metal pipe
Emotional/Subjective,haunting,Mechanical,pump,basement,the rhythmic thudding of a submerged sump pump through a wall
Emotional/Subjective,haunting,Mechanical,piston,engine room,the slow metallic groaning of a steam piston reaching its limit
Emotional/Subjective,haunting,Mechanical,camera,darkroom,the mechanical click and whir of a vintage film camera
Emotional/Subjective,haunting,Mechanical,lever,railway station,a heavy steel switch lever being thrown in a silent yard
Emotional/Subjective,haunting,Mechanical,chains,cargo hold,the clinking of heavy metal chains sliding over a metal edge
Emotional/Subjective,haunting,Mechanical,bell,village square,the muffled strike of a clock tower bell in the rain
Emotional/Subjective,haunting,Environmental,wind,canyon,the low-pitched moaning of a gale through a narrow rock fissure
Emotional/Subjective,haunting,Environmental,ice,arctic fjord,the deep subterranean groaning of a shifting glacier
Emotional/Subjective,haunting,Environmental,thunder,plains,the long rolling rumble of a distant thunderclap
Emotional/Subjective,haunting,Environmental,waterfall,gorge,the continuous low-frequency thrum of water in a deep ravine
Emotional/Subjective,haunting,Environmental,lava,cavern,the thick bubbling and glooping of magma in a hollow
Emotional/Subjective,haunting,Environmental,geyser,volcanic field,a low steady hiss of steam from a narrow earth vent
Emotional/Subjective,haunting,Environmental,ocean,sea cave,the deep resonant boom of a wave hitting a hollow rock
Emotional/Subjective,haunting,Environmental,leaves,forest,the dry rustling of dead leaves swirling in a draft
Emotional/Subjective,haunting,Environmental,stalactite,grotto,a single drop of water hitting a resonant stone pool
Emotional/Subjective,haunting,Environmental,sand,desert,the low-pitched singing of sand sliding down a steep dune
Emotional/Subjective,haunting,Environmental,avalanche,mountain,the muffled roar of a snowpack collapsing in the distance
Emotional/Subjective,haunting,Environmental,fire,lodge,the faint crackling of a dying fire in a stone hearth
Emotional/Subjective,haunting,Environmental,storm,harbor,the high-pitched whistling of wind through ship rigging
Emotional/Subjective,haunting,Environmental,river,valley,the steady low-frequency rushing of a wide river at night
Emotional/Subjective,haunting,Environmental,reeds,marsh,the hollow clattering of dry reeds in a shifting breeze
Emotional/Subjective,haunting,Environmental,shale,cliff,small pieces of shale skittering down a rock face
Emotional/Subjective,haunting,Environmental,pine grove,ridge,the low sighing of wind through a dense needle forest
Emotional/Subjective,haunting,Environmental,flood,valley,the heavy churning of water and debris in a gorge
Emotional/Subjective,haunting,Organic,loon,lake,the mournful high-pitched call of a loon across the water
Emotional/Subjective,haunting,Organic,wolf,winter forest,a single sustained howl of a wolf in the hills
Emotional/Subjective,haunting,Organic,owl,barn,the deep hooting of a great horned owl in a rafter
Emotional/Subjective,haunting,Organic,heartbeat,quiet room,the muffled thumping of a human heart through a chest
Emotional/Subjective,haunting,Organic,throat singing,shrine,the multi-tonal resonant drone of a human throat singer
Emotional/Subjective,haunting,Organic,lion,savanna,a distant deep guttural roar of a lion at night
Emotional/Subjective,haunting,Organic,elephant,bush,the low-frequency infrasonic rumble of an elephant
Emotional/Subjective,haunting,Organic,breathing,bedroom,the slow rhythmic sound of heavy sleep breathing
Emotional/Subjective,haunting,Organic,alligator,swamp,the low-pitched vibrating call of an alligator in the mud
Emotional/Subjective,haunting,Organic,whale,ocean,the complex mournful song of a humpback whale through water
Emotional/Subjective,haunting,Organic,stomach,library,the deep gurgling of a digestive system in a silent room
Emotional/Subjective,haunting,Organic,purr,den,the low-frequency vibration of a large tiger purring
Emotional/Subjective,haunting,Organic,wings,cave,the fluttering of many bat wings in a narrow passage
Emotional/Subjective,haunting,Organic,howl,canyon,the echoing cry of a coyote from a far ledge
Emotional/Subjective,haunting,Organic,peacock,garden,the sharp piercing scream of a peacock in the mist
Emotional/Subjective,haunting,Organic,dove,eaves,the soft cooing of a mourning dove at dusk
Emotional/Subjective,haunting,Organic,snoring,room,the deep resonant snort of a heavy sleeper
Emotional/Subjective,haunting,Organic,throat,church,a single short dry cough from a person in a hall
Emotional/Subjective,haunting,Domestic,floorboard,old house,the long groaning of a thick floorboard under weight
Emotional/Subjective,haunting,Domestic,rocking chair,porch,the rhythmic creaking of a wooden chair on floorboards
Emotional/Subjective,haunting,Domestic,door,mansion,the heavy boom of a solid oak door closing in a hall
Emotional/Subjective,haunting,Domestic,faucet,kitchen,a single drip of water hitting a metal sink in the dark
Emotional/Subjective,haunting,Domestic,curtains,theater,the low whoosh of heavy velvet curtains moving in a draft
Emotional/Subjective,haunting,Domestic,trunk,attic,the low creak of a heavy wooden chest lid opening
Emotional/Subjective,haunting,Domestic,boiler,basement,the deep clanking and hissing of a steam radiator
Emotional/Subjective,haunting,Domestic,radiator,apartment,the rhythmic gurgling of water in a heating pipe
Emotional/Subjective,haunting,Domestic,fireplace,den,the low-frequency roar of a wood fire in a chimney
Emotional/Subjective,haunting,Domestic,kettle,pantry,the faint high-pitched whistle of a tea kettle cooling
Emotional/Subjective,haunting,Domestic,clock,hallway,the slow rhythmic ticking of a grandfather clock
Emotional/Subjective,haunting,Domestic,window,attic,the rattling of a loose window pane in its frame
Emotional/Subjective,haunting,Domestic,stairs,house,the muffled thud of footsteps on a creaky staircase
Emotional/Subjective,haunting,Domestic,bathtub,bathroom,the resonant thrum of water hitting an empty iron tub
Emotional/Subjective,haunting,Domestic,refrigerator,kitchen,the steady low-pitched hum of a compressor at night
Emotional/Subjective,haunting,Domestic,fan,bedroom,the slow rhythmic whoosh of a ceiling fan in the dark
Emotional/Subjective,haunting,Domestic,trash can,alley,the boom of a metal bin lid in the wind
Emotional/Subjective,haunting,Domestic,mirror,bathroom,the resonant ring of a glass mirror being wiped
Emotional/Subjective,haunting,Electronic,transformer,substation,the constant heavy low-frequency hum of a power unit
Emotional/Subjective,haunting,Electronic,analog synth,studio,a layered drone of five overlapping sawtooth oscillators
Emotional/Subjective,haunting,Electronic,static,radio,the faint hiss of white noise between radio stations
Emotional/Subjective,haunting,Electronic,neon sign,diner,the high-pitched buzzing of a flickering neon sign
Emotional/Subjective,haunting,Electronic,vacuum tube,room,the low-frequency warm hum of an idling tube amplifier
Emotional/Subjective,haunting,Electronic,modem,office,the high-pitched handshake tones of a dial-up modem
Emotional/Subjective,haunting,Electronic,hard drive,study,the high-pitched whine of a spinning disk platter
Emotional/Subjective,haunting,Electronic,server,data center,the collective low-pitched whir of cooling fans
Emotional/Subjective,haunting,Electronic,interference,attic,the erratic crackling and humming of radio noise
Emotional/Subjective,haunting,Electronic,beeper,hospital,the high-pitched pulse of a digital pager alert
Emotional/Subjective,haunting,Electronic,subwoofer,car,the vibrating drone of a sub-bass tone through a trunk
Emotional/Subjective,haunting,Electronic,fluorescent,hallway,the rhythmic flickering buzz of a failing tube
Emotional/Subjective,haunting,Electronic,capacitor,laboratory,the faint sound of a capacitor leaking charge
Emotional/Subjective,haunting,Electronic,plasma globe,museum,the faint low crackle and buzz of plasma filaments
Emotional/Subjective,haunting,Electronic,feedback,stage,the piercing sustained howl of a guitar amplifier
Emotional/Subjective,haunting,Electronic,buzzer,kitchen,the faint high-pitched beep of a digital timer
Emotional/Subjective,haunting,Electronic,led bulbs,basement,the faint high-pitched buzzing of a failing led bulb
Emotional/Subjective,haunting,Electronic,electric heater,bedroom,the steady low-pitched whir of a fan heater
Emotional/Subjective,natural,Musical,wooden flute,forest clearing,a breathy melody played on a bamboo flute
Emotional/Subjective,natural,Musical,marimba,botanical garden,a soft yarn mallet hitting a rosewood marimba bar
Emotional/Subjective,natural,Musical,hand drum,beach fire,a palm strike on a goat-skin djembe
Emotional/Subjective,natural,Musical,pan flute,mountain ridge,a hollow breathy note from a bamboo pan flute
Emotional/Subjective,natural,Musical,acoustic guitar,wooden porch,a thumb strumming across nylon strings
Emotional/Subjective,natural,Musical,kalimba,rainforest,a thumb pluck on a wooden kalimba tine
Emotional/Subjective,natural,Musical,ocarina,misty valley,a mellow tune on a ceramic ocarina
Emotional/Subjective,natural,Musical,didgeridoo,outback,the rhythmic drone of a eucalyptus didgeridoo
Emotional/Subjective,natural,Musical,harmonium,temple,the air-filled pumping of a vintage harmonium
Emotional/Subjective,natural,Musical,lute,study,a gentle pluck on a wooden lute string
Emotional/Subjective,natural,Musical,woodblock,hall,a single hit on a hollow teak woodblock
Emotional/Subjective,natural,Musical,tambourine,meadow,the light jingle of metal zils on a wooden rim
Emotional/Subjective,natural,Musical,harp,conservatory,the soft pluck of a gut string with a fingertip
Emotional/Subjective,natural,Musical,recorder,nursery,a low breathy note on a wooden recorder
Emotional/Subjective,natural,Musical,cello,cabin,a deep C-string pluck on a wooden cello
Emotional/Subjective,natural,Musical,shaker,room,the soft sliding of seeds inside a wooden shaker
Emotional/Subjective,natural,Musical,bell,foyer,the jingle of a small bronze handbell
Emotional/Subjective,natural,Musical,oboe,studio,a low resonant phrase on a wooden oboe
Emotional/Subjective,natural,Mechanical,water wheel,mill,the heavy splashing and groaning of a wooden water wheel
Emotional/Subjective,natural,Mechanical,millstone,farmland,the slow grinding of two large granite millstones
Emotional/Subjective,natural,Mechanical,bellows,forge,the rhythmic wheezing of wood-handled leather bellows
Emotional/Subjective,natural,Mechanical,loom,shed,the rhythmic thud of a wooden loom shuttle
Emotional/Subjective,natural,Mechanical,spinning wheel,cottage,the continuous whirring of a wooden spinning wheel
Emotional/Subjective,natural,Mechanical,churn,dairy,the sloshing of cream inside a wooden butter churn
Emotional/Subjective,natural,Mechanical,pulley,barn,a thick hemp rope sliding over a wooden pulley
Emotional/Subjective,natural,Mechanical,manual drill,woodshop,a manual drill boring into a thick piece of cedar
Emotional/Subjective,natural,Mechanical,crank,farm,the groaning of a heavy wooden hand-crank
Emotional/Subjective,natural,Mechanical,mallet,site,a wooden mallet striking a timber beam
Emotional/Subjective,natural,Mechanical,press,vineyard,the creaking of a wooden grape press
Emotional/Subjective,natural,Mechanical,cart,road,the rattling of wooden wheels on a dirt path
Emotional/Subjective,natural,Mechanical,ladder,attic,the creaking of a wooden extension ladder
Emotional/Subjective,natural,Mechanical,bench,park,the groan of a wooden bench under weight
Emotional/Subjective,natural,Mechanical,handle,garage,the click of a wooden tool handle on a bench
Emotional/Subjective,natural,Mechanical,shutter,house,the soft thud of a wooden shutter closing
Emotional/Subjective,natural,Mechanical,rattle,fair,the rapid clacking of a wooden ratchet toy
Emotional/Subjective,natural,Mechanical,spinning top,nursery,the hum of a wooden top spinning on a table
Emotional/Subjective,natural,Environmental,rain,forest,large raindrops hitting a thick bed of moss
Emotional/Subjective,natural,Environmental,river,valley,the steady low-frequency rushing of a wide river
Emotional/Subjective,natural,Environmental,wind,prairie,the soft rustle of wind through tall dry grass
Emotional/Subjective,natural,Environmental,ocean,beach,the slow wash of a small wave over soft sand
Emotional/Subjective,natural,Environmental,waterfall,gorge,the continuous heavy roar of a massive waterfall
Emotional/Subjective,natural,Environmental,thunder,plains,the long rolling rumble of far-off thunder
Emotional/Subjective,natural,Environmental,geyser,basin,the pre-eruption gurgling of a large geyser
Emotional/Subjective,natural,Environmental,leaves,woods,the soft crunching of dry leaves underfoot
Emotional/Subjective,natural,Environmental,fire,lodge,the gentle crackling of seasoned oak logs
Emotional/Subjective,natural,Environmental,snow,slope,the soft sound of powder snow sliding down a hill
Emotional/Subjective,natural,Environmental,ice,pond,the sharp crystalline crack of a thin ice layer
Emotional/Subjective,natural,Environmental,sand,desert,the fine whistling of wind-blown sand
Emotional/Subjective,natural,Environmental,hail,car,small hailstones hitting a metal sunroof
Emotional/Subjective,natural,Environmental,frost,morning,the delicate crackle of frost on grass
Emotional/Subjective,natural,Environmental,bamboo,jungle,hollow bamboo stalks knocking together
Emotional/Subjective,natural,Environmental,reeds,marsh,the rustling of dry reeds in a light wind
Emotional/Subjective,natural,Environmental,twigs,path,the dry crunching of twigs under a footstep
Emotional/Subjective,natural,Environmental,rocks,riverbed,two smooth quartz stones being hit together
Emotional/Subjective,natural,Organic,horse,dirt track,the muffled trotting of a horse on soft earth
Emotional/Subjective,natural,Organic,bird,orchard,the rhythmic chirping of a small songbird
Emotional/Subjective,natural,Organic,elephant,savanna,the low infrasonic rumble of an elephant
Emotional/Subjective,natural,Organic,lion,bush,a deep guttural growl from a male lion
Emotional/Subjective,natural,Organic,whale,ocean,the complex mournful song of a humpback whale
Emotional/Subjective,natural,Organic,insects,meadow,the rhythmic shimmering drone of summer cicadas
Emotional/Subjective,natural,Organic,purr,room,the continuous deep purring of a large cat
Emotional/Subjective,natural,Organic,heart,doctor's office,the rhythmic thumping of a human heart
Emotional/Subjective,natural,Organic,breathing,bedroom,the rhythmic sound of deep sleep breathing
Emotional/Subjective,natural,Organic,wings,barn,the soft heavy flapping of an owl's wings
Emotional/Subjective,natural,Organic,howl,forest,the sustained howling of a wolf pack
Emotional/Subjective,natural,Organic,moo,pasture,the low resonant mooing of a cow
Emotional/Subjective,natural,Organic,footsteps,woods,boots walking over a thick carpet of pine needles
Emotional/Subjective,natural,Organic,clapping,stadium,the synchronized clap of a large crowd
Emotional/Subjective,natural,Organic,stomach,library,the deep gurgling of a full stomach
Emotional/Subjective,natural,Organic,beak,forest,the rhythmic drumming of a woodpecker
Emotional/Subjective,natural,Organic,growl,den,the deep huffing of a grizzly bear
Emotional/Subjective,natural,Organic,swallow,kitchen,the deep sound of a person swallowing water
Emotional/Subjective,natural,Domestic,wooden bowl,pantry,a wooden spoon stirring inside a wooden bowl
Emotional/Subjective,natural,Domestic,fireplace,den,the low-frequency roar of a wood fire
Emotional/Subjective,natural,Domestic,sweeping,hallway,the soft brushing of a straw broom on a rug
Emotional/Subjective,natural,Domestic,bread dough,bakery,the rhythmic kneading of heavy bread dough
Emotional/Subjective,natural,Domestic,wool,spinning room,the sound of raw wool being teased by hand
Emotional/Subjective,natural,Domestic,leather,saddlery,the creaking of a heavy leather saddle
Emotional/Subjective,natural,Domestic,socks,hallway,the sound of thick wool socks walking on wood
Emotional/Subjective,natural,Domestic,wicker chair,sunroom,the creaking of a wicker chair under weight
Emotional/Subjective,natural,Domestic,teapot,tea room,the low-pitched whistle of a ceramic teapot
Emotional/Subjective,natural,Domestic,bathtub,bathroom,water filling a large cast-iron bathtub
Emotional/Subjective,natural,Domestic,stew,kitchen,the slow thick bubbling of a heavy stew
Emotional/Subjective,natural,Domestic,drawer,bedroom,the smooth sliding of a wooden drawer
Emotional/Subjective,natural,Domestic,floorboard,house,the groan of a thick floorboard underfoot
Emotional/Subjective,natural,Domestic,broom,porch,the rhythmic brushing of a corn broom on stone
Emotional/Subjective,natural,Domestic,matches,kitchen,the sharp strike of a match against a box
Emotional/Subjective,natural,Domestic,ceramic,pantry,the clink of two china cups
Emotional/Subjective,natural,Domestic,iron,laundry room,the sound of a steam iron on a damp shirt
Emotional/Subjective,natural,Domestic,basket,room,the creaking of a woven willow basket
Emotional/Subjective,natural,Electronic,ground loop,studio,the low-frequency hum of a power transformer
Emotional/Subjective,natural,Electronic,static,radio,the broad hiss of white noise between stations
Emotional/Subjective,natural,Electronic,white noise,office,the steady hiss of a white noise machine
Emotional/Subjective,natural,Electronic,speaker,basement,the faint background hiss of a powered speaker
Emotional/Subjective,natural,Electronic,interference,attic,the crackling and humming of radio noise
Emotional/Subjective,natural,Electronic,tape,study,the background hiss of a playing cassette tape
Emotional/Subjective,natural,Electronic,plasma,museum,the continuous crackling hiss of a plasma globe
Emotional/Subjective,natural,Electronic,battery,garage,the faint hissing of a lead-acid battery
Emotional/Subjective,natural,Electronic,welder,workshop,the intense sizzle of an electric arc welder
Emotional/Subjective,natural,Electronic,fluorescent,hallway,the faint buzzing hiss of a failing tube
Emotional/Subjective,natural,Electronic,circuit,workbench,the high-pitched hiss of a short-circuiting wire
Emotional/Subjective,natural,Electronic,spark,laboratory,a high-voltage spark jumping between electrodes
Emotional/Subjective,natural,Electronic,modem,office,the high-pitched handshake tones of a modem
Emotional/Subjective,natural,Electronic,led,basement,the faint buzzing of a failing led bulb
Emotional/Subjective,natural,Electronic,fan,room,the high-pitched whir of a small cooling fan
Emotional/Subjective,natural,Electronic,buzzer,kitchen,the high-pitched alert of a digital timer
Emotional/Subjective,artificial,Musical,toy piano,nursery,a light strike on a plastic toy piano key
Emotional/Subjective,artificial,Musical,synthesizer,studio,a short percussive pulse from a drum machine
Emotional/Subjective,artificial,Musical,kazoo,parade,a buzzing melody through a plastic kazoo
Emotional/Subjective,artificial,Musical,electronic drum,garage,a rubber beater striking a plastic drum pad
Emotional/Subjective,artificial,Musical,keytar,bedroom,a synthesized chord from a plastic keyboard
Emotional/Subjective,artificial,Musical,auto-tune,booth,the rhythmic pitch-shifting of a processed vocal
Emotional/Subjective,artificial,Musical,metronome,music room,the digital beep of an electronic metronome
Emotional/Subjective,artificial,Musical,toy flute,school,a high-pitched peep on a plastic recorder
Emotional/Subjective,artificial,Musical,drum machine,club,a rhythmic pulse of a synthesized kick drum
Emotional/Subjective,artificial,Musical,organ,shrine,the clean tones of a digital church organ
Emotional/Subjective,artificial,Musical,string synth,hall,a sustained chord of synthesized violins
Emotional/Subjective,artificial,Musical,sequencer,room,a sharp rhythmic trigger pulse from a synth
Emotional/Subjective,artificial,Musical,music box,attic,the rhythmic plucking of a digital music toy
Emotional/Subjective,artificial,Musical,looper,stage,the repetitive playback of a recorded guitar phrase
Emotional/Subjective,artificial,Musical,shaker,studio,the sliding of plastic beads inside a shaker
Emotional/Subjective,artificial,Musical,tambourine,parade,the jangle of plastic zils on a plastic rim
Emotional/Subjective,artificial,Musical,guitar,porch,the clean processed sound of an electric guitar
Emotional/Subjective,artificial,Musical,trumpet,alley,a synthesized blast of a brass-like patch
Emotional/Subjective,artificial,Mechanical,conveyor,factory,a heavy rubber package hitting a conveyor belt
Emotional/Subjective,artificial,Mechanical,robotic arm,lab,the high-speed whir of a stepper motor
Emotional/Subjective,artificial,Mechanical,vacuum,office,the steady drone of an autonomous vacuum
Emotional/Subjective,artificial,Mechanical,elevator,hotel,the clean whir of a modern elevator motor
Emotional/Subjective,artificial,Mechanical,fan,room,the steady whir of a high-velocity plastic fan
Emotional/Subjective,artificial,Mechanical,pump,pool,the muffled throb of a pump under a plastic cover
Emotional/Subjective,artificial,Mechanical,printer,office,the rhythmic clicking of an inkjet printer head
Emotional/Subjective,artificial,Mechanical,scanner,library,the high-pitched whir of a document scanner
Emotional/Subjective,artificial,Mechanical,drill,garage,the high-pitched whir of a battery-powered drill
Emotional/Subjective,artificial,Mechanical,treadmill,gym,the rhythmic slap of a running belt on plastic
Emotional/Subjective,artificial,Mechanical,toy,playroom,the mechanical whir of a plastic walking robot
Emotional/Subjective,artificial,Mechanical,clock,hall,the silent sweep of a quartz clock motor
Emotional/Subjective,artificial,Mechanical,keypad,vault,the tactile click of a plastic button
Emotional/Subjective,artificial,Mechanical,dispenser,kitchen,the rhythmic clicking of a plastic soap pump
Emotional/Subjective,artificial,Mechanical,cooler,garage,the low-pitched whir of an electric cooling box
Emotional/Subjective,artificial,Mechanical,stapler,office,the sharp snap of a plastic desktop stapler
Emotional/Subjective,artificial,Mechanical,mouse,study,the tactile click of a plastic mouse button
