category,tag,domain,source,environment,scenario
Emotional/Subjective,artificial,Mechanical,shutter,house,the rattling of plastic window blinds
Emotional/Subjective,artificial,Environmental,fountain,mall,the rhythmic splashing of water in a tiled pool
Emotional/Subjective,artificial,Environmental,snow,slope,the high-pitched roar of a snowmaking machine
Emotional/Subjective,artificial,Environmental,wind,tunnel,the steady roar of air in a testing facility
Emotional/Subjective,artificial,Environmental,rain,greenhouse,water spraying through a plastic nozzle system
Emotional/Subjective,artificial,Environmental,geyser,park,the timed blast of a simulated steam vent
Emotional/Subjective,artificial,Environmental,fire,lodge,the steady hum of an electric fireplace fan
Emotional/Subjective,artificial,Environmental,ocean,resort,the rhythmic thumping of a wave machine
Emotional/Subjective,artificial,Environmental,sand,beach,the sound of artificial grit being poured
Emotional/Subjective,artificial,Environmental,grass,stadium,the sound of shoes on synthetic turf
Emotional/Subjective,artificial,Environmental,thunder,theatre,the metallic sheet rumble of a thunder effect
Emotional/Subjective,artificial,Environmental,hail,roof,the sound of plastic beads hitting a window
Emotional/Subjective,artificial,Environmental,ice,rink,the scraping of skates on a synthetic ice floor
Emotional/Subjective,artificial,Environmental,lava,museum,the bubbling of a viscous orange liquid in a display
Emotional/Subjective,artificial,Environmental,mist,patio,the high-pitched hiss of a cooling mist system
Emotional/Subjective,artificial,Environmental,earthquake,lab,the rhythmic shaking of a test platform
Emotional/Subjective,artificial,Environmental,stream,garden,the splashing of a pump-driven waterfall
Emotional/Subjective,artificial,Environmental,cicada,orchard,the electronic chirp of a sonic pest repeller
Emotional/Subjective,artificial,Environmental,reeds,marsh,the rattling of plastic decorative stalks
Emotional/Subjective,artificial,Organic,heart,hospital,the rhythmic beep of an artificial heart monitor
Emotional/Subjective,artificial,Organic,skin,lab,the sound of a finger on a silicone surface
Emotional/Subjective,artificial,Organic,voice,hall,the clean tones of a speech synthesizer
Emotional/Subjective,artificial,Organic,fur,den,the sound of a hand stroking polyester faux fur
Emotional/Subjective,artificial,Organic,bones,museum,the clatter of plastic resin skeleton parts
Emotional/Subjective,artificial,Organic,chewing,kitchen,the crunch of a highly processed snack
Emotional/Subjective,artificial,Organic,breathing,room,the rhythmic whir of a medical ventilator
Emotional/Subjective,artificial,Organic,claws,floor,the clicking of a prosthetic limb on tile
Emotional/Subjective,artificial,Organic,bird,forest,the electronic chirp of a digital bird decoy
Emotional/Subjective,artificial,Organic,eggs,farm,the clinking of plastic decorative eggs
Emotional/Subjective,artificial,Organic,fruit,pantry,the sound of a person squeezing a wax apple
Emotional/Subjective,artificial,Organic,hair,salon,the sharp snip of scissors through nylon wig hair
Emotional/Subjective,artificial,Organic,scales,swamp,the rustling of a plastic snake toy
Emotional/Subjective,artificial,Organic,honey,kitchen,the thick sound of corn syrup being poured
Emotional/Subjective,artificial,Organic,leather,saddle,the creaking of a vinyl faux-leather bag
Emotional/Subjective,artificial,Organic,wings,barn,the rhythmic whir of a drone's plastic blades
Emotional/Subjective,artificial,Organic,howl,woods,the electronic play of a recorded wolf call
Emotional/Subjective,artificial,Organic,teeth,room,the clicking of a set of plastic dentures
Emotional/Subjective,artificial,Domestic,kettle,kitchen,the digital beep of an electric water heater
Emotional/Subjective,artificial,Domestic,microwave,pantry,the low-frequency hum of an oven
Emotional/Subjective,artificial,Domestic,blender,kitchen,the overwhelming roar of a blender
Emotional/Subjective,artificial,Domestic,dryer,laundry,the rhythmic thumping of a spin cycle
Emotional/Subjective,artificial,Domestic,fan,bedroom,the steady whir of a plastic floor fan
Emotional/Subjective,artificial,Domestic,heater,den,the low hum of an electric space heater
Emotional/Subjective,artificial,Domestic,air conditioner,window,the steady drone of an AC unit
Emotional/Subjective,artificial,Domestic,doorbell,foyer,the digital chime of a wireless doorbell
Emotional/Subjective,artificial,Domestic,timer,kitchen,the sharp beep of a digital oven clock
Emotional/Subjective,artificial,Domestic,fridge,pantry,the low hum of a modern compressor
Emotional/Subjective,artificial,Domestic,lamp,bedroom,the tactile click of a plastic light switch
Emotional/Subjective,artificial,Domestic,bottle,kitchen,the crinkling of a plastic water bottle
Emotional/Subjective,artificial,Domestic,shoes,hallway,the squeak of rubber soles on a floor
Emotional/Subjective,artificial,Domestic,sponge,bathroom,the sound of a synthetic foam sponge
Emotional/Subjective,artificial,Domestic,curtain,theater,the whoosh of a polyester stage curtain
Emotional/Subjective,artificial,Domestic,zipper,closet,the rapid sliding of a plastic zipper
Emotional/Subjective,artificial,Domestic,remote,room,the soft click of a silicone button
Emotional/Subjective,artificial,Electronic,beeper,hospital,the high-pitched pulse of a digital pager
Emotional/Subjective,artificial,Electronic,modem,office,the handshake tones of a connection
Emotional/Subjective,artificial,Electronic,synth,studio,a pure sine wave from an oscillator
Emotional/Subjective,artificial,Electronic,static,radio,the hiss of digital white noise
Emotional/Subjective,artificial,Electronic,hard drive,center,the high-pitched whine of a disk
Emotional/Subjective,artificial,Electronic,fan,rack,the high-pitched whir of a cooling unit
Emotional/Subjective,artificial,Electronic,transformer,station,the low hum of a power unit
Emotional/Subjective,artificial,Electronic,relay,closet,the sharp click of an electrical relay
Emotional/Subjective,artificial,Electronic,buzzer,kitchen,the sharp beep of a digital timer
Emotional/Subjective,artificial,Electronic,watch,bedroom,the digital beep of a wristwatch
Emotional/Subjective,artificial,Electronic,taser,training,the snapping of an electrical arc
Emotional/Subjective,artificial,Electronic,led,basement,the buzzing of a failing led bulb
Emotional/Subjective,artificial,Electronic,scanner,library,the whir of a document scanner
Emotional/Subjective,artificial,Electronic,toy,playroom,the electronic chirp of a plastic toy
Emotional/Subjective,artificial,Electronic,feedback,studio,the howl of a speaker loop
Emotional/Subjective,artificial,Electronic,treadmill,gym,the drone of a motor belt
Emotional/Subjective,artificial,Electronic,shaver,bathroom,the whir of an electric razor
Emotional/Subjective,artificial,Electronic,calculator,room,the click of a button
Emotional/Subjective,organic,Musical,cello,stone cellar,the bowing of a thick cello string held at a low resonance
Emotional/Subjective,organic,Musical,upright bass,jazz club,a heavy finger pluck on a double bass e-string
Emotional/Subjective,organic,Musical,harmonium,shrine,the air-driven oscillation of brass reeds
Emotional/Subjective,organic,Musical,didgeridoo,cave,the continuous rhythmic resonance of a didgeridoo
Emotional/Subjective,organic,Musical,violin,alley,a sharp pizzicato pluck on a violin string
Emotional/Subjective,organic,Musical,harp,conservatory,the soft pluck of a gut string
Emotional/Subjective,organic,Musical,piano,hall,the mechanical thud of a piano hammer on wood
Emotional/Subjective,organic,Musical,guitar,porch,the pluck of a nylon string on a wooden guitar
Emotional/Subjective,organic,Musical,bassoon,monastery,the deep vibrating hum of a double reed
Emotional/Subjective,organic,Musical,singing bowl,temple,the resonance of a wooden mallet on brass
Emotional/Subjective,organic,Mechanical,water wheel,mill,the heavy splashing and groaning of a wooden wheel
Emotional/Subjective,organic,Mechanical,millstone,farmland,the slow grinding of two large granite stones
Emotional/Subjective,organic,Mechanical,bellows,forge,the rhythmic wheezing of leather bellows
Emotional/Subjective,organic,Mechanical,spinning wheel,cottage,the continuous whirring of a wooden wheel
Emotional/Subjective,organic,Mechanical,drill,woodshop,a manual drill boring into a piece of cedar
Emotional/Subjective,organic,Mechanical,spinning top,nursery,the hum of a wooden top spinning
Emotional/Subjective,organic,Environmental,wind,prairie,the soft rustle of wind through tall grass
Emotional/Subjective,organic,Environmental,ocean,beach,the slow wash of a small wave over sand
Emotional/Subjective,organic,Environmental,waterfall,gorge,the continuous heavy roar of a waterfall
Emotional/Subjective,organic,Environmental,geyser,basin,the pre-eruption gurgling of a geyser
Emotional/Subjective,organic,Environmental,snow,slope,the soft sound of powder snow sliding
Emotional/Subjective,organic,Environmental,twigs,path,the dry crunching of twigs under a step
Emotional/Subjective,organic,Environmental,rocks,riverbed,two smooth quartz stones being hit
Emotional/Subjective,organic,Organic,horse,dirt track,the muffled trotting of a horse on earth
Emotional/Subjective,organic,Organic,bird,orchard,the rhythmic chirping of a songbird
Emotional/Subjective,organic,Organic,whale,ocean,the complex song of a humpback whale
Emotional/Subjective,organic,Organic,insects,meadow,the rhythmic shimmering drone of cicadas
Emotional/Subjective,organic,Organic,breathing,bedroom,the rhythmic sound of sleep breathing
Emotional/Subjective,organic,Organic,footsteps,woods,boots walking over a carpet of pine needles
Emotional/Subjective,organic,Organic,clapping,stadium,the synchronized clap of a crowd
Emotional/Subjective,organic,Organic,swallow,kitchen,the deep sound of a person swallowing
Emotional/Subjective,organic,Domestic,wooden bowl,pantry,a wooden spoon stirring inside a bowl
Emotional/Subjective,organic,Domestic,sweeping,hallway,the soft brushing of a straw broom
Emotional/Subjective,organic,Domestic,bread dough,bakery,the rhythmic kneading of bread dough
Emotional/Subjective,organic,Domestic,wool,spinning room,the sound of raw wool being teased
Emotional/Subjective,organic,Domestic,socks,hallway,the sound of wool socks walking on wood
Emotional/Subjective,organic,Domestic,wicker chair,sunroom,the creaking of a wicker chair
Emotional/Subjective,organic,Domestic,broom,porch,the rhythmic brushing of a corn broom
Emotional/Subjective,organic,Domestic,iron,laundry room,the sound of a steam iron on a shirt
Emotional/Subjective,organic,Electronic,ground loop,studio,the low-frequency hum of a transformer
Emotional/Subjective,organic,Electronic,capacitor,lab,the faint sound of a capacitor leaking
Emotional/Subjective,organic,Electronic,white noise,office,the steady hiss of a noise machine
Emotional/Subjective,organic,Electronic,speaker,basement,the faint background hiss of a speaker
Emotional/Subjective,organic,Electronic,tape,study,the background hiss of a cassette tape
Emotional/Subjective,organic,Electronic,plasma,museum,the continuous crackling hiss of a globe
Emotional/Subjective,organic,Electronic,welder,workshop,the intense sizzle of an arc welder
Emotional/Subjective,organic,Electronic,fluorescent,hallway,the faint buzzing hiss of a tube
Emotional/Subjective,organic,Electronic,circuit,workbench,the high-pitched hiss of a short circuit
Emotional/Subjective,organic,Electronic,spark,laboratory,a high-voltage spark between electrodes
Emotional/Subjective,synthetic,Musical,synthesizer,recording studio,a sub-bass sawtooth wave vibrating a wooden floor
Emotional/Subjective,synthetic,Musical,sampling,studio,the digital stuttering of a re-triggered audio loop
Emotional/Subjective,synthetic,Musical,vocoder,basement,the robotic synthesized resonance of a vocal line
Emotional/Subjective,synthetic,Musical,arpeggiator,loft,a fast rhythmic series of electronic notes
Emotional/Subjective,synthetic,Musical,fm synth,office,the brittle crystalline chime of a digital patch
Emotional/Subjective,synthetic,Musical,drum pad,hallway,the flat thud of a finger on a silicone pad
Emotional/Subjective,synthetic,Musical,plugin,theatre,the shimmering wash of an artificial reverb tail
Emotional/Subjective,synthetic,Musical,wavetable,den,a morphing metallic tone from a digital oscillator
Emotional/Subjective,synthetic,Environmental,snow machine,slope,the high-pitched roar of a snowmaking unit
Emotional/Subjective,synthetic,Environmental,electric fire,lodge,the steady hum of a simulated fire fan
Emotional/Subjective,synthetic,Environmental,wave machine,resort,the rhythmic thumping of an ocean simulator
Emotional/Subjective,synthetic,Environmental,turf,stadium,the sound of shoes on synthetic grass
Emotional/Subjective,synthetic,Organic,heart monitor,hospital,the rhythmic beep of an artificial heart
Emotional/Subjective,synthetic,Organic,speech synth,hall,the clean tones of a computer voice
Emotional/Subjective,synthetic,Organic,faux fur,den,the sound of a hand stroking polyester fur
Emotional/Subjective,synthetic,Organic,resin bones,museum,the clatter of plastic skeleton parts
Emotional/Subjective,synthetic,Organic,nylon hair,salon,the sharp snip of scissors through wig hair
Emotional/Subjective,synthetic,Organic,vinyl bag,saddle,the creaking of a faux-leather bag
Emotional/Subjective,synthetic,Organic,drone blades,barn,the rhythmic whir of plastic propellers
Emotional/Subjective,synthetic,Organic,dentures,room,the clicking of a set of plastic teeth
Emotional/Subjective,synthetic,Domestic,water heater,kitchen,the digital beep of an electric kettle
Emotional/Subjective,synthetic,Domestic,spin cycle,laundry,the rhythmic thumping of a machine
Emotional/Subjective,synthetic,Domestic,plastic fan,bedroom,the steady whir of a floor fan
Emotional/Subjective,synthetic,Domestic,space heater,den,the low hum of an electric heater
Emotional/Subjective,synthetic,Domestic,ac unit,window,the steady drone of an air conditioner
Emotional/Subjective,synthetic,Domestic,wireless bell,foyer,the digital chime of a doorbell
Emotional/Subjective,synthetic,Domestic,fridge compressor,pantry,the low hum of a modern fridge
Emotional/Subjective,synthetic,Domestic,light switch,bedroom,the tactile click of a plastic switch
Emotional/Subjective,synthetic,Domestic,water bottle,kitchen,the crinkling of a plastic bottle
Emotional/Subjective,synthetic,Domestic,rubber soles,hallway,the squeak of shoes on a floor
Emotional/Subjective,synthetic,Domestic,foam sponge,bathroom,the sound of a synthetic sponge
Emotional/Subjective,synthetic,Domestic,stage curtain,theater,the whoosh of a polyester curtain
Emotional/Subjective,synthetic,Domestic,plastic zipper,closet,the rapid sliding of a zipper
Emotional/Subjective,synthetic,Domestic,silicone button,room,the soft click of a remote button
Emotional/Subjective,synthetic,Electronic,digital pager,hospital,the high-pitched pulse of a beeper
Emotional/Subjective,synthetic,Electronic,oscillator,studio,a pure sine wave from a synth
Emotional/Subjective,synthetic,Electronic,white noise,radio,the hiss of digital static
Emotional/Subjective,synthetic,Electronic,disk platter,center,the high-pitched whine of a drive
Emotional/Subjective,synthetic,Electronic,cooling fan,rack,the high-pitched whir of a fan
Emotional/Subjective,synthetic,Electronic,electrical relay,closet,the sharp click of a relay
Emotional/Subjective,synthetic,Electronic,digital timer,kitchen,the sharp beep of a timer
Emotional/Subjective,synthetic,Electronic,wristwatch,bedroom,the digital beep of an alarm
Emotional/Subjective,synthetic,Electronic,electrical arc,training,the snapping of a taser
Emotional/Subjective,synthetic,Electronic,led bulb,basement,the buzzing of a failing bulb
Emotional/Subjective,synthetic,Electronic,document scanner,library,the whir of a scanner
Emotional/Subjective,synthetic,Electronic,plastic toy,playroom,the electronic chirp of a toy
Emotional/Subjective,synthetic,Electronic,speaker feedback,studio,the howl of an audio loop
Emotional/Subjective,synthetic,Electronic,motor belt,gym,the drone of a treadmill motor
Emotional/Subjective,synthetic,Electronic,electric razor,bathroom,the whir of a shaver
Emotional/Subjective,synthetic,Electronic,plastic button,room,the click of a calculator
Emotional/Subjective,robotic,Musical,step sequencer,recording studio,the rapid rhythmic clicking of a digital drum machine
Emotional/Subjective,robotic,Musical,solenoid drum,garage,a metal striker hitting a snare drum via magnetic trigger
Emotional/Subjective,robotic,Musical,player piano,saloon,the mechanical clicking and playing of a self-operating piano
Emotional/Subjective,robotic,Musical,mechanical metronome,music room,the rigid precise ticking of a pendulum metronome
Emotional/Subjective,robotic,Musical,midi controller,bedroom,the rapid clicking of plastic buttons on a beat pad
Emotional/Subjective,robotic,Musical,tuned percussion,factory,the rhythmic hitting of metal pipes by a machine arm
Emotional/Subjective,robotic,Musical,synthesizer,loft,a series of perfectly timed square wave pulses
Emotional/Subjective,robotic,Musical,digital organ,shrine,a series of rigid staccato notes from a pipe simulator
Emotional/Subjective,robotic,Musical,drum robot,arena,the high-speed repetitive striking of a cymbal by a piston
Emotional/Subjective,robotic,Musical,arpeggiator,studio,a perfectly consistent sequence of electronic tones
Emotional/Subjective,robotic,Musical,robotic flute,lab,the clean mechanical opening and closing of flute keys
Emotional/Subjective,robotic,Musical,automated bell,tower,the precise rhythmic strike of a motorized bell hammer
Emotional/Subjective,robotic,Musical,sampler,room,the repetitive digital looping of a single percussion hit
Emotional/Subjective,robotic,Musical,vocoder,basement,the mechanical resonance of a voice through a synth
Emotional/Subjective,robotic,Musical,electric bass,garage,a perfectly rhythmic picking of a single metal string
Emotional/Subjective,robotic,Musical,keypad,office,the rhythmic high-pitched clicking of a data entry pad
Emotional/Subjective,robotic,Musical,looper,stage,the identical repetition of a recorded drum phrase
Emotional/Subjective,robotic,Musical,clockwork music box,nursery,the rigid rhythmic plucking of a metal comb
Emotional/Subjective,robotic,Mechanical,robotic arm,laboratory,the high-speed whir and click of a stepper motor
Emotional/Subjective,robotic,Mechanical,conveyor,warehouse,the rhythmic thumping of packages on a motor belt
Emotional/Subjective,robotic,Mechanical,servo motor,workshop,the precise whining sound of a gear head rotating
Emotional/Subjective,robotic,Mechanical,printer,office,the rapid rhythmic clicking of a print head moving
Emotional/Subjective,robotic,Mechanical,autonomous vacuum,room,the steady whir of a floor-cleaning robot
Emotional/Subjective,robotic,Mechanical,cnc machine,factory,the high-pitched whine of a tool cutting metal
Emotional/Subjective,robotic,Mechanical,stepper motor,lab,the rhythmic stuttering whir of a camera slider
Emotional/Subjective,robotic,Mechanical,automated door,mall,the clean whir of a sliding glass door motor
Emotional/Subjective,robotic,Mechanical,sorting machine,dock,the rhythmic mechanical thuds of a piston arm
Emotional/Subjective,robotic,Mechanical,drone,field,the high-pitched buzzing of four plastic propellers
Emotional/Subjective,robotic,Mechanical,winding machine,plant,the rapid rhythmic whir of a spooling motor
Emotional/Subjective,robotic,Mechanical,hydraulic ram,garage,the smooth mechanical sigh of a lift cylinder
Emotional/Subjective,robotic,Mechanical,actuator,closet,the sharp crystalline click of a magnetic switch
Emotional/Subjective,robotic,Mechanical,treadmill,gym,the steady rhythmic drone of a motor and belt
Emotional/Subjective,robotic,Mechanical,scanner,library,the precise mechanical whir of a carriage moving
Emotional/Subjective,robotic,Mechanical,elevator,hotel,the clean whir and floor chime of a modern lift
Emotional/Subjective,robotic,Mechanical,vending machine,hallway,the mechanical whir and thud of a motorized coil
Emotional/Subjective,robotic,Environmental,steam vent,volcanic field,a rhythmic pulsing hiss of steam from a fissure
Emotional/Subjective,robotic,Environmental,ice crack,arctic,a series of perfectly timed sharp snaps in a glacier
Emotional/Subjective,robotic,Environmental,geyser,basin,the rhythmic subterranean thumping of a pulsing vent
Emotional/Subjective,robotic,Environmental,basalt column,desert,the rigid clacking of falling rock pillars
Emotional/Subjective,robotic,Environmental,wind,window,a rhythmic high-pitched whistle through a narrow seal
Emotional/Subjective,robotic,Environmental,water drop,sink,the perfectly timed dripping of water into metal
Emotional/Subjective,robotic,Environmental,fire,lodge,the rhythmic clicking of a gas fireplace igniter
Emotional/Subjective,robotic,Environmental,ocean,shore,the rhythmic thumping of a wave-powered generator
Emotional/Subjective,robotic,Environmental,hail,roof,the rhythmic tapping of beads on a testing surface
Emotional/Subjective,robotic,Environmental,cicada,orchard,the rigid mechanical vibration of a single insect
Emotional/Subjective,robotic,Environmental,sand,dune,the rhythmic whistling of sand against a metal pole
Emotional/Subjective,robotic,Environmental,mist,patio,the rhythmic pulsing hiss of a high-pressure nozzle
Emotional/Subjective,robotic,Environmental,lava,museum,the rhythmic bubbling of a heavy fluid display
Emotional/Subjective,robotic,Environmental,rain,greenhouse,the rhythmic tapping of a sprinkler system
Emotional/Subjective,robotic,Environmental,stream,garden,the rhythmic splashing of a pump-driven falls
Emotional/Subjective,robotic,Environmental,quartz,quarry,the rhythmic ping of a chisel on a stone vein
Emotional/Subjective,robotic,Environmental,reeds,marsh,the rhythmic clattering of stalks in a steady gust
Emotional/Subjective,robotic,Organic,woodpecker,forest,the perfectly rhythmic hammering of a woodpecker
Emotional/Subjective,robotic,Organic,click beetle,bucket,the rigid mechanical snap of an insect's thorax
Emotional/Subjective,robotic,Organic,breathing,room,the rhythmic whir of a medical ventilator machine
Emotional/Subjective,robotic,Organic,footsteps,hallway,the rhythmic clicking of a prosthetic limb on tile
Emotional/Subjective,robotic,Organic,teeth,bedroom,the perfectly rhythmic chattering of teeth in the cold
Emotional/Subjective,robotic,Organic,voice,loft,the clean rhythmic tones of a speech synthesizer
Emotional/Subjective,robotic,Organic,claws,floor,the rhythmic clicking of a dog's claws on hardwood
Emotional/Subjective,robotic,Organic,chewing,kitchen,the rhythmic crunching of a person eating an apple
Emotional/Subjective,robotic,Organic,paws,loft,the rhythmic scuttling of a small animal overhead
Emotional/Subjective,robotic,Organic,wings,barn,the rhythmic heavy fluttering of an owl's wings
Emotional/Subjective,robotic,Organic,alligator,swamp,the rhythmic low-pitched bellowing of an alligator
Emotional/Subjective,robotic,Organic,clapping,stadium,the perfectly timed rhythmic clap of a crowd
Emotional/Subjective,robotic,Organic,purr,room,the perfectly consistent low vibration of a cat
Emotional/Subjective,robotic,Organic,stomach,library,the rhythmic gurgling of a digestive system
Emotional/Subjective,robotic,Organic,howl,woods,the rhythmic repetition of a recorded wolf call
Emotional/Subjective,robotic,Organic,scales,desert,the rhythmic rustling of a lizard moving over leaves
Emotional/Subjective,robotic,Organic,throat,church,the rhythmic intermittent coughing of a person
Emotional/Subjective,robotic,Domestic,microwave,pantry,the perfectly timed beep of a digital oven
Emotional/Subjective,robotic,Domestic,blender,kitchen,the rhythmic roar of a blender on a timed cycle
Emotional/Subjective,robotic,Domestic,electric kettle,pantry,the digital beep of a boiling unit
Emotional/Subjective,robotic,Domestic,ac unit,window,the steady rhythmic hum of an air conditioner
Emotional/Subjective,robotic,Domestic,doorbell,foyer,the rigid electronic chime of a wireless bell
Emotional/Subjective,robotic,Domestic,timer,kitchen,the perfectly rhythmic beep of a digital clock
Emotional/Subjective,robotic,Domestic,fridge compressor,pantry,the rhythmic hum of a fridge motor
Emotional/Subjective,robotic,Domestic,light switch,bedroom,the precise click of a plastic switch
Emotional/Subjective,robotic,Domestic,water bottle,kitchen,the rhythmic crinkling of a plastic bottle
Emotional/Subjective,robotic,Domestic,rubber soles,hallway,the rhythmic squeak of shoes on a floor
Emotional/Subjective,robotic,Domestic,fan,bedroom,the perfectly rhythmic whoosh of a floor fan
Emotional/Subjective,robotic,Domestic,heater,den,the steady rhythmic whir of a space heater
Emotional/Subjective,robotic,Domestic,dryer,laundry,the rhythmic thumping of heavy towels in a drum
Emotional/Subjective,robotic,Domestic,zipper,closet,the rhythmic sliding of a metal zipper
Emotional/Subjective,robotic,Domestic,shutter,study,the rhythmic clicking of a camera lens cap
Emotional/Subjective,robotic,Domestic,remote,room,the rhythmic click of a silicone button
Emotional/Subjective,robotic,Electronic,stepper motor,lab,the rhythmic stuttering whir of a carriage
Emotional/Subjective,robotic,Electronic,relay,closet,the sharp rhythmic click of an industrial relay
Emotional/Subjective,robotic,Electronic,beeper,hospital,the rhythmic pulse of a digital pager alert
Emotional/Subjective,robotic,Electronic,modem,office,the rhythmic handshake tones of a connection
Emotional/Subjective,robotic,Electronic,synth,studio,a rhythmic series of square wave pulses
Emotional/Subjective,robotic,Electronic,static,radio,the rhythmic pulsing of digital white noise
Emotional/Subjective,robotic,Electronic,hard drive,center,the rhythmic mechanical clicking of a head
