category,tag,domain,source,environment,scenario
Energy/Dynamics,surging,Organic,frog chorus,marsh,the rising collective croaking of frogs at night
Energy/Dynamics,surging,Organic,horse stampede,plain,the rising rhythmic thundering of a horse herd
Energy/Dynamics,surging,Organic,human screaming,fairground,the rising wall of sound from people on a ride
Energy/Dynamics,surging,Organic,tree canopy,storm,the rising roar of wind through a dense leafy canopy
Energy/Dynamics,surging,Organic,bison herd,prairie,the rising grumbling and thudding of a bison herd
Energy/Dynamics,surging,Organic,laughter,party,the rising layered noise of a hundred people laughing
Energy/Dynamics,surging,Organic,monkey troop,jungle,the rising chaotic screeching of a troop of monkeys
Energy/Dynamics,surging,Organic,heartbeat,medical room,the rising thumping of a heart through a monitor
Energy/Dynamics,surging,Organic,breathing,closet,the rising rhythmic sound of heavy panicked breathing
Energy/Dynamics,surging,Organic,bird colony,cliffs,the rising chaotic calls of thousands of seabirds
Energy/Dynamics,surging,Domestic,blender,kitchen,the rising grinding roar of a blender as it reaches max speed
Energy/Dynamics,surging,Domestic,vacuum,hallway,the rising steady roar of a powerful vacuum cleaner
Energy/Dynamics,surging,Domestic,hair dryer,bathroom,the rising high-pitched whir of a hair dryer
Energy/Dynamics,surging,Domestic,fireplace,cabin,the rising roaring and popping of a large wood fire
Energy/Dynamics,surging,Domestic,shower,bathroom,the rising wash of high-pressure water in a tiled stall
Energy/Dynamics,surging,Domestic,washing machine,laundry,the rising thrumming of a machine on the spin cycle
Energy/Dynamics,surging,Domestic,faucet,kitchen,the rising roar of water running at full pressure in a sink
Energy/Dynamics,surging,Domestic,kettle,kitchen,the rising screaming hiss of a boiling tea kettle
Energy/Dynamics,surging,Domestic,garbage truck,alley,the rising mechanical roar of a trash compactor
Energy/Dynamics,surging,Domestic,shredder,office,the rising grinding of a paper shredder at work
Energy/Dynamics,surging,Domestic,fan,bedroom,the rising steady whir of a large box fan at high speed
Energy/Dynamics,surging,Domestic,door slam,manor,the rising thud and echo of a heavy oak door closing
Energy/Dynamics,surging,Domestic,frying,kitchen,the rising constant sizzling of food in a deep fryer
Energy/Dynamics,surging,Domestic,iron,laundry,the rising hiss of a steam iron on a wet garment
Energy/Dynamics,surging,Domestic,radio,den,the rising white noise of a radio at max volume
Energy/Dynamics,surging,Domestic,lawnmower,yard,the rising steady drone of a lawnmower outside
Energy/Dynamics,surging,Domestic,dryer,utility room,the rising tumbling of heavy towels in a dryer
Energy/Dynamics,surging,Domestic,staircase,house,the rising rhythmic thudding of someone running up stairs
Energy/Dynamics,surging,Electronic,feedback,stage,the rising high-frequency scream of audio feedback
Energy/Dynamics,surging,Electronic,transformer,substation,the rising powerful buzzing of a large transformer
Energy/Dynamics,surging,Electronic,synth drone,studio,a rising multi-layered synthesizer at peak resonance
Energy/Dynamics,surging,Electronic,server room,center,the rising collective whir of many server racks
Energy/Dynamics,surging,Electronic,arc welder,shipyard,the rising crackling roar of an industrial arc welder
Energy/Dynamics,surging,Electronic,mri machine,hospital,the rising rhythmic thumping of an mri scanner
Energy/Dynamics,surging,Electronic,taser,security,the rising rapid arcing of a high-voltage taser
Energy/Dynamics,surging,Electronic,pa system,arena,the rising resonant hum of a large arena sound system
Energy/Dynamics,surging,Electronic,generator,site,the rising steady roar of a large diesel generator
Energy/Dynamics,surging,Electronic,plasma,lab,the rising high-pitched hiss of a plasma torch
Energy/Dynamics,surging,Electronic,radar,station,the rising mechanical and electronic hum of a radar array
Energy/Dynamics,surging,Electronic,bitcrusher,studio,the rising harmonic distortion of a digital bitcrusher
Energy/Dynamics,surging,Electronic,microwave,breakroom,the rising heavy buzz of a microwave oven in use
Energy/Dynamics,surging,Electronic,computer fan,closet,the rising high-speed whir of a server fan
Energy/Dynamics,surging,Electronic,vacuum tube,radio,the rising warm hum of a saturated vacuum tube
Energy/Dynamics,surging,Electronic,buzzer,factory,the rising steady sound of an industrial emergency buzzer
Energy/Dynamics,surging,Electronic,static,radio,the rising white noise of a radio at full volume
Energy/Dynamics,surging,Electronic,high-gain amp,stage,the rising harmonic roar of a guitar amp at max gain
Energy/Dynamics,pulsing,Musical,kick drum,basement club,a kick drum being struck for a steady rhythmic pulse
Energy/Dynamics,pulsing,Musical,timpani,orchestra pit,a timpani drum roll performed for a steady rhythmic throb
Energy/Dynamics,pulsing,Musical,didgeridoo,outback,the steady rhythmic vibrating pulse of a didgeridoo
Energy/Dynamics,pulsing,Musical,cello,cellar,a cello playing a steady rhythmic pulse on its lowest string
Energy/Dynamics,pulsing,Musical,double bass,jazz club,a double bass being plucked for a steady walking line
Energy/Dynamics,pulsing,Musical,metronome,music room,the steady rhythmic click of a mechanical metronome
Energy/Dynamics,pulsing,Musical,handbells,chapel,a steady rhythmic sequence of handbell ringing in a chapel
Energy/Dynamics,pulsing,Musical,shaker,recording room,a bead-filled shaker being shaken for a steady pulse
Energy/Dynamics,pulsing,Musical,banjo,barn,a banjo being played for a steady rhythmic bluegrass roll
Energy/Dynamics,pulsing,Musical,claves,music room,two wooden claves being struck for a steady pulse
Energy/Dynamics,pulsing,Musical,cowbell,club,a metal cowbell being struck for a steady rhythmic pulse
Energy/Dynamics,pulsing,Musical,harmonica,campsite,a steady rhythmic melody played on a harmonica
Energy/Dynamics,pulsing,Musical,tambourine,stage,a tambourine being shaken for a steady rhythmic pulse
Energy/Dynamics,pulsing,Musical,ukulele,beach,a ukulele being strummed for a steady tropical pulse
Energy/Dynamics,pulsing,Musical,accordion,piazza,an accordion playing a steady rhythmic polka in a square
Energy/Dynamics,pulsing,Musical,castanets,dance studio,wooden castanets being clicked for a steady pulse
Energy/Dynamics,pulsing,Musical,marimba,rehearsal,a marimba being played for a steady rhythmic pattern
Energy/Dynamics,pulsing,Musical,synthesizer,studio,a synthesizer playing a steady rhythmic electronic pulse
Energy/Dynamics,pulsing,Mechanical,clock,library,the steady rhythmic ticking of a large mechanical clock
Energy/Dynamics,pulsing,Mechanical,engine,auto shop,the steady rhythmic clicking of valves in an idling engine
Energy/Dynamics,pulsing,Mechanical,printing press,newspaper,the steady rhythmic thud and click of a printing press
Energy/Dynamics,pulsing,Mechanical,washing machine,laundry,the steady rhythmic thumping of a machine cycle
Energy/Dynamics,pulsing,Mechanical,sewing machine,factory,the steady rhythmic clicking of an industrial machine
Energy/Dynamics,pulsing,Mechanical,conveyor,warehouse,the steady rhythmic thumping of a conveyor belt splice
Energy/Dynamics,pulsing,Mechanical,oil pump,oil field,the steady rhythmic mechanical thud of a pumpjack
Energy/Dynamics,pulsing,Mechanical,telegraph,station,the steady rhythmic clicking of a telegraph key
Energy/Dynamics,pulsing,Mechanical,staple gun,upholstery shop,a staple gun firing for a steady rhythmic pulse
Energy/Dynamics,pulsing,Mechanical,watch,quiet study,the steady rhythmic ticking of a small desk clock
Energy/Dynamics,pulsing,Mechanical,loom,textile mill,the steady rhythmic mechanical clatter of an industrial loom
Energy/Dynamics,pulsing,Mechanical,pump,well,the steady rhythmic clanking of a manual water pump handle
Energy/Dynamics,pulsing,Mechanical,ratchet,auto shop,the steady rhythmic clicking of a socket wrench
Energy/Dynamics,pulsing,Mechanical,wind-up toy,playroom,the steady rhythmic clicking of a toy's internal gears
Energy/Dynamics,pulsing,Mechanical,projector,cinema,the steady rhythmic clicking of a film projector shutter
Energy/Dynamics,pulsing,Mechanical,stapler,office,the steady rhythmic clicking of a heavy-duty stapler
Energy/Dynamics,pulsing,Mechanical,elevator,shaft,the steady rhythmic thumping of an elevator moving
Energy/Dynamics,pulsing,Mechanical,fan,laptop,the steady rhythmic whir of a fan blade hitting a wire
Energy/Dynamics,pulsing,Environmental,cricket,meadow,the steady rhythmic chirping of a cricket in a field
Energy/Dynamics,pulsing,Environmental,rain,tin roof,the steady rhythmic tapping of raindrops on a metal roof
Energy/Dynamics,pulsing,Environmental,waterfall,basin,the steady rhythmic thud of water hitting a rocky pool
Energy/Dynamics,pulsing,Environmental,hail,car roof,the steady rhythmic drumming of hail on a metal surface
Energy/Dynamics,pulsing,Environmental,geyser,field,the steady rhythmic bubbling and popping of a mud vent
Energy/Dynamics,pulsing,Environmental,stalactite,cave,the steady rhythmic dripping of water into a pool
Energy/Dynamics,pulsing,Environmental,pebbles,shore,the steady rhythmic clinking of pebbles in the surf
Energy/Dynamics,pulsing,Environmental,reeds,marsh,the steady rhythmic clattering of dry reeds in the wind
Energy/Dynamics,pulsing,Environmental,ice,lake,the steady rhythmic cracking of ice on a frozen lake
Energy/Dynamics,pulsing,Environmental,sand,desert,the steady rhythmic tapping of sand against a metal pipe
Energy/Dynamics,pulsing,Environmental,branch,window,the steady rhythmic tapping of a branch against a glass pane
Energy/Dynamics,pulsing,Environmental,sleet,glass,the steady rhythmic tapping of sleet on a greenhouse
Energy/Dynamics,pulsing,Environmental,cicada,orchard,the steady rhythmic buzzing call of a cicada in a tree
Energy/Dynamics,pulsing,Environmental,thunder,valley,the steady rhythmic rolling of thunder echoing in a gorge
Energy/Dynamics,pulsing,Environmental,obsidian,slope,the steady rhythmic clinking of obsidian shards on a hill
Energy/Dynamics,pulsing,Environmental,leaves,courtyard,the steady rhythmic skittering of dry leaves in the wind
Energy/Dynamics,pulsing,Environmental,wind chimes,porch,the steady rhythmic clinking of metal wind chimes
Energy/Dynamics,pulsing,Environmental,thaw,mountain,the steady rhythmic sound of melting snow dripping
Energy/Dynamics,pulsing,Organic,heartbeat,room,the steady rhythmic thumping of a person's heartbeat
Energy/Dynamics,pulsing,Organic,teeth,cold room,the steady rhythmic chattering of a person's teeth
Energy/Dynamics,pulsing,Organic,breathing,bedroom,the steady rhythmic heavy breathing of a person sleeping
Energy/Dynamics,pulsing,Organic,alligator,swamp,the steady rhythmic vibration of an alligator's bellows
Energy/Dynamics,pulsing,Organic,frog pond,marsh,the steady rhythmic collective croaking of frogs at night
Energy/Dynamics,pulsing,Organic,grasshopper,field,the steady rhythmic stridulation of a grasshopper
Energy/Dynamics,pulsing,Organic,bat,cave,the steady rhythmic echolocation clicks of a bat in a cavern
Energy/Dynamics,pulsing,Organic,fist,bag,the steady rhythmic thumping of a boxer hitting a speed bag
Energy/Dynamics,pulsing,Organic,tail,floor,the steady rhythmic thumping of a dog's tail on a floor
Energy/Dynamics,pulsing,Organic,hooves,road,the steady rhythmic thud of a horse's hooves on a paved road
Energy/Dynamics,pulsing,Organic,beak,farm,the steady rhythmic tapping of a chicken's beak on a feeder
Energy/Dynamics,pulsing,Organic,claws,tile,the steady rhythmic clicking of a dog's claws on a floor
Energy/Dynamics,pulsing,Organic,bees,hive,the steady rhythmic hum of a large honeybee colony
Energy/Dynamics,pulsing,Organic,finger tapping,desk,the steady rhythmic tapping of fingers on a wooden table
Energy/Dynamics,pulsing,Organic,wasp,window,the steady rhythmic buzzing of a wasp against a glass pane
Energy/Dynamics,pulsing,Organic,chick,coop,the steady rhythmic high-pitched peeping of baby chicks
Energy/Dynamics,pulsing,Organic,tongue,mouth,the steady rhythmic clicking of the tongue against the roof
Energy/Dynamics,pulsing,Organic,scales,rock,the steady rhythmic dry rustle of a snake moving over stones
Energy/Dynamics,pulsing,Domestic,knocks,door,the steady rhythmic knocking of a hand on a wooden door
Energy/Dynamics,pulsing,Domestic,keyboard,office,the steady rhythmic clicking of a person typing on a keyboard
Energy/Dynamics,pulsing,Domestic,chopping,kitchen,the steady rhythmic sound of a knife chopping vegetables
Energy/Dynamics,pulsing,Domestic,silverware,dining room,the steady rhythmic clinking of silverware on plates
Energy/Dynamics,pulsing,Domestic,drawer,bedroom,the steady rhythmic rattling of items in a drawer
Energy/Dynamics,pulsing,Domestic,ball,court,the steady rhythmic bouncing of a basketball on concrete
Energy/Dynamics,pulsing,Domestic,hammer,workshop,the steady rhythmic striking of a hammer on a nail
Energy/Dynamics,pulsing,Domestic,scissors,sewing room,the steady rhythmic snipping of scissors through fabric
Energy/Dynamics,pulsing,Domestic,curtain,bedroom,the steady rhythmic clinking of curtain rings on a rod
Energy/Dynamics,pulsing,Domestic,washing machine,laundry,the steady rhythmic thumping of a washing machine cycle
Energy/Dynamics,pulsing,Domestic,shredder,office,the steady rhythmic grinding of a paper shredder
Energy/Dynamics,pulsing,Domestic,egg timer,kitchen,the steady rhythmic ticking of a mechanical egg timer
Energy/Dynamics,pulsing,Domestic,keys,entryway,the steady rhythmic jingle of keys on a ring being shaken
Energy/Dynamics,pulsing,Domestic,measuring spoons,kitchen,the steady rhythmic clinking of metal measuring spoons
Energy/Dynamics,pulsing,Domestic,flipping pages,library,the steady rhythmic sound of someone flipping through a book
Energy/Dynamics,pulsing,Domestic,rocking chair,porch,the steady rhythmic creaking of a rocking chair
Energy/Dynamics,pulsing,Domestic,dice,game room,the steady rhythmic sound of several dice being rolled
Energy/Dynamics,pulsing,Electronic,sequencer,studio,the steady rhythmic electronic pulses of a hardware sequencer
Energy/Dynamics,pulsing,Electronic,geiger counter,site,the steady rhythmic rapid clicking of a geiger counter
Energy/Dynamics,pulsing,Electronic,metronome,digital,the steady rhythmic beep of a digital metronome
Energy/Dynamics,pulsing,Electronic,alarm,bedroom,the steady rhythmic beeping of a digital alarm clock
Energy/Dynamics,pulsing,Electronic,scanner,store,the steady rhythmic beeping of a scanner at a checkout
Energy/Dynamics,pulsing,Electronic,relay,server room,the steady rhythmic clicking of a power relay cycling
Energy/Dynamics,pulsing,Electronic,heart monitor,hospital,the steady rhythmic beeping of a digital heart monitor
Energy/Dynamics,pulsing,Electronic,printer,office,the steady rhythmic mechanical clicking of a dot-matrix printer
Energy/Dynamics,pulsing,Electronic,taser,security,the steady rhythmic arcing of a handheld taser being tested
Energy/Dynamics,pulsing,Electronic,camera,studio,the steady rhythmic clicking of a camera in burst mode
Energy/Dynamics,pulsing,Electronic,walkie-talkie,site,the steady rhythmic static bursts of a walkie-talkie
Energy/Dynamics,pulsing,Electronic,synthesizer,studio,a steady rhythmic sequence of short electronic notes
Energy/Dynamics,pulsing,Electronic,modem,office,the steady rhythmic electronic chirping of a dial-up modem
Energy/Dynamics,pulsing,Electronic,plasma globe,museum,the steady rhythmic crackling of a plasma globe
Energy/Dynamics,pulsing,Electronic,led,workshop,the steady rhythmic flickering buzz of a faulty led fixture
Energy/Dynamics,pulsing,Electronic,phone,office,the steady rhythmic ringing of several different desk phones
Energy/Dynamics,pulsing,Electronic,buzzer,factory,the steady rhythmic buzzing of an industrial alarm
Energy/Dynamics,pulsing,Electronic,glitch,computer,a steady rhythmic series of digital pops and clicks
