category,tag,domain,source,environment,scenario
Energy/Dynamics,energetic,Mechanical,wind-up toy,playroom,the lively clicking of a mechanical toy moving across a floor
Energy/Dynamics,energetic,Mechanical,mill,riverside,the lively splashing and clanking of a water-powered mill
Energy/Dynamics,energetic,Mechanical,projector,cinema,the lively rhythmic clicking of a film projector shutter
Energy/Dynamics,energetic,Mechanical,stapler,office,the lively clicking of a heavy-duty stapler being used
Energy/Dynamics,energetic,Environmental,cicadas,orchard,the lively collective buzzing of cicadas in a summer grove
Energy/Dynamics,energetic,Environmental,rain,tin roof,the lively rhythmic tapping of raindrops on a corrugated roof
Energy/Dynamics,energetic,Environmental,waterfall,rocks,the lively splashing of a mountain stream over jagged rocks
Energy/Dynamics,energetic,Environmental,crickets,meadow,the lively rhythmic chirping of crickets in a summer field
Energy/Dynamics,energetic,Environmental,hail,car roof,the lively drumming of small hail on a metal surface
Energy/Dynamics,energetic,Environmental,geyser,field,the lively bubbling and popping of a mud vent in a field
Energy/Dynamics,energetic,Environmental,leaves,courtyard,the lively skittering of dry leaves in a gusty wind
Energy/Dynamics,energetic,Environmental,reeds,marsh,the lively clattering of dry reeds in a brisk breeze
Energy/Dynamics,energetic,Environmental,pebbles,shore,the lively clinking of pebbles in the receding surf
Energy/Dynamics,energetic,Environmental,wind chimes,porch,the lively overlapping clinking of metal wind chimes
Energy/Dynamics,energetic,Environmental,stalactite,cave,the lively rhythmic dripping of water into a pool
Energy/Dynamics,energetic,Environmental,ice,river,the lively tinkling of ice shards floating in a stream
Energy/Dynamics,energetic,Environmental,sand,desert,the lively tapping of sand grains against a metal pipe
Energy/Dynamics,energetic,Environmental,twig,woods,the lively snapping of branches in a windstorm
Energy/Dynamics,energetic,Environmental,thaw,mountain,the lively sound of melting snow dripping on rocks
Energy/Dynamics,energetic,Environmental,insect swarm,meadow,the lively high-pitched hum of many insects
Energy/Dynamics,energetic,Environmental,bamboo,grove,the lively knocking of many bamboo stalks together
Energy/Dynamics,energetic,Environmental,geyser,vent,the lively hissing of several small steam vents in a field
Energy/Dynamics,energetic,Organic,birdsong,jungle,the lively overlapping calls of various tropical birds
Energy/Dynamics,energetic,Organic,chicken coop,farm,the lively clucking and scratching of many chickens
Energy/Dynamics,energetic,Organic,puppies,kennel,the lively yapping and scratching of several puppies
Energy/Dynamics,energetic,Organic,market,square,the lively sounds of many people talking and moving in a market
Energy/Dynamics,energetic,Organic,monkey troop,canopy,the lively screeching and rustling of monkeys in the trees
Energy/Dynamics,energetic,Organic,horse,meadow,the lively thud of a horse galloping across an open field
Energy/Dynamics,energetic,Organic,laughter,party,the lively sound of a group of people laughing together
Energy/Dynamics,energetic,Organic,bats,cavern,the lively clicking and fluttering of a large bat colony
Energy/Dynamics,energetic,Organic,frog pond,marsh,the lively collective croaking of frogs at night
Energy/Dynamics,energetic,Organic,hands,hall,the lively sound of many people clapping in a rhythm
Energy/Dynamics,energetic,Organic,teeth,room,the lively clicking of a person's teeth in the cold
Energy/Dynamics,energetic,Organic,claws,tile,the lively clicking of a dog's claws on a hardwood floor
Energy/Dynamics,energetic,Organic,bees,hive,the lively constant hum of a large honeybee colony
Energy/Dynamics,energetic,Organic,heartbeat,room,the lively rhythmic thumping of a person's heartbeat
Energy/Dynamics,energetic,Organic,finger tapping,desk,the lively rhythmic tapping of fingers on a wooden table
Energy/Dynamics,energetic,Organic,beak,farm,the lively tapping of a chicken's beak on a metal feeder
Energy/Dynamics,energetic,Organic,wasp,window,the lively buzzing of a wasp against a glass pane
Energy/Dynamics,energetic,Organic,chick,coop,the lively high-pitched peeping of baby chicks in a nest
Energy/Dynamics,energetic,Domestic,toy box,playroom,the lively sound of plastic toys being moved in a box
Energy/Dynamics,energetic,Domestic,chopping,kitchen,the lively rhythmic sound of a knife chopping vegetables
Energy/Dynamics,energetic,Domestic,ball,court,the lively rhythmic bouncing of a basketball on concrete
Energy/Dynamics,energetic,Domestic,knocks,door,the lively rhythmic knocking of a hand on a wooden door
Energy/Dynamics,energetic,Domestic,silverware,dining room,the lively clinking of silverware on china plates
Energy/Dynamics,energetic,Domestic,drawer,bedroom,the lively rattling of items in a drawer being opened
Energy/Dynamics,energetic,Domestic,keys,entryway,the lively jingle of a large ring of keys being shaken
Energy/Dynamics,energetic,Domestic,scissors,sewing room,the lively snipping of scissors through fabric
Energy/Dynamics,energetic,Domestic,curtain,bedroom,the lively clinking of curtain rings on a metal rod
Energy/Dynamics,energetic,Domestic,washing machine,laundry,the lively thumping of a washing machine cycle
Energy/Dynamics,energetic,Domestic,egg timer,kitchen,the lively rhythmic ticking of a mechanical egg timer
Energy/Dynamics,energetic,Domestic,flipping pages,library,the lively sound of someone flipping through a book
Energy/Dynamics,energetic,Domestic,rocking chair,porch,the lively rhythmic creaking of a rocking chair
Energy/Dynamics,energetic,Domestic,dice,game room,the lively sound of several dice being rolled on a table
Energy/Dynamics,energetic,Domestic,dishes,sink,the lively clinking of many dishes being washed
Energy/Dynamics,energetic,Domestic,shredder,office,the lively grinding of a paper shredder in operation
Energy/Dynamics,energetic,Domestic,fan,bedroom,the lively rhythmic whir of a fan blade hitting a wire
Energy/Dynamics,energetic,Domestic,laundry,room,the lively rustle of a large pile of fresh clothes
Energy/Dynamics,energetic,Electronic,sequencer,studio,the lively electronic pulses of a hardware sequencer
Energy/Dynamics,energetic,Electronic,arcade,game center,the lively electronic sounds of several different games
Energy/Dynamics,energetic,Electronic,geiger counter,site,the lively rapid clicking of a geiger counter
Energy/Dynamics,energetic,Electronic,metronome,digital,the lively steady rhythmic beep of a digital metronome
Energy/Dynamics,energetic,Electronic,alarm,bedroom,the lively rhythmic beeping of a digital alarm clock
Energy/Dynamics,energetic,Electronic,scanner,store,the lively beeping of several registers at a checkout
Energy/Dynamics,energetic,Electronic,relay,server room,the lively clicking of a power relay cycling
Energy/Dynamics,energetic,Electronic,heart monitor,hospital,the lively rhythmic beeping of a digital heart monitor
Energy/Dynamics,energetic,Electronic,printer,office,the lively mechanical clicking of a dot-matrix printer
Energy/Dynamics,energetic,Electronic,taser,security,the lively rapid arcing of a handheld taser being tested
Energy/Dynamics,energetic,Electronic,camera,studio,the lively rhythmic clicking of a camera in burst mode
Energy/Dynamics,energetic,Electronic,walkie-talkie,site,the lively static bursts of a walkie-talkie communication
Energy/Dynamics,energetic,Electronic,modem,office,the lively electronic chirping of a dial-up modem
Energy/Dynamics,energetic,Electronic,plasma globe,museum,the lively rhythmic crackling of a plasma globe
Energy/Dynamics,energetic,Electronic,led,workshop,the lively flickering buzz of a faulty led fixture
Energy/Dynamics,energetic,Electronic,phone,office,the lively ringing of several different desk phones
Energy/Dynamics,energetic,Electronic,buzzer,factory,the lively rhythmic buzzing of an industrial alarm
Energy/Dynamics,energetic,Electronic,glitch,computer,a lively series of rapid digital pops and clicks
Energy/Dynamics,compressed,Musical,trumpet,jazz club,a trumpet playing with a tight plunger mute in a club
Energy/Dynamics,compressed,Musical,electric guitar,studio,an electric guitar string being squeezed behind a nut
Energy/Dynamics,compressed,Musical,bass drum,garage,a kick drum stuffed with heavy blankets and struck
Energy/Dynamics,compressed,Musical,snare drum,booth,a snare drum with a thick internal dampener being struck
Energy/Dynamics,compressed,Musical,bagpipes,closet,the tight wheezing of bagpipes being squeezed in a closet
Energy/Dynamics,compressed,Musical,clarinet,room,a clarinet reed being pressed tightly against a mouthpiece
Energy/Dynamics,compressed,Musical,synthesizer,studio,a synthesizer patch with a tight high-resonance filter
Energy/Dynamics,compressed,Musical,harmonium,chapel,the restricted wheeze of a harmonium with low bellows pressure
Energy/Dynamics,compressed,Musical,violin,chamber,a violin playing a tight choked note near the bridge
Energy/Dynamics,compressed,Musical,accordion,piazza,the tight breath of an accordion being squeezed shut
Energy/Dynamics,compressed,Musical,jaw harp,porch,the tight metallic twang of a jaw harp in the mouth
Energy/Dynamics,compressed,Musical,tambourine,stage,a tambourine being gripped tightly to choke the jingles
Energy/Dynamics,compressed,Musical,cello,cellar,a cello string being pressed against the neck while bowed
Energy/Dynamics,compressed,Musical,penny whistle,study,a penny whistle being blown with restricted airflow
Energy/Dynamics,compressed,Musical,kazoo,basement,the tight buzzing of a kazoo with a finger over the hole
Energy/Dynamics,compressed,Musical,djembe,beach,the tight high-pitched ring of a djembe edge slap
Energy/Dynamics,compressed,Musical,harp,hall,a harp string being pinched and plucked in a stone hall
Energy/Dynamics,compressed,Musical,marimba,studio,a marimba bar being struck while damped by the hand
Energy/Dynamics,compressed,Mechanical,steam valve,factory,the tight hiss of steam escaping a narrow valve
Energy/Dynamics,compressed,Mechanical,pneumatic piston,shop,the tight wheeze of a pneumatic piston moving
Energy/Dynamics,compressed,Mechanical,spray can,alley,the tight hiss of paint from a nozzle on a metal can
Energy/Dynamics,compressed,Mechanical,hydraulic cylinder,plant,the tight groan of a hydraulic cylinder under load
Energy/Dynamics,compressed,Mechanical,air hose,garage,the tight high-pitched hiss of air from a small leak
Energy/Dynamics,compressed,Mechanical,gears,clock tower,the tight clicking of gears under heavy spring tension
Energy/Dynamics,compressed,Mechanical,vacuum pump,lab,the tight rhythmic thrum of a vacuum pump in a lab
Energy/Dynamics,compressed,Mechanical,pulleys,warehouse,the tight squeal of a wire cable on a small pulley
Energy/Dynamics,compressed,Mechanical,drill,woodshop,the tight laboring whir of a drill in a thick oak beam
Energy/Dynamics,compressed,Mechanical,shutter,house,the tight rattling of a window shutter in a high wind
Energy/Dynamics,compressed,Mechanical,bellows,forge,the tight huff of leather bellows being squeezed
Energy/Dynamics,compressed,Mechanical,ratchet strap,truck,the tight clicking of a strap being winched taut
Energy/Dynamics,compressed,Mechanical,sewing machine,factory,the tight rapid clicking of a needle in thick fabric
Energy/Dynamics,compressed,Mechanical,stapler,office,the tight metallic snap of a stapler on a thick stack
Energy/Dynamics,compressed,Mechanical,watch,study,the tight fine metallic ticking of a pocket watch
Energy/Dynamics,compressed,Mechanical,elevator,shaft,the tight mechanical hum of a winch in a narrow shaft
Energy/Dynamics,compressed,Mechanical,fan,laptop,the tight high-pitched whir of a fan through a dust filter
Energy/Dynamics,compressed,Mechanical,typewriter,attic,the tight mechanical click of a key striking the platen
Energy/Dynamics,compressed,Environmental,geyser,vent,the tight high-pitched hiss of steam from a narrow vent
Energy/Dynamics,compressed,Environmental,wind,keyhole,the tight whistling of wind through a narrow keyhole
Energy/Dynamics,compressed,Environmental,rain,tent,the tight drumming of rain on a taut canvas tent surface
Energy/Dynamics,compressed,Environmental,ice,lake,the tight high-pitched crack of ice under extreme tension
Energy/Dynamics,compressed,Environmental,sand,desert,the tight hiss of sand grains being blown through a gap
Energy/Dynamics,compressed,Environmental,water,sink,the tight hiss of water through a partially blocked faucet
Energy/Dynamics,compressed,Environmental,mist,forest,the tight high-pitched hiss of mist through pine needles
Energy/Dynamics,compressed,Environmental,stalactite,cave,the tight drip of water into a narrow rocky crevice
Energy/Dynamics,compressed,Environmental,snow,mountain,the tight squeak of frozen snow under a heavy boot
Energy/Dynamics,compressed,Environmental,reeds,marsh,the tight clattering of dry reeds in a narrow thicket
Energy/Dynamics,compressed,Environmental,thaw,river,the tight tinkling of ice crystals in a narrow stream
Energy/Dynamics,compressed,Environmental,geyser,field,the tight subterranean thumping before a steam release
Energy/Dynamics,compressed,Environmental,bubble,mudpot,the tight pop of a small bubble in thick geothermal mud
Energy/Dynamics,compressed,Environmental,twigs,woods,the tight snap of a dry branch under a heavy weight
Energy/Dynamics,compressed,Environmental,cavern wind,cave,the tight moaning of wind through a narrow passage
Energy/Dynamics,compressed,Environmental,leaves,garden,the tight rustle of dry leaves in a narrow courtyard
Energy/Dynamics,compressed,Environmental,hail,car roof,the tight drumming of sleet on a metal car roof
Energy/Dynamics,compressed,Environmental,rock,quarry,the tight grinding of two heavy stones under pressure
Energy/Dynamics,compressed,Organic,breathing,closet,the tight wheezing breath of a person in a small space
Energy/Dynamics,compressed,Organic,teeth,cold room,the tight rapid clicking of teeth chattering in the cold
Energy/Dynamics,compressed,Organic,heartbeat,room,the tight muffled thumping of a heart through a thick wall
Energy/Dynamics,compressed,Organic,snake,rock,the tight dry hiss of a snake moving through a crevice
Energy/Dynamics,compressed,Organic,wasp,window,the tight high-pitched buzz of a wasp against a glass pane
Energy/Dynamics,compressed,Organic,bat,cave,the tight high-pitched clicking of a bat in a narrow cavern
Energy/Dynamics,compressed,Organic,beetle,attic,the tight scuttling of a beetle on a wooden floorboard
Energy/Dynamics,compressed,Organic,shrimp,reef,the tight high-pitched snap of a pistol shrimp underwater
Energy/Dynamics,compressed,Organic,bird,cage,the tight chirping of a small bird in a wire cage
Energy/Dynamics,compressed,Organic,claws,tile,the tight clicking of a cat's claws on a hard floor
Energy/Dynamics,compressed,Organic,eggshell,bowl,the tight snap of an eggshell against a porcelain rim
Energy/Dynamics,compressed,Organic,hair,brush,the tight static crackle of hair being pulled in a brush
Energy/Dynamics,compressed,Organic,wasp,attic,the tight buzzing of a wasp in a small enclosed space
Energy/Dynamics,compressed,Organic,chick,coop,the tight high-pitched peeping of a baby chick in a nest
Energy/Dynamics,compressed,Organic,seed pod,hand,a dry seed pod being crushed in a closed palm
Energy/Dynamics,compressed,Organic,shout,tunnel,a human shout echoing in a narrow stone tunnel
Energy/Dynamics,compressed,Organic,fist,bag,the tight thud of a punch hitting a small speed bag
Energy/Dynamics,compressed,Organic,tongue,mouth,a tight clicking of the tongue against the roof of the mouth
Energy/Dynamics,compressed,Domestic,aluminum foil,kitchen,the tight crinkling of a small piece of aluminum foil
Energy/Dynamics,compressed,Domestic,keys,pocket,the tight jingle of several keys in a denim pocket
Energy/Dynamics,compressed,Domestic,zipper,closet,the tight zipping sound of a small nylon zipper
Energy/Dynamics,compressed,Domestic,scissors,sewing room,the tight snip of small scissors through thick fabric
Energy/Dynamics,compressed,Domestic,thimble,sewing basket,a tight tap of a thimble against a needle
Energy/Dynamics,compressed,Domestic,measuring spoon,kitchen,a tight clink of a metal spoon in a bowl
Energy/Dynamics,compressed,Domestic,safety pin,dressing room,the tight click of a safety pin being closed
Energy/Dynamics,compressed,Domestic,spectacles,study,the tight click of a spectacle case being closed
Energy/Dynamics,compressed,Domestic,lightbulb,garage,the tight rattle of a filament in a small lamp
Energy/Dynamics,compressed,Domestic,envelope,office,the tight sound of paper being torn from a letter
Energy/Dynamics,compressed,Domestic,thread,sewing room,the tight snap of a single thread being broken
Energy/Dynamics,compressed,Domestic,beads,bedroom,the tight clink of two glass beads on a string
Energy/Dynamics,compressed,Domestic,can opener,kitchen,the tight pierce of a manual opener on a tin lid
Energy/Dynamics,compressed,Domestic,clock,bedroom,the tight rhythmic tick of a small travel clock
Energy/Dynamics,compressed,Domestic,pills,bottle,the tight rattling of pills in a small plastic bottle
Energy/Dynamics,compressed,Domestic,razor,bathroom,a safety razor being tapped against a sink
Energy/Dynamics,compressed,Domestic,match,campsite,the tight strike of a match against a small box
Energy/Dynamics,compressed,Domestic,pin,floor,the tight tinkle of a sewing pin dropping on a floor
Energy/Dynamics,compressed,Electronic,earbuds,library,the tight tinny sound of music leaking from earbuds
Energy/Dynamics,compressed,Electronic,buzzer,toy,the tight high-pitched buzz of a small electronic toy
Energy/Dynamics,compressed,Electronic,glitch,computer,a tight high-frequency digital pop from a speaker
Energy/Dynamics,compressed,Electronic,static,radio,the tight high-pitched white noise from a small radio
Energy/Dynamics,compressed,Electronic,beep,hospital,the tight high-pitched beep of a digital heart monitor
Energy/Dynamics,compressed,Electronic,watch alarm,bedroom,the tight high-pitched beep of a digital watch
Energy/Dynamics,compressed,Electronic,camera flash,studio,the tight high-pitched whine of a charging flash
Energy/Dynamics,compressed,Electronic,scanner,store,the tight high-pitched beep of a barcode scanner
Energy/Dynamics,compressed,Electronic,taser,security,the tight high-pitched arcing of a handheld taser
Energy/Dynamics,compressed,Electronic,piezo,alarm,the tight high-pitched chirp of a small piezo alarm
Energy/Dynamics,compressed,Electronic,led driver,workshop,the tight high-pitched buzz of a faulty led light
Energy/Dynamics,compressed,Electronic,microchip,lab,the tight high-frequency whine of a microchip
Energy/Dynamics,compressed,Electronic,modem,office,the tight high-pitched screeching of a dial-up modem
Energy/Dynamics,compressed,Electronic,capacitor,bench,the tight snap of a small capacitor discharging
Energy/Dynamics,compressed,Electronic,neon sign,diner,the tight high-pitched flicker of a small neon sign
Energy/Dynamics,compressed,Electronic,walkie-talkie,site,the tight static burst from a handheld radio
Energy/Dynamics,compressed,Electronic,smartwatch,bedroom,the tight high-pitched chirp of a notification
Energy/Dynamics,compressed,Electronic,fan,laptop,the tight high-speed whir of a small computer fan
Energy/Dynamics,surging,Musical,orchestra,concert hall,a full orchestra performing a gradual volume swell
Energy/Dynamics,surging,Musical,pipe organ,cathedral,the rising sound of multiple organ stops being added
Energy/Dynamics,surging,Musical,choir,abbey,a choir performing a powerful crescendo in a stone abbey
Energy/Dynamics,surging,Musical,gong,monastery,a gong being struck for a rising shimmering wash of sound
Energy/Dynamics,surging,Musical,cello,cellar,a cello playing a long rising note with increasing pressure
Energy/Dynamics,surging,Musical,trumpet,courtyard,a trumpet playing a loud rising fanfare in a courtyard
Energy/Dynamics,surging,Musical,synthesizer,studio,a synthesizer playing a rising filtered lead patch
Energy/Dynamics,surging,Musical,harmonium,chapel,the rising breath of a harmonium with increasing bellows
Energy/Dynamics,surging,Musical,handpan,tunnel,the rising overlapping resonance of a handpan in a tunnel
Energy/Dynamics,surging,Musical,bagpipes,field,the rising drone of bagpipes as they are being inflated
Energy/Dynamics,surging,Musical,timpani,stage,a timpani drum roll performing a loud crescendo on stage
Energy/Dynamics,surging,Musical,violin,chamber,a violin playing a rising trill with increasing speed
Energy/Dynamics,surging,Musical,drum kit,garage,a drum roll on a snare drum increasing in volume
Energy/Dynamics,surging,Musical,kazoo,parade,the rising collective buzzing of multiple kazoos
Energy/Dynamics,surging,Musical,tambourine,stage,a tambourine being shaken with increasing intensity
Energy/Dynamics,surging,Musical,harp,hall,a harp glissando increasing in speed and volume
Energy/Dynamics,surging,Musical,didgeridoo,cave,the rising vibrating drone of a didgeridoo in a cavern
Energy/Dynamics,surging,Musical,piano,ballroom,a grand piano playing a series of chords with increasing force
Energy/Dynamics,surging,Mechanical,jet engine,runway,the rising roar of a jet engine as it reaches full throttle
Energy/Dynamics,surging,Mechanical,turbine,power plant,the rising high-pitched whine of a turbine spinning up
Energy/Dynamics,surging,Mechanical,locomotive,railway,the rising thrum of a diesel locomotive as it accelerates
Energy/Dynamics,surging,Mechanical,industrial fan,warehouse,the rising whir of a giant fan as it starts up
Energy/Dynamics,surging,Mechanical,generator,camp,the rising roar of a diesel generator as it takes a load
Energy/Dynamics,surging,Mechanical,air compressor,garage,the rising throb of a compressor filling a tank
Energy/Dynamics,surging,Mechanical,elevator,shaft,the rising hum of a winch as an elevator accelerates
Energy/Dynamics,surging,Mechanical,vacuum,warehouse,the rising steady roar of an industrial vacuum cleaner
Energy/Dynamics,surging,Mechanical,drill,woodshop,the rising whir of a hand drill reaching max speed
Energy/Dynamics,surging,Mechanical,sawmill,forest,the rising whine of a circular saw hitting a thick beam
Energy/Dynamics,surging,Mechanical,pump,station,the rising rhythmic thrum of a water pump starting
Energy/Dynamics,surging,Mechanical,boiler,basement,the rising roar of a gas burner as it ignites and builds
Energy/Dynamics,surging,Mechanical,crane,shipyard,the rising groan of a crane lifting a heavy container
Energy/Dynamics,surging,Mechanical,hydraulic lift,garage,the rising groan of a lift raising a heavy truck
Energy/Dynamics,surging,Mechanical,centrifuge,lab,the rising high-pitched whine of a centrifuge at max speed
Energy/Dynamics,surging,Mechanical,spinning wheel,attic,the rising steady whir of a wooden spinning wheel
Energy/Dynamics,surging,Mechanical,loom,textile mill,the rising clatter of an industrial loom starting up
Energy/Dynamics,surging,Mechanical,engine,auto shop,the rising roar of a car engine being revved in a garage
Energy/Dynamics,surging,Environmental,ocean wave,beach,the rising roar of a massive wave as it approaches a shore
Energy/Dynamics,surging,Environmental,thunder,canyon,the rising roll of thunder echoing in a mountain valley
Energy/Dynamics,surging,Environmental,waterfall,basin,the rising roar of water after a heavy rain upstream
Energy/Dynamics,surging,Environmental,hurricane,coast,the rising roar of wind as a storm hits the coastline
Energy/Dynamics,surging,Environmental,fire,forest,the rising roaring and crackling of a forest fire in the wind
Energy/Dynamics,surging,Environmental,geyser,field,the rising explosive hiss of a geyser before eruption
Energy/Dynamics,surging,Environmental,landslide,mountain,the rising roar of falling rock on a mountain slope
Energy/Dynamics,surging,Environmental,avalanche,slope,the rising muffled roar of a snow avalanche on a hill
Energy/Dynamics,surging,Environmental,wind,glacier,the rising whistling roar of wind through an ice field
Energy/Dynamics,surging,Environmental,river,rapids,the rising constant rushing of class-five river rapids
Energy/Dynamics,surging,Environmental,mudslide,valley,the rising wet roar of a massive mudflow in a gorge
Energy/Dynamics,surging,Environmental,surf,sea wall,the rising thrum of waves hitting a concrete sea wall
Energy/Dynamics,surging,Environmental,storm surge,coast,the rising low-frequency wash of a storm surge
Energy/Dynamics,surging,Environmental,volcano,crater,the rising guttural roar of a volcanic gas release
Energy/Dynamics,surging,Environmental,hail,tin shed,the rising drumming of hail on a corrugated metal roof
Energy/Dynamics,surging,Environmental,rain,forest,the rising sound of heavy rain as a storm approaches
Energy/Dynamics,surging,Environmental,sandstorm,desert,the rising roar of a sandstorm moving across a field
Energy/Dynamics,surging,Environmental,mudpot,field,the rising bubbling and popping of a mud vent
Energy/Dynamics,surging,Organic,stadium crowd,arena,the rising roar of a crowd after a goal in a stadium
Energy/Dynamics,surging,Organic,honeybees,hive,the rising vibrating hum of a disturbed honeybee colony
Energy/Dynamics,surging,Organic,wolf pack,ridge,the rising layered howling of a large pack of wolves
Energy/Dynamics,surging,Organic,cicada chorus,orchard,the rising collective hum of cicadas in the trees
Energy/Dynamics,surging,Organic,whale song,ocean,the rising harmonic textures of multiple whales singing
Energy/Dynamics,surging,Organic,lion roar,savanna,the rising chest-vibrating roar of a lion in a park
Energy/Dynamics,surging,Organic,elephant trumpet,jungle,the rising resonant trumpet of an elephant
Energy/Dynamics,surging,Organic,insect swarm,swamp,the rising high-pitched cloud of sound from a gnat swarm
