category,tag,domain,source,environment,scenario
Energy/Dynamics,powerful,Musical,pipe organ,cathedral,a pipe organ playing a full fortissimo chord in a stone cathedral
Energy/Dynamics,powerful,Musical,taiko drum,open field,a massive taiko drum being struck with heavy wooden bachi in a field
Energy/Dynamics,powerful,Musical,grand piano,ballroom,the lowest keys of a grand piano being struck with great force in a ballroom
Energy/Dynamics,powerful,Musical,gong,monastery,a large bronze gong being struck with a heavy padded mallet in a monastery
Energy/Dynamics,powerful,Musical,tuba,empty theater,a tuba sustaining a loud low-register note in an empty theater
Energy/Dynamics,powerful,Musical,brass section,concert hall,a full brass section playing a triumphant fanfare in a concert hall
Energy/Dynamics,powerful,Musical,kettledrum,orchestra pit,a large kettledrum being struck for a single accented note in an orchestra pit
Energy/Dynamics,powerful,Musical,double bass,jazz cellar,a double bass string being plucked forcefully in a basement jazz club
Energy/Dynamics,powerful,Musical,bagpipes,highland ridge,bagpipes playing a loud melody on a windy highland ridge
Energy/Dynamics,powerful,Musical,conch shell,coastal cliff,a conch shell being blown with maximum effort on a coastal cliff
Energy/Dynamics,powerful,Musical,choir,abbey,a hundred-voice choir singing a sustained chord in a stone abbey
Energy/Dynamics,powerful,Musical,handbells,chapel,a large handbell being swung vigorously in a stone chapel
Energy/Dynamics,powerful,Musical,cello,underground cellar,a cello playing a heavy resonant melody on its lowest string
Energy/Dynamics,powerful,Musical,harp,music room,a rapid lush glissando across all harp strings in a music room
Energy/Dynamics,powerful,Musical,12-string guitar,studio,a 12-string guitar being strummed with a heavy plectrum in a studio
Energy/Dynamics,powerful,Musical,synthesizer,recording room,a multi-oscillator analog synthesizer playing a loud bass note
Energy/Dynamics,powerful,Musical,bassoon,rehearsal hall,a bassoon playing a loud staccato note in a rehearsal hall
Energy/Dynamics,powerful,Musical,timpani,stage,a timpani drum roll reaching a loud climax on a concert stage
Energy/Dynamics,powerful,Mechanical,jet engine,runway,the roaring air of a jet engine at full throttle on a runway
Energy/Dynamics,powerful,Mechanical,locomotive,railway station,a massive diesel locomotive idling with a deep thrum at a station
Energy/Dynamics,powerful,Mechanical,bulldozer,construction site,the deep growling of a large bulldozer pushing earth at a site
Energy/Dynamics,powerful,Mechanical,steam hammer,industrial forge,a heavy steam hammer striking a hot metal ingot in a forge
Energy/Dynamics,powerful,Mechanical,crane,shipyard,the mechanical groaning of a massive crane lifting a shipping container
Energy/Dynamics,powerful,Mechanical,industrial fan,warehouse,the deep whir of a giant industrial fan in a warehouse
Energy/Dynamics,powerful,Mechanical,printing press,factory,the rhythmic heavy thud of an industrial printing press in a factory
Energy/Dynamics,powerful,Mechanical,cement mixer,street,the heavy tumbling of wet concrete in a cement mixer on a street
Energy/Dynamics,powerful,Mechanical,oil pump,desert,the rhythmic low creak of an oil pump in a desert field
Energy/Dynamics,powerful,Mechanical,elevator motor,high-rise,the hum of a heavy elevator motor in a high-rise building
Energy/Dynamics,powerful,Mechanical,turbine,power plant,the high-pitched whine of a steam turbine in a power plant
Energy/Dynamics,powerful,Mechanical,generator,remote camp,the steady loud roar of a large diesel generator at a camp
Energy/Dynamics,powerful,Mechanical,air compressor,garage,the heavy rhythmic throb of an industrial air compressor in a garage
Energy/Dynamics,powerful,Mechanical,hydraulic lift,car shop,the low groan of a hydraulic lift raising a heavy truck
Energy/Dynamics,powerful,Mechanical,wrecking ball,demolition site,the impact of a wrecking ball hitting a brick wall at a site
Energy/Dynamics,powerful,Mechanical,piledriver,harbor,the massive impact of a piledriver in a harbor
Energy/Dynamics,powerful,Mechanical,grain elevator,farmland,the deep drone of a grain elevator in operation on a farm
Energy/Dynamics,powerful,Mechanical,boiler,basement,the powerful roar of an industrial gas boiler in a basement
Energy/Dynamics,powerful,Environmental,thunder,canyon,a massive roll of thunder traveling through a mountain canyon
Energy/Dynamics,powerful,Environmental,waterfall,tropical jungle,the powerful roar of a massive waterfall hitting a rocky basin
Energy/Dynamics,powerful,Environmental,ocean wave,sea wall,a massive ocean wave slamming against a concrete sea wall
Energy/Dynamics,powerful,Environmental,landslide,ravine,the deep roar of a landslide descending into a ravine
Energy/Dynamics,powerful,Environmental,volcano,active crater,the deep guttural grumble of an active volcano crater
Energy/Dynamics,powerful,Environmental,hurricane wind,coastline,the overwhelming roar of hurricane-force winds hitting a coast
Energy/Dynamics,powerful,Environmental,avalanche,mountain peak,the muffled roar of a massive snow avalanche on a peak
Energy/Dynamics,powerful,Environmental,geyser eruption,volcanic field,the explosive burst of a geyser eruption in a volcanic field
Energy/Dynamics,powerful,Environmental,forest fire,wilderness,the expansive roaring and crackling of a large forest fire
Energy/Dynamics,powerful,Environmental,earthquake,tectonic fault,the deep subterranean vibration of the earth during a tremor
Energy/Dynamics,powerful,Environmental,storm surge,coast,the heavy thrum of a storm surge hitting a coastline
Energy/Dynamics,powerful,Environmental,river rapids,gorge,the continuous powerful rushing of class-five river rapids
Energy/Dynamics,powerful,Environmental,glacier calving,arctic bay,the deep boom of a glacier calving into the ocean
Energy/Dynamics,powerful,Environmental,mudslide,valley,the heavy wet roar of a mudslide down a mountain valley
Energy/Dynamics,powerful,Environmental,rockfall,canyon,a large boulder impacting a canyon floor after a fall
Energy/Dynamics,powerful,Environmental,geyser steam,field,the loud constant hiss of high-pressure steam from a vent
Energy/Dynamics,powerful,Environmental,sandstorm,desert,the deep roar of a sandstorm moving across a desert expanse
Energy/Dynamics,powerful,Environmental,storm wind,pine forest,the deep roar of wind through a dense forest canopy
Energy/Dynamics,powerful,Organic,elephant trumpet,savanna,the loud resonant trumpet of an elephant on the savanna
Energy/Dynamics,powerful,Organic,lion roar,safari park,the powerful chest-heavy roar of a lion in a park
Energy/Dynamics,powerful,Organic,blue whale,ocean,the powerful low-pitched song of a blue whale in the ocean
Energy/Dynamics,powerful,Organic,grizzly growl,mountain cave,the deep guttural growl of a grizzly bear in a cave
Energy/Dynamics,powerful,Organic,gorilla thump,rainforest,a gorilla thumping its chest in a dense jungle
Energy/Dynamics,powerful,Organic,bison grumble,prairie,the deep low-register grumble of a bison herd on the prairie
Energy/Dynamics,powerful,Organic,moose grunt,northern marsh,the deep resonant grunt of a moose in a marsh
Energy/Dynamics,powerful,Organic,hippo honk,river bank,the deep guttural honk of a hippopotamus by a river
Energy/Dynamics,powerful,Organic,rhinoceros huff,scrubland,the heavy huffing of a rhinoceros in the scrubland
Energy/Dynamics,powerful,Organic,wolf howl,winter ridge,the powerful resonant howl of a wolf on a snowy ridge
Energy/Dynamics,powerful,Organic,alligator bellow,cypress swamp,the deep vibration of an alligator bellowing in a swamp
Energy/Dynamics,powerful,Organic,horse gallop,meadow,the powerful rhythmic thud of a horse galloping on soft grass
Energy/Dynamics,powerful,Organic,whale tail slap,ocean surface,a massive whale's tail slapping the ocean surface
Energy/Dynamics,powerful,Organic,human shout,empty stadium,a powerful human shout echoing in an empty stadium
Energy/Dynamics,powerful,Organic,bird colony,cliffside,the collective roar of thousands of gulls on a cliffside
Energy/Dynamics,powerful,Organic,cicada swarm,orchard,the deafening collective hum of cicadas in an orchard
Energy/Dynamics,powerful,Organic,heartbeat,stethoscope,the loud rhythmic thump of a heartbeat through a stethoscope
Energy/Dynamics,powerful,Organic,bear roar,wilderness,the powerful roar of a bear echoing through a forest
Energy/Dynamics,powerful,Domestic,door slam,manor house,a heavy oak door being slammed shut in a manor house
Energy/Dynamics,powerful,Domestic,fireplace roar,cabin,the deep roar and crackle of a large log fireplace in a cabin
Energy/Dynamics,powerful,Domestic,vacuum cleaner,hallway,the loud steady roar of an industrial vacuum cleaner in a hall
Energy/Dynamics,powerful,Domestic,washing machine,laundry room,the powerful thrum of a washing machine on the spin cycle
Energy/Dynamics,powerful,Domestic,bathtub drain,bathroom,the powerful roar of water draining from a full bathtub
Energy/Dynamics,powerful,Domestic,wardrobe slide,bedroom,a heavy wooden wardrobe being pushed across a floor
Energy/Dynamics,powerful,Domestic,grandfather clock chime,hallway,the deep resonant chime of a grandfather clock in a hall
Energy/Dynamics,powerful,Domestic,sofa thud,living room,the deep thud of someone jumping onto a heavy leather sofa
Energy/Dynamics,powerful,Domestic,garbage truck,alleyway,the powerful mechanical roar of a garbage truck compressor
Energy/Dynamics,powerful,Domestic,boiler,basement,the deep steady roar of a gas boiler in a basement
Energy/Dynamics,powerful,Domestic,trunk drop,attic,a heavy steamer trunk being dropped onto a wooden attic floor
Energy/Dynamics,powerful,Domestic,refrigerator hum,kitchen,the deep steady hum of an old refrigerator in a kitchen
Energy/Dynamics,powerful,Domestic,rug beat,backyard,the deep thud of a heavy rug being beaten with a wooden stick
Energy/Dynamics,powerful,Domestic,pantry door creak,kitchen,the deep creak of a heavy wooden pantry door in a kitchen
Energy/Dynamics,powerful,Domestic,armchair creak,den,the deep creak of a large leather armchair in a den
Energy/Dynamics,powerful,Domestic,book slam,library,a massive leather-bound book being slammed shut in a library
Energy/Dynamics,powerful,Domestic,curtains swish,theater,the deep swish of heavy velvet curtains being drawn in a theater
Energy/Dynamics,powerful,Domestic,boiling pot,kitchen,the deep rhythmic bubbling of a large boiling stew pot
Energy/Dynamics,powerful,Electronic,subwoofer pulse,home theater,a powerful low-frequency pulse from a subwoofer in a room
Energy/Dynamics,powerful,Electronic,transformer hum,substation,the deep powerful hum of a massive power transformer
Energy/Dynamics,powerful,Electronic,bass amp,concert stage,the deep resonant hum of a bass amplifier on stage
Energy/Dynamics,powerful,Electronic,industrial motor,plant,the powerful steady hum of a large electric motor in a plant
Energy/Dynamics,powerful,Electronic,server rack whir,data center,the collective deep whir of a full server rack in a center
Energy/Dynamics,powerful,Electronic,mri machine,hospital,the powerful rhythmic thumping of an mri machine in a hospital
Energy/Dynamics,powerful,Electronic,radar array,coastal cliff,the deep mechanical hum of a rotating radar dish on a cliff
Energy/Dynamics,powerful,Electronic,power lines,misty field,the deep steady buzzing of high-voltage lines in a field
Energy/Dynamics,powerful,Electronic,arc welder,shipyard,the powerful crackling roar of an industrial arc welder
Energy/Dynamics,powerful,Electronic,synth drone,studio,a deep multi-layered analog synthesizer drone in a studio
Energy/Dynamics,powerful,Electronic,industrial vacuum,warehouse,the powerful roar of an industrial vacuum cleaner motor
Energy/Dynamics,powerful,Electronic,generator,construction site,the deep steady roar of a large portable generator at a site
Energy/Dynamics,powerful,Electronic,electric heater,basement,the deep steady whir of a large electric heater in a basement
Energy/Dynamics,powerful,Electronic,pa system,stadium,the deep resonant hum of a large stadium sound system
Energy/Dynamics,powerful,Electronic,solenoid,factory,the powerful mechanical thunk of a large industrial solenoid
Energy/Dynamics,powerful,Electronic,hydrophone wash,ocean floor,the deep low-frequency wash recorded by an underwater hydrophone
Energy/Dynamics,powerful,Electronic,radio tower,ridge,the deep steady hum of a radio transmission tower on a ridge
Energy/Dynamics,powerful,Electronic,computer bank,server room,the powerful steady whir of multiple computer fans
Energy/Dynamics,aggressive,Musical,electric guitar,rehearsal room,an electric guitar playing a fast palm-muted thrash riff
Energy/Dynamics,aggressive,Musical,snare drum,studio,a snare drum being struck with a hard rimshot in a studio
Energy/Dynamics,aggressive,Musical,saxophone,jazz club,a tenor saxophone playing a loud growling note in a jazz club
Energy/Dynamics,aggressive,Musical,violin,chamber hall,a violin bow being dug into the strings for a harsh staccato
Energy/Dynamics,aggressive,Musical,tambourine,stage,a tambourine being struck sharply with the edge of the hand
Energy/Dynamics,aggressive,Musical,cello,cellar,a cello string being snapped against the fretboard in a cellar
Energy/Dynamics,aggressive,Musical,drum kit,garage,a rapid aggressive drum fill across all toms and cymbals
Energy/Dynamics,aggressive,Musical,banjo,barn,a banjo being played with fast aggressive fingerpicking in a barn
Energy/Dynamics,aggressive,Musical,trumpet,courtyard,a trumpet playing a loud piercing note in an open courtyard
Energy/Dynamics,aggressive,Musical,double bass,jazz cellar,a double bass string being slapped against the neck in a club
Energy/Dynamics,aggressive,Musical,kazoo,parade,the loud aggressive buzzing of a kazoo in a street parade
Energy/Dynamics,aggressive,Musical,cymbals,stage,a pair of orchestral cymbals clashing together with great force
Energy/Dynamics,aggressive,Musical,synthesizer,studio,a synthesizer playing a distorted aggressive bass patch
Energy/Dynamics,aggressive,Musical,vibraslap,booth,the rattling clatter of a vibraslap being struck in a studio
Energy/Dynamics,aggressive,Musical,timpani,hall,a timpani drum being struck for a fast aggressive roll
Energy/Dynamics,aggressive,Musical,hard plectrum,guitar,a guitar string being struck with a hard metal plectrum
Energy/Dynamics,aggressive,Musical,harmonica,porch,a harmonica being played with a loud growling tone on a porch
Energy/Dynamics,aggressive,Musical,cowbell,club,a metal cowbell being struck rapidly with a drumstick in a club
Energy/Dynamics,aggressive,Mechanical,jackhammer,city street,the rapid aggressive hammering of a jackhammer on concrete
Energy/Dynamics,aggressive,Mechanical,circular saw,lumber mill,the high-pitched scream of a circular saw cutting hardwood
Energy/Dynamics,aggressive,Mechanical,metal lathe,machine shop,the harsh grinding of a metal lathe cutting into steel
Energy/Dynamics,aggressive,Mechanical,impact wrench,auto shop,the rapid aggressive hammering of a pneumatic impact wrench
Energy/Dynamics,aggressive,Mechanical,chainsaw,forest,the loud aggressive roar of a chainsaw cutting a tree trunk
Energy/Dynamics,aggressive,Mechanical,grinder,workshop,the harsh rasping of a metal grinder on a steel plate
Energy/Dynamics,aggressive,Mechanical,pneumatic drill,tunnel,the loud rattling of a pneumatic drill in a stone tunnel
Energy/Dynamics,aggressive,Mechanical,stamping press,factory,the loud aggressive thud of a metal stamping press
Energy/Dynamics,aggressive,Mechanical,sandblaster,shipyard,the harsh abrasive roar of a sandblaster against a metal hull
Energy/Dynamics,aggressive,Mechanical,manual typewriter,library,the loud aggressive clicking of keys being struck on a typewriter
Energy/Dynamics,aggressive,Mechanical,staple gun,upholstery shop,a heavy-duty staple gun firing rapidly into a wooden frame
Energy/Dynamics,aggressive,Mechanical,centrifuge,lab,the high-pitched aggressive whine of a centrifuge at max speed
Energy/Dynamics,aggressive,Mechanical,milling machine,shop,the harsh grinding of a milling machine through iron
Energy/Dynamics,aggressive,Mechanical,fan,engine room,the loud aggressive whir of a high-speed cooling fan
Energy/Dynamics,aggressive,Mechanical,boiler,ship,the loud aggressive roar of a ship's steam boiler in a room
Energy/Dynamics,aggressive,Mechanical,conveyor,factory,the loud clattering of metal parts on a conveyor belt
Energy/Dynamics,aggressive,Mechanical,wrecking ball,demolition site,the loud impact of a wrecking ball hitting a wall
Energy/Dynamics,aggressive,Mechanical,jackhammer,alley,the loud aggressive rattling of a jackhammer in a narrow space
Energy/Dynamics,aggressive,Environmental,ocean wave,rocky shore,a massive wave crashing aggressively against a jagged shore
Energy/Dynamics,aggressive,Environmental,forest fire,wilderness,the loud aggressive crackling and roaring of a forest fire
Energy/Dynamics,aggressive,Environmental,thunder,valley,the sharp aggressive crack of nearby thunder in a valley
Energy/Dynamics,aggressive,Environmental,wind,canyon,the loud aggressive howling of wind through a rock canyon
Energy/Dynamics,aggressive,Environmental,hail,tin shed,the loud aggressive drumming of hail on a corrugated roof
Energy/Dynamics,aggressive,Environmental,sandstorm,desert,the harsh aggressive hiss of sand hitting a metal pipe
Energy/Dynamics,aggressive,Environmental,river rapids,gorge,the loud aggressive rushing of water through narrow rapids
Energy/Dynamics,aggressive,Environmental,ice cracking,frozen lake,the sharp aggressive boom of ice cracking on a lake
Energy/Dynamics,aggressive,Environmental,geyser,field,the loud aggressive hiss and pop of a steam vent in a field
Energy/Dynamics,aggressive,Environmental,mudslide,ravine,the loud aggressive roar of mud and rock sliding down a slope
Energy/Dynamics,aggressive,Environmental,landslide,mountain,the loud aggressive roar of falling rock on a mountain
Energy/Dynamics,aggressive,Environmental,waterfall,basin,the loud aggressive impact of water hitting a rocky basin
Energy/Dynamics,aggressive,Environmental,lightning,meadow,the sharp aggressive crack of a nearby lightning strike
Energy/Dynamics,aggressive,Environmental,storm surge,coast,the loud aggressive thrum of waves hitting a pier
Energy/Dynamics,aggressive,Environmental,volcano,crater,the loud aggressive grumble of an active volcanic crater
Energy/Dynamics,aggressive,Environmental,avalanche,slope,the loud aggressive roar of a snow avalanche on a slope
Energy/Dynamics,aggressive,Environmental,obsidian,lava field,the harsh aggressive clink of obsidian shards sliding down a hill
Energy/Dynamics,aggressive,Environmental,bamboo grove,jungle,the loud aggressive knocking of bamboo stalks in a storm
Energy/Dynamics,aggressive,Organic,snarling wolf,winter forest,the aggressive snarling of a wolf in a winter forest
Energy/Dynamics,aggressive,Organic,alligator hiss,swamp,the loud aggressive hiss of an alligator in a swamp
Energy/Dynamics,aggressive,Organic,gorilla thump,jungle,the aggressive thumping of a gorilla on its chest
Energy/Dynamics,aggressive,Organic,lion roar,savanna,the loud aggressive roar of a lion on the savanna
Energy/Dynamics,aggressive,Organic,bear growl,cave,the loud aggressive growl of a bear in a mountain cave
Energy/Dynamics,aggressive,Organic,fist,gym,the loud aggressive thud of a boxer hitting a heavy bag
Energy/Dynamics,aggressive,Organic,hooves,road,the loud aggressive thud of horse hooves on a paved road
Energy/Dynamics,aggressive,Organic,beak,farm,the aggressive tapping of a chicken's beak on a metal feeder
Energy/Dynamics,aggressive,Organic,claws,tile,the loud aggressive clicking of a dog's claws on a tile floor
Energy/Dynamics,aggressive,Organic,wasp,window,the loud aggressive buzzing of a wasp against a glass pane
Energy/Dynamics,aggressive,Organic,scales,rock,the harsh aggressive rustle of snake scales over a rock
Energy/Dynamics,aggressive,Organic,teeth,room,the aggressive clicking of teeth chattering in the cold
Energy/Dynamics,aggressive,Organic,shrimp,reef,the loud aggressive snap of a pistol shrimp in a reef
Energy/Dynamics,aggressive,Organic,bat,cave,the aggressive high-pitched clicking of a bat in a cavern
Energy/Dynamics,aggressive,Organic,human shout,stadium,a loud aggressive human shout echoing in a stadium
Energy/Dynamics,aggressive,Organic,dog,alleyway,the loud aggressive barking of a dog in a narrow alley
Energy/Dynamics,aggressive,Organic,monkey,jungle,the loud aggressive screeching of a monkey in a tree
Energy/Dynamics,aggressive,Organic,bull,pasture,the aggressive huffing and pawing of a bull on the ground
Energy/Dynamics,aggressive,Domestic,glass shatter,kitchen,the loud aggressive sound of a glass bottle breaking on a floor
Energy/Dynamics,aggressive,Domestic,blender,kitchen,the loud aggressive grinding roar of a blender at max speed
Energy/Dynamics,aggressive,Domestic,door slam,hallway,the loud aggressive thud of a heavy door being slammed
Energy/Dynamics,aggressive,Domestic,fireplace,cabin,the loud aggressive crackling and popping of a wood fire
Energy/Dynamics,aggressive,Domestic,vacuum,hallway,the loud aggressive roar of an industrial vacuum cleaner
Energy/Dynamics,aggressive,Domestic,hair dryer,bathroom,the loud aggressive whir of a hair dryer at full power
Energy/Dynamics,aggressive,Domestic,faucet,kitchen,the loud aggressive roar of water running at full pressure
Energy/Dynamics,aggressive,Domestic,kettle,kitchen,the loud aggressive hiss of a boiling tea kettle
Energy/Dynamics,aggressive,Domestic,garbage truck,alley,the loud aggressive roar of a trash compactor
Energy/Dynamics,aggressive,Domestic,shredder,office,the loud aggressive grinding of a paper shredder
Energy/Dynamics,aggressive,Domestic,rug beat,backyard,the loud aggressive thud of a rug being beaten with a stick
Energy/Dynamics,aggressive,Domestic,cabinet,pantry,the loud aggressive thud of a cabinet door being slammed
Energy/Dynamics,aggressive,Domestic,frying,kitchen,the loud aggressive sizzling of food in a hot deep fryer
Energy/Dynamics,aggressive,Domestic,lawnmower,yard,the loud aggressive drone of a lawnmower outside a window
Energy/Dynamics,aggressive,Domestic,iron,laundry,the loud aggressive hiss of a steam iron on a wet garment
Energy/Dynamics,aggressive,Domestic,radio,den,the loud aggressive white noise of a radio at max volume
Energy/Dynamics,aggressive,Domestic,dryer,utility room,the loud aggressive tumbling of heavy towels in a dryer
Energy/Dynamics,aggressive,Domestic,staircase,house,the loud aggressive thudding of someone running up stairs
Energy/Dynamics,aggressive,Electronic,feedback,stage,the loud aggressive high-frequency scream of audio feedback
Energy/Dynamics,aggressive,Electronic,taser arc,security,the loud aggressive rapid arcing of a high-voltage taser
Energy/Dynamics,aggressive,Electronic,buzzer,factory,the loud aggressive steady sound of an industrial buzzer
Energy/Dynamics,aggressive,Electronic,static,radio,the loud aggressive white noise of a radio between stations
Energy/Dynamics,aggressive,Electronic,high-gain amp,studio,the loud aggressive harmonic roar of a guitar amp
Energy/Dynamics,aggressive,Electronic,arc welder,shipyard,the loud aggressive crackling of an industrial arc welder
Energy/Dynamics,aggressive,Electronic,transformer,pole,the loud aggressive buzzing of a faulty power transformer
Energy/Dynamics,aggressive,Electronic,synth bass,room,a loud aggressive distorted bass patch on a synthesizer
Energy/Dynamics,aggressive,Electronic,plasma torch,lab,the loud aggressive high-pitched hiss of a plasma torch
Energy/Dynamics,aggressive,Electronic,mri machine,hospital,the loud aggressive rhythmic thumping of an mri scanner
Energy/Dynamics,aggressive,Electronic,radar,station,the loud aggressive mechanical hum of a radar array
Energy/Dynamics,aggressive,Electronic,bitcrusher,studio,the loud aggressive harmonic distortion of a bitcrusher effect
Energy/Dynamics,aggressive,Electronic,microwave,kitchen,the loud aggressive heavy buzz of a microwave in use
Energy/Dynamics,aggressive,Electronic,computer fan,closet,the loud aggressive high-speed whir of a server fan
Energy/Dynamics,aggressive,Electronic,vacuum tube,radio,the loud aggressive warm hum of a saturated vacuum tube
Energy/Dynamics,aggressive,Electronic,geiger counter,site,the loud aggressive rapid clicking of a geiger counter
Energy/Dynamics,aggressive,Electronic,alarm,warehouse,the loud aggressive beeping of a warehouse security alarm
Energy/Dynamics,aggressive,Electronic,sequencer,studio,a loud aggressive rhythmic pulse from an analog sequencer
Energy/Dynamics,intense,Musical,violin,concert hall,a violin playing a rapid intense tremolo in a concert hall
Energy/Dynamics,intense,Musical,snare drum,parade,a snare drum being played for a loud intense roll on a parade ground
Energy/Dynamics,intense,Musical,bagpipes,small room,the loud intense harmonic density of bagpipes in a room
Energy/Dynamics,intense,Musical,gong,monastery,a gong being struck for a loud intense shimmering wash of sound
Energy/Dynamics,intense,Musical,saxophone,jazz club,a tenor saxophone playing a loud intense solo in a club
Energy/Dynamics,intense,Musical,synthesizer,studio,a synthesizer playing a loud intense multi-layered lead patch
Energy/Dynamics,intense,Musical,harpsichord,gallery,a harpsichord being played for a loud intense rapid arpeggio
Energy/Dynamics,intense,Musical,tambourine,stage,a tambourine being shaken with maximum force and speed
Energy/Dynamics,intense,Musical,12-string guitar,booth,a 12-string guitar being strummed with an intense rapid rhythm
Energy/Dynamics,intense,Musical,choir,cathedral,a large choir singing a loud intense harmonic chord in a cathedral
Energy/Dynamics,intense,Musical,trumpet,courtyard,a trumpet playing a loud intense fanfare in a stone courtyard
