category,tag,domain,source,environment,scenario
Energy/Dynamics,pulsing,Electronic,hard drive,server,the rhythmic seek of a disk drive
Energy/Dynamics,pulsing,Electronic,oscillator,lab,a low-frequency pulse from a signal generator
Energy/Dynamics,pulsing,Electronic,speaker,club,the rhythmic thump of a bass track
Energy/Dynamics,pulsing,Electronic,motor,garage,the rhythmic whir of a stepped motor
Energy/Dynamics,pulsing,Electronic,buzzer,entry,a buzzer sounding in a rhythmic pulse
Energy/Dynamics,pulsing,Electronic,modem,office,the rhythmic chirping of a modem connecting
Energy/Dynamics,pulsing,Electronic,scanner,library,the rhythmic hum of a flatbed scanner
Energy/Dynamics,pulsing,Electronic,toy,nursery,a battery toy making a rhythmic sound
Energy/Dynamics,pulsing,Electronic,fan,case,the rhythmic whir of a cooling fan
Energy/Dynamics,pulsing,Electronic,printer,office,the rhythmic sound of a dot matrix printer
Energy/Dynamics,pulsing,Electronic,transformer,station,the rhythmic buzz of a transformer bank
