category,tag,domain,source,environment,scenario
Pitch/Register,tinny,Musical,toy piano,playroom,a child striking the plastic keys of a miniature toy piano
Pitch/Register,tinny,Musical,harmonica,playground,a small metal harmonica being played at a high register
Pitch/Register,tinny,Musical,music box,nursery,the internal mechanism of a small jewelry box playing a melody
Pitch/Register,tinny,Musical,tin whistle,rocky cliff,a metal whistle being blown sharply on a windy ridge
Pitch/Register,tinny,Musical,ukulele,beach,a plastic ukulele being strummed quickly near the surf
Pitch/Register,tinny,Musical,recorder,classroom,a small plastic soprano recorder playing a series of short notes
Pitch/Register,tinny,Musical,kazoo,backyard,a plastic kazoo vibrating as a person hums into it
Pitch/Register,tinny,Musical,tambourine,festival,the jingle of small metal zils on a plastic tambourine
Pitch/Register,tinny,Musical,finger cymbals,dance studio,two thin brass finger cymbals clinking together
Pitch/Register,tinny,Musical,triangle,orchestra pit,a thin steel triangle being struck once with a metal rod
Pitch/Register,tinny,Musical,glockenspiel,school,a metal mallet hitting the smallest bar of a glockenspiel
Pitch/Register,tinny,Musical,toy drum,nursery,a wooden stick hitting the plastic head of a toy drum
Pitch/Register,tinny,Musical,thumb piano,garden,the thin metal tines of a small kalimba being plucked
Pitch/Register,tinny,Musical,banjo,farmyard,the high-pitched twang of a banjo string being picked
Pitch/Register,tinny,Musical,harpsichord,gallery,the mechanical plucking of a harpsichord string in a small room
Pitch/Register,tinny,Musical,mandolin,piazza,the thin and fast strumming of a mandolin in an open square
Pitch/Register,tinny,Musical,piccolo,parade ground,a piccolo playing a sharp melody during a march
Pitch/Register,tinny,Musical,cowbell,pasture,a small metal cowbell clanking against a steel post
Pitch/Register,tinny,Mechanical,watch,workshop,the fast ticking of a mechanical wrist watch held close
Pitch/Register,tinny,Mechanical,gears,watchmaker shop,small brass gears clicking inside a pocket watch
Pitch/Register,tinny,Mechanical,camera,photography studio,the mechanical shutter of a vintage film camera snapping
Pitch/Register,tinny,Mechanical,typewriter,study,the metal hammer of a typewriter hitting the roller
Pitch/Register,tinny,Mechanical,bicycle bell,city street,a small chrome bicycle bell being rung repeatedly
Pitch/Register,tinny,Mechanical,stapler,office,a manual desk stapler clicking shut on a single sheet of paper
Pitch/Register,tinny,Mechanical,timer,kitchen,the ticking of a mechanical egg timer on a granite counter
Pitch/Register,tinny,Mechanical,latch,cabinet,a small metal cabinet latch snapping shut
Pitch/Register,tinny,Mechanical,ratchet,garage,the individual clicks of a small socket wrench being turned
Pitch/Register,tinny,Mechanical,fan,attic,a small metal fan blade clipping a wire guard
Pitch/Register,tinny,Mechanical,motor,toy shop,the whir of a tiny battery-powered motor in a plastic car
Pitch/Register,tinny,Mechanical,bell,shop door,a small brass bell jingling on a shop door as it opens
Pitch/Register,tinny,Mechanical,key,lockbox,a small metal key turning in a thin lock
Pitch/Register,tinny,Mechanical,scissors,sewing room,the snipping of small metal scissors through paper
Pitch/Register,tinny,Mechanical,razor,bathroom,the high-speed vibration of an electric travel shaver
Pitch/Register,tinny,Mechanical,piston,laboratory,a micro-pneumatic valve clicking in a clean room
Pitch/Register,tinny,Mechanical,drill,hobby shop,a small hobby drill bit spinning against a piece of plastic
Pitch/Register,tinny,Mechanical,staple gun,garage,a small handheld staple gun firing into a wooden board
Pitch/Register,tinny,Environmental,hail,tin roof,small hail stones bouncing off a corrugated metal shed
Pitch/Register,tinny,Environmental,sand,desert,a spray of fine sand hitting a metal sign during a storm
Pitch/Register,tinny,Environmental,rain,porch,raindrops tapping against a thin plastic tarp
Pitch/Register,tinny,Environmental,ice,pond,a thin sheet of ice cracking on the surface of a puddle
Pitch/Register,tinny,Environmental,wind,wire fence,wind whistling through a thin wire mesh fence
Pitch/Register,tinny,Environmental,twigs,forest,a handful of small dry twigs being snapped
Pitch/Register,tinny,Environmental,pebbles,beach,small stones clattering together in a receding wave
Pitch/Register,tinny,Environmental,leaves,garden,dry autumn leaves skittering across a paved path
Pitch/Register,tinny,Environmental,icicle,cave,a small icicle shattering on a stone floor
Pitch/Register,tinny,Environmental,mist,ocean,fine sea spray hissing against a metal railing
Pitch/Register,tinny,Environmental,shell,shore,small seashells clinking together in a plastic bucket
Pitch/Register,tinny,Environmental,frost,window,the delicate snapping of frost crystals on a glass pane
Pitch/Register,tinny,Environmental,bubble,sink,soap bubbles popping on the surface of a dish basin
Pitch/Register,tinny,Environmental,grass,meadow,dry grass rubbing together in a light breeze
Pitch/Register,tinny,Environmental,reeds,marsh,wind blowing through a patch of dry frozen reeds
Pitch/Register,tinny,Environmental,dust,attic,the soft sound of dust particles hitting a metal vent
Pitch/Register,tinny,Environmental,sleet,tent,sleet tapping against the taut fabric of a nylon tent
Pitch/Register,tinny,Environmental,stream,mountain,water trickling over small pebbles in a shallow rill
Pitch/Register,tinny,Organic,mosquito,bedroom,the high-pitched buzz of a mosquito flying near an ear
Pitch/Register,tinny,Organic,bird,orchard,a small songbird chirping from a high branch
Pitch/Register,tinny,Organic,cricket,porch,the rhythmic chirping of a single cricket at night
Pitch/Register,tinny,Organic,cicada,field,the high-speed buzzing of a cicada in a dry meadow
Pitch/Register,tinny,Organic,bat,cave,the ultrasonic clicking of a bat echoing in a cavern
Pitch/Register,tinny,Organic,mouse,attic,a small mouse scratching behind a wooden wall
Pitch/Register,tinny,Organic,beetle,pantry,the clicking of a beetle's legs on a plastic shelf
Pitch/Register,tinny,Organic,teeth,bathroom,teeth chattering together due to cold
Pitch/Register,tinny,Organic,claws,tile,a cat's claws tapping on a ceramic floor
Pitch/Register,tinny,Organic,wings,garden,the rapid whir of a hummingbird's wings
Pitch/Register,tinny,Organic,bone,kitchen,a small chicken bone snapping on a plate
Pitch/Register,tinny,Organic,shrimp,reef,the sharp snapping of a pistol shrimp underwater
Pitch/Register,tinny,Organic,eggshell,breakfast nook,an eggshell cracking against the rim of a bowl
Pitch/Register,tinny,Organic,scales,terrarium,the rustle of a small lizard's scales against glass
Pitch/Register,tinny,Organic,voice,hallway,a high-pitched whisper echoing in a quiet corridor
Pitch/Register,tinny,Organic,tongue,kitchen,a sharp click of the tongue against the palate
Pitch/Register,tinny,Organic,shiver,bedroom,the sound of a person shivering in a cold room
Pitch/Register,tinny,Organic,fingernail,table,a fingernail tapping on a polished wooden surface
Pitch/Register,tinny,Domestic,foil,kitchen,a sheet of aluminum foil being crinkled into a ball
Pitch/Register,tinny,Domestic,silverware,dining room,the clink of a metal spoon against a porcelain cup
Pitch/Register,tinny,Domestic,keys,entryway,a ring of small brass keys jingling in a hand
Pitch/Register,tinny,Domestic,can,pantry,the opening of a soda can tab
Pitch/Register,tinny,Domestic,scissors,office,a pair of metal scissors snipping through a single sheet of paper
Pitch/Register,tinny,Domestic,zipper,closet,a metal zipper being pulled up quickly on a jacket
Pitch/Register,tinny,Domestic,pen,library,the clicking of a ballpoint pen mechanism
Pitch/Register,tinny,Domestic,beads,bedroom,a string of plastic beads clattering on a wooden floor
Pitch/Register,tinny,Domestic,lighter,porch,the flick of a metal lighter lid and wheel
Pitch/Register,tinny,Domestic,spray,bathroom,the nozzle of a hairspray bottle being depressed
Pitch/Register,tinny,Domestic,bottle cap,kitchen,a metal bottle cap being removed with an opener
Pitch/Register,tinny,Domestic,match,cellar,a match being struck against a cardboard box
Pitch/Register,tinny,Domestic,thimble,sewing room,a metal thimble tapping against a wooden table
Pitch/Register,tinny,Domestic,comb,bathroom,the clicking of plastic comb teeth against a mirror
Pitch/Register,tinny,Domestic,glass,dining room,the clink of two wine glasses during a toast
Pitch/Register,tinny,Domestic,clock,bedroom,the fast ticking of a small travel alarm clock
Pitch/Register,tinny,Domestic,remote,living room,the click of a button on a plastic remote control
Pitch/Register,tinny,Domestic,staple,desk,a small staple being removed from a document
Pitch/Register,tinny,Electronic,phone speaker,office,music playing through a small smartphone speaker
Pitch/Register,tinny,Electronic,radio,attic,the sound of a vintage transistor radio in a large room
Pitch/Register,tinny,Electronic,earbuds,subway,music leaking from a pair of cheap earbuds
Pitch/Register,tinny,Electronic,buzzer,game show,a high-pitched electronic buzzer being pressed
Pitch/Register,tinny,Electronic,static,radio,the crackle of white noise between stations on a radio
Pitch/Register,tinny,Electronic,beep,kitchen,the high-pitched beep of a digital microwave timer
Pitch/Register,tinny,Electronic,hard drive,study,the whir of a spinning hard drive disk
Pitch/Register,tinny,Electronic,led,control room,the faint buzz of a small led indicator light
Pitch/Register,tinny,Electronic,flash,studio,the high-pitched whine of a camera flash charging
Pitch/Register,tinny,Electronic,taser,security,the rapid pulsing of a small electric arc
Pitch/Register,tinny,Electronic,modem,office,the chirping of a dial-up modem connecting
Pitch/Register,tinny,Electronic,chip,lab,the high-frequency vibration of a quartz oscillator
Pitch/Register,tinny,Electronic,coil,basement,the high-pitched whine of a power supply unit
Pitch/Register,tinny,Electronic,relay,server room,the clicking of a small electromagnetic relay
Pitch/Register,tinny,Electronic,monitor,attic,the high-pitched whine of an old computer screen
Pitch/Register,tinny,Electronic,pager,hospital,the high-pitched beep of a pager on a desk
Pitch/Register,tinny,Electronic,calculator,library,the click of buttons on a handheld calculator
Pitch/Register,tinny,Electronic,sensor,factory,the beep of a barcode scanner in a warehouse
Pitch/Register,hissing,Musical,shaker,studio,a metal shaker being moved in a steady rhythmic motion
Pitch/Register,hissing,Musical,brushes,jazz club,wire brushes being swirled on a snare drum head
Pitch/Register,hissing,Musical,flute,den,a person blowing air through a flute without producing a tone
Pitch/Register,hissing,Musical,sand blocks,classroom,two wooden blocks covered in sandpaper being rubbed together
Pitch/Register,hissing,Musical,hi-hat,concert,a pair of hi-hat cymbals being held slightly open while struck
Pitch/Register,hissing,Musical,sitar,temple,the sympathetic vibration of sitar strings after a pluck
Pitch/Register,hissing,Musical,tambourine,festival,a tambourine being shaken very rapidly
Pitch/Register,hissing,Musical,organ,cathedral,the sound of air escaping from a pipe organ bellows
Pitch/Register,hissing,Musical,synthesizer,studio,a white noise burst from a modular synthesizer
Pitch/Register,hissing,Musical,cymbals,stage,the long decay of a large crash cymbal being struck
Pitch/Register,hissing,Musical,trumpet,rehearsal,the sound of a trumpet being cleaned with a burst of air
Pitch/Register,hissing,Musical,harmonica,porch,a long draw note on a harmonica with a lot of breath
Pitch/Register,hissing,Musical,rainstick,gallery,the sound of seeds falling inside a long cactus rainstick
Pitch/Register,hissing,Musical,pan flute,meadow,the breathy sound of air entering a wooden pipe
Pitch/Register,hissing,Musical,guiro,dance studio,a wooden scraper being moved across a notched guiro
Pitch/Register,hissing,Musical,bow,conservatory,the sound of a bow hair sliding across a dry cello string
Pitch/Register,hissing,Musical,bagpipes,highlands,the initial sound of air filling a bagpipe bag
Pitch/Register,hissing,Musical,accordion,entryway,the wheezing of an accordion bellows without keys pressed
Pitch/Register,hissing,Mechanical,steam pipe,factory,high-pressure steam escaping from a valve in a mill
Pitch/Register,hissing,Mechanical,air brake,truck stop,the sudden release of air from a truck's braking system
Pitch/Register,hissing,Mechanical,pneumatic,assembly line,a high-pressure air hose venting in a factory
Pitch/Register,hissing,Mechanical,sprinkler,lawn,water hissing through a brass impact sprinkler head
Pitch/Register,hissing,Mechanical,boiler,basement,the sound of a gas burner igniting in a furnace
Pitch/Register,hissing,Mechanical,tire,garage,air escaping from a punctured rubber tire
Pitch/Register,hissing,Mechanical,sandblaster,workshop,a stream of sand hitting a metal plate in a booth
Pitch/Register,hissing,Mechanical,extinguisher,hallway,the discharge of a carbon dioxide fire extinguisher
Pitch/Register,hissing,Mechanical,vacuum,office,the sound of air being sucked into a vacuum nozzle
Pitch/Register,hissing,Mechanical,pump,well house,the sound of air and water moving through a pipe
Pitch/Register,hissing,Mechanical,valve,boiler room,a high-pressure steam valve snapping open
Pitch/Register,hissing,Mechanical,lathe,machine shop,a metal lathe spray-cooling a part with fluid
Pitch/Register,hissing,Mechanical,fan,warehouse,the sound of high-speed air moving through a metal vent
Pitch/Register,hissing,Mechanical,compressor,garage,the sound of a compressor tank venting air
Pitch/Register,hissing,Mechanical,igniter,kitchen,the sound of a gas stove igniter clicking and hissing
Pitch/Register,hissing,Mechanical,soldering iron,workshop,the sizzle of solder hitting a hot iron tip
Pitch/Register,hissing,Mechanical,grease gun,auto shop,high-pressure grease being forced into a fitting
Pitch/Register,hissing,Mechanical,propeller,underwater,the sound of cavitation around a spinning ship propeller
Pitch/Register,hissing,Environmental,geyser,park,the continuous hiss of steam from a geothermal vent
Pitch/Register,hissing,Environmental,sea spray,coastline,ocean mist being blown against a rocky cliff
Pitch/Register,hissing,Environmental,rain,forest,heavy rain hitting a bed of dry pine needles
Pitch/Register,hissing,Environmental,wind,meadow,a stiff breeze blowing through a patch of dry grass
Pitch/Register,hissing,Environmental,waterfall,abyss,the mist of a waterfall hitting a rocky pool
Pitch/Register,hissing,Environmental,sand,desert,sand sliding down the face of a high dune
Pitch/Register,hissing,Environmental,fire,campsite,the sound of sap boiling out of a green log in a fire
Pitch/Register,hissing,Environmental,stream,mountain,the sound of white water rushing over small rocks
Pitch/Register,hissing,Environmental,mist,valley,fine mist moving through a dense forest canopy
Pitch/Register,hissing,Environmental,glacier,arctic,air bubbles escaping from a melting ice sheet
Pitch/Register,hissing,Environmental,reeds,marsh,wind whistling through a patch of dry reeds
Pitch/Register,hissing,Environmental,lava,volcano,cooling lava flowing into the ocean with steam
Pitch/Register,hissing,Environmental,frost,garden,the sound of morning frost sublimating in the sun
Pitch/Register,hissing,Environmental,waves,beach,the sound of water receding over fine sand
Pitch/Register,hissing,Environmental,sleet,tent,the sound of sleet sliding down a nylon tent fly
Pitch/Register,hissing,Environmental,dust,desert,the sound of a dust devil spinning over a salt flat
Pitch/Register,hissing,Environmental,geothermal,field,the sound of boiling water in a thermal pool
Pitch/Register,hissing,Environmental,cracking,ice,the sound of air escaping a fissure in a frozen lake
Pitch/Register,hissing,Organic,snake,desert,the sharp and continuous hiss of a cornered viper
Pitch/Register,hissing,Organic,cat,living room,the warning hiss of an angry cat toward a dog
Pitch/Register,hissing,Organic,exhale,gym,a person exhaling sharply through their teeth after exertion
Pitch/Register,hissing,Organic,goose,pond,the aggressive hiss of a goose protecting its nest
Pitch/Register,hissing,Organic,beetle,jungle,the defensive hiss of a large Madagascar cockroach
Pitch/Register,hissing,Organic,lizard,scrub,the sound of a lizard's scales rubbing against a rock
Pitch/Register,hissing,Organic,breathing,nursery,the sound of air moving through a person's nose
Pitch/Register,hissing,Organic,whisper,gallery,a long sibilant whisper echoing in a hall
Pitch/Register,hissing,Organic,alligator,swamp,the low-pitched hiss of an alligator on a bank
Pitch/Register,hissing,Organic,cicadas,field,the continuous high-frequency buzzing of a cicada swarm
Pitch/Register,hissing,Organic,bats,cave,the sound of a thousand bats chittering in a cavern
Pitch/Register,hissing,Organic,shrimp,reef,the collective clicking of shrimp sounding like a hiss
Pitch/Register,hissing,Organic,wings,garden,the high-speed whir of a hummingbird near a flower
Pitch/Register,hissing,Organic,shell,beach,the sound of the wind in a large conch shell
Pitch/Register,hissing,Organic,voice,hallway,"a person making a long ""shh"" sound in a corridor"
Pitch/Register,hissing,Organic,throat,studio,the sibilant sound of a vocalist's breath
Pitch/Register,hissing,Organic,skin,spa,the sound of hands rubbing together with dry skin
Pitch/Register,hissing,Organic,grasshopper,meadow,the sound of a grasshopper's wings in flight
Pitch/Register,hissing,Domestic,spray bottle,kitchen,the nozzle of a cleaning spray being used
Pitch/Register,hissing,Domestic,aerosol,bathroom,the discharge of an aerosol deodorant can
Pitch/Register,hissing,Domestic,kettle,kitchen,steam escaping the whistle of a boiling tea kettle
Pitch/Register,hissing,Domestic,frying,kitchenette,the sound of water hitting hot oil in a pan
Pitch/Register,hissing,Domestic,soda,porch,the sound of a carbonated drink being poured into a glass
Pitch/Register,hissing,Domestic,vacuum,hall,the sound of air rushing into a vacuum cleaner hose
Pitch/Register,hissing,Domestic,iron,laundry,a burst of steam from a hot clothes iron
Pitch/Register,hissing,Domestic,radiator,apartment,steam escaping from a valve on a cast iron radiator
Pitch/Register,hissing,Domestic,faucet,bathroom,the sound of air in a water pipe when a tap opens
Pitch/Register,hissing,Domestic,foil,kitchen,the sound of aluminum foil being unfolded
Pitch/Register,hissing,Domestic,lighter,porch,the sound of gas escaping a butane lighter
Pitch/Register,hissing,Domestic,extinguisher,garage,the discharge of a dry chemical fire extinguisher
Pitch/Register,hissing,Domestic,soup,kitchen,the sound of steam rising from a hot bowl of soup
Pitch/Register,hissing,Domestic,shower,bathroom,the sound of a high-pressure shower head
Pitch/Register,hissing,Domestic,blender,pantry,the sound of air being whipped into a liquid
Pitch/Register,hissing,Domestic,fan,bedroom,the sound of a high-speed electric fan
Pitch/Register,hissing,Domestic,heater,basement,the sound of a forced-air furnace starting up
Pitch/Register,hissing,Domestic,door,house,the sound of a pneumatic door closer venting air
Pitch/Register,hissing,Electronic,static,radio,the sound of white noise between stations on an FM radio
Pitch/Register,hissing,Electronic,capacitor,lab,the sound of a failing capacitor leaking gas
Pitch/Register,hissing,Electronic,monitor,attic,the high-pitched whine of an old CRT screen
Pitch/Register,hissing,Electronic,speaker,studio,the faint hiss of a high-gain amplifier with no input
Pitch/Register,hissing,Electronic,plasma,science fair,the sound of a plasma globe discharging
Pitch/Register,hissing,Electronic,led,billboard,the high-frequency buzz of a large led display
Pitch/Register,hissing,Electronic,transformer,pole,the sound of a failing power transformer
Pitch/Register,hissing,Electronic,spark,garage,the continuous snapping of an electric arc
Pitch/Register,hissing,Electronic,welder,workshop,the sizzle of an arc welder on a metal seam
Pitch/Register,hissing,Electronic,taser,security,the rapid pulsing of an electric taser arc
Pitch/Register,hissing,Electronic,synth,studio,a noise-based filter sweep on a synthesizer
Pitch/Register,hissing,Electronic,interference,attic,the digital noise of a distorted radio signal
Pitch/Register,hissing,Electronic,flash,studio,the sound of a camera flash charging
Pitch/Register,hissing,Electronic,microwave,kitchen,the sound of an industrial microwave running
Pitch/Register,hissing,Electronic,modem,office,the high-pitched chirping of a dial-up modem
Pitch/Register,hissing,Electronic,fan,pc,the whir of a small computer cooling fan
Pitch/Register,hissing,Electronic,buzzer,classroom,the sound of an old intercom buzzer
Pitch/Register,thunderous,Musical,timpani,concert hall,a large timpani drum being struck with a heavy mallet
Pitch/Register,thunderous,Musical,pipe organ,cathedral,the lowest note of a pipe organ with all stops open
Pitch/Register,thunderous,Musical,taiko drum,temple,a massive wooden mallet striking a giant taiko drum
Pitch/Register,thunderous,Musical,gong,monastery,a bronze gong being struck with a heavy padded beater
Pitch/Register,thunderous,Musical,bass drum,stadium,the deep thud of a marching bass drum in a bowl
Pitch/Register,thunderous,Musical,piano,ballroom,a heavy low-octave cluster on a grand piano
Pitch/Register,thunderous,Musical,choir,abbey,a hundred-voice choir singing a fortissimo chord
Pitch/Register,thunderous,Musical,brass,atrium,a full brass section playing a loud fanfare
Pitch/Register,thunderous,Musical,didgeridoo,canyon,a deep didgeridoo drone echoing off stone walls
Pitch/Register,thunderous,Musical,church bell,tower,a massive church bell swinging and ringing
Pitch/Register,thunderous,Musical,double bass,vault,a low open string on an upright bass being bowed
Pitch/Register,thunderous,Musical,log drum,jungle,a hollowed tree trunk being struck with a large beam
Pitch/Register,thunderous,Musical,synthesizer,studio,a sub-bass oscillator pulsing through a subwoofer
Pitch/Register,thunderous,Musical,cello,conservatory,the c-string of a cello being bowed with force
Pitch/Register,thunderous,Musical,harpsichord,gallery,the resonance of a harpsichord in a large hall
Pitch/Register,thunderous,Musical,percussion,warehouse,a large drum section playing in a hollow room
Pitch/Register,thunderous,Musical,bassoon,hallway,a bassoon playing its lowest note in a stone space
Pitch/Register,thunderous,Musical,organ,chapel,the vibration of a reed organ's bellows at max
Pitch/Register,thunderous,Mechanical,jet engine,hangar,the roar of a jet turbine engine at takeoff power
Pitch/Register,thunderous,Mechanical,steam locomotive,railyard,the roar of a steam engine moving a heavy load
Pitch/Register,thunderous,Mechanical,pile driver,construction,a massive pile driver impacting a steel post
Pitch/Register,thunderous,Mechanical,wrecking ball,demolition,a wrecking ball hitting a concrete wall
Pitch/Register,thunderous,Mechanical,hydraulic press,factory,a press crushing a block of solid steel
Pitch/Register,thunderous,Mechanical,bulldozer,quarry,the vibration of a bulldozer blade moving earth
Pitch/Register,thunderous,Mechanical,generator,utility,the roar of a massive diesel generator bank
Pitch/Register,thunderous,Mechanical,excavator,mine,the grinding of heavy treads on stone
Pitch/Register,thunderous,Mechanical,printing press,newsroom,the rhythmic roar of a high-speed press
Pitch/Register,thunderous,Mechanical,turbine,dam,the steady roar of a hydroelectric turbine floor
Pitch/Register,thunderous,Mechanical,rocket,launchpad,the roar of a rocket engine during ignition
Pitch/Register,thunderous,Mechanical,shredder,recycling plant,an industrial metal shredder pulverizing a car
Pitch/Register,thunderous,Mechanical,crane,dockside,the groan of a winch lifting a heavy container
Pitch/Register,thunderous,Mechanical,oil derrick,oil field,the groaning of a large industrial oil pump
Pitch/Register,thunderous,Mechanical,propeller,underwater,the throb of a ship's propeller heard from below
Pitch/Register,thunderous,Mechanical,furnace,basement,the roar of an industrial boiler firing up
Pitch/Register,thunderous,Mechanical,fan,tunnel,the drone of giant ventilation fans in a subway
Pitch/Register,thunderous,Mechanical,truck,loading dock,the idling of a semi-truck in a concrete bay
Pitch/Register,thunderous,Environmental,thunder,canyon,a nearby roll of thunder echoing through a gorge
Pitch/Register,thunderous,Environmental,waterfall,abyss,a massive waterfall hitting a rocky pool
Pitch/Register,thunderous,Environmental,ocean,coastline,a massive wave breaking against a sea wall
Pitch/Register,thunderous,Environmental,volcano,island,the rumble of a volcanic eruption across a plain
Pitch/Register,thunderous,Environmental,landslide,mountain,a rockslide tumbling down a steep slope
Pitch/Register,thunderous,Environmental,earthquake,valley,the vibration of the earth shifting in a tremor
Pitch/Register,thunderous,Environmental,avalanche,slope,the resonant roar of a powder avalanche
Pitch/Register,thunderous,Environmental,geyser,park,the roar of steam and water from a large eruption
Pitch/Register,thunderous,Environmental,fire,wildlands,the roar of a forest fire consuming timber
Pitch/Register,thunderous,Environmental,rain,jungle,the continuous sound of a tropical downpour
Pitch/Register,thunderous,Environmental,wind,tundra,the howling of a gale across open plains
Pitch/Register,thunderous,Environmental,glacier,arctic,the massive groan of a glacier calving
Pitch/Register,thunderous,Environmental,mud,wetlands,the popping of a massive mud bubble
Pitch/Register,thunderous,Environmental,ice,lake,the resonant boom of a frozen lake cracking
