category,tag,domain,source,environment,scenario
Pitch/Register,rumbling,Organic,gorilla,jungle,the deep and rhythmic thumping of a gorilla's chest
Pitch/Register,rumbling,Organic,whale,ocean,the low and sustained moan of a blue whale underwater
Pitch/Register,rumbling,Organic,bear,den,the deep and steady growl of a grizzly bear in a cave
Pitch/Register,rumbling,Organic,heartbeat,stethoscopy,the low-frequency thumping of a heart during exertion
Pitch/Register,rumbling,Organic,hooves,meadow,the deep and steady gallop of a large horse on soft turf
Pitch/Register,rumbling,Organic,stomach,library,the low and steady gurgle of a hungry stomach
Pitch/Register,rumbling,Organic,throat singer,temple,the deep and sustained resonance of a monk's chant
Pitch/Register,rumbling,Organic,wings,cliffside,the low-frequency whoosh of a condor's wings in flight
Pitch/Register,rumbling,Organic,breathing,cave,the deep and steady breathing of an animal in a den
Pitch/Register,rumbling,Organic,laughter,ballroom,the low and steady sound of a massive group laughing
Pitch/Register,rumbling,Organic,voice,hallway,the deep and sustained quality of a bass voice echoing
Pitch/Register,rumbling,Organic,shiver,bedroom,the low-frequency vibration of a person shivering in bed
Pitch/Register,rumbling,Organic,bark,kennel,the deep and resonant bark of a large guard dog
Pitch/Register,rumbling,Organic,snore,house,the low and steady sound of a heavy snore through a floor
Pitch/Register,rumbling,Domestic,washing machine,laundry,the low and steady thumping of a heavy laundry load
Pitch/Register,rumbling,Domestic,refrigerator,kitchen,the deep and steady hum of a commercial compressor
Pitch/Register,rumbling,Domestic,fireplace,cabin,the low and steady roar of a large wood fire in a hearth
Pitch/Register,rumbling,Domestic,heater,basement,the deep and steady roar of an electric furnace blower
Pitch/Register,rumbling,Domestic,wardrobe,bedroom,the low and rhythmic groan of a wooden chest sliding
Pitch/Register,rumbling,Domestic,stairs,attic,the deep and steady creaking of floorboards underfoot
Pitch/Register,rumbling,Domestic,door,mansion,the low-frequency thud of a solid oak door closing
Pitch/Register,rumbling,Domestic,vacuum,hall,the deep and steady roar of a professional vacuum cleaner
Pitch/Register,rumbling,Domestic,curtain,theatre,the low and steady rustle of a massive stage curtain
Pitch/Register,rumbling,Domestic,rug,yard,the deep and rhythmic thumping of a rug being beaten
Pitch/Register,rumbling,Domestic,boiling,bakery,the low and steady bubbling of a large vat of water
Pitch/Register,rumbling,Domestic,fan,warehouse,the deep and steady drone of a large industrial fan
Pitch/Register,rumbling,Domestic,freezer,pantry,the low and steady hum of a commercial chest freezer
Pitch/Register,rumbling,Domestic,boiler,utility room,the deep and steady roar of an industrial boiler
Pitch/Register,rumbling,Domestic,safe,vault,the low-frequency clunk of a steel safe door closing
Pitch/Register,rumbling,Domestic,book,library,the deep and resonant thud of a stack of books falling
Pitch/Register,rumbling,Domestic,pipe,bathroom,the low and steady thud of water hammer in a basement
Pitch/Register,rumbling,Domestic,mattress,bedroom,the deep and rhythmic sound of a person jumping on a bed
Pitch/Register,rumbling,Electronic,transformer,substation,the low and steady hum of a power substation grid
Pitch/Register,rumbling,Electronic,subwoofer,concert,the deep and steady pulse of a massive speaker array
Pitch/Register,rumbling,Electronic,grid,city,the low-frequency drone of an urban electrical transformer
Pitch/Register,rumbling,Electronic,analog synth,studio,a deep and sustained bass drone from a synthesizer
Pitch/Register,rumbling,Electronic,tube amp,stage,the low and steady hum of a vintage guitar amplifier
Pitch/Register,rumbling,Electronic,motor,factory,the deep and steady hum of a massive induction motor
Pitch/Register,rumbling,Electronic,server fans,data center,the low and steady drone of high-speed server fans
Pitch/Register,rumbling,Electronic,organ blower,church,the deep and steady hum of an electric organ's blower
Pitch/Register,rumbling,Electronic,microwave,kitchen,the low-frequency hum of an industrial microwave running
Pitch/Register,rumbling,Electronic,welder,workshop,the deep and steady buzz of an industrial arc welder
Pitch/Register,rumbling,Electronic,speaker stack,stadium,the low and sustained thrum of a speaker array
Pitch/Register,rumbling,Electronic,generator,utility,the deep and steady roar of a massive power generator
Pitch/Register,rumbling,Electronic,taser arc,security,the low and rhythmic pulsing of an electric taser
Pitch/Register,rumbling,Electronic,flash,gallery,the low-frequency whine of a large flash bank charging
Pitch/Register,rumbling,Electronic,static,attic,the deep and steady crackle of noise on an untuned radio
Pitch/Register,rumbling,Electronic,line,factory,the low-frequency clatter of an automated assembly line
Pitch/Register,rumbling,Electronic,oscilloscope,lab,the low and steady beep of a frequency generator
Pitch/Register,rumbling,Electronic,solenoid,utility,the deep and rhythmic clicking of a large industrial relay
