category,tag,domain,source,environment,scenario,file
spatial/near,near,domestic,knife,kitchen,a chef's knife hitting a cutting board directly in front of the cook,near/near_domestic_0182.mp3
spatial/near,near,domestic,remote,parlor,a remote control button being clicked right under the thumb,near/near_domestic_0183.mp3
spatial/near,near,domestic,door,hallway,a doorknob being turned and clicking right next to the hand,near/near_domestic_0184.mp3
spatial/near,near,domestic,blanket,bedroom,a wool blanket being pulled up to the ears,near/near_domestic_0185.mp3
spatial/near,near,domestic,timer,kitchen,an egg timer ticking on a counter right in front of the cook,near/near_domestic_0186.mp3
spatial/near,near,domestic,bag,pantry,a paper bag being crinkled right next to the face,near/near_domestic_0187.mp3
spatial/near,near,domestic,brush,bedroom,a hairbrush moving across the scalp,near/near_domestic_0188.mp3
spatial/near,near,electronic,earbuds,office,sound leaking from a pair of earbuds sitting on a desk,near/near_electronic_0189.mp3
spatial/near,near,electronic,piezo,lab,a small piezo buzzer beeping on a workbench directly in front of a technician,near/near_electronic_0190.mp3
spatial/near,near,electronic,phone,bedroom,a phone screen being tapped by a finger right next to the face,near/near_electronic_0191.mp3
spatial/near,near,electronic,capacitor,workshop,a capacitor discharging with a snap right next to the hands,near/near_electronic_0192.mp3
spatial/near,near,electronic,monitor,desk,the faint high-pitched whine of a monitor heard from a foot away,near/near_electronic_0193.mp3
spatial/near,near,electronic,relay,panel,a mechanical relay clicking inside a box held in the hand,near/near_electronic_0194.mp3
spatial/near,near,electronic,spark,garage,a spark jumping between two wires held by pliers,near/near_electronic_0195.mp3
spatial/near,near,electronic,led,factory,an led being clicked into a socket right in front of the eyes,near/near_electronic_0196.mp3
spatial/near,near,electronic,hard drive,office,the spinning of a hard drive heard from the laptop on a lap,near/near_electronic_0197.mp3
spatial/near,near,electronic,radio,living room,the static of a handheld radio held near the ear,near/near_electronic_0198.mp3
spatial/near,near,electronic,transformer,closet,the hum of a small wall-wart transformer right next to an outlet,near/near_electronic_0199.mp3
spatial/near,near,electronic,keyboard,study,the clicking of mechanical keys right under the fingers,near/near_electronic_0200.mp3
spatial/near,near,electronic,mouse,den,a computer mouse clicking right under the palm,near/near_electronic_0201.mp3
spatial/near,near,electronic,battery,garage,a battery charger humming on a bench right in front of a person,near/near_electronic_0202.mp3
spatial/near,near,electronic,sensor,entryway,a motion sensor clicking as it activates over a head,near/near_electronic_0203.mp3
spatial/near,near,electronic,wire,workshop,a thin wire being stripped with a tool held in the hand,near/near_electronic_0204.mp3
spatial/near,near,electronic,flash,studio,a camera flash charging right next to the ear,near/near_electronic_0205.mp3
spatial/near,direct,musical,trumpet,studio,a trumpet bell aimed directly at a sound-absorbing wall,direct/direct_musical_0102.mp3
spatial/near,direct,musical,snare drum,garage,a snare drum struck in the center with a stick in a dry room,direct/direct_musical_0103.mp3
spatial/near,direct,musical,piano,hall,a piano note played with the lid removed and no pedal,direct/direct_musical_0104.mp3
spatial/near,direct,musical,flute,meadow,a flute note blown straight into a windless air,direct/direct_musical_0105.mp3
spatial/near,direct,musical,triangle,theatre,a triangle struck once with a metal rod in a dead space,direct/direct_musical_0106.mp3
spatial/near,direct,musical,violin,attic,a violin string plucked pizzicato with a clear line of sight,direct/direct_musical_0107.mp3
spatial/near,direct,musical,harp,gallery,a harp string snapped and released in a room with no curtains,direct/direct_musical_0108.mp3
spatial/near,direct,musical,tambourine,festival,a tambourine hit with a single palm strike in an open field,direct/direct_musical_0109.mp3
spatial/near,direct,musical,gong,temple,a gong struck with a hard mallet in a small stone chamber,direct/direct_musical_0110.mp3
spatial/near,direct,musical,xylophone,classroom,a xylophone bar hit with a plastic mallet in a quiet room,direct/direct_musical_0111.mp3
spatial/near,direct,musical,cello,conservatory,a cello note played with a short sharp bow stroke,direct/direct_musical_0112.mp3
spatial/near,direct,musical,harmonium,shrine,a harmonium note sounding through a single open reed,direct/direct_musical_0113.mp3
spatial/near,direct,musical,banjo,porch,a banjo string plucked with a metal pick on a wooden deck,direct/direct_musical_0114.mp3
spatial/near,direct,musical,organ,church,a single organ pipe sounding in an empty stone hallway,direct/direct_musical_0115.mp3
spatial/near,direct,musical,handbells,chapel,a handbell rung once with a sharp forward motion,direct/direct_musical_0116.mp3
spatial/near,direct,musical,didgeridoo,canyon,a didgeridoo blast directed at a flat rock face,direct/direct_musical_0117.mp3
spatial/near,direct,musical,guitar,club,an electric guitar string being hit by a heavy plectrum,direct/direct_musical_0118.mp3
spatial/near,direct,mechanical,pneumatic valve,factory,a pneumatic valve releasing a burst of air into an open space,direct/direct_mechanical_0119.mp3
spatial/near,direct,mechanical,hammer,workshop,a hammer striking a flat metal plate on a solid bench,direct/direct_mechanical_0120.mp3
spatial/near,direct,mechanical,drill,garage,a drill bit hitting a sheet of steel with a clear impact,direct/direct_mechanical_0121.mp3
spatial/near,direct,mechanical,piston,engine room,a pneumatic piston firing with no obstacles in the way,direct/direct_mechanical_0122.mp3
spatial/near,direct,mechanical,shutter,studio,a mechanical camera shutter firing in a soundproof room,direct/direct_mechanical_0123.mp3
spatial/near,direct,mechanical,lathe,machine shop,a lathe tool biting into a spinning brass rod,direct/direct_mechanical_0124.mp3
spatial/near,direct,mechanical,ratchet,warehouse,a metal ratchet clicking in a large empty room,direct/direct_mechanical_0125.mp3
spatial/near,direct,mechanical,typewriter,office,a typewriter key striking a platen with a sharp thud,direct/direct_mechanical_0126.mp3
spatial/near,direct,mechanical,stapler,desk,a heavy stapler firing into a wooden block,direct/direct_mechanical_0127.mp3
spatial/near,direct,mechanical,gears,tower,two large gears engaging with a sharp metallic snap,direct/direct_mechanical_0128.mp3
spatial/near,direct,mechanical,saw,woodshop,a circular saw blade hitting a hard knot in a board,direct/direct_mechanical_0129.mp3
spatial/near,direct,mechanical,latch,barn,a metal gate latch slamming into a steel post,direct/direct_mechanical_0130.mp3
spatial/near,direct,mechanical,punch,factory,a metal punch striking a hole in an aluminum sheet,direct/direct_mechanical_0131.mp3
spatial/near,direct,mechanical,solenoid,lab,an industrial solenoid clicking shut on a workbench,direct/direct_mechanical_0132.mp3
spatial/near,direct,mechanical,pulley,shipyard,a metal pulley cable snapping under a heavy load,direct/direct_mechanical_0133.mp3
spatial/near,direct,mechanical,fan,office,a desk fan blade hitting a plastic shroud,direct/direct_mechanical_0134.mp3
spatial/near,direct,mechanical,pump,basement,a water pump thudding against a concrete floor,direct/direct_mechanical_0135.mp3
spatial/near,direct,mechanical,wrench,garage,a heavy wrench falling onto a flat stone floor,direct/direct_mechanical_0136.mp3
spatial/near,direct,environmental,lightning,plains,a lightning strike hitting a nearby metal pole,direct/direct_environmental_0137.mp3
spatial/near,direct,environmental,thunder,canyon,a sharp crack of thunder echoing off a single wall,direct/direct_environmental_0138.mp3
spatial/near,direct,environmental,ice,glacier,a thick sheet of ice cracking with a sudden snap,direct/direct_environmental_0139.mp3
spatial/near,direct,environmental,stone,quarry,a granite slab splitting after a single chisel strike,direct/direct_environmental_0140.mp3
spatial/near,direct,environmental,hail,greenhouse,a large hailstone shattering a glass pane overhead,direct/direct_environmental_0141.mp3
spatial/near,direct,environmental,branch,forest,a dry tree branch snapping in half under tension,direct/direct_environmental_0142.mp3
spatial/near,direct,environmental,geyser,valley,a geyser releasing a sudden burst of high-pressure steam,direct/direct_environmental_0143.mp3
spatial/near,direct,environmental,volcano,island,a volcanic rock exploding as it hits a flat ledge,direct/direct_environmental_0144.mp3
spatial/near,direct,environmental,wave,shoreline,a wave hitting a hollow rock with a sharp slap,direct/direct_environmental_0145.mp3
spatial/near,direct,environmental,rain,tin roof,a large raindrop hitting a corrugated metal roof,direct/direct_environmental_0146.mp3
spatial/near,direct,environmental,sand,desert,a gust of sand hitting a glass window in a storm,direct/direct_environmental_0147.mp3
spatial/near,direct,environmental,mist,fjord,a water droplet hitting a metal surface in a harbor,direct/direct_environmental_0148.mp3
spatial/near,direct,environmental,fire,campsite,a dry log popping and releasing a spark,direct/direct_environmental_0149.mp3
spatial/near,direct,environmental,snow,tundra,a foot stepping on a crust of frozen snow,direct/direct_environmental_0150.mp3
spatial/near,direct,environmental,bubble,marsh,a gas bubble popping on the surface of water,direct/direct_environmental_0151.mp3
spatial/near,direct,environmental,steam,vent,a steam vent hissing from a hole in a rock,direct/direct_environmental_0152.mp3
spatial/near,direct,environmental,thistle,prairie,a seed pod bursting in the dry heat,direct/direct_environmental_0153.mp3
spatial/near,direct,organic,human,hallway,a person snapping their fingers in a quiet room,direct/direct_organic_0154.mp3
spatial/near,direct,organic,bird,aviary,a bird's beak clicking together during a peck,direct/direct_organic_0155.mp3
spatial/near,direct,organic,teeth,dentist,a person's teeth clicking together once,direct/direct_organic_0156.mp3
spatial/near,direct,organic,bone,forest,a dry animal bone snapping under a heavy step,direct/direct_organic_0157.mp3
spatial/near,direct,organic,claws,attic,a rodent's claw clicking on a metal pipe,direct/direct_organic_0158.mp3
spatial/near,direct,organic,hoof,stable,a horse's hoof hitting a concrete floor,direct/direct_organic_0159.mp3
spatial/near,direct,organic,wings,garden,a bird's wings flapping once during takeoff,direct/direct_organic_0160.mp3
spatial/near,direct,organic,tail,desert,a rattlesnake's rattle making a single sharp strike,direct/direct_organic_0161.mp3
spatial/near,direct,organic,chest,rainforest,a gorilla thumping its chest once with force,direct/direct_organic_0162.mp3
spatial/near,direct,organic,mouth,kitchen,a person clicking their tongue against the palate,direct/direct_organic_0163.mp3
spatial/near,direct,organic,skin,spa,a hand slapping the surface of a pool of water,direct/direct_organic_0164.mp3
spatial/near,direct,organic,leaf,garden,a dry leaf crunching once under a boot,direct/direct_organic_0165.mp3
spatial/near,direct,organic,pollen,field,a dry seed pod exploding in the sun,direct/direct_organic_0166.mp3
spatial/near,direct,organic,eggshall,barn,an eggshell cracking against a metal bowl,direct/direct_organic_0167.mp3
spatial/near,direct,organic,insect,meadow,a grasshopper's legs clicking during a jump,direct/direct_organic_0168.mp3
spatial/near,direct,organic,antler,tundra,two elk antlers clashing together with a snap,direct/direct_organic_0169.mp3
spatial/near,direct,organic,toe,nursery,a person's toe joint cracking during a stretch,direct/direct_organic_0170.mp3
spatial/near,direct,domestic,light switch,hallway,a plastic switch being flipped in a quiet room,direct/direct_domestic_0171.mp3
spatial/near,direct,domestic,door latch,foyer,a metal latch clicking into a strike plate,direct/direct_domestic_0172.mp3
spatial/near,direct,domestic,glass,dining room,a wine glass being set on a marble table,direct/direct_domestic_0173.mp3
spatial/near,direct,domestic,ceramic,kitchen,a ceramic plate shattering on a tile floor,direct/direct_domestic_0174.mp3
spatial/near,direct,domestic,key,entryway,a metal key hitting a wooden table,direct/direct_domestic_0175.mp3
spatial/near,direct,domestic,scissors,hobby room,metal scissors cutting through cardboard,direct/direct_domestic_0176.mp3
spatial/near,direct,domestic,match,kitchen,a wooden match being struck in a box,direct/direct_domestic_0177.mp3
spatial/near,direct,domestic,knife,kitchen,a chef's knife hitting a cutting board,direct/direct_domestic_0178.mp3
spatial/near,direct,domestic,spoon,dining room,a metal spoon hitting a ceramic bowl,direct/direct_domestic_0179.mp3
spatial/near,direct,domestic,bottle,cellar,a glass bottle clinking against another,direct/direct_domestic_0180.mp3
spatial/near,direct,domestic,drawer,bedroom,a wooden drawer being slammed shut,direct/direct_domestic_0181.mp3
spatial/near,direct,domestic,staple,office,a stapler firing into a stack of paper,direct/direct_domestic_0182.mp3
spatial/near,direct,domestic,coin,foyer,a large coin dropping onto a hardwood floor,direct/direct_domestic_0183.mp3
spatial/near,direct,domestic,curtain,living room,a metal curtain ring hitting a rod,direct/direct_domestic_0184.mp3
spatial/near,direct,domestic,pen,study,a ballpoint pen being clicked open,direct/direct_domestic_0185.mp3
spatial/near,direct,domestic,box,attic,a cardboard box being taped shut,direct/direct_domestic_0186.mp3
spatial/near,direct,domestic,pot,kitchen,a metal pot lid hitting a tile floor,direct/direct_domestic_0187.mp3
spatial/near,direct,electronic,relay,server room,a mechanical relay clicking shut in a panel,direct/direct_electronic_0188.mp3
spatial/near,direct,electronic,capacitor,workbench,a capacitor discharging with a sharp pop,direct/direct_electronic_0189.mp3
spatial/near,direct,electronic,spark,garage,an electric spark jumping from a battery,direct/direct_electronic_0190.mp3
spatial/near,direct,electronic,circuit breaker,utility room,a circuit breaker tripping with a snap,direct/direct_electronic_0191.mp3
spatial/near,direct,electronic,synthesizer,studio,a synth producing a sound with zero attack,direct/direct_electronic_0192.mp3
spatial/near,direct,electronic,switch,lab,a high-quality toggle switch being flipped,direct/direct_electronic_0193.mp3
spatial/near,direct,electronic,buzzer,factory,an electronic buzzer starting its beep suddenly,direct/direct_electronic_0194.mp3
spatial/near,direct,electronic,monitor,office,a crt monitor turning on with a click,direct/direct_electronic_0195.mp3
spatial/near,direct,electronic,laptop,library,a laptop lid being closed with a snap,direct/direct_electronic_0196.mp3
spatial/near,direct,electronic,keyboard,study,a mechanical keyboard key being pressed,direct/direct_electronic_0197.mp3
spatial/near,direct,electronic,mouse,office,a computer mouse clicking once,direct/direct_electronic_0198.mp3
spatial/near,direct,electronic,battery,store,a battery snapping into a compartment,direct/direct_electronic_0199.mp3
spatial/near,direct,electronic,led,factory,an led being clicked into a socket mount,direct/direct_electronic_0200.mp3
spatial/near,direct,electronic,sensor,entryway,a motion sensor clicking as it activates,direct/direct_electronic_0201.mp3
spatial/near,direct,electronic,phone,bedroom,a phone screen being tapped once,direct/direct_electronic_0202.mp3
spatial/near,direct,electronic,cable,studio,a jack being plugged into an amplifier,direct/direct_electronic_0203.mp3
spatial/near,direct,electronic,alarm,building,a digital alarm beep starting at full volume,direct/direct_electronic_0204.mp3
spatial/near,focused,musical,tuning fork,lab,a tuning fork struck and held against a resonant block,focused/focused_musical_0104.mp3
spatial/near,focused,musical,violin,studio,a violin bow moving across a string with heavy rosin,focused/focused_musical_0105.mp3
spatial/near,focused,musical,flute,meadow,a flute playing a single high-register note,focused/focused_musical_0106.mp3
spatial/near,focused,musical,piano,hall,a pianist striking a single key with great force,focused/focused_musical_0107.mp3
spatial/near,focused,musical,snare drum,garage,a drumstick hitting a snare in the exact center,focused/focused_musical_0108.mp3
spatial/near,focused,musical,triangle,theatre,a triangle struck once with a thin needle beater,focused/focused_musical_0109.mp3
spatial/near,focused,musical,harp,gallery,a harp string plucked and released suddenly,focused/focused_musical_0110.mp3
spatial/near,focused,musical,cello,conservatory,a cello player performing a sharp pizzicato,focused/focused_musical_0111.mp3
spatial/near,focused,musical,trumpet,plaza,a trumpet fanfare starting with a clean attack,focused/focused_musical_0112.mp3
spatial/near,focused,musical,xylophone,classroom,a xylophone bar hit with a hard plastic mallet,focused/focused_musical_0113.mp3
spatial/near,focused,musical,tambourine,festival,a tambourine hit with a single sharp strike,focused/focused_musical_0114.mp3
spatial/near,focused,musical,gong,monastery,a gong hit in the center with a hard mallet,focused/focused_musical_0115.mp3
spatial/near,focused,musical,banjo,porch,a banjo string snapped against a metal fret,focused/focused_musical_0116.mp3
spatial/near,focused,musical,organ,church,a single organ pipe sounding in a quiet room,focused/focused_musical_0117.mp3
spatial/near,focused,musical,handbells,chapel,a handbell rung once with a sharp motion,focused/focused_musical_0118.mp3
spatial/near,focused,musical,didgeridoo,canyon,a didgeridoo drone directed into a narrow gap,focused/focused_musical_0119.mp3
spatial/near,focused,musical,guitar,club,an electric guitar string snapped with a heavy pick,focused/focused_musical_0120.mp3
spatial/near,focused,mechanical,laser,factory,a laser cutting through a sheet of metal,focused/focused_mechanical_0121.mp3
spatial/near,focused,mechanical,drill,garage,a drill bit boring into a metal plate,focused/focused_mechanical_0122.mp3
spatial/near,focused,mechanical,lathe,machine shop,a lathe tool carving a narrow groove in brass,focused/focused_mechanical_0123.mp3
spatial/near,focused,mechanical,piston,engine room,a pneumatic piston firing with a sharp hiss,focused/focused_mechanical_0124.mp3
spatial/near,focused,mechanical,shutter,studio,a camera shutter firing in a soundproof room,focused/focused_mechanical_0125.mp3
spatial/near,focused,mechanical,hammer,workshop,a hammer striking a nail in a solid beam,focused/focused_mechanical_0126.mp3
spatial/near,focused,mechanical,ratchet,warehouse,a metal ratchet clicking once sharply,focused/focused_mechanical_0127.mp3
spatial/near,focused,mechanical,typewriter,office,a typewriter key striking the paper through a ribbon,focused/focused_mechanical_0128.mp3
spatial/near,focused,mechanical,stapler,desk,a heavy-duty stapler firing into a wooden block,focused/focused_mechanical_0129.mp3
spatial/near,focused,mechanical,latch,barn,a metal gate latch snapping into its socket,focused/focused_mechanical_0130.mp3
spatial/near,focused,mechanical,valve,shipyard,a high-pressure valve releasing a sharp blast,focused/focused_mechanical_0131.mp3
spatial/near,focused,mechanical,gears,tower,two gears engaging with a sharp metallic snap,focused/focused_mechanical_0132.mp3
spatial/near,focused,mechanical,saw,woodshop,a saw blade hitting a hard knot in wood,focused/focused_mechanical_0133.mp3
spatial/near,focused,mechanical,punch,factory,a metal punch striking a sheet of aluminum,focused/focused_mechanical_0134.mp3
spatial/near,focused,mechanical,solenoid,lab,an industrial solenoid clicking shut on a bench,focused/focused_mechanical_0135.mp3
spatial/near,focused,mechanical,pulley,shipyard,a pulley cable snapping under tension,focused/focused_mechanical_0136.mp3
spatial/near,focused,mechanical,fan,office,a fan blade hitting its housing with a tap,focused/focused_mechanical_0137.mp3
spatial/near,focused,mechanical,wrench,garage,a heavy wrench hitting a flat stone floor,focused/focused_mechanical_0138.mp3
spatial/near,focused,environmental,lightning,plains,a lightning strike hitting a metal pole nearby,focused/focused_environmental_0139.mp3
spatial/near,focused,environmental,thunder,canyon,a sharp crack of thunder echoing off a rock,focused/focused_environmental_0140.mp3
spatial/near,focused,environmental,ice,glacier,a thick sheet of ice cracking with a snap,focused/focused_environmental_0141.mp3
spatial/near,focused,environmental,stone,quarry,a granite slab splitting after a chisel strike,focused/focused_environmental_0142.mp3
spatial/near,focused,environmental,hail,greenhouse,a large hailstone shattering a glass pane,focused/focused_environmental_0143.mp3
spatial/near,focused,environmental,branch,forest,a dry tree branch snapping under tension,focused/focused_environmental_0144.mp3
spatial/near,focused,environmental,geyser,valley,a geyser releasing a burst of high pressure,focused/focused_environmental_0145.mp3
spatial/near,focused,environmental,volcano,island,a volcanic rock exploding as it hits a ledge,focused/focused_environmental_0146.mp3
spatial/near,focused,environmental,wave,shoreline,a wave hitting a rock with a sharp slap,focused/focused_environmental_0147.mp3
spatial/near,focused,environmental,rain,tin roof,a large raindrop hitting a metal roof,focused/focused_environmental_0148.mp3
spatial/near,focused,environmental,sand,desert,a gust of sand hitting a glass window,focused/focused_environmental_0149.mp3
spatial/near,focused,environmental,mist,fjord,a water droplet hitting a metal surface,focused/focused_environmental_0150.mp3
spatial/near,focused,environmental,bubble,marsh,a gas bubble popping on the water surface,focused/focused_environmental_0151.mp3
spatial/near,focused,environmental,steam,vent,a steam vent hissing from a rock hole,focused/focused_environmental_0152.mp3
spatial/near,focused,organic,woodpecker,woods,a woodpecker hammering on a hollow spot on a tree,focused/focused_organic_0153.mp3
spatial/near,focused,organic,chest,rainforest,a gorilla thumping its chest once,focused/focused_organic_0154.mp3
spatial/near,focused,organic,skin,spa,a hand slapping the surface of water,focused/focused_organic_0155.mp3
spatial/near,focused,organic,leaf,garden,a dry leaf crunching under a boot,focused/focused_organic_0156.mp3
spatial/near,focused,organic,antler,tundra,elk antlers clashing together with a snap,focused/focused_organic_0157.mp3
spatial/near,focused,domestic,fountain pen,office,a fountain pen tip scratching on heavy paper,focused/focused_domestic_0158.mp3
spatial/near,focused,domestic,light switch,hallway,a plastic switch being flipped in a room,focused/focused_domestic_0159.mp3
spatial/near,focused,domestic,coin,foyer,a large coin dropping onto a floor,focused/focused_domestic_0160.mp3
spatial/near,focused,electronic,buzzer,factory,an electronic buzzer starting its beep,focused/focused_electronic_0161.mp3
spatial/near,focused,electronic,alarm,building,a digital alarm beep at full volume,focused/focused_electronic_0162.mp3
spatial/near,precise,musical,metronome,study,a mechanical metronome ticking with sharp action,precise/precise_musical_0103.mp3
spatial/near,precise,musical,tuning fork,lab,a tuning fork struck and held against a metal rod,precise/precise_musical_0104.mp3
spatial/near,precise,musical,violin,studio,a violin bow performing a sharp spiccato stroke,precise/precise_musical_0105.mp3
spatial/near,precise,musical,piano,hall,a pianist striking a high-register key once,precise/precise_musical_0106.mp3
spatial/near,precise,musical,snare drum,garage,a snare drum hit with a clean rimshot,precise/precise_musical_0107.mp3
spatial/near,precise,musical,triangle,theatre,a triangle struck with a thin needle beater,precise/precise_musical_0108.mp3
spatial/near,precise,musical,harp,gallery,a harp string plucked near the bridge,precise/precise_musical_0109.mp3
spatial/near,precise,musical,cello,conservatory,a cello string being plucked pizzicato,precise/precise_musical_0110.mp3
spatial/near,precise,musical,trumpet,plaza,a trumpet playing a short staccato note,precise/precise_musical_0111.mp3
spatial/near,precise,musical,xylophone,classroom,a xylophone bar hit with a metal mallet,precise/precise_musical_0112.mp3
spatial/near,precise,musical,tambourine,festival,a tambourine shaken once with a snap,precise/precise_musical_0113.mp3
spatial/near,precise,musical,banjo,porch,a banjo string plucked with a metal pick,precise/precise_musical_0114.mp3
spatial/near,precise,musical,organ,church,a single short organ pipe pipe sounding,precise/precise_musical_0115.mp3
spatial/near,precise,musical,didgeridoo,canyon,a didgeridoo drone starting with a snap,precise/precise_musical_0116.mp3
spatial/near,precise,musical,guitar,club,an electric guitar string snapped with a pick,precise/precise_musical_0117.mp3
spatial/near,precise,mechanical,micro-gear,lab,a micro-gear clicking into place in a tool,precise/precise_mechanical_0118.mp3
spatial/near,precise,mechanical,watch,workshop,a mechanical watch escapement ticking,precise/precise_mechanical_0119.mp3
spatial/near,precise,mechanical,tweezers,desk,a pair of tweezers snapping shut on a pin,precise/precise_mechanical_0120.mp3
spatial/near,precise,mechanical,shutter,studio,a high-speed camera shutter firing,precise/precise_mechanical_0121.mp3
spatial/near,precise,mechanical,drill,garage,a small drill bit hitting a target spot,precise/precise_mechanical_0122.mp3
