category,tag,domain,source,environment,scenario,file
spatial/near,projecting,electronic,neon sign,diner,the buzz of a neon sign at a roadside diner at night,projecting/projecting_electronic_0300.mp3
spatial/near,projecting,electronic,drone,field,the high-pitched whine of a drone flying high in the sky,projecting/projecting_electronic_0301.mp3
spatial/near,projecting,electronic,microwave,breakroom,a microwave oven beeping in a staff kitchenette,projecting/projecting_electronic_0302.mp3
spatial/near,projecting,electronic,elevator chime,lobby,an electronic chime in a grand hotel lobby area,projecting/projecting_electronic_0303.mp3
spatial/near,projecting,electronic,scanner,library,a barcode scanner beeping in a vaulted library,projecting/projecting_electronic_0304.mp3
spatial/near,strong,musical,timpani,hall,a timpani drum being struck with a heavy mallet in a hall,strong/strong_musical_0188.mp3
spatial/near,strong,musical,trumpet,stadium,a trumpet playing a loud brassy note in a large stadium,strong/strong_musical_0189.mp3
spatial/near,strong,musical,snare drum,rehearsal room,a snare drum being struck with a forceful rimshot,strong/strong_musical_0190.mp3
spatial/near,strong,musical,bass drum,parade,a large bass drum being hit with a heavy beater in a parade,strong/strong_musical_0191.mp3
spatial/near,strong,musical,trombone,pit,a trombone playing a loud note in an orchestra pit,strong/strong_musical_0192.mp3
spatial/near,strong,musical,piano,ballroom,a grand piano being played with a forceful technique in a hall,strong/strong_musical_0193.mp3
spatial/near,strong,musical,cello,room,a cello being bowed with a heavy draw in a wooden room,strong/strong_musical_0194.mp3
spatial/near,strong,musical,harpsichord,museum,a harpsichord playing a full chord in a stone gallery,strong/strong_musical_0195.mp3
spatial/near,strong,musical,accordion,piazza,an accordion playing a full chord in a cobblestone square,strong/strong_musical_0196.mp3
spatial/near,strong,musical,clarinet,room,a clarinet playing a loud clear note in a quiet room,strong/strong_musical_0197.mp3
spatial/near,strong,musical,harp,conservatory,a harp arpeggio ringing out in a glass conservatory,strong/strong_musical_0198.mp3
spatial/near,strong,musical,marimba,studio,a marimba bar being hit with a hard mallet in a studio,strong/strong_musical_0199.mp3
spatial/near,strong,musical,tambourine,festival,a tambourine being slapped forcefully with the palm,strong/strong_musical_0200.mp3
spatial/near,strong,musical,bongo,beach,bongo drums being played with high energy on a beach,strong/strong_musical_0201.mp3
spatial/near,strong,mechanical,engine,track,a racing engine idling at high volume on a racetrack,strong/strong_mechanical_0202.mp3
spatial/near,strong,mechanical,drill,site,a hammer drill boring into a concrete wall at a building site,strong/strong_mechanical_0203.mp3
spatial/near,strong,mechanical,saw,workshop,a circular saw cutting through a steel pipe in a shop,strong/strong_mechanical_0204.mp3
spatial/near,strong,mechanical,steam whistle,factory,a steam whistle blowing in an industrial plant,strong/strong_mechanical_0205.mp3
spatial/near,strong,mechanical,jet engine,tarmac,a jet turbine roaring during takeoff on a tarmac,strong/strong_mechanical_0206.mp3
spatial/near,strong,mechanical,crane,site,a tower crane motor whirring at high speed on a skyline,strong/strong_mechanical_0207.mp3
spatial/near,strong,mechanical,press,plant,a printing press thumping in an industrial factory,strong/strong_mechanical_0208.mp3
spatial/near,strong,mechanical,ratchet,garage,a ratchet wrench clicking quickly as a bolt is tightened,strong/strong_mechanical_0209.mp3
spatial/near,strong,organic,cicadas,field,the drone of cicadas in a summer orchard,strong/strong_organic_0210.mp3
spatial/near,strong,organic,sheep,pasture,the bleating of sheep in an open pasture area,strong/strong_organic_0211.mp3
spatial/near,strong,electronic,drone,field,the high-pitched whine of a drone flying high over a field,strong/strong_electronic_0212.mp3
spatial/near,powerful,musical,pipe organ,cathedral,a pipe organ playing a full chord with all stops pulled in a stone cathedral,powerful/powerful_musical_0108.mp3
spatial/near,powerful,musical,orchestra,concert hall,a full orchestra performing a sudden crescendo in a concert hall,powerful/powerful_musical_0109.mp3
spatial/near,powerful,musical,grand piano,ballroom,a low-register grand piano chord ringing out with force in a ballroom,powerful/powerful_musical_0110.mp3
spatial/near,powerful,musical,timpani,stadium,a timpani drum being struck with great energy in an open stadium,powerful/powerful_musical_0111.mp3
spatial/near,powerful,musical,gong,temple,a massive bronze gong being hit with a heavy padded mallet in a temple,powerful/powerful_musical_0112.mp3
spatial/near,powerful,musical,tuba,hall,a tuba playing its lowest note with a resonant force in a hall,powerful/powerful_musical_0113.mp3
spatial/near,powerful,musical,crash cymbals,parade route,orchestral crash cymbals being struck together with force in a parade,powerful/powerful_musical_0114.mp3
spatial/near,powerful,musical,drum kit,recording studio,a drummer playing a high-energy beat on a full drum kit in a studio,powerful/powerful_musical_0115.mp3
spatial/near,powerful,musical,didgeridoo,canyon,a didgeridoo drone resonating with a deep force through a desert canyon,powerful/powerful_musical_0116.mp3
spatial/near,powerful,musical,bagpipes,highlands,the initial powerful drone of bagpipes filling with air in the highlands,powerful/powerful_musical_0117.mp3
spatial/near,powerful,musical,bass clarinet,theatre,a bass clarinet playing a low sustained note with energy in a theatre,powerful/powerful_musical_0118.mp3
spatial/near,powerful,musical,trombone,pit,a trombone playing a loud brassy note in an orchestra pit,powerful/powerful_musical_0119.mp3
spatial/near,powerful,musical,celesta,conservatory,a celesta arpeggio being played with forceful strikes in a room,powerful/powerful_musical_0120.mp3
spatial/near,powerful,musical,trumpet,square,a trumpet playing a bright fanfare in a cobblestone town square,powerful/powerful_musical_0121.mp3
spatial/near,powerful,musical,accordion,piazza,an accordion playing a full loud chord as the bellows are pulled hard,powerful/powerful_musical_0122.mp3
spatial/near,powerful,musical,bongo drums,beach,bongo drums being played with intense rhythmic hand strikes on a beach,powerful/powerful_musical_0123.mp3
spatial/near,powerful,musical,taiko drum,peak,a taiko drum being struck with heavy wooden bachi on a mountaintop,powerful/powerful_musical_0124.mp3
spatial/near,powerful,mechanical,jet engine,tarmac,a jet turbine roaring at full power during takeoff on an airport tarmac,powerful/powerful_mechanical_0125.mp3
spatial/near,powerful,mechanical,steam locomotive,yard,a steam engine chuffing with massive energy as it starts to move,powerful/powerful_mechanical_0126.mp3
spatial/near,powerful,mechanical,industrial press,factory,a large hydraulic press striking a sheet of steel with high force,powerful/powerful_mechanical_0127.mp3
spatial/near,powerful,mechanical,ship engine,harbor,the low-frequency powerful thrum of a cargo ship engine in a harbor,powerful/powerful_mechanical_0128.mp3
spatial/near,powerful,mechanical,diesel generator,outpost,a large diesel generator humming with intensity at a remote site,powerful/powerful_mechanical_0129.mp3
spatial/near,powerful,mechanical,turbine,power station,the high-pitched powerful whir of a massive power turbine,powerful/powerful_mechanical_0130.mp3
spatial/near,powerful,mechanical,winch motor,dock,a heavy winch motor straining and whining as it lifts a large load,powerful/powerful_mechanical_0131.mp3
spatial/near,powerful,mechanical,crane,shipyard,a tower crane motor roaring as it lifts a shipping container,powerful/powerful_mechanical_0132.mp3
spatial/near,powerful,mechanical,pneumatic drill,site,a pneumatic hammer drill breaking concrete at a construction site,powerful/powerful_mechanical_0133.mp3
spatial/near,powerful,mechanical,impact wrench,auto garage,an air-powered impact wrench striking a lug nut with force,powerful/powerful_mechanical_0134.mp3
spatial/near,powerful,mechanical,elevator,shaft,an elevator motor roaring as it moves a car through a tall shaft,powerful/powerful_mechanical_0135.mp3
spatial/near,powerful,mechanical,printing press,newsroom,a high-speed printing press thumping with energy in a newsroom,powerful/powerful_mechanical_0136.mp3
spatial/near,powerful,mechanical,tractor,farmland,a heavy tractor engine roaring as it pulls a plow through thick mud,powerful/powerful_mechanical_0137.mp3
spatial/near,powerful,mechanical,boiler,cellar,a large steam boiler igniting with a muffled powerful boom in a cellar,powerful/powerful_mechanical_0138.mp3
spatial/near,powerful,mechanical,millstone,watermill,a massive stone wheel grinding grain with force in a watermill,powerful/powerful_mechanical_0139.mp3
spatial/near,powerful,mechanical,fan,warehouse,a large ventilation fan roaring as it reaches its highest speed,powerful/powerful_mechanical_0140.mp3
spatial/near,powerful,mechanical,saw,scrap yard,a circular saw cutting through a metal pipe with high-energy noise,powerful/powerful_mechanical_0141.mp3
spatial/near,powerful,mechanical,air compressor,workshop,an industrial air compressor charging up with a loud whine,powerful/powerful_mechanical_0142.mp3
spatial/near,powerful,environmental,thunder peal,plains,a powerful peal of thunder rolling and cracking across open plains,powerful/powerful_environmental_0143.mp3
spatial/near,powerful,environmental,waterfall roar,gorge,the massive roar of a wide waterfall crashing in a deep gorge,powerful/powerful_environmental_0144.mp3
spatial/near,powerful,environmental,ocean surf,cliffside,heavy ocean waves crashing with force against a hollow cliff,powerful/powerful_environmental_0145.mp3
spatial/near,powerful,environmental,landslide,valley,the roar of a massive landslide of rocks and earth into a valley,powerful/powerful_environmental_0146.mp3
spatial/near,powerful,environmental,storm wind,coast,the howl and roar of hurricane-force winds against a building,powerful/powerful_environmental_0147.mp3
spatial/near,powerful,environmental,geyser eruption,park,a geyser erupting and hissing with intense steam pressure,powerful/powerful_environmental_0148.mp3
spatial/near,powerful,environmental,river rush,floodplain,a flooded river rushing through a canyon with massive energy,powerful/powerful_environmental_0149.mp3
spatial/near,powerful,environmental,volcano rumble,island,the subterranean powerful rumble of an active volcano eruption,powerful/powerful_environmental_0150.mp3
spatial/near,powerful,environmental,avalanche,mountain,the roar of a distant snow avalanche moving down a steep slope,powerful/powerful_environmental_0151.mp3
spatial/near,powerful,environmental,sandstorm,desert,the hiss and roar of a sandstorm hitting a metal structure,powerful/powerful_environmental_0152.mp3
spatial/near,powerful,environmental,iceberg calving,arctic,the deep powerful groan of an iceberg fracturing in the sea,powerful/powerful_environmental_0153.mp3
spatial/near,powerful,environmental,forest fire,wilderness,the sustained roar of a crown fire moving through trees,powerful/powerful_environmental_0154.mp3
spatial/near,powerful,environmental,mud pot,field,a large geothermal mud pot bubbling and plopping with force,powerful/powerful_environmental_0155.mp3
spatial/near,powerful,environmental,ice sheet,lake,a sharp powerful crack echoing across a frozen lake surface,powerful/powerful_environmental_0156.mp3
spatial/near,powerful,environmental,geothermal vent,field,a heavy hiss of steam from a large high-pressure vent,powerful/powerful_environmental_0157.mp3
spatial/near,powerful,environmental,blizzard,tundra,the howling of a blizzard across a frozen and empty tundra plain,powerful/powerful_environmental_0158.mp3
spatial/near,powerful,environmental,rockslide,quarry,a rockslide of large boulders falling down a quarry wall,powerful/powerful_environmental_0159.mp3
spatial/near,powerful,organic,lion roar,savanna,a lion's powerful deep roar echoing across the savanna at dawn,powerful/powerful_organic_0160.mp3
spatial/near,powerful,organic,wolf pack,forest,a pack of wolves howling together with intense resonance in the woods,powerful/powerful_organic_0161.mp3
spatial/near,powerful,organic,elephant trumpet,jungle,an elephant trumpeting with a powerful and resonant note in the jungle,powerful/powerful_organic_0162.mp3
spatial/near,powerful,organic,howler monkey,canopy,the resonant roar of a howler monkey in a tropical forest canopy,powerful/powerful_organic_0163.mp3
spatial/near,powerful,organic,blue whale call,ocean,the deep powerful infrasonic call of a blue whale underwater,powerful/powerful_organic_0164.mp3
spatial/near,powerful,organic,human shout,stadium,a crowd of people shouting with great energy in an empty stadium,powerful/powerful_organic_0165.mp3
spatial/near,powerful,organic,alligator bellow,swamp,the deep powerful bellow of an alligator in a misty swamp,powerful/powerful_organic_0166.mp3
spatial/near,powerful,organic,gorilla chest,jungle,a gorilla thumping its chest with cupped hands in a forest clearing,powerful/powerful_organic_0167.mp3
spatial/near,powerful,organic,bear growl,forest,the guttural powerful growl of a grizzly bear in a pine woods,powerful/powerful_organic_0168.mp3
spatial/near,powerful,organic,cow moo,pasture,a cow mooing a long low note with resonant force in a field,powerful/powerful_organic_0169.mp3
spatial/near,powerful,organic,elk bugle,valley,the bugle of an elk echoing with powerful harmonics in a valley,powerful/powerful_organic_0170.mp3
spatial/near,powerful,organic,seal bark,shoreline,the resonant powerful bark of a seal on a rocky beach shore,powerful/powerful_organic_0171.mp3
spatial/near,powerful,organic,human bass,cathedral,a deep bass voice singing a low note with resonance in a hall,powerful/powerful_organic_0172.mp3
spatial/near,powerful,organic,bees swarm,orchard,the collective powerful hum of a large bee swarm in the trees,powerful/powerful_organic_0173.mp3
spatial/near,powerful,organic,frogs chorus,marsh,the continuous powerful chorus of bullfrogs in a marshland,powerful/powerful_organic_0174.mp3
spatial/near,powerful,organic,cicadas,field,the long powerful drone of cicadas in a summer grassy field,powerful/powerful_organic_0175.mp3
spatial/near,powerful,organic,pigeon wings,barn,the sound of many pigeons taking flight with powerful wing flaps,powerful/powerful_organic_0176.mp3
spatial/near,powerful,domestic,door slam,mansion,a heavy wooden front door slamming shut with a powerful thud,powerful/powerful_domestic_0177.mp3
spatial/near,powerful,domestic,fireplace roar,den,the powerful roar of a large fire in a stone fireplace area,powerful/powerful_domestic_0178.mp3
spatial/near,powerful,domestic,vacuum cleaner,hallway,a heavy-duty vacuum cleaner humming with intense energy in a hall,powerful/powerful_domestic_0179.mp3
spatial/near,powerful,domestic,washing machine,laundry,a machine thumping during a powerful spin cycle in a room,powerful/powerful_domestic_0180.mp3
spatial/near,powerful,domestic,refrigerator,kitchen,the low powerful hum of a large industrial refrigerator motor,powerful/powerful_domestic_0181.mp3
spatial/near,powerful,domestic,dishwasher,kitchen,water splashing with force inside a running dishwasher machine,powerful/powerful_domestic_0182.mp3
spatial/near,powerful,domestic,kettle whistle,kitchen,a metal kettle whistling with intense steam pressure in a room,powerful/powerful_domestic_0183.mp3
spatial/near,powerful,domestic,ceiling fan,room,a large ceiling fan whirring at its highest speed in a room,powerful/powerful_domestic_0184.mp3
spatial/near,powerful,domestic,air conditioner,room,a window unit unit thrumming and buzzing with energy in a room,powerful/powerful_domestic_0185.mp3
spatial/near,powerful,domestic,boiler roar,cellar,a central heating boiler igniting with a powerful muffled boom,powerful/powerful_domestic_0186.mp3
spatial/near,powerful,domestic,pipes,house,water hissing and hammering with force in old metal pipes,powerful/powerful_domestic_0187.mp3
spatial/near,powerful,domestic,bath filling,bathroom,water filling a large tub with a powerful stream in a house,powerful/powerful_domestic_0188.mp3
spatial/near,powerful,domestic,clock strike,hallway,a grandfather clock striking the hour with resonant force,powerful/powerful_domestic_0189.mp3
spatial/near,powerful,domestic,lawnmower,yard,a gas lawnmower engine roaring with intensity in a large yard,powerful/powerful_domestic_0190.mp3
spatial/near,powerful,domestic,armchair,den,a person sitting with force into a large stuffed armchair in a room,powerful/powerful_domestic_0191.mp3
spatial/near,powerful,domestic,wardrobe,bedroom,a heavy oak wardrobe being dragged with a powerful scrape,powerful/powerful_domestic_0192.mp3
spatial/near,powerful,domestic,curtains,theatre,heavy velvet curtains being drawn closed with a powerful rustle,powerful/powerful_domestic_0193.mp3
spatial/near,powerful,electronic,subwoofer,club,a deep powerful bass pulse from a large subwoofer in a nightclub,powerful/powerful_electronic_0194.mp3
spatial/near,powerful,electronic,transformer,substation,the low powerful hum of a high-voltage power transformer,powerful/powerful_electronic_0195.mp3
spatial/near,powerful,electronic,amplifier,stadium,the low-frequency powerful hum of a stack of bass amplifiers,powerful/powerful_electronic_0196.mp3
spatial/near,powerful,electronic,server farm,center,the collective powerful drone of a large server farm room,powerful/powerful_electronic_0197.mp3
spatial/near,powerful,electronic,neon sign,diner,the continuous powerful buzz of a large neon sign at night,powerful/powerful_electronic_0198.mp3
spatial/near,powerful,electronic,electric motor,factory,a large electric motor thrumming with energy under a load,powerful/powerful_electronic_0199.mp3
spatial/near,powerful,electronic,radio static,outpost,the continuous powerful hiss of white noise from a radio,powerful/powerful_electronic_0200.mp3
spatial/near,powerful,electronic,synthesizer,studio,a full-spectrum powerful synthesizer drone in a recording hall,powerful/powerful_electronic_0201.mp3
spatial/near,powerful,electronic,microwave,kitchen,the steady powerful vibration of a microwave oven running,powerful/powerful_electronic_0202.mp3
spatial/near,powerful,electronic,plasma screen,room,the low powerful hum of a plasma television in a quiet room,powerful/powerful_electronic_0203.mp3
spatial/near,powerful,electronic,intercom,hall,the continuous powerful buzz of an old intercom system,powerful/powerful_electronic_0204.mp3
spatial/near,powerful,electronic,charger,garage,the high-pitched powerful hum of a vehicle charging station,powerful/powerful_electronic_0205.mp3
spatial/near,powerful,electronic,ups,office,the steady powerful hum of an uninterruptible power supply,powerful/powerful_electronic_0206.mp3
spatial/near,powerful,electronic,oscillator,lab,the resonant powerful tone of an analog signal generator,powerful/powerful_electronic_0207.mp3
spatial/near,powerful,electronic,buzzer,stadium,a loud powerful scoreboard buzzer in an empty gym area,powerful/powerful_electronic_0208.mp3
spatial/near,powerful,electronic,drone,field,the high-pitched powerful whine of a drone flying high in the sky,powerful/powerful_electronic_0209.mp3
spatial/near,powerful,electronic,reverb decay,hall,the full powerful decay of a digital reverb in a room,powerful/powerful_electronic_0210.mp3
spatial/near,loud,musical,timpani,hall,a timpani drum being struck with a heavy mallet in an empty hall,loud/loud_musical_0103.mp3
spatial/near,loud,musical,trumpet,stadium,a trumpet playing a high note in a large stadium,loud/loud_musical_0104.mp3
spatial/near,loud,musical,snare drum,studio,a snare drum being hit with a sharp rimshot in a booth,loud/loud_musical_0105.mp3
spatial/near,loud,musical,gong,temple,a large bronze gong being struck forcefully in a temple,loud/loud_musical_0106.mp3
spatial/near,loud,musical,bass drum,parade,a large bass drum being hit with a heavy beater,loud/loud_musical_0107.mp3
spatial/near,loud,musical,trombone,pit,a trombone playing a loud brassy note in an orchestra,loud/loud_musical_0108.mp3
spatial/near,loud,musical,piano,ballroom,a grand piano chord being struck with force in a hall,loud/loud_musical_0109.mp3
spatial/near,loud,musical,harp,conservatory,a harp arpeggio ringing out in a glass room,loud/loud_musical_0110.mp3
spatial/near,loud,musical,marimba,studio,a marimba bar being hit with a hard mallet in a booth,loud/loud_musical_0111.mp3
spatial/near,loud,mechanical,engine,track,a racing engine idling at high volume on a track,loud/loud_mechanical_0112.mp3
spatial/near,loud,mechanical,impact driver,site,an impact driver being used on a metal beam,loud/loud_mechanical_0113.mp3
spatial/near,loud,mechanical,winch,dock,a winch motor whining loudly as it pulls a load,loud/loud_mechanical_0114.mp3
spatial/near,loud,mechanical,fan,warehouse,a large ventilation fan whirring in a warehouse,loud/loud_mechanical_0115.mp3
spatial/near,loud,environmental,ocean surf,beach,heavy waves crashing on a wide sandy shore,loud/loud_environmental_0116.mp3
spatial/near,loud,environmental,wind,canyon,wind moaning through a narrow gap in a canyon,loud/loud_environmental_0117.mp3
spatial/near,loud,environmental,storm,city,the collective roar of wind and rain in a city,loud/loud_environmental_0118.mp3
spatial/near,loud,environmental,geyser,park,a geyser erupting and hissing in an open park,loud/loud_environmental_0119.mp3
spatial/near,loud,environmental,avalanche,mountain,the roar of a snow avalanche in the mountains,loud/loud_environmental_0120.mp3
spatial/near,loud,environmental,sandstorm,desert,sand hitting a metal tank during a windstorm,loud/loud_environmental_0121.mp3
spatial/near,loud,environmental,lava,crater,molten lava bubbling at the bottom of a crater,loud/loud_environmental_0122.mp3
spatial/near,loud,environmental,rockslide,cliff,stones clattering down an open granite cliff,loud/loud_environmental_0123.mp3
spatial/near,loud,organic,lion,savanna,a lion's deep roar echoing across the savanna,loud/loud_organic_0124.mp3
spatial/near,loud,organic,howler monkey,canopy,a monkey roar echoing from a forest canopy,loud/loud_organic_0125.mp3
spatial/near,loud,organic,elephant,plain,an elephant trumpeting in an open river plain,loud/loud_organic_0126.mp3
spatial/near,loud,organic,dog bark,valley,a dog barking in a mountain valley at night,loud/loud_organic_0127.mp3
spatial/near,loud,organic,human shout,stadium,a person shouting in a large empty stadium,loud/loud_organic_0128.mp3
spatial/near,loud,organic,elk,meadow,the bugle of an elk in a mountain meadow,loud/loud_organic_0129.mp3
spatial/near,loud,organic,woodpecker,clearing,a woodpecker drumming in a forest clearing,loud/loud_organic_0130.mp3
spatial/near,loud,organic,frogs,swamp,the chorus of frogs in a tropical marshland,loud/loud_organic_0131.mp3
spatial/near,loud,organic,coyote,desert,coyotes yapping in an open desert valley,loud/loud_organic_0132.mp3
spatial/near,loud,organic,bees,garden,the hum of a bee swarm in an open garden area,loud/loud_organic_0133.mp3
spatial/near,loud,organic,owl,night,an owl hooting from a tree in a night forest,loud/loud_organic_0134.mp3
spatial/near,loud,organic,crow,woods,a crow cawing from a branch in the woods,loud/loud_organic_0135.mp3
spatial/near,loud,domestic,lawnmower,yard,a gas lawnmower engine running in a large yard,loud/loud_domestic_0136.mp3
spatial/near,loud,domestic,toilet,bathroom,a toilet flushing in a large tiled restroom,loud/loud_domestic_0137.mp3
spatial/near,loud,domestic,fireplace,den,the roar of a large fire in a stone fireplace,loud/loud_domestic_0138.mp3
spatial/near,loud,domestic,shower,bathroom,the sound of water in a full-pressure shower,loud/loud_domestic_0139.mp3
spatial/near,loud,domestic,washing machine,laundry,a machine thumping during a spin cycle,loud/loud_domestic_0140.mp3
spatial/near,loud,domestic,dishwasher,kitchen,water splashing inside a running dishwasher,loud/loud_domestic_0141.mp3
spatial/near,loud,domestic,fan,bedroom,a ceiling fan whirring at high speed in a room,loud/loud_domestic_0142.mp3
spatial/near,loud,domestic,air conditioner,room,a window unit thrumming in a room,loud/loud_domestic_0143.mp3
spatial/near,loud,domestic,boiler,cellar,a central heating boiler roaring in a cellar,loud/loud_domestic_0144.mp3
spatial/near,loud,domestic,clock,hallway,a grandfather clock striking the hour in a hall,loud/loud_domestic_0145.mp3
spatial/near,loud,domestic,bath,bathroom,water filling a large tub in a quiet house,loud/loud_domestic_0146.mp3
spatial/near,loud,domestic,lighter,den,a metal lighter being flicked open in a room,loud/loud_domestic_0147.mp3
spatial/near,loud,electronic,car alarm,parking lot,a car alarm beeping in an open parking lot,loud/loud_electronic_0148.mp3
spatial/near,loud,electronic,intercom,warehouse,a voice announcement over a warehouse pa,loud/loud_electronic_0149.mp3
spatial/near,loud,electronic,megaphone,park,a person speaking over a megaphone in a park,loud/loud_electronic_0150.mp3
spatial/near,loud,electronic,smoke alarm,hallway,a smoke detector chirping in a long hallway,loud/loud_electronic_0151.mp3
spatial/near,loud,electronic,amplifier,stadium,the hum of a large pa system in a stadium,loud/loud_electronic_0152.mp3
spatial/near,loud,electronic,transformer,street,the buzz of a power transformer on a street,loud/loud_electronic_0153.mp3
spatial/near,loud,electronic,intercom chime,theatre,a bell sound over a theatre pa system,loud/loud_electronic_0154.mp3
