category,tag,domain,source,environment,scenario,file
texture/smooth,pure,environmental,wind,glacier,a high-altitude wind whistling through a single narrow ice crack,pure/pure_environmental_0238.mp3
texture/smooth,pure,environmental,water drop,cave,a single drop of water hitting the center of a still pool,pure/pure_environmental_0239.mp3
texture/smooth,pure,environmental,echo,canyon,a single sharp whistle echoing once in a granite gorge,pure/pure_environmental_0240.mp3
texture/smooth,pure,environmental,ice,lake,the clear high-pitched ping of a small ice shard hitting a frozen lake,pure/pure_environmental_0241.mp3
texture/smooth,pure,environmental,geyser,valley,the steady high-pitched hiss of a clean steam vent,pure/pure_environmental_0242.mp3
texture/smooth,pure,environmental,rain,tin roof,a single raindrop hitting a resonant metal sheet in a desert,pure/pure_environmental_0243.mp3
texture/smooth,pure,environmental,stalactite,cavern,the clear ring of a water drop hitting a hollow stone,pure/pure_environmental_0244.mp3
texture/smooth,pure,environmental,stream,mountain,water trickling into a deep resonant rock hole,pure/pure_environmental_0245.mp3
texture/smooth,pure,environmental,leaves,garden,the isolated rustle of a single dry leaf on stone,pure/pure_environmental_0246.mp3
texture/smooth,pure,environmental,fire,campsite,the high-pitched whistle of steam escaping a burning log,pure/pure_environmental_0247.mp3
texture/smooth,pure,environmental,snow,tundra,the clean crunch of a single footstep on hard-packed snow,pure/pure_environmental_0248.mp3
texture/smooth,pure,environmental,mist,valley,the subtle high-pitched hiss of a pressurized spray,pure/pure_environmental_0249.mp3
texture/smooth,pure,environmental,bamboo,grove,a single sharp clack of two dry bamboo stalks,pure/pure_environmental_0250.mp3
texture/smooth,pure,environmental,sand,dune,"the high-pitched ""singing"" of sand grains in a windstorm",pure/pure_environmental_0251.mp3
texture/smooth,pure,environmental,ocean,beach,the clear whistle of wind through a large hollow conch shell,pure/pure_environmental_0252.mp3
texture/smooth,pure,environmental,volcano,basin,the high-frequency hiss of a gas vent in a crater,pure/pure_environmental_0253.mp3
texture/smooth,pure,environmental,hail,carport,the sharp ping of a single hailstone on a metal roof,pure/pure_environmental_0254.mp3
texture/smooth,pure,organic,whistle,stadium,a single clear human whistle echoing in an empty arena,pure/pure_organic_0255.mp3
texture/smooth,pure,organic,bird,forest,the isolated melodic whistle of a thrush in a morning grove,pure/pure_organic_0256.mp3
texture/smooth,pure,organic,owl,woods,the clean hollow hoot of an owl in a quiet forest,pure/pure_organic_0257.mp3
texture/smooth,pure,organic,wolf,highlands,a single sustained howl of a wolf on a clear night,pure/pure_organic_0258.mp3
texture/smooth,pure,organic,bee,meadow,the high-pitched steady drone of a single bumblebee,pure/pure_organic_0259.mp3
texture/smooth,pure,organic,dolphin,ocean,a high-pitched clear whistle from a dolphin underwater,pure/pure_organic_0260.mp3
texture/smooth,pure,organic,teeth,arctic,the rapid clean chattering of teeth in the cold,pure/pure_organic_0261.mp3
texture/smooth,pure,organic,voice,hall,a single pure vowel note sung by a child in a stone room,pure/pure_organic_0262.mp3
texture/smooth,pure,organic,shout,canyon,a short sharp yell reflecting off a single cliff face,pure/pure_organic_0263.mp3
texture/smooth,pure,organic,heartbeat,room,the isolated thump of a heartbeat in a silent room,pure/pure_organic_0264.mp3
texture/smooth,pure,organic,cicada,field,the high-frequency steady buzz of a single cicada,pure/pure_organic_0265.mp3
texture/smooth,pure,organic,wings,garden,the rapid clear flutter of a hummingbird's wings,pure/pure_organic_0266.mp3
texture/smooth,pure,organic,bone,desert,the clean snap of a small dry bone in a silent landscape,pure/pure_organic_0267.mp3
texture/smooth,pure,organic,beak,woods,the sharp isolated tap of a woodpecker on a hollow branch,pure/pure_organic_0268.mp3
texture/smooth,pure,organic,hair,bathroom,the single clean snap of a taut hair being broken,pure/pure_organic_0269.mp3
texture/smooth,pure,organic,grass,prairie,the clear whistle of a blade of grass held between thumbs,pure/pure_organic_0270.mp3
texture/smooth,pure,organic,cricket,meadow,the isolated rhythmic chirp of a single field cricket,pure/pure_organic_0271.mp3
texture/smooth,pure,domestic,crystal glass,dining room,a lead crystal goblet being struck with a silver knife,pure/pure_domestic_0272.mp3
texture/smooth,pure,domestic,silverware,kitchen,the clean ring of a silver spoon hitting a ceramic tile,pure/pure_domestic_0273.mp3
texture/smooth,pure,domestic,clock,hallway,the isolated chime of a small mantel clock in a quiet house,pure/pure_domestic_0274.mp3
texture/smooth,pure,domestic,lightbulb,basement,the high-pitched ring of a lightbulb filament being tapped,pure/pure_domestic_0275.mp3
texture/smooth,pure,domestic,kettle,pantry,the clear unwavering whistle of a tea kettle at full boil,pure/pure_domestic_0276.mp3
texture/smooth,pure,domestic,faucet,bathroom,a single water drop hitting a half-full metal basin,pure/pure_domestic_0277.mp3
texture/smooth,pure,domestic,doorbell,foyer,the clean mechanical strike of a single-note doorbell,pure/pure_domestic_0278.mp3
texture/smooth,pure,domestic,coin,laundry,the clear ring of a silver coin spinning on a glass table,pure/pure_domestic_0279.mp3
texture/smooth,pure,domestic,zipper,closet,the single clean pull of a high-quality metal zipper,pure/pure_domestic_0280.mp3
texture/smooth,pure,domestic,keys,foyer,the isolated jingle of a single brass key on a ring,pure/pure_domestic_0281.mp3
texture/smooth,pure,domestic,ceramic,cafe,the clean tap of a spoon on the rim of a porcelain cup,pure/pure_domestic_0282.mp3
texture/smooth,pure,domestic,paper,study,the sharp clean fold of a piece of heavy parchment,pure/pure_domestic_0283.mp3
texture/smooth,pure,domestic,scissors,studio,the clean snip of metal shears through a single thread,pure/pure_domestic_0284.mp3
texture/smooth,pure,domestic,beads,curtain,the clean clink of two glass beads hitting each other,pure/pure_domestic_0285.mp3
texture/smooth,pure,domestic,spray,bathroom,the high-pitched clear hiss of an aerosol can burst,pure/pure_domestic_0286.mp3
texture/smooth,pure,domestic,drawer,office,the single clean click of a metal desk drawer locking,pure/pure_domestic_0287.mp3
texture/smooth,pure,domestic,pot,kitchen,the clear ring of a stainless steel lid hitting a counter,pure/pure_domestic_0288.mp3
texture/smooth,pure,electronic,test tone,lab,a 1000hz sine wave tone from a laboratory oscillator,pure/pure_electronic_0289.mp3
texture/smooth,pure,electronic,synthesizer,den,a pure sine wave lead with no modulation or effects,pure/pure_electronic_0290.mp3
texture/smooth,pure,electronic,buzzer,factory,the clear high-pitched tone of a piezoelectric buzzer,pure/pure_electronic_0291.mp3
texture/smooth,pure,electronic,hum,basement,the isolated 50hz hum of a power transformer in a room,pure/pure_electronic_0292.mp3
texture/smooth,pure,electronic,monitor,office,the high-pitched clear whistle of a crt television set,pure/pure_electronic_0293.mp3
texture/smooth,pure,electronic,feedback,stage,a single clear high-frequency note of microphone feedback,pure/pure_electronic_0294.mp3
texture/smooth,pure,electronic,modem,bedroom,the high-pitched carrier tone of a computer modem,pure/pure_electronic_0295.mp3
texture/smooth,pure,electronic,alarm,apartment,the clean digital beep of a wristwatch alarm,pure/pure_electronic_0296.mp3
texture/smooth,pure,electronic,flash,studio,the high-pitched rising whine of a camera flash unit,pure/pure_electronic_0297.mp3
texture/smooth,pure,electronic,radio,attic,the clear high-frequency whistle of a radio heterodyne,pure/pure_electronic_0298.mp3
texture/smooth,pure,electronic,transformer,substation,the steady pure buzz of an electrical grid component,pure/pure_electronic_0299.mp3
texture/smooth,pure,electronic,capacitor,workbench,the high-pitched whine of a charging power capacitor,pure/pure_electronic_0300.mp3
texture/smooth,pure,electronic,relay,closet,the isolated precise click of a reed relay in a cabinet,pure/pure_electronic_0301.mp3
texture/smooth,pure,electronic,laser,lab,the high-pitched steady drone of a gas laser's power supply,pure/pure_electronic_0302.mp3
texture/smooth,pure,electronic,scanner,library,the clear whir of a flatbed scanner's internal motor,pure/pure_electronic_0303.mp3
texture/smooth,pure,electronic,hearing aid,room,the high-pitched clear feedback of an earphone,pure/pure_electronic_0304.mp3
texture/smooth,pure,electronic,microwave,kitchen,the high-pitched clear beep of an oven cycle ending,pure/pure_electronic_0305.mp3
texture/smooth,clean,musical,piano,ballroom,a single staccato note played in the high register of a grand piano,clean/clean_musical_0199.mp3
texture/smooth,clean,musical,triangle,cathedral,a precise strike on a triangle that rings without overtones,clean/clean_musical_0200.mp3
texture/smooth,clean,musical,harp,gallery,the isolated pluck of a nylon harp string in a quiet room,clean/clean_musical_0201.mp3
texture/smooth,clean,musical,xylophone,pavilion,a hard mallet strike on a synthetic xylophone bar,clean/clean_musical_0202.mp3
texture/smooth,clean,musical,glockenspiel,nursery,a steel glockenspiel note with a fast onset and decay,clean/clean_musical_0203.mp3
texture/smooth,clean,musical,snare drum,studio,a single rimshot on a tightly tuned snare drum,clean/clean_musical_0204.mp3
texture/smooth,clean,musical,trumpet,harbor,a short sharp trumpet staccato echoing off a wall,clean/clean_musical_0205.mp3
texture/smooth,clean,musical,violin,hall,a single spiccato stroke on a violin e-string,clean/clean_musical_0206.mp3
texture/smooth,clean,musical,recorder,classroom,a short precise breath into a soprano recorder,clean/clean_musical_0207.mp3
texture/smooth,clean,musical,chimes,observatory,a single strike of a small tubular bell with a metal hammer,clean/clean_musical_0208.mp3
texture/smooth,clean,musical,claves,temple,the sharp click of two rosewood sticks hitting each other,clean/clean_musical_0209.mp3
texture/smooth,clean,musical,banjo,porch,the isolated snap of a steel banjo string being plucked,clean/clean_musical_0210.mp3
texture/smooth,clean,musical,castanets,dance hall,a single sharp clack of a hardwood castanet,clean/clean_musical_0211.mp3
texture/smooth,clean,musical,cowbell,barn,a hard strike on a small metal cowbell in a quiet field,clean/clean_musical_0212.mp3
texture/smooth,clean,musical,ukulele,greenhouse,the clean pluck of a high ukulele string,clean/clean_musical_0213.mp3
texture/smooth,clean,musical,piccolo,stadium,a sharp short note on a silver piccolo,clean/clean_musical_0214.mp3
texture/smooth,clean,musical,tongue drum,shrine,a single clean tap on a steel tongue drum,clean/clean_musical_0215.mp3
texture/smooth,clean,mechanical,camera shutter,museum,the sharp isolated snap of a high-quality camera shutter,clean/clean_mechanical_0216.mp3
texture/smooth,clean,mechanical,switch,office,the precise mechanical click of a light switch being toggled,clean/clean_mechanical_0217.mp3
texture/smooth,clean,mechanical,relay,server room,the single sharp click of an electrical relay activating,clean/clean_mechanical_0218.mp3
texture/smooth,clean,mechanical,typewriter,study,the isolated strike of a single typewriter key hammer,clean/clean_mechanical_0219.mp3
texture/smooth,clean,mechanical,stapler,library,the precise sound of a heavy-duty stapler firing once,clean/clean_mechanical_0220.mp3
texture/smooth,clean,mechanical,lock,vault,the clean mechanical click of a bank vault tumbler,clean/clean_mechanical_0221.mp3
texture/smooth,clean,mechanical,watch,workshop,the sharp precise tick-tock of a mechanical stopwatch,clean/clean_mechanical_0222.mp3
texture/smooth,clean,mechanical,bearing,factory,the clean mechanical drop of a ball bearing onto steel,clean/clean_mechanical_0223.mp3
texture/smooth,clean,mechanical,shutter,studio,the fast sharp snap of a medium format camera shutter,clean/clean_mechanical_0224.mp3
texture/smooth,clean,mechanical,bell,shipyard,the clean strike of a bicycle bell with a spring lever,clean/clean_mechanical_0225.mp3
texture/smooth,clean,mechanical,spring,basement,the isolated mechanical snap of a spring being released,clean/clean_mechanical_0226.mp3
texture/smooth,clean,mechanical,meter,garage,the clean click of a mechanical gas meter incrementing,clean/clean_mechanical_0227.mp3
texture/smooth,clean,mechanical,button,elevator,the precise click of a metal elevator floor button,clean/clean_mechanical_0228.mp3
texture/smooth,clean,mechanical,tally counter,stadium,the single sharp click of a metal hand counter,clean/clean_mechanical_0229.mp3
texture/smooth,clean,mechanical,jack,shipyard,the clean ratchet click of a mechanical car jack,clean/clean_mechanical_0230.mp3
texture/smooth,clean,mechanical,drill,workshop,the sharp onset of a high-speed electric drill motor,clean/clean_mechanical_0231.mp3
texture/smooth,clean,mechanical,hole punch,office,the clean mechanical snip of a heavy-duty paper punch,clean/clean_mechanical_0232.mp3
texture/smooth,clean,environmental,water drop,cave,the isolated splash of a water droplet in a still pool,clean/clean_environmental_0233.mp3
texture/smooth,clean,environmental,ice,lake,the sharp isolated crack of a single ice shard breaking,clean/clean_environmental_0234.mp3
texture/smooth,clean,environmental,echo,canyon,a single sharp clap reflecting once off a canyon wall,clean/clean_environmental_0235.mp3
texture/smooth,clean,environmental,stone,quarry,the clean ring of a small pebble hitting a granite floor,clean/clean_environmental_0236.mp3
texture/smooth,clean,environmental,twig,woods,the sharp isolated snap of a dry cedar twig,clean/clean_environmental_0237.mp3
texture/smooth,clean,environmental,rain,tin roof,a single raindrop hitting a resonant metal sheet,clean/clean_environmental_0238.mp3
texture/smooth,clean,environmental,hail,carport,the sharp isolated ping of a hailstone on a car roof,clean/clean_environmental_0239.mp3
texture/smooth,clean,environmental,thorns,desert,the clean sharp scratch of a thorn on a metal bottle,clean/clean_environmental_0240.mp3
texture/smooth,clean,environmental,bamboo,grove,the single sharp clack of two bamboo stalks colliding,clean/clean_environmental_0241.mp3
texture/smooth,clean,environmental,shell,beach,the sharp isolated crunch of a single seashell underfoot,clean/clean_environmental_0242.mp3
texture/smooth,clean,environmental,lava,field,the clean sharp crackle of a volcanic glass bubble,clean/clean_environmental_0243.mp3
texture/smooth,clean,environmental,thunder,plains,a single sharp crack of dry lightning on the horizon,clean/clean_environmental_0244.mp3
texture/smooth,clean,environmental,snow,tundra,the sharp isolated squeak of a boot on dry snow,clean/clean_environmental_0245.mp3
texture/smooth,clean,environmental,stalactite,cavern,the clean ring of a water drop hitting a stone pillar,clean/clean_environmental_0246.mp3
texture/smooth,clean,environmental,stream,mountain,the isolated bubble pop of water in a rock pool,clean/clean_environmental_0247.mp3
texture/smooth,clean,environmental,mist,valley,the clean sharp hiss of a pressurized steam vent,clean/clean_environmental_0248.mp3
texture/smooth,clean,environmental,leaves,garden,the sharp isolated rustle of a single dry maple leaf,clean/clean_environmental_0249.mp3
texture/smooth,clean,organic,whistle,stadium,a single short sharp human whistle through the teeth,clean/clean_organic_0250.mp3
texture/smooth,clean,organic,fingernail,table,a single clean tap of a fingernail on a polished surface,clean/clean_organic_0251.mp3
texture/smooth,clean,organic,bone,desert,the sharp isolated snap of a dry bird bone,clean/clean_organic_0252.mp3
texture/smooth,clean,organic,beak,forest,the single sharp tap of a woodpecker on a hollow tree,clean/clean_organic_0253.mp3
texture/smooth,clean,organic,teeth,arctic,the single sharp click of two teeth meeting,clean/clean_organic_0254.mp3
texture/smooth,clean,organic,claws,tile,the clean sharp click of a dog's claw on a marble floor,clean/clean_organic_0255.mp3
texture/smooth,clean,organic,voice,hall,a single short sharp syllable spoken in an empty room,clean/clean_organic_0256.mp3
texture/smooth,clean,organic,shout,canyon,a short sharp yell echoing once in a narrow gorge,clean/clean_organic_0257.mp3
texture/smooth,clean,organic,egg,kitchen,the sharp isolated crack of an eggshell on a bowl rim,clean/clean_organic_0258.mp3
texture/smooth,clean,organic,skin,gym,a single clean slap of a hand on a leather mat,clean/clean_organic_0259.mp3
texture/smooth,clean,organic,insect,meadow,the sharp isolated buzz of a fly hitting a glass pane,clean/clean_organic_0260.mp3
texture/smooth,clean,organic,hair,bathroom,the single clean snap of a taut hair strand,clean/clean_organic_0261.mp3
texture/smooth,clean,organic,grass,prairie,the sharp isolated rustle of a single dry stalk,clean/clean_organic_0262.mp3
texture/smooth,clean,organic,hooves,plaza,the single sharp thud of a horse's hoof on stone,clean/clean_organic_0263.mp3
texture/smooth,clean,organic,tongue,room,the sharp clean click of a tongue against the palate,clean/clean_organic_0264.mp3
texture/smooth,clean,organic,seeds,field,the single clean rattle of a dry poppy pod,clean/clean_organic_0265.mp3
texture/smooth,clean,organic,wings,garden,the sharp isolated flap of a bird's wing,clean/clean_organic_0266.mp3
texture/smooth,clean,domestic,glass,dining room,the clean ring of a silver spoon hitting a crystal glass,clean/clean_domestic_0267.mp3
texture/smooth,clean,domestic,silverware,kitchen,the isolated clink of a fork hitting a ceramic plate,clean/clean_domestic_0268.mp3
texture/smooth,clean,domestic,keys,foyer,the single clean jingle of a key being inserted into a lock,clean/clean_domestic_0269.mp3
texture/smooth,clean,domestic,light switch,hallway,the sharp precise click of a rocker switch,clean/clean_domestic_0270.mp3
texture/smooth,clean,domestic,faucet,bathroom,the single clean drip of water into a metal sink,clean/clean_domestic_0271.mp3
texture/smooth,clean,domestic,coin,laundry,the sharp ring of a coin hitting a tile floor once,clean/clean_domestic_0272.mp3
texture/smooth,clean,domestic,zipper,closet,the clean sharp pull of a metal zipper being closed,clean/clean_domestic_0273.mp3
texture/smooth,clean,domestic,ceramic,cafe,the sharp precise tap of a cup being set on a saucer,clean/clean_domestic_0274.mp3
texture/smooth,clean,domestic,scissors,studio,the single clean snip of metal shears through silk,clean/clean_domestic_0275.mp3
texture/smooth,clean,domestic,beads,curtain,the isolated clink of two glass beads on a string,clean/clean_domestic_0276.mp3
texture/smooth,clean,domestic,spray,bathroom,the short sharp hiss of an aerosol can burst,clean/clean_domestic_0277.mp3
texture/smooth,clean,domestic,drawer,office,the clean mechanical thud of a desk drawer closing,clean/clean_domestic_0278.mp3
texture/smooth,clean,domestic,pot,kitchen,the sharp clean ring of a lid being set on a metal pot,clean/clean_domestic_0279.mp3
texture/smooth,clean,domestic,door,hallway,the precise click of a door handle latching shut,clean/clean_domestic_0280.mp3
texture/smooth,clean,domestic,paper,study,the clean sharp sound of a page being turned,clean/clean_domestic_0281.mp3
texture/smooth,clean,domestic,clock,parlor,the isolated clean tick of a mechanical mantel clock,clean/clean_domestic_0282.mp3
texture/smooth,clean,domestic,can,pantry,the single sharp click of a soda tab being cracked,clean/clean_domestic_0283.mp3
texture/smooth,clean,electronic,beep,lab,the clean short beep of a laboratory timer ending,clean/clean_electronic_0284.mp3
texture/smooth,clean,electronic,click,server room,the isolated precise click of a digital mouse,clean/clean_electronic_0285.mp3
texture/smooth,clean,electronic,synthesizer,den,a short staccato note with zero resonance or decay,clean/clean_electronic_0286.mp3
texture/smooth,clean,electronic,pulse,studio,a single clean pulse wave from a modular synthesizer,clean/clean_electronic_0287.mp3
texture/smooth,clean,electronic,relay,closet,the precise sharp click of a signal relay switching,clean/clean_electronic_0288.mp3
texture/smooth,clean,electronic,alarm,apartment,a single clean digital beep from a microwave,clean/clean_electronic_0289.mp3
texture/smooth,clean,electronic,flash,studio,the sharp onset of a camera flash capacitor charging,clean/clean_electronic_0290.mp3
texture/smooth,clean,electronic,modem,bedroom,the isolated digital chirp of a network router,clean/clean_electronic_0291.mp3
texture/smooth,clean,electronic,switch,den,the clean sharp snap of an electronic toggle switch,clean/clean_electronic_0292.mp3
texture/smooth,clean,electronic,static,radio,a short isolated burst of clean white noise,clean/clean_electronic_0293.mp3
texture/smooth,clean,electronic,transformer,substation,the sharp onset of a transformer humming,clean/clean_electronic_0294.mp3
texture/smooth,clean,electronic,scanner,library,the clean sharp click of a scanner's lamp turning on,clean/clean_electronic_0295.mp3
texture/smooth,clean,electronic,phone,foyer,the single clean electronic chime of a smartphone,clean/clean_electronic_0296.mp3
texture/smooth,clean,electronic,buzzer,factory,the short sharp tone of an electronic timer,clean/clean_electronic_0297.mp3
texture/smooth,clean,electronic,display,office,the precise click of a monitor power button,clean/clean_electronic_0298.mp3
texture/smooth,clean,electronic,fuse,basement,the clean sharp tink of a glass fuse blowing,clean/clean_electronic_0299.mp3
texture/smooth,clean,electronic,spark,lab,the isolated sharp snap of a static spark,clean/clean_electronic_0300.mp3
texture/smooth,clear,musical,flute,meadow,a solo flute note sustaining in the crisp mountain air,clear/clear_musical_0135.mp3
texture/smooth,clear,musical,handbells,church,the transparent ring of a single brass handbell in a hall,clear/clear_musical_0136.mp3
texture/smooth,clear,musical,glockenspiel,observatory,a steel glockenspiel note with a long pure decay,clear/clear_musical_0137.mp3
texture/smooth,clear,musical,harp,gallery,the distinct resonant pluck of a high harp string,clear/clear_musical_0138.mp3
texture/smooth,clear,musical,piano,ballroom,a middle-register note on a grand piano with no pedal,clear/clear_musical_0139.mp3
texture/smooth,clear,musical,triangle,chamber,the transparent high-pitched ring of a steel triangle,clear/clear_musical_0140.mp3
texture/smooth,clear,musical,vibraphone,conservatory,a single vibraphone strike with the motor off,clear/clear_musical_0141.mp3
texture/smooth,clear,musical,trumpet,harbor,a bright clear trumpet note echoing over calm water,clear/clear_musical_0142.mp3
texture/smooth,clear,musical,violin,studio,a clear high-pitched harmonic note on a single string,clear/clear_musical_0143.mp3
texture/smooth,clear,musical,recorder,classroom,a steady transparent note on a wooden recorder,clear/clear_musical_0144.mp3
texture/smooth,clear,musical,chime bar,nursery,the distinct ring of a silver chime bar once struck,clear/clear_musical_0145.mp3
texture/smooth,clear,musical,celesta,palace,a single clear note on a celesta in an empty hall,clear/clear_musical_0146.mp3
texture/smooth,clear,musical,ukulele,porch,the distinct pluck of a nylon ukulele string,clear/clear_musical_0147.mp3
texture/smooth,clear,musical,santoor,garden,the clear resonance of a wire string struck by a mallet,clear/clear_musical_0148.mp3
texture/smooth,clear,musical,marimba,pavilion,the transparent ring of a rosewood marimba bar,clear/clear_musical_0149.mp3
texture/smooth,clear,musical,piccolo,stadium,a high-pitched clear note from a silver piccolo,clear/clear_musical_0150.mp3
texture/smooth,clear,musical,singing bowl,temple,the long clear decay of a struck crystal bowl,clear/clear_musical_0151.mp3
texture/smooth,clear,mechanical,bell,shipyard,the transparent ring of a brass ship bell being struck,clear/clear_mechanical_0152.mp3
texture/smooth,clear,mechanical,escapement,watchmaker,the distinct and sharp tick of a pendulum clock,clear/clear_mechanical_0153.mp3
texture/smooth,clear,mechanical,shutter,museum,the clear mechanical snap of a 35mm camera shutter,clear/clear_mechanical_0154.mp3
texture/smooth,clear,mechanical,motor,laboratory,the transparent high-pitched hum of a small electric motor,clear/clear_mechanical_0155.mp3
texture/smooth,clear,mechanical,gears,tower,the distinct chime of a gear-driven mechanical clock,clear/clear_mechanical_0156.mp3
texture/smooth,clear,mechanical,turbine,hangar,the clear high-pitched whine of a spooling turbine,clear/clear_mechanical_0157.mp3
texture/smooth,clear,mechanical,switch,office,the distinct mechanical click of a metal toggle switch,clear/clear_mechanical_0158.mp3
texture/smooth,clear,mechanical,spring,basement,the transparent vibration of a plucked coil spring,clear/clear_mechanical_0159.mp3
texture/smooth,clear,mechanical,relay,server room,the distinct sharp click of a magnetic relay,clear/clear_mechanical_0160.mp3
texture/smooth,clear,mechanical,bearing,factory,the clear ring of a ball bearing on a steel plate,clear/clear_mechanical_0161.mp3
texture/smooth,clear,mechanical,lathe,garage,the clear high-pitched sing of a lathe cutting metal,clear/clear_mechanical_0162.mp3
texture/smooth,clear,mechanical,projector,theater,the distinct whir of a film projector's cooling fan,clear/clear_mechanical_0163.mp3
texture/smooth,clear,mechanical,typewriter,study,the clear strike of a single typewriter hammer,clear/clear_mechanical_0164.mp3
