category,tag,domain,source,environment,scenario,file
texture/smooth,smooth,mechanical,piston,laboratory,a polished steel piston sliding in an oiled cylinder,smooth/smooth_mechanical_0120.mp3
texture/smooth,smooth,mechanical,ball bearing,workshop,a ceramic ball bearing spinning on a glass surface,smooth/smooth_mechanical_0121.mp3
texture/smooth,smooth,mechanical,lathe,machine shop,a metal lathe spinning at a constant high speed,smooth/smooth_mechanical_0122.mp3
texture/smooth,smooth,mechanical,tape reel,vault,a magnetic tape reel turning on a professional deck,smooth/smooth_mechanical_0123.mp3
texture/smooth,smooth,mechanical,conveyor,factory,a rubber conveyor belt sliding over polished rollers,smooth/smooth_mechanical_0124.mp3
texture/smooth,smooth,mechanical,fan,bedroom,the steady whir of a balanced ceiling fan on low speed,smooth/smooth_mechanical_0125.mp3
texture/smooth,smooth,mechanical,elevator,hotel,a hydraulic elevator car ascending in a modern hotel,smooth/smooth_mechanical_0126.mp3
texture/smooth,smooth,mechanical,drill,dentist office,a high-speed turbine drill spinning in a sterile room,smooth/smooth_mechanical_0127.mp3
texture/smooth,smooth,mechanical,gyroscope,museum,a heavy brass gyroscope spinning on a pedestal,smooth/smooth_mechanical_0128.mp3
texture/smooth,smooth,mechanical,shutter,studio,the silent movement of a leaf shutter in a camera,smooth/smooth_mechanical_0129.mp3
texture/smooth,smooth,mechanical,potentiometer,control room,a fader sliding along a lubricated track on a mixing desk,smooth/smooth_mechanical_0130.mp3
texture/smooth,smooth,mechanical,wind turbine,field,the slow rhythmic pass of a wind turbine blade,smooth/smooth_mechanical_0131.mp3
texture/smooth,smooth,mechanical,hard drive,office,the steady spin of a high-speed platter in a hard drive,smooth/smooth_mechanical_0132.mp3
texture/smooth,smooth,mechanical,gears,clock tower,precision brass gears interlocking in a clock tower,smooth/smooth_mechanical_0133.mp3
texture/smooth,smooth,mechanical,flywheel,power plant,a massive steel flywheel spinning in a power plant,smooth/smooth_mechanical_0134.mp3
texture/smooth,smooth,mechanical,pulley,theater,a nylon rope sliding through a plastic pulley in a theater loft,smooth/smooth_mechanical_0135.mp3
texture/smooth,smooth,mechanical,sliding door,train station,a pneumatic door sliding open on a high-speed train,smooth/smooth_mechanical_0136.mp3
texture/smooth,smooth,environmental,ice,glacier,a heavy block of ice sliding over a frozen surface,smooth/smooth_environmental_0137.mp3
texture/smooth,smooth,environmental,wind,dunes,a steady breeze blowing over curved sand dunes,smooth/smooth_environmental_0138.mp3
texture/smooth,smooth,environmental,stream,meadow,a laminar flow of water over a mossy rock in a stream,smooth/smooth_environmental_0139.mp3
texture/smooth,smooth,environmental,lava,volcanic field,a slow flow of pahoehoe lava over a flat plain,smooth/smooth_environmental_0140.mp3
texture/smooth,smooth,environmental,mist,harbor,a foghorn blast echoing through thick morning mist,smooth/smooth_environmental_0141.mp3
texture/smooth,smooth,environmental,sand,desert,sand grains sliding down the face of a dune in a desert,smooth/smooth_environmental_0142.mp3
texture/smooth,smooth,environmental,waterfall,forest,a thin sheet of water falling into a deep pool,smooth/smooth_environmental_0143.mp3
texture/smooth,smooth,environmental,thaw,cave,a steady drip of water falling into a deep subterranean lake,smooth/smooth_environmental_0144.mp3
texture/smooth,smooth,environmental,geyser,basin,a constant hiss of steam from a small thermal vent,smooth/smooth_environmental_0145.mp3
texture/smooth,smooth,environmental,snow,tundra,a sled runner sliding over hard-packed wind-swept snow,smooth/smooth_environmental_0146.mp3
texture/smooth,smooth,environmental,leaves,woods,a gentle wind rustling through a canopy of broad leaves,smooth/smooth_environmental_0147.mp3
texture/smooth,smooth,environmental,ocean,beach,the receding wash of a wave on a flat sandy beach,smooth/smooth_environmental_0148.mp3
texture/smooth,smooth,environmental,clouds,plains,the distant low roar of a steady wind in the upper atmosphere,smooth/smooth_environmental_0149.mp3
texture/smooth,smooth,environmental,river,valley,a deep river flowing silently through a wide valley,smooth/smooth_environmental_0150.mp3
texture/smooth,smooth,environmental,rain,greenhouse,steady rain hitting a glass roof in a greenhouse,smooth/smooth_environmental_0151.mp3
texture/smooth,smooth,environmental,bubbles,pond,a continuous stream of small bubbles rising in a pond,smooth/smooth_environmental_0152.mp3
texture/smooth,smooth,environmental,mud,swamp,a slow bubble of gas escaping a thick mud pit,smooth/smooth_environmental_0153.mp3
texture/smooth,smooth,organic,purr,living room,the steady resonant purr of a large cat on a sofa,smooth/smooth_organic_0154.mp3
texture/smooth,smooth,organic,breath,bedroom,the rhythmic inhalation and exhalation of a sleeping person,smooth/smooth_organic_0155.mp3
texture/smooth,smooth,organic,skin,spa,a hand sliding over oiled skin during a massage,smooth/smooth_organic_0156.mp3
texture/smooth,smooth,organic,voice,cathedral,a monk chanting a single long vowel in a stone abbey,smooth/smooth_organic_0157.mp3
texture/smooth,smooth,organic,swallow,kitchen,a person drinking a glass of water in a quiet kitchen,smooth/smooth_organic_0158.mp3
texture/smooth,smooth,organic,humming,bathroom,a person humming a steady note in a tiled bathroom,smooth/smooth_organic_0159.mp3
texture/smooth,smooth,organic,wings,meadow,the steady hum of a dragonfly's wings in a meadow,smooth/smooth_organic_0160.mp3
texture/smooth,smooth,organic,heartbeat,clinic,a steady heartbeat heard through a stethoscope in a quiet room,smooth/smooth_organic_0161.mp3
texture/smooth,smooth,organic,throat,office,a long gentle sigh in a quiet office,smooth/smooth_organic_0162.mp3
texture/smooth,smooth,organic,hair,bedroom,a plastic brush sliding through long dry hair,smooth/smooth_organic_0163.mp3
texture/smooth,smooth,organic,scales,desert,a snake sliding across a polished rock in the desert,smooth/smooth_organic_0164.mp3
texture/smooth,smooth,organic,fingernail,tabletop,a fingernail sliding across a polished mahogany table,smooth/smooth_organic_0165.mp3
texture/smooth,smooth,organic,whale,ocean,a long low-frequency moan of a whale underwater,smooth/smooth_organic_0166.mp3
texture/smooth,smooth,organic,owl,forest,the soft flap of an owl's wings in a night forest,smooth/smooth_organic_0167.mp3
texture/smooth,smooth,organic,teeth,bathroom,a toothbrush sliding across wet teeth in a bathroom,smooth/smooth_organic_0168.mp3
texture/smooth,smooth,organic,belly,savanna,the sound of an elephant's trunk sliding over a tree branch,smooth/smooth_organic_0169.mp3
texture/smooth,smooth,organic,furs,tent,a hand stroking a soft fur blanket in a tent,smooth/smooth_organic_0170.mp3
texture/smooth,smooth,domestic,knife,kitchen,a sharp knife slicing through a block of soft butter,smooth/smooth_domestic_0171.mp3
texture/smooth,smooth,domestic,vacuum,living room,the steady motor hum of a vacuum cleaner on a rug,smooth/smooth_domestic_0172.mp3
texture/smooth,smooth,domestic,door,hallway,a well-oiled wooden door closing silently in a hallway,smooth/smooth_domestic_0173.mp3
texture/smooth,smooth,domestic,iron,laundry room,a steam iron sliding over a damp cotton shirt,smooth/smooth_domestic_0174.mp3
texture/smooth,smooth,domestic,washing machine,basement,the high-speed spin cycle of a front-loading washer,smooth/smooth_domestic_0175.mp3
texture/smooth,smooth,domestic,refrigerator,kitchen,the constant hum of a refrigerator compressor at night,smooth/smooth_domestic_0176.mp3
texture/smooth,smooth,domestic,curtain,bedroom,a silk curtain sliding along a metal rod,smooth/smooth_domestic_0177.mp3
texture/smooth,smooth,domestic,drawer,office,a metal drawer sliding open on ball-bearing tracks,smooth/smooth_domestic_0178.mp3
texture/smooth,smooth,domestic,zipper,closet,a nylon zipper being pulled slowly on a jacket,smooth/smooth_domestic_0179.mp3
texture/smooth,smooth,domestic,sponge,bathroom,a wet sponge being wiped across a porcelain bathtub,smooth/smooth_domestic_0180.mp3
texture/smooth,smooth,domestic,fan,study,the whir of a small usb desk fan in a quiet study,smooth/smooth_domestic_0181.mp3
texture/smooth,smooth,domestic,clock,mantel,a silent quartz clock hand moving across a face,smooth/smooth_domestic_0182.mp3
texture/smooth,smooth,domestic,kettle,kitchen,the first steady hiss of steam from a tea kettle,smooth/smooth_domestic_0183.mp3
texture/smooth,smooth,domestic,floor,living room,a felt pad on a chair leg sliding across a hardwood floor,smooth/smooth_domestic_0184.mp3
texture/smooth,smooth,domestic,window,porch,a glass pane sliding in a vinyl track,smooth/smooth_domestic_0185.mp3
texture/smooth,smooth,domestic,silverware,dining room,a silver spoon stirring a cup of hot tea,smooth/smooth_domestic_0186.mp3
texture/smooth,smooth,domestic,rug,entryway,a heavy rug being unrolled on a stone floor,smooth/smooth_domestic_0187.mp3
texture/smooth,smooth,electronic,oscillator,lab,a pure sine wave from a laboratory signal generator,smooth/smooth_electronic_0188.mp3
texture/smooth,smooth,electronic,transformer,substation,the steady 60hz hum of an electrical transformer,smooth/smooth_electronic_0189.mp3
texture/smooth,smooth,electronic,hard drive,server room,the high-pitched steady whine of a server fan,smooth/smooth_electronic_0190.mp3
texture/smooth,smooth,electronic,led,control panel,the faint electronic hum of a large led display,smooth/smooth_electronic_0191.mp3
texture/smooth,smooth,electronic,capacitor,workbench,the steady charging whine of a high-voltage capacitor,smooth/smooth_electronic_0192.mp3
texture/smooth,smooth,electronic,static,radio station,the constant hiss of white noise on an fm frequency,smooth/smooth_electronic_0193.mp3
texture/smooth,smooth,electronic,drone,studio,a low-pass filtered electronic drone in a studio,smooth/smooth_electronic_0194.mp3
texture/smooth,smooth,electronic,feedback,stage,a controlled high-frequency feedback loop in a speaker,smooth/smooth_electronic_0195.mp3
texture/smooth,smooth,electronic,modem,basement,the steady carrier tone of a dial-up modem,smooth/smooth_electronic_0196.mp3
texture/smooth,smooth,electronic,sonar,submarine,a single sustained sonar ping in deep water,smooth/smooth_electronic_0197.mp3
texture/smooth,smooth,electronic,buzzer,factory,the steady sound of a high-frequency electronic buzzer,smooth/smooth_electronic_0198.mp3
texture/smooth,smooth,electronic,monitor,office,the faint high-pitched whine of a crt monitor,smooth/smooth_electronic_0199.mp3
texture/smooth,smooth,electronic,laser,laboratory,the steady hum of a gas laser cooling system,smooth/smooth_electronic_0200.mp3
texture/smooth,smooth,electronic,beeper,hospital,the steady rhythmic beep of a pulse oximeter,smooth/smooth_electronic_0201.mp3
texture/smooth,smooth,electronic,switch,car,the smooth electronic movement of a power window,smooth/smooth_electronic_0202.mp3
texture/smooth,smooth,electronic,alarm,bedroom,the steady ascending tone of a digital alarm clock,smooth/smooth_electronic_0203.mp3
texture/smooth,smooth,electronic,scanner,library,the steady movement of a flatbed scanner motor,smooth/smooth_electronic_0204.mp3
texture/smooth,pure,musical,tuning fork,studio,a steel tuning fork vibrating on a wooden tabletop,pure/pure_musical_0102.mp3
texture/smooth,pure,musical,triangle,cathedral,a single strike on a steel triangle in a stone cathedral,pure/pure_musical_0103.mp3
texture/smooth,pure,musical,flute,mountain top,a single long note on a silver flute in thin air,pure/pure_musical_0104.mp3
texture/smooth,pure,musical,crystal bowl,spa,a wooden mallet rubbing the edge of a quartz singing bowl,pure/pure_musical_0105.mp3
texture/smooth,pure,musical,piccolo,botanical garden,a high-register piccolo note in a greenhouse,pure/pure_musical_0106.mp3
texture/smooth,pure,musical,handbell,chapel,a single ring of a silver handbell in a chapel,pure/pure_musical_0107.mp3
texture/smooth,pure,musical,celesta,concert hall,a metal hammer hitting a steel plate in a celesta,pure/pure_musical_0108.mp3
texture/smooth,pure,musical,recorder,classroom,a clear note on a wooden recorder in a quiet room,pure/pure_musical_0109.mp3
texture/smooth,pure,musical,glockenspiel,music room,a brass mallet striking a glockenspiel bar,pure/pure_musical_0110.mp3
texture/smooth,pure,musical,pipe organ,abbey,a single flute stop note on a pipe organ,pure/pure_musical_0111.mp3
texture/smooth,pure,musical,glass harmonica,conservatory,a sustained note on a rotating glass harmonica,pure/pure_musical_0112.mp3
texture/smooth,pure,musical,crotales,rehearsal space,a brass mallet striking a crotale disc,pure/pure_musical_0113.mp3
texture/smooth,pure,musical,pan flute,forest,a single breath through a bamboo pan flute,pure/pure_musical_0114.mp3
texture/smooth,pure,musical,trumpet,field,a high trumpet note played in an open field,pure/pure_musical_0115.mp3
texture/smooth,pure,musical,wine glass,dining room,a finger rubbing the rim of a crystal wine glass,pure/pure_musical_0116.mp3
texture/smooth,pure,musical,oboe,chamber,a tuning note on an orchestral oboe,pure/pure_musical_0117.mp3
texture/smooth,pure,musical,harp,closet,a single high harp string plucked in a quiet room,pure/pure_musical_0118.mp3
texture/smooth,pure,mechanical,watch,workshop,the precise ticking of a high-end mechanical watch,pure/pure_mechanical_0119.mp3
texture/smooth,pure,mechanical,gears,clock shop,the rhythmic whir of small brass gears,pure/pure_mechanical_0120.mp3
texture/smooth,pure,mechanical,valve,laboratory,a precision air valve releasing a single puff of gas,pure/pure_mechanical_0121.mp3
texture/smooth,pure,mechanical,shutter,studio,the mechanical click of a high-speed camera shutter,pure/pure_mechanical_0122.mp3
texture/smooth,pure,mechanical,bell,bicycle,a single strike on a chrome bicycle bell,pure/pure_mechanical_0123.mp3
texture/smooth,pure,mechanical,lathe,factory,the steady hum of a precision lathe at high speed,pure/pure_mechanical_0124.mp3
texture/smooth,pure,mechanical,fan,office,the whir of a computer fan in a quiet office,pure/pure_mechanical_0125.mp3
texture/smooth,pure,mechanical,relay,control room,the sharp click of a reed relay on a circuit board,pure/pure_mechanical_0126.mp3
texture/smooth,pure,mechanical,motor,laboratory,the whine of a small electric motor in a centrifuge,pure/pure_mechanical_0127.mp3
texture/smooth,pure,mechanical,spring,workshop,a small coil spring vibrating after being flicked,pure/pure_mechanical_0128.mp3
texture/smooth,pure,mechanical,lever,cockpit,a metal toggle switch clicking in an airplane cockpit,pure/pure_mechanical_0129.mp3
texture/smooth,pure,mechanical,gyroscope,museum,the steady hum of a motorized gyroscope,pure/pure_mechanical_0130.mp3
texture/smooth,pure,mechanical,drill,dentist office,the high-pitched whine of a dental drill,pure/pure_mechanical_0131.mp3
texture/smooth,pure,mechanical,piston,model shop,the rhythmic puff of a model steam engine,pure/pure_mechanical_0132.mp3
texture/smooth,pure,mechanical,lock,bank vault,the internal click of a combination lock tumblers,pure/pure_mechanical_0133.mp3
texture/smooth,pure,mechanical,metronome,music room,the wooden click of a mechanical metronome,pure/pure_mechanical_0134.mp3
texture/smooth,pure,mechanical,typewriter,study,the single click of a typewriter key hitting the platen,pure/pure_mechanical_0135.mp3
texture/smooth,pure,environmental,ice,pond,a single sharp crack in a sheet of frozen ice,pure/pure_environmental_0136.mp3
texture/smooth,pure,environmental,water,cave,a single drop of water hitting a deep still pool,pure/pure_environmental_0137.mp3
texture/smooth,pure,environmental,wind,mountain,wind whistling through a narrow rock fissure,pure/pure_environmental_0138.mp3
texture/smooth,pure,environmental,bubbles,lake,a single bubble of gas popping on a calm lake surface,pure/pure_environmental_0139.mp3
texture/smooth,pure,environmental,thaw,forest,water dripping from an icicle onto a flat stone,pure/pure_environmental_0140.mp3
texture/smooth,pure,environmental,geyser,basin,a sharp hiss of steam from a pinpoint vent,pure/pure_environmental_0141.mp3
texture/smooth,pure,environmental,echo,canyon,a single handclap echoing in a deep canyon,pure/pure_environmental_0142.mp3
texture/smooth,pure,environmental,mist,valley,the sound of wind passing over a hollow log,pure/pure_environmental_0143.mp3
texture/smooth,pure,environmental,snow,tundra,the soft crunch of a single step in dry snow,pure/pure_environmental_0144.mp3
texture/smooth,pure,environmental,thunder,plains,a distant thunderclap echoing over a flat plain,pure/pure_environmental_0145.mp3
texture/smooth,pure,environmental,lightning,mountaintop,the sharp crack of a nearby lightning strike,pure/pure_environmental_0146.mp3
texture/smooth,pure,environmental,rain,greenhouse,a single large raindrop hitting a glass pane,pure/pure_environmental_0147.mp3
texture/smooth,pure,environmental,pebble,quarry,a small stone hitting a large granite slab,pure/pure_environmental_0148.mp3
texture/smooth,pure,environmental,fire,campsite,a single sharp pop of a burning pine knot,pure/pure_environmental_0149.mp3
texture/smooth,pure,environmental,hail,car roof,a single hailstone hitting a metal car roof,pure/pure_environmental_0150.mp3
texture/smooth,pure,environmental,leaves,woods,the rustle of a single dry leaf falling on stone,pure/pure_environmental_0151.mp3
texture/smooth,pure,environmental,frost,window,the crackle of frost on a glass window pane,pure/pure_environmental_0152.mp3
texture/smooth,pure,organic,whistle,meadow,a single human whistle echoing in a meadow,pure/pure_organic_0153.mp3
texture/smooth,pure,organic,bird,forest,the high-pitched song of a lone sparrow,pure/pure_organic_0154.mp3
texture/smooth,pure,organic,voice,cathedral,a child's voice singing a single high note,pure/pure_organic_0155.mp3
texture/smooth,pure,organic,heartbeat,room,a single clear heartbeat in a quiet room,pure/pure_organic_0156.mp3
texture/smooth,pure,organic,breath,bedroom,a sharp intake of breath in the dark,pure/pure_organic_0157.mp3
texture/smooth,pure,organic,wings,garden,the hum of a hummingbird's wings near a flower,pure/pure_organic_0158.mp3
texture/smooth,pure,organic,cicada,orchard,the steady high-frequency buzz of a cicada,pure/pure_organic_0159.mp3
texture/smooth,pure,organic,cricket,basement,the rhythmic chirp of a lone cricket,pure/pure_organic_0160.mp3
texture/smooth,pure,organic,throat,church,a single sharp throat clear in a stone hall,pure/pure_organic_0161.mp3
texture/smooth,pure,organic,laughter,hallway,a single high-pitched laugh in a tiled corridor,pure/pure_organic_0162.mp3
texture/smooth,pure,organic,cough,library,a single dry cough in a quiet library,pure/pure_organic_0163.mp3
texture/smooth,pure,organic,teeth,kitchen,teeth clicking together in a cold room,pure/pure_organic_0164.mp3
texture/smooth,pure,organic,fingernail,glass,a fingernail tapping on a crystal glass,pure/pure_organic_0165.mp3
texture/smooth,pure,organic,skin,spa,two palms clapping together once,pure/pure_organic_0166.mp3
texture/smooth,pure,organic,shiver,tent,the rustle of a nylon sleeping bag during a shiver,pure/pure_organic_0167.mp3
texture/smooth,pure,organic,snore,bedroom,a high-pitched whistle during a snore,pure/pure_organic_0168.mp3
texture/smooth,pure,organic,scales,desert,the rustle of a lizard scurrying over a dry rock,pure/pure_organic_0169.mp3
texture/smooth,pure,domestic,glass,kitchen,a crystal wine glass clinking against another,pure/pure_domestic_0170.mp3
texture/smooth,pure,domestic,silverware,dining room,a silver fork hitting a porcelain plate,pure/pure_domestic_0171.mp3
texture/smooth,pure,domestic,bell,foyer,a brass service bell being struck once,pure/pure_domestic_0172.mp3
texture/smooth,pure,domestic,kettle,kitchen,the high-pitched whistle of a tea kettle,pure/pure_domestic_0173.mp3
texture/smooth,pure,domestic,light switch,hallway,the sharp click of a plastic light switch,pure/pure_domestic_0174.mp3
texture/smooth,pure,domestic,clock,bedroom,the rhythmic ticking of a small desk clock,pure/pure_domestic_0175.mp3
texture/smooth,pure,domestic,door,house,the latch of a door clicking into place,pure/pure_domestic_0176.mp3
texture/smooth,pure,domestic,can,alley,the opening of a soda can and the hiss of gas,pure/pure_domestic_0177.mp3
texture/smooth,pure,domestic,keys,entryway,a single key hitting a wooden floor,pure/pure_domestic_0178.mp3
texture/smooth,pure,domestic,faucet,bathroom,a single drop of water hitting a ceramic sink,pure/pure_domestic_0179.mp3
texture/smooth,pure,domestic,spray,bathroom,a single burst from an aerosol spray bottle,pure/pure_domestic_0180.mp3
texture/smooth,pure,domestic,zipper,closet,the sharp zip of a metal zipper,pure/pure_domestic_0181.mp3
texture/smooth,pure,domestic,scissors,sewing room,a single snip of sharp metal shears,pure/pure_domestic_0182.mp3
texture/smooth,pure,domestic,lighter,porch,the click of a piezo igniter on a gas stove,pure/pure_domestic_0183.mp3
texture/smooth,pure,domestic,plate,dining room,the ring of a ceramic plate being tapped,pure/pure_domestic_0184.mp3
texture/smooth,pure,domestic,beads,closet,two glass beads clicking together on a string,pure/pure_domestic_0185.mp3
texture/smooth,pure,domestic,mirror,bathroom,the sound of a glass bottle being set on a vanity,pure/pure_domestic_0186.mp3
texture/smooth,pure,electronic,oscillator,studio,a pure sine wave from an electronic synthesizer,pure/pure_electronic_0187.mp3
texture/smooth,pure,electronic,beep,office,a digital notification beep from a computer,pure/pure_electronic_0188.mp3
texture/smooth,pure,electronic,ping,phone,a single digital chime from a smartphone,pure/pure_electronic_0189.mp3
texture/smooth,pure,electronic,static,radio,a burst of high-frequency radio static,pure/pure_electronic_0190.mp3
texture/smooth,pure,electronic,buzzer,factory,the sound of a piezoelectric buzzer,pure/pure_electronic_0191.mp3
texture/smooth,pure,electronic,beeper,kitchen,the electronic beep of a microwave oven,pure/pure_electronic_0192.mp3
texture/smooth,pure,electronic,alarm,watch,the high-pitched alarm of a digital watch,pure/pure_electronic_0193.mp3
texture/smooth,pure,electronic,relay,server room,the click of a miniature relay on a circuit board,pure/pure_electronic_0194.mp3
texture/smooth,pure,electronic,capacitor,lab,the discharge of a small electronic capacitor,pure/pure_electronic_0195.mp3
texture/smooth,pure,electronic,hum,bedroom,the high-pitched hum of a phone charger,pure/pure_electronic_0196.mp3
texture/smooth,pure,electronic,chime,hallway,a digital doorbell chime in a house,pure/pure_electronic_0197.mp3
texture/smooth,pure,electronic,sonar,submarine,a high-frequency sonar ping underwater,pure/pure_electronic_0198.mp3
texture/smooth,pure,electronic,modem,office,the handshake sequence of a fax machine,pure/pure_electronic_0199.mp3
texture/smooth,pure,electronic,flash,studio,the whine of a camera flash charging up,pure/pure_electronic_0200.mp3
texture/smooth,pure,electronic,beeper,hospital,the rhythmic beep of a heart monitor,pure/pure_electronic_0201.mp3
texture/smooth,pure,electronic,drone,studio,a pure triangle wave drone from an oscillator,pure/pure_electronic_0202.mp3
texture/smooth,pure,electronic,hard drive,study,the high-speed spin of a laptop hard drive,pure/pure_electronic_0203.mp3
texture/smooth,clean,musical,piano,studio,a single staccato note on a grand piano,clean/clean_musical_0099.mp3
texture/smooth,clean,musical,guitar,room,a single acoustic guitar string plucked with a pick,clean/clean_musical_0100.mp3
texture/smooth,clean,musical,triangle,pit,a sharp strike on a triangle with a metal beater,clean/clean_musical_0101.mp3
texture/smooth,clean,musical,snare drum,garage,a single sharp rimshot on a snare drum,clean/clean_musical_0102.mp3
texture/smooth,clean,musical,xylophone,classroom,a hard mallet strike on a high xylophone bar,clean/clean_musical_0103.mp3
texture/smooth,clean,musical,castanets,dance studio,a sharp click of wooden castanets,clean/clean_musical_0104.mp3
texture/smooth,clean,musical,banjo,porch,a single sharp pluck on a banjo string,clean/clean_musical_0105.mp3
texture/smooth,clean,musical,harpsichord,parlor,a single sharp note on a harpsichord,clean/clean_musical_0106.mp3
texture/smooth,clean,musical,tambourine,stage,a single sharp hit on a tambourine,clean/clean_musical_0107.mp3
texture/smooth,clean,musical,handbell,chapel,a single sharp ring of a small brass bell,clean/clean_musical_0108.mp3
texture/smooth,clean,musical,piccolo,hall,a single sharp staccato note on a piccolo,clean/clean_musical_0109.mp3
texture/smooth,clean,musical,claves,music room,two wooden claves struck together once,clean/clean_musical_0110.mp3
texture/smooth,clean,musical,marimba,conservatory,a single strike on a marimba with a hard mallet,clean/clean_musical_0111.mp3
texture/smooth,clean,musical,glockenspiel,nursery,a brass mallet hitting a glockenspiel bar,clean/clean_musical_0112.mp3
texture/smooth,clean,musical,cowbell,stadium,a single strike on a metal cowbell,clean/clean_musical_0113.mp3
texture/smooth,clean,musical,temple block,shrine,a wooden mallet strike on a hollow block,clean/clean_musical_0114.mp3
texture/smooth,clean,musical,vibraphone,club,a single mallet strike on a vibraphone bar,clean/clean_musical_0115.mp3
texture/smooth,clean,mechanical,staple gun,woodshop,a staple gun firing into a block of wood,clean/clean_mechanical_0116.mp3
texture/smooth,clean,mechanical,shutter,studio,a professional camera shutter clicking once,clean/clean_mechanical_0117.mp3
